image_name|comment_number|comment|corrected_comment
2162367970.jpg|0|Two small children , one wearing a red winter jacket and the other a black one , are slipping and sliding down an icy slope .|Нэг нь улаан өвлийн хүрэм, нөгөө нь хар хувцас өмссөн хоёр бяцхан хүүхэд мөсөн энгэрээр хальтирч гулсаж байна.
2162469360.jpg|0|One construction worker in a red shirt watching another construction worker with a hammer fix something .|Улаан цамцтай нэг барилгын ажилчин өөр нэг барилгын ажилчныг алх барин ямар нэг зүйл засаж байгааг харж байна.
2162564553.jpg|0|A shirtless man with a backpack and a hat is standing on a rocky shoreline .|Хадан эрэг дээр үүргэвчтэй, малгайтай цамцгүй эр зогсож байна.
2162746678.jpg|0|A man in a dark jacket with white gloves smokes a cigarette while working with a series of large copper wires .|Цагаан бээлий өмссөн хар хүрэм өмссөн хүн хэд хэдэн том зэс утсаар ажиллаж байхдаа тамхи татаж байна.
216308314.jpg|0|The men are enjoy a scooter ride through an office space .|Эрчүүд оффисын талбайгаар скутерээр зугаалж байна.
2163780897.jpg|0|There are two people , a man and a woman , sitting on a bus .|Автобусанд эрэгтэй, эмэгтэй хоёр хүн сууж байна.
2164018393.jpg|0|"Several children are playing on a "" Moon Bounce , "" with one child in the foreground and a supervisory adult in the background ."|"Хэд хэдэн хүүхэд "" Сарны харайлт "" дээр тоглож байна, урд талд нь нэг хүүхэд, ард нь хяналтын том хүн байна."
2164363131.jpg|0|A person holding a Frisbee just out of reach of a white dog on a rural road|Хөдөөгийн зам дээр цагаан нохой хүрэхгүй газар фрисби барьсан хүн
2164429357.jpg|0|A salesman is standing in front of a monitor showing customers how to use a device in a store .|Дэлгүүрт байгаа төхөөрөмжийг хэрхэн ашиглахыг хэрэглэгчдэд үзүүлж буй мониторын өмнө худалдагч зогсож байна.
2164591530.jpg|0|The man is trying to start a fire in his backyard fire pit .|Эр хүн хашааныхаа галын нүхэнд гал гаргах гэж байна.
2164665069.jpg|0|A woman standing in smoke or steam underneath a beach umbrella in a neighborhood holding a food platter .|Хөрш орчмын далайн эрэг дээрх шүхрийн доор утаа эсвэл ууранд хутгалдаж, хоолны таваг барьсан эмэгтэй .
2165459064.jpg|0|Two white dogs with cutoff tails running in green grass .|Ногоон зүлгэн дунд сүүлээ зүссэн хоёр цагаан нохой гүйж байна.
2165461920.jpg|0|Four white dogs are running and jumping with masks over their mouth .|Дөрвөн цагаан нохой амаа таглаад гүйж, үсэрч байна.
2165677531.jpg|0|A blue rally car pulls away from the spectators watching from the side of the track .|Цэнхэр ралли машин замын хажуугаас харж буй үзэгчдээс холдож байна.
2165724565.jpg|0|A woman with short black hair in a blue t-shirt holds a baby in pink clothes with a pacifier .|Цэнхэр подволк өмссөн богино хар үстэй эмэгтэй ягаан хувцастай хүүхдээ соосогтой тэвэрч байна.
216585846.jpg|0|A man in a red cap and blue jeans is riding a bike that is carrying a large green cart with something large inside .|Улаан малгайтай, цэнхэр жинсэн өмд өмссөн эрэгтэй дугуй унаж, дотроо том зүйлтэй том ногоон тэргэнцэр тээж байна.
216594524.jpg|0|A man and a woman , both dressed in white talking to each other in a restaurant .|Зоогийн газарт цагаан хувцас өмссөн эрэгтэй эмэгтэй хоёр хоорондоо ярилцаж байна.
2166120300.jpg|0|A lady with a hurt hand is cashing out her purchases at the grocery mart by a cashier in a black and red jacket .|Гар нь өвдсөн эмэгтэй дэлгүүрт хар улаан хүрэмтэй кассчин худалдан авалтаа бэлэн мөнгө болгож байна.
216627488.jpg|0|A man wearing khaki pants and a red jacket is lying on the ground beside a small tree .|Хаки өмд, улаан хүрэм өмссөн эрэгтэй жижигхэн модны дэргэд хэвтэж байна.
2166278644.jpg|0|A young boy is shoveling snow so deep it comes up to his knees .|Залуу хүү цасыг өвдгөөрөө хүртлээ гүн хусч байна.
2166417615.jpg|0|Three children and one adult are near the base of a rock formation in shallow water , and an adult wearing a blue shirt is standing on the top of the rocks .|Гүехэн усан дахь чулуулгийн суурийн ойролцоо гурван хүүхэд, нэг том хүн байгаа бөгөөд хадны орой дээр цэнхэр цамц өмссөн том хүн зогсож байна.
2166529027.jpg|0|A boy wearing a fireman 's hat holds a small flower in one hand and a saw in the other .|Гал сөнөөгчийн малгай өмссөн хүү нэг гартаа жижиг цэцэг, нөгөө гартаа хөрөө барьдаг.
2166946777.jpg|0|A ship filled with supplies is docked on the shore with several others in the background and several men in the foreground .|Хэрэгслээр дүүрсэн хөлөг онгоц эрэг дээр зогссон бөгөөд цаана нь хэд хэдэн хүн, урд талд нь хэд хэдэн хүн байна.
216696529.jpg|0|Four men in cargo shorts without shirts on are standing on metal scaffolding .|Цамц өмсөөгүй ачааны шорт өмссөн дөрвөн эрэгтэй төмөр тавцан дээр зогсож байна.
2167365840.jpg|0|A man is about to saw off a small tree limb while a child in a fireman 's hat watches .|Гал сөнөөгчийн малгай өмссөн хүүхэд харж байхад эрэгтэй хүн модны жижиг мөчрийг хуулах гэж байна.
2167644298.jpg|0|A man with a hat , glasses , jewelry and a jacket stands against an orange wall .|Малгай, нүдний шил, гоёл чимэглэл, хүрэмтэй эр улбар шар өнгийн хананд зогсож байна.
2167711328.jpg|0|A woman with a red shirt and red purse facing away from a man with a black hat sitting on a bench .|Улаан цамц, улаан түрийвчтэй эмэгтэй вандан сандал дээр сууж буй хар малгайтай эрэгтэйгээс хойш харан зогсож байна.
216778085.jpg|0|Two workers in hard hats examine a piece of industrial equipment in a tunnel underground .|Хатуу малгай өмссөн хоёр ажилчин газар доорх хонгилд байгаа үйлдвэрийн тоног төхөөрөмжийг шалгаж байна.
2168021521.jpg|0|A smiling man in a blue shirt and straw hat is standing inside a brick structure .|Тоосгон дотор хөх цамц, сүрэл малгай өмссөн инээмсэглэсэн хүн зогсож байна.
21687074.jpg|0|A man with no shirt on , holding a cup , watches a woman wearing a yellow bikini top in a crowd .|Цамцгүй эр аяга бариад, олны дунд шар бикини өмссөн эмэгтэйг харж байна.
2168723623.jpg|0|A plane flies overhead as military men stand at attention , a flag blows in the wind as a lady in red stares out towards the camera .|Цэргийнхэн анхаарлаа хандуулж, улаан хувцастай эмэгтэй камер руу ширтэж байхад туг салхинд хийсч байхад онгоц дээгүүр нисч байна.
2168809436.jpg|0|Old man poses for picture in front of construction site .|Өвгөн барилгын талбайн урд зургаа татуулж байна .
21688595.jpg|0|Group of people watching a guy in a knight custom and a girl in a fishnet and white & green skirt .|Баатрын заншилтай залуу, загасны тор, цагаан ногоон банзал өмссөн охин хоёрыг харж буй хэсэг бүлэг хүмүүс .
2169067981.jpg|0|Two boys in blue clothing are pulling on a rope while one boy is touching a brown chair .|Цэнхэр хувцастай хоёр хүү олс татаж байхад нэг хүү бор сандал дээр хүрч байна.
2169709244.jpg|0|A little girl in a blue dress and white shoes is sitting on her red toy tractor , in a dirt road near a fence .|Цэнхэр даашинз, цагаан гутал өмссөн бяцхан охин улаан тоглоомон трактор дээрээ хашааны дэргэдэх шороон зам дээр сууж байна.
2169788484.jpg|0|Two people are seated in striped outdoor chairs which are placed in a body of water and one man is holding a large fishing pole .|Усан дотор байрлуулсан судалтай гадаа сандал дээр хоёр хүн сууж, нэг хүн том загас агнуурын шон барьж байна.
2169951750.jpg|0|A brown dog is running across the snowy ground .|Хүрэн нохой цастай газар гүйж байна.
2169986652.jpg|0|Four workers walking in a field with a desert in the background .|Дөрвөн ажилчин цаагуураа элсэн цөлтэй хээр талд алхаж байна.
217013833.jpg|0|A closeup of the back of a girl 's head looking out the window onto a lawn beyond which is some construction machinery .|Охидын толгойны ар талыг цонхоор харж буй зүлгэн дээрх барилгын машин механизмыг ойртуулж байна.
2170187328.jpg|0|A girl in a swimming pool looks on while a boy in a mask jumps in from a diving board .|Усанд шумбах тавцангаас маск зүүсэн хүү үсрэн орж ирэхийг усан санд байгаа охин харж байна.
2170222061.jpg|0|A small animal leaps behind a larger animal , the larger animal 's tail obscuring the smaller one 's face .|Бог мал том амьтны араас үсрэн орж ирэхэд том амьтны сүүл жижиг амьтны нүүрийг халхалж байна.
217108448.jpg|0|A young blond child wearing a black shirt and white shorts looks at the sky with a bridge and water in the background .|Хар цамц, цагаан шорт өмссөн залуу шаргал үст хүүхэд гүүр, цаана нь устай тэнгэр рүү харж байна.
2171154778.jpg|0|A boy plays with some toys in the house with a blue chair in the background .|Хөвгүүн гэрт хэдэн тоглоом тоглож, цаана нь цэнхэр сандал сууж байна.
2171388397.jpg|0|A smiling child dressed in bright pink and green sleds down a snow-covered hill .|Цасанд хучигдсан толгодоор гулгаж, тод ягаан, ногоон өнгийн хувцас өмссөн инээж буй хүүхэд чарга .
2171576939.jpg|0|A smiling boy in winter clothes waves his mittened hands outside a building in the snow .|Өвлийн хувцастай инээж буй хүү цасанд дарагдсан барилгын гадаа бээлийтэй гараа даллаж байна.
2171891283.jpg|0|Two dogs are walking on a rugged path , one with a blue rope tied to a red object in its mouth .|Хоёр нохой бартаатай замаар алхаж байгаа бөгөөд нэг нохой нь амандаа улаан юманд хөх олс уячихсан байдаг.
2172329361.jpg|0|A red-cheeked , white-bearded man smiles as he stands at an arrangement of colorful arrangement of baskets and decorations .|Улаан хацартай, цагаан сахалтай эр олон өнгийн сагс, гоёл чимэглэлийн зүйлсийн дэргэд зогсож байхдаа инээмсэглэж байна.
2172493537.jpg|0|Three people are wading in shallow water near a stone path and spraying fountains .|Гурван хүн чулуун замын дэргэд гүехэн усанд гүйж, усан оргилуур цацаж байна.
2172526745.jpg|0|A young boy at a water park pouring a bucket water on a young girl in a swimsuit .|Усан цэцэрлэгт хүрээлэнгийн залуу хүү усны хувцастай залуу охин руу хувингаар ус асгаж байна.
2172570753.jpg|0|A woman wearing glasses and a brown beanie next to a girl with long brown hair holding a book .|Ном барьчихсан урт бор үстэй охины хажууд нүдний шил зүүсэн, бор новш зүүсэн эмэгтэй .
2172572633.jpg|0|The people in winter clothing are getting ready to start skiing .|Өвлийн хувцастай хүмүүс цанаар гулгах бэлтгэлээ базааж байна.
2172574039.jpg|0|Skiers dressed in many colors skiing on the white fluffy mountain of snow .|Цасан цагаан сэвсгэр ууланд олон өнгийн хувцас өмссөн цаначид цанаар гулгаж байна.
2173061319.jpg|0|A small child in an orange , white and black coat coming down a snowy hill on an innertube .|Улбар шар, цагаан, хар пальтотой бяцхан хүүхэд цасан толгодоос дотуур хоолой дээр бууж байна.
2173115233.jpg|0|Five individuals are standing on a lawn , talking and preparing to play their varied stringed instruments .|Таван хүн зүлгэн дээр зогсоод ярилцаж, янз бүрийн чавхдаст хөгжмөө тоглохоор бэлтгэж байна.
217330024.jpg|0|Man with hairy legs , wearing gray shorts and yellow t-shirt , hanging from a stripper pole , with several other people watch while laughing , some holding bottles .|Саарал шорт, шар цамц өмссөн үсэрхэг хөлтэй, тайчигчны шонноос өлгөөтэй, хэд хэдэн хүн инээж, зарим нь шил бариад харж байна.
2173312932.jpg|0|A brown dog is in the middle of a line of dogs chasing a dirty tennis ball over dirt .|Хүрэн нохой бохир теннисний бөмбөгийг шороон дээр хөөж байгаа нохойнуудын дунд байна.
2173362914.jpg|0|Three people take a lift up the mountain in the ski resort of Adirondack express .|Гурван хүн Адирондакийн цанын баазын ууланд өргөлтөөр гарч байна.
2173677067.jpg|0|A small girl standing on one leg in the grass , with another child in the background .|Бяцхан охин өвсөн дунд нэг хөл дээрээ зогсож, цаана нь өөр хүүхэд.
2173828253.jpg|0|A figure in green and black clothes poses for the camera while hoisting a sword-like object and camera , partially obscured by weeds in a snowy , outdoor , rural setting .|Цастай, гадаа, хөдөөгийн орчинд зэрлэг ургамлаар хэсэгчлэн халхалсан сэлэм шиг зүйл, камер өргөх зуураа ногоон, хар хувцастай дүрс камерын өмнө бууж байна.
2173831145.jpg|0|Two people wearing dark hoods , one in a black shirt , one in a green shirt , are surrounded by branches .|Хар юүдэнтэй нэг нь хар цамцтай, нөгөө нь ногоон цамцтай хоёр хүн мөчирөөр хүрээлэгдсэн байна.
217388728.jpg|0|A motocross rider riding a red bike with a red and white outfit is flying up in the air off of a ramp .|Улаан, цагаан хувцастай, улаан дугуй унасан мотокросчин налуу зам дээр агаарт нисч байна.
2174206711.jpg|0|Two Asian cheerleaders are facing forward waving silver pompoms , whilst other cheerleaders are performing facing the other way .|Азийн хоёр хөгжөөн дэмжигч урагшаа харсан мөнгөн помпонуудыг даллаж байхад бусад хөгжөөн дэмжигчид эсрэг тал руугаа үзүүлбэр үзүүлж байна.
2174343200.jpg|0|An older gentleman plays with his dog with a toy bone .|Хөгшин ноён нохойгоо тоглоомон ястай тоглож байна.
2174583700.jpg|0|The young toddler in the striped shirt eats grapes and a banana as an afternoon snack at his grandmas .|Судалтай цамцтай бяцхан хүүхэд эмээ дээрээ үдээс хойш зууш болгон усан үзэм, банана идэж байна.
217460891.jpg|0|Two young ladies in swimsuits stand in the ocean next to some mountains .|Усны хувцастай хоёр залуу бүсгүй далайд уулын хажууд зогсож байна.
2174648405.jpg|0|Women in dresses work the assembly line while wearing masks and hairnets .|Хувцаслалттай эмэгтэйчүүд маск зүүж, үсний тор зүүж угсрах шугам дээр ажилладаг.
2175184797.jpg|0|A person is performing yoga in the ocean under an orange sky .|Хүн улбар шар өнгийн тэнгэрийн дор далайд йог хийж байна.
2175631995.jpg|0|A smiling blond young woman in a purple sweater holds a faux alligator up to another blond young woman who pretends to be scared .|Нил ягаан өнгийн ноосон цамц өмссөн инээмсэглэж буй шаргал залуу эмэгтэй айсан дүр эсгэж буй өөр нэг шаргал үстэй залуу эмэгтэйн дэргэд хуурамч матар барьж байна.
217571210.jpg|0|A young man in a blue hat and a young girl with a curly ponytail smiling at each other .|Цэнхэр малгайтай залуу, буржгар гэзэгтэй охин хоёр бие бие рүүгээ инээмсэглэж байна.
2175758177.jpg|0|A baby wearing a white sleeper is sleeping in a crib .|Цагаан унтлага өмссөн хүүхэд өлгийд унтаж байна.
217583047.jpg|0|A man sits in a rowboat alone on foggy water .|Манантай усан дээр сэлүүрт завин дээр ганцаараа сууж байна.
217593609.jpg|0|A dark-skinned boy in a white karate uniform with a yellow belt is leaping with his limbs outstretched while a girl in a yellow silk outfit watches him , outside inside a fence .|Шар бүстэй, цагаан каратэгийн дүрэмт хувцастай, хар арьстай хүү хоёр гар хөлөө дэлгэн харайж байхад, гадаа хашаан дотор шар торгон хувцастай охин түүнийг харж байна.
2175980524.jpg|0|Little boy in his bathing suit tentatively preparing to step in the rocky-lined stream .|Усны хувцастай бяцхан хүү чулуурхаг урсгалд орохоор бэлтгэлээ базааж байна.
2176147758.jpg|0|A man in a red jacket is standing by a bicycle and trailer in a city street .|Унадаг хүрэмтэй эр хотын гудамжинд дугуй, чиргүүлийн дэргэд зогсож байна.
2176229181.jpg|0|A crowd of people are sitting in a large arena with three young women sitting on the floor .|Гурван залуу эмэгтэй шалан дээр суусан олон хүмүүс том дэвжээнд сууж байна.
2176364472.jpg|0|The large , dark colored dog is doing a climbing stunt outdoors , while a man watches .|Том, бараан өнгөтэй нохой гадаа авирах үзүүлбэр хийж байхад эрэгтэй хүн харж байна.
2176776800.jpg|0|Two men and three women are sitting at a rectangular wooden table drinking beer from glasses of various shapes .|Тэгш өнцөгт модон ширээн дээр хоёр эрэгтэй, гурван эмэгтэй сууж янз бүрийн хэлбэрийн шилээр шар айраг ууж байна.
2176874361.jpg|0|a small black dog growling at a large brown and white cow .|Боом бор цагаан үнээ рүү архирч буй жижиг хар нохой .
2176980976.jpg|0|a group of people peering over the edge of a large rocky mountain|том чулуурхаг уулын ирмэг дээгүүр харж буй хэсэг хүмүүс
2178064851.jpg|0|The child has a necklace on and is in the water .|Хүүхэд зүүлт зүүсэн, усанд байна .
2178095150.jpg|0|Greyhound are racing on a track , and number eight is making a run for first|Бузар гахайн зам дээр уралдаж байгаа бөгөөд 8 дугаартай тамирчин түрүүлж гүйж байна.
2178295140.jpg|0|A man with shoulder-length brown hair is smoking a cigarette outside while wearing a black jacket and blue jeans .|Мөр хүртлээ урт бор үстэй эрэгтэй хар хүрэм, цэнхэр жинсэн өмд өмсөж гадаа тамхи татаж байна.
2178295748.jpg|0|A man tends a grill full of cooking chicken parts as another man in a white apron looks on .|Цагаан хормогч өмссөн өөр нэг эр шарсан махаар дүүрэн тахианы мах шарж байна.
2178306830.jpg|0|The scuba diver floats underwater looking at the beauty of the sea .|Усан доогуур шумбагч далайн гоо сайхныг харж хөвж байна.
217838128.jpg|0|The man in the brown cap is paddling a boat on calm river .|Хүрэн малгайтай эр намуухан гол дээр завь сэлүүрдэж байна.
2178985121.jpg|0|A boy in a red shirt and a man with dark blond-hair hang out in the toy aisle of a store .|Дэлгүүрийн тоглоомын коридорт улаан цамцтай хүү, хар шар үстэй эрэгтэй хоёр нийлж байна.
2179330298.jpg|0|Three people walk through what appears to be a canyon as the mountains cast shadows on the dirt covered ground .|Гурван хүн хавцал мэт харагдах газраар алхаж байхад уулс шороон дээр сүүдэрлэж байна.
217949158.jpg|0|A Indian lady sitting making a clothing piece with a young child and older lady looking upon her , young child in the background playing .|Энэтхэг эмэгтэй бага насны хүүхэд, ахимаг насны эмэгтэй хоёрын хамт хувцас урлаж сууж байна, цаана нь бага насны хүүхэд тоглож байна.
2179759270.jpg|0|A middle-aged woman in a black dress stands facing a little girl who is holding a stuffed animal in blue hat .|Цэнхэр малгайтай чихмэл барьсан бяцхан охины өөдөөс хар даашинзтай дунд эргэм насны эмэгтэй зогсож байна.
218004295.jpg|0|Five adults and young girl is setting at table in a restaurant and a female adult has a camera in her hand .|Таван том хүн, залуу охин ресторанд ширээний ард сууж, насанд хүрсэн эмэгтэй гартаа камер барьсан байна.
2180356743.jpg|0|A little boy is standing above a structure and watching the other boys play a game .|Бяцхан хүү байшингийн дээгүүр зогсоод бусад хөвгүүдийн тоглоом тоглож байгааг харж байна.
2180480870.jpg|0|Tan dog running through long grass in a park-like setting .|Тан нохой цэцэрлэгт хүрээлэн шиг урт өвсөн дундуур гүйж байна.
2180726636.jpg|0|A worker actively engaged in welding two pieces of railing together .|Хоёр хашлагыг хооронд нь гагнах ажилд идэвхтэй оролцож буй ажилчин .
2180731945.jpg|0|Two men wearing button up shirts standing at a podium with medical slides showing on a screen behind them .|Ард нь дэлгэцэн дээр эмнэлгийн слайдыг харуулсан индэр дээр товчтой цамц өмссөн хоёр эрэгтэй зогсож байна.
2180886307.jpg|0|A brown dog is swimming and splashing in the water .|Хүрэн нохой усанд сэлж, ус цацаж байна.
