image_name|comment_number|comment|corrected_comment
890734502.jpg|0|Boy in black swim trunks playing in spray of water .|Усаар шүршиж тоглож буй хар сандалтай хүү .
89202781.jpg|0|A lady with blue jeans and a brown shirt is speaking on her cellphone on the second floor of the mall .|Цэнхэр жинсэн өмд, бор цамц өмссөн эмэгтэй худалдааны төвийн хоёрдугаар давхарт гар утсаараа ярьж байна.
892340814.jpg|0|A man in a red shirt climbs a sheer cliff face over the tree tops .|Улаан цамцтай хүн модны орой дээрх цав цагаан хад руу авирч байна.
89245315.jpg|0|Two kids wearing martial arts uniforms sitting on a blue mat with two people in the background performing a stretching exercise .|Цэнхэр дэвсгэр дээр суугаа тулааны спортын дүрэмт хувцас өмссөн хоёр хүүхэд, цаана нь хоёр хүн сунгалтын дасгал хийж байна.
89253626.jpg|0|One girl is stretching face down on a blue mat while a boy is behind her at a kickboxing studio .|Кикбоксын студид нэг охин хөх дэвсгэр дээр нүүрээ доош харуулан суниаж байхад араас нь хүү сууж байна.
892870649.jpg|0|Two people , a woman wearing an orange shirt and a man wearing a blue shirt , are jumping out of swings in midair .|Улбар шар өнгийн цамц өмссөн эмэгтэй, цэнхэр цамц өмссөн эрэгтэй хоёр хүн агаарт савлуур дээрээс үсэрч байна.
89332423.jpg|0|An African American man holding a big sword fish on his sailboat .|Дарвуулт завин дээрээ том сэлэм загас барьсан Африк гаралтай Америк эр .
89353191.jpg|0|A man on a ladder passes something to another man up to the second story of a building .|Шатан дээр байгаа хүн барилгын хоёр дахь давхар хүртэл өөр хүнд ямар нэг юм дамжуулж байна.
893808757.jpg|0|A man with a light colored shirt is lean against a post , looking at another person that is standing below him .|Цайвар өнгийн цамцтай эрэгтэй шон налан, доор нь зогсож буй өөр хүн рүү харна.
89404014.jpg|0|Three firemen in uniform are putting out a fire .|Дүрт хувцастай гурван гал сөнөөгч галыг унтрааж байна.
89407459.jpg|0|The brass section of an orchestra , mostly school-aged , performs a piece .|Оркестрийн гуулин хэсэг, ихэвчлэн сургуулийн насныхан уран бүтээлээ тоглодог.
894928353.jpg|0|Two young boys and a young girl playing on a gaurd rail .|Хоёр залуу, нэг охин төмөр зам дээр тоглож байна.
894964960.jpg|0|A man with glasses and a long-sleeve green shirt admires a Komodo dragon .|Нүдний шилтэй, урт ханцуйтай ногоон цамцтай эр Комодо лууг биширдэг.
89505897.jpg|0|A baby in a pink bib is drinking from two cups at the same time , while a woman looks at her .|Ягаан цээжтэй хүүхэд хоёр аяганаас зэрэг ууж байхад эмэгтэй хүн түүн рүү харж байна.
895359811.jpg|0|A group of woman are walking the street in different directions .|Бүлэг эмэгтэй гудамжаар янз бүрийн чиглэлд алхаж байна.
895502702.jpg|0|A black and white dog runs on a dry , yellow field of grass .|Хар цагаан нохой гандсан шаргал өвсөн дээр гүйж байна.
897406883.jpg|0|A toddler in a red jacket and jeans pulling another toddler wearing a green hat and jacket and red paints in a red wagon .|Улаан хүрэм, жинсэн өмд өмссөн бяцхан хүүхэд улаан тэргэн дээр ногоон малгай, хүрэм өмсөж, улаан будаг өмссөн өөр нэг хүүхдийг татаж байна.
897621891.jpg|0|A little boy underwater in a pool , holding a plastic dinosaur .|Усан дор хуванцар үлэг гүрвэл барьсан бяцхан хүү усан санд .
89779839.jpg|0|A woman wearing a black long-sleeve top and blue jeans is kneading bread .|Хар урт ханцуйтай цамц, цэнхэр жинсэн өмд өмссөн эмэгтэй талх зуурч байна.
89787769.jpg|0|A man holds a metal bowl full of some batter in one hand while his other hand appears blurred .|Хүн нэг гартаа зуурсан гурилаар дүүрэн төмөр аяга барьж байхад нөгөө гар нь бүдэг харагдаж байна.
8990627.jpg|0|A man is on the street in front of 2 windows with red metal on the front of them .|Гудамжинд нэг эрэгтэй урд талдаа улаан төмөр тавьсан 2 цонхны өмнө зогсож байна.
899079053.jpg|0|On a clear day , an older girl chases a boy along a beach with a forest nearby .|Цэлмэг өдөр том охин ойролцоох ой модтой далайн эрэг дагуу хүүг хөөж байна.
899810584.jpg|0|A person in red rock climbing , a mountain in the background .|Улаан хаданд авирсан хүн , цаана нь уул .
90011335.jpg|0|A white boat on glassy water with mountains in the background .|Ар талд уулстай шилэн усан дээр цагаан завь .
900144365.jpg|0|Marathon runners are racing on a city street , with other people standing around .|Марафон гүйлтийн тамирчид хотын гудамжаар уралдаж, бусад хүмүүс эргэн тойронд зогсож байна.
90044984.jpg|0|A man in a brown shirt and jeans leans against a pole in front of Chanel while a man in a cinema security shirt faces the other way near him .|Хүрэн цамц, жинсэн өмд өмссөн эрэгтэй Шанелийн урд шон налан зогсож байхад кино театрын хамгаалалтын цамц өмссөн эрэгтэй түүний хажуу тийшээ харан зогсож байна.
900557881.jpg|0|A man in a collared shirt and slacks grills on his outdoor barbecue next to a house .|Байшингийн хажууд гадаа шарсан мах шарахдаа захтай цамц, өмд өмссөн эрэгтэй .
90093157.jpg|0|An old man in a suit jacket and glasses is standing in front of an adults only establishment painted blue .|Цэнхэр будгаар будсан насанд хүрэгчдэд зориулсан байгууллагын өмнө костюм хүрэм, нүдний шил зүүсэн өвгөн зогсож байна.
901027462.jpg|0|There are three kids in a field with flowers in the background and the kid with a red shirt and the kid with the blue hat are holding what appears to be bug catching nets .|Цаана цэцэгтэй талбайд гурван хүүхэд байгаа бөгөөд улаан цамцтай, цэнхэр малгайтай хүүхэд алдааны тор барьж байгаа бололтой.
90123355.jpg|0|One man playing a red guitar and singing into a microphone has a larger man playing the drums behind him .|Улаан гитар тоглож, микрофонд дуулж буй нэг эрэгтэйн ард бөмбөр тоглож байгаа том биетэй хүн байна.
90168112.jpg|0|A young girl is playing on the shore of a beach , she is running away from a wave .|Залуу охин далайн эрэг дээр тоглож, давалгаанаас зугтаж байна.
901763909.jpg|0|Asian school children sitting on each others shoulders .|Ази сургуулийн хүүхдүүд мөрөн дээрээ суугаад .
9035232.jpg|0|A white man with beard and earring chops onions for dinner in his home kitchen .|Сахал, ээмэгтэй цагаан эр гэрийн гал тогоонд оройн хоолонд сонгино хэрчиж байна.
90358839.jpg|0|A man , wearing a black shirt and striped tie , talking on the phone and reviewing paperwork .|Хар цамц, судалтай зангиа зүүж, утсаар ярьж, бичиг цаасны ажил хийж буй эрэгтэй .
904404695.jpg|0|A man is resting in a small stream with a hat over his head while the little waterfall is pouring in the background .|Араас бяцхан хүрхрээ асгарч байхад нэг хүн толгой дээрээ малгайтай жижиг горхинд амарч байна.
905022127.jpg|0|A man in a baseball cap is standing on a rocky beach at sunset with a fishing pole in his hands and the sun setting behind him .|Бэйсболын малгай өмссөн эр нар жаргах үед хад асгатай эрэг дээр гартаа загас агнуурын шон бариад, нар жаргаж байна.
905355838.jpg|0|A male ballplayer wearing a white and blue uniform playing in front of a large crowd .|Цагаан цэнхэр өнгийн дүрэмт хувцас өмссөн эрэгтэй бөмбөгчин олны өмнө тоглож байна.
906991263.jpg|0|A tourist walks down the street , camera in hand , trying to find something worthy of a photo .|Гудамжаар алхаж буй жуулчин гартаа камераа барин, гэрэл зураг авахад тохиромжтой зүйл хайж байна.
908636680.jpg|0|A group of eight campers sit around a fire pit trying to roast marshmallows on their sticks .|Найман баазынхан галын нүхийг тойрон сууж, савхан дээрээ зефир шарахыг оролдож байна.
909191414.jpg|0|Children are playing in and around a garden tube in the front yard of a house .|Хүүхдүүд байшингийн үүдний хашаан дахь цэцэрлэгийн гуурсан дотор болон эргэн тойронд тоглож байна.
909808296.jpg|0|Two small dogs , one black-and-white and one brown-and-black , walk down the street .|Гудамжаар нэг хар цагаан, нэг бор хар гэсэн хоёр жижиг нохой алхаж байна.
91083825.jpg|0|The women wearing a white tank top and a brown hair tie appears to be painting very rapidly in the color green .|Цагаан цамц өмсөж, хүрэн үсний зангиа зүүсэн эмэгтэйчүүд ногоон өнгөөр маш хурдан зурж байгаа бололтой.
911527312.jpg|0|A young boy wearing red Croc sandals climbs a tree with healthy , green leaves .|Улаан Croc шаахайн өмссөн залуу эрүүл, ногоон навчтай модонд авирч байна.
911795495.jpg|0|a young girl with long brown hair holding a black and red striped stick .|хар улаан судалтай саваа барьсан урт бор үстэй залуу охин .
912382266.jpg|0|Two men wearing striped blue polo shirts are sitting at a table in a room with other people and wide windows .|Судалтай цэнхэр поло цамц өмссөн хоёр эрэгтэй бусад хүмүүстэй, өргөн цонхтой өрөөнд ширээний ард сууж байна.
912402498.jpg|0|A man in a white striped shirt sits at a table with a dark red tablecloth laden with wineglasses and food plates , where many other people are also sitting .|Цагаан судалтай цамцтай хүн дарсны шил, хоолны таваг бүхий бараан улаан ширээний бүтээлэгтэй ширээний ард сууж байгаа бөгөөд тэнд өөр олон хүмүүс сууж байна.
91251257.jpg|0|A black-haired woman in yellow and orange is doing work near the water .|Усны дэргэд шар, улбар шар хувцастай хар үстэй эмэгтэй ажил хийж байна.
91365036.jpg|0|This is a scene of children and adults on a pavilion on a tropical isle .|Энэ бол халуун орны арал дээрх асарт хүүхдүүд болон насанд хүрэгчдийн дүр зураг юм.
915300855.jpg|0|Old guitarist in white clothes performing to an audience .|Цагаан хувцастай өвгөн гитарчин үзэгчдийн өмнө тоглож байна.
916624251.jpg|0|Two men and a woman walking down a small city street , while a crowd of people are walking behind them .|Хотын жижиг гудамжаар эрэгтэй, эмэгтэй хоёр алхаж байхад ард нь бөөн хүмүүс алхаж байна.
917574521.jpg|0|Two little girls stand against a wall , one girl has a happy face and the other girl has a sad face .|Хоёр бяцхан охин хана налан зогсоход нэг охин нь баяр хөөртэй, нөгөө охин нь гунигтай царайтай.
91852718.jpg|0|Three formally-dressed people sit around a wooden table eating dessert and drinking from white cups on white saucers .|Албан ёсны хувцастай гурван хүн модон ширээний ард суугаад амттан идэж, цагаан тавган дээрх цагаан аяганаас ууж байна.
918545497.jpg|0|A young man in a gray t-shirt and dark pants is mowing a lawn outside a white clapboard building .|Саарал цамц, бараан өмд өмссөн залуу цагаан хавтангийн барилгын гадаа зүлэг хадаж байна.
91875542.jpg|0|An elderly woman with white hair and glasses is next to a window and in front of an open cash register drawer .|Цонхны дэргэд, онгорхой кассын шүүгээний өмнө цагаан үстэй, нүдний шилтэй өндөр настай эмэгтэй байна.
918886676.jpg|0|A tan dog has a drink from water being poured from a spout .|Бүдгэр нохой хошуунаас асгаж байгаа уснаас ууж байна.
91972799.jpg|0|A woman in a blue top and pink shorts swims underwater .|Цэнхэр топ, ягаан шорт өмссөн эмэгтэй усан дор сэлж байна.
921190481.jpg|0|A child in a baseball park who has just hit a baseball off a tee with a blue bat and is about to run to first base .|Дөнгөж бейсболын цэцэрлэгт хүрээлэнд хөх цохиураар бейсболыг цохиж, эхний бааз руу гүйх гэж буй хүүхэд.
92246314.jpg|0|People are ice-skating and walking across a frozen surface with the Adobe building in the background .|Хүмүүс мөсөн гулгаж, цаад талд нь Adobe-ийн барилгатай хөлдсөн гадаргуу дээгүүр алхаж байна.
92289076.jpg|0|A guy in a black jacket and blue jeans holding a large arrangement of roses while walking down the sidewalk .|Хар хүрэм, цэнхэр жинсэн өмд өмссөн залуу явган хүний замаар алхаж байхдаа том сарнай барьчихсан.
923550133.jpg|0|Two girls are sitting outside on the ground in front of a lake .|Хоёр охин гадаа нуурын урд газар сууж байна.
92413203.jpg|0|Three people each lead one camel with riders in a silhouetted line across sand dunes and a gray sky .|Гурван хүн тус бүр нэг тэмээ дагуулан элсэн манхан, саарал тэнгэрийг хөндлөн гулдуулсан морьтонтой хамт явж байна.
92497263.jpg|0|Outdoor street view with a elementary school-age boy in khaki pants and black t-shirt standing on sidewalk next to a wall mural while an adult stoops over an individual sitting on the curb .|Хаки өмд, хар подволк өмссөн бага сургуулийн насны хүү явган хүний зам дээр зогсож байгаа гадаа гудамжны харагдах байдал, ханын цаасны хажууд насанд хүрсэн хүн замын хашлага дээр сууж буй хүний дээгүүр бөхийж байна.
925491651.jpg|0|A white dog is splashing through the water .|Усан дундуур цагаан нохой цацаж байна.
92679312.jpg|0|A young white boy with short hair smiling into a microphone , standing near a slightly balding white male smiling into a microphone .|Богино үстэй залуу цагаан хүү микрофон руу инээмсэглэж, бага зэрэг халзан цагаан эрийн дэргэд зогсож микрофон руу инээмсэглэж байна.
9268793.jpg|0|A man with a blue shirt , mustache and glasses is working with lumber on a deck .|Цэнхэр цамцтай, сахалтай, нүдний шилтэй хүн тавцан дээр модон материалаар ажиллаж байна.
92732320.jpg|0|A snow hut illuminated internally with a figure in a blue snowsuit standing at the entrance , in the background stands what appears to be a snowman .|Орцонд цэнхэр өнгийн цасан хувцастай дүрсээр гэрэлтсэн цасан овоохой, цаана нь цасан хүн шиг харагдаж байна.
927420680.jpg|0|Someone in a light shirt is walking past several large trees overlooking a city .|Хөнгөн цамцтай хэн нэгэн хотыг харсан хэд хэдэн том модны дэргэдүүр алхаж байна.
929679367.jpg|0|A puppy is playing with a tennis ball on a well-kept path lined with groomed bushes .|Гөлөг арчсан бутнуудын доторлогоотой сайхан зам дээр теннисний бөмбөгөөр тоглож байна.
930126921.jpg|0|The man white purple and white polka-dotted shirts is eating and looking to his right while the woman behind him has a confused look on her face .|Цагаан нил ягаан, цагаан цэгэн цамцтай эр хоол идэж, баруун тийшээ харж байхад ард нь байгаа эмэгтэй эргэлзсэн царайтай.
930748509.jpg|0|A man in pets a dog on the chest at a park .|Гэрийн тэжээвэр амьтантай хүн цэцэрлэгт хүрээлэнгийн цээжин дээрээ нохой .
931028778.jpg|0|A group of people stand below black and white patterned decorations .|Хар цагаан хээтэй гоёл чимэглэлийн доор хэсэг хүмүүс зогсож байна.
931156700.jpg|0|A woman in a pink shirt is holding a hot air balloon with an American flag on it .|Ягаан цамцтай эмэгтэй Америкийн далбаатай агаарын бөмбөлөг барьж байна.
9324151.jpg|0|A man in a black hoodie and blue jeans kneels in the middle of a road .|Хар юүдэнтэй цамц, цэнхэр жинсэн өмд өмссөн эрэгтэй замын голд сөхрөн суув.
93270842.jpg|0|A man who resembles a lone traveler with his suitcase , sits on a park bench and watches a scene full of people behind him .|Чумодантайгаа ганцаардсан аялагчтай төстэй эр цэцэрлэгт хүрээлэнгийн сандал дээр суугаад ард нь дүүрэн хүмүүстэй дүр зургийг харж байна.
93307139.jpg|0|A woman holds her mouth wide open as she is placing a stack of crackers in .|Эмэгтэй хүн амаа ангайлган жигнэмэг овоолон хийж байна.
93311089.jpg|0|A little boy with a shirt , shorts and socks on , standing on the beach .|Цамц, шорт, оймс өмссөн бяцхан хүү далайн эрэг дээр зогсож байна.
933118213.jpg|0|A young boy with a hat on has a fishing pole in hand .|Загас агнуурын шон барьчихсан малгайтай залуу .
934028208.jpg|0|A young adult male , wearing shorts , a black shirt and a work apron , makes adjustments to a bicycle .|Шорт өмд, хар цамц, ажлын хормогч өмссөн насанд хүрсэн залуу унадаг дугуйндаа тохируулга хийж байна.
93406137.jpg|0|two men clean the side of a gas service station canopy below a blue sky .|Хоёр хүн цэнхэр тэнгэрийн доор шатахуун түгээх станцын халхавчны хажуу талыг цэвэрлэж байна.
934375844.jpg|0|A cute baby boy is sitting on the bed looking very happy .|Хөөрхөн хүү орон дээр их л аз жаргалтай сууж байна.
93447586.jpg|0|A gymnast in blue on the balancing beam jumping in the air with a crowd of people wearing mainly orange watching .|Тэнцвэрийн цацраг дээр цэнхэр хувцастай гимнастикч, улбар шар өнгийн хувцас өмссөн олон хүмүүсийн дунд агаарт үсэрч байна.
937559727.jpg|0|The fisherman stands in water while looking at something small in his hands .|Загасчин гартаа байгаа жижиг зүйлийг хараад усанд зогсож байна.
938012664.jpg|0|A little girl wearing pink is blowing bubbles with her eyes closed , outdoors .|Ягаан хувцас өмссөн бяцхан охин гадаа нүдээ аниад бөмбөлөг үлээж байна.
938162709.jpg|0|A person is crosscountry skiing through the snow .|Хүн цасан дундуур цанаар гулгаж байна.
938661426.jpg|0|A british band having a practice at night in their red uniforms .|Улаан дүрэмт хувцастайгаа шөнө бэлтгэл хийж байгаа Британийн хамтлаг .
93922153.jpg|0|A woman rock climber scales a cliff far above pastures .|Хаданд авирагч эмэгтэй бэлчээрийн дээгүүр хад цохиж байна.
94024624.jpg|0|An oriental woman wearing a hat riding down the street on a bicycle .|Гудамжаар унадаг дугуйгаар явж буй малгай өмссөн дорнын эмэгтэй .
94062798.jpg|0|A woman wearing a hat selling something to an older women with white hair .|Цагаан үстэй хөгшин эмэгтэйчүүдэд ямар нэгэн зүйл зарж буй малгай өмссөн эмэгтэй .
940973925.jpg|0|Two children are climbing on the wall of a white building whilst one child plays with a green ball .|Хоёр хүүхэд цагаан байшингийн ханан дээр авирч байхад нэг хүүхэд ногоон бөмбөгөөр тоглож байна.
941641803.jpg|0|A guy in an olive-green sweater and blue jeans is playing with a blond-haired toddler in a yard using toy golf clubs .|Чидун ногоон ноосон цамц, цэнхэр жинсэн өмд өмссөн залуу шаргал үстэй бяцхан хүүхэдтэй хашаандаа гольфын тоглоом тоглож байна.
94183012.jpg|0|A machine lifting dirt in front of an apartment building .|Орон сууцны урд шороог өргөх машин .
94232465.jpg|0|The woman is ice skating and pulling the little girl in the cart across the ice .|Эмэгтэй тэшүүрээр гулгаж, тэргэнцэрт суугаа бяцхан охиныг мөсөн дээгүүр чирж байна.
942399470.jpg|0|A long-bearded man wearing a coat , fur vest , and broad brimmed fur-trimmed hat .|Пальто, үслэг хантааз, өргөн хүрээтэй үслэг малгай өмссөн урт сахалтай эр.
9426826.jpg|0|A white woman wearing a white shirt sitting and looking at her plate of food .|Цагаан цамц өмссөн цагаан эмэгтэй тавагтай хоолоо хараад сууж байна.
942900552.jpg|0|An old Asian woman is standing with her legs tied together .|Ази хөгшин эмэгтэй хөлөө боогоод зогсож байна .
944374205.jpg|0|Similarly dressed children are playing soccer in a rocky field in front of a building .|Ижил хувцастай хүүхдүүд барилгын урд талын чулуурхаг талбайд хөл бөмбөг тоглож байна.
944424269.jpg|0|Someone in a black dress and a tan colored hat , selling fruit and vegetables on the road .|Хар даашинзтай, бор малгайтай хүн зам дээр жимс ногоо зарж байна.
94472195.jpg|0|On a rainy day in a crowded area , nine people wait in line at a stand selling pretzels and soft drinks .|Бороотой өдөр хөл хөдөлгөөн ихтэй газар есөн хүн зутан , ундаа зардаг лангуунд оочерлож байна .
944788251.jpg|0|A boy and a large dog stand on a dock watching another dog swim in the water .|Хүү, том нохой хоёр усан онгоцны зогсоол дээр зогсож, өөр нохойг усанд сэлж байхыг харж байна.
