image_name|comment_number|comment|corrected_comment
8018752014.jpg|0|An older food vendor , in a white embroidered shirt , maroon vest and checked apron , is sitting , leaning forward , with her elbows on her knees and her hands clasped , behind her foodstuffs .|Цагаан хатгамал цамц, хүрэн улаан хантааз, шалан хормогч өмссөн хуучин хүнсний худалдагч тохойгоо өвдгөөрөө бөхийлгөж, гараа атгаж, хоолныхоо ард сууж байна.
8018915471.jpg|0|Three individuals are riding bikes down a steep slope in what seems to be a race .|Уралдаанд гурван хүн эгц энгэр уруу дугуй унаж байна.
8019420543.jpg|0|A defensive football player from Wisconsin almost sacking the UTEP quarterback before he got rid of the ball .|Висконсин мужийн хамгаалагч хөлбөмбөгчин бөмбөгнөөс салахаас өмнө UTEP-ийн хамгаалагчийг халах шахсан.
8022825509.jpg|0|A woman in black athletic gear and a blue helmet tries to move past another woman in similar gear and a black helmet with a referee on each side of them|Хар өнгийн спортын хувцастай, цэнхэр дуулгатай эмэгтэй ижил хувцастай, хоёр талдаа шүүгчтэй хар дуулгатай өөр эмэгтэйн хажуугаар өнгөрөхийг оролдож байна.
8025522249.jpg|0|One man playing a trumpet , another playing a saxophone , and a third man playing the keyboard at a performance .|Тоглолт дээр нэг хүн бүрээ тоглож, нөгөө хүн саксофон тоглож, гурав дахь хүн гар тоглож байна.
8025717431.jpg|0|A youth soccer game , with one girl primarily in black and the other in yellow , is contested on a grass field .|Өсвөр үеийнхний хөл бөмбөгийн тэмцээн нэг охин голдуу хар, нөгөө нь шар хувцастай, зүлгэн талбайд өрсөлдөж байна.
802594049.jpg|0|A man with a beard and a navy blue backwards baseball cap stares intently at something in the distance .|Сахалтай, хар хөх өнгийн бэйсболын малгайтай эр алсад байгаа зүйлийг анхааралтай ширтэж байна.
80282277.jpg|0|A young female dancer , wearing a pink top and pants , with her hair pulled behind her in a long ponytail , executes a step with one raised leg bent at the knee , and both arms extended and bent at the wrist , while two young people sit on folding chairs and watch .|Ягаан цамц, өмд өмссөн, үсээ урт гэзэг болгож ардаа барьсан бүжигчин бүсгүй нэг хөлөө өвдгөөрөө бөхийлгөж, хоёр гараа сунгаж бугуйгаа нугалан алхаа гүйцэтгэж байна. , хоёр залуу эвхэгддэг сандал дээр суугаад харж байхад .
8029536.jpg|0|baby wearing blue and red suit kneeling next to vending machine|Цэнхэр, улаан хослол өмссөн хүүхэд автомат машины дэргэд өвдөг сөгдөн сууж байна
8030378528.jpg|0|Several men on bicycles pass a group of spectators , many of which are cheering for Great Britain .|Унадаг дугуйтай хэдэн эрэгтэй үзэгчдийн хажуугаар өнгөрч, тэдний ихэнх нь Их Британийг дэмжиж байна.
803175693.jpg|0|Six skimpily dressed cheerleaders with pompoms are standing at the game field sidelines during an outside event .|Гадаад нэгэн арга хэмжээний үеэр помпонтой, нарийхан хувцасласан зургаан хөгжөөн дэмжигч тоглоомын талбайн хажууд зогсож байна.
8033603923.jpg|0|A blond woman watches a woman in wearing a pink flowery top holding her hand up as they both stand behind a bar .|Ягаан цэцэгтэй цамц өмссөн эмэгтэйг гараа өргөхөд хоёулаа баарны ард зогсохыг шаргал үстэй эмэгтэй харж байна.
8034136985.jpg|0|A golfer is holding his backstroke pose during a tournament while being watched by hundreds of onlookers .|Гольфчин тэмцээний үеэр нуруугаар даллах зургаа барьж байхад олон зуун үзэгчид үзэж байна.
8034139464.jpg|0|A man in an orange shirt is raising his golf club on a grassy course while five other men look on .|Улбар шар өнгийн цамцтай эр гольфын цохиураа өвстэй талбай дээр өргөж байхад өөр таван эрэгтэй харж байна.
8034142456.jpg|0|A golfer , wearing a white shirt , hat , and khaki pants , is celebrating a job well done by holding his hands and club in the air .|Цагаан цамц , малгай , хаки өмд өмссөн гольфчин гар , бороохойгоо агаарт атган ажлаа сайн хийсэн гэж тэмдэглэж байна .
8036413429.jpg|0|Two males , sweaty and smiling , running during a game , one male has brown hair and a blue uniform with a sleeve tattoo on his arms , and is holding up his right index finger .|Тоглолтын үеэр хөлөрч, инээмсэглэн гүйж буй хоёр эрэгтэй эрэгтэй бор үстэй, хөх өнгийн дүрэмт хувцастай, гартаа ханцуйтай шивээстэй, баруун долоовор хуруугаа дээш өргөв.
8036608675.jpg|0|A runner in blue has the lead in the inside lane , while two runners in green and orange trail from the outside .|Цэнхэр хувцастай гүйгч дотоод эгнээнд тэргүүлж байгаа бол гадна талаас ногоон, улбар шар өнгийн гүйлттэй хоёр гүйгч байна.
8036955015.jpg|0|A man wearing a white helmet is driving a four wheeled motorcycle in a dirt field .|Цагаан дуулга өмссөн эрэгтэй шороон талбайд дөрвөн дугуйтай мотоцикль жолоодож байна.
8037906430.jpg|0|Many hockey players are bunched up around the goal , the goalie is in a crouched position and one player wearing a red and white jersey appears to be celebrating .|Олон хоккейчид хаалганы эргэн тойронд цугларч, хаалгач бөхийсөн байрлалд байгаа бөгөөд улаан, цагаан өмсгөл өмссөн нэг тоглогч баяраа тэмдэглэж байгаа бололтой.
8038092309.jpg|0|Two baseball players in a stadium during broad daylight are both after the same baseball in the outfield .|Өдрийн цагаар цэнгэлдэх хүрээлэнд хоёр бейсболын тоглогч гадна талбайд ижил бейсболын араас явж байна.
8038836818.jpg|0|bicycle race on a small street that curves right between very tall green trees with a lot of people watching from the sidelines holding flags|маш өндөр ногоон моддын дундуур муруйсан жижиг гудамжинд туг барин хажуунаас харж буй олон хүмүүстэй дугуйн уралдаан
8038838476.jpg|0|A cyclist in a blue jersey is being cheered by a crowd laced with French flags as he pedals away from other riders .|Цэнхэр өмсгөлтэй дугуйчин бусад дугуйчдаас холдоод, Францын далбаатай олон хүмүүс түүнийг дэмжиж байна.
8038855203.jpg|0|An asian table tennis player is eagerly watching and waiting for his opponent serves the ball .|Азийн ширээний теннисчин өрсөлдөгчөө бөмбөгөөр үйлчлэхийг тэсэн ядан харж, хүлээж байна.
8039814484.jpg|0|Four men are sitting in front of two large windows ; one man is playing a guitar , one is playing the bongo drums , and two are sitting back without instruments .|Хоёр том цонхны өмнө дөрвөн эрэгтэй сууж байна; нэг хүн гитар тоглож, нэг нь бонго бөмбөр тоглож, хоёр нь зэмсэггүй хойш сууж байна.
804087017.jpg|0|Two men sitting on a bench on a street next to two women doing the same .|Гудамжинд вандан сандал дээр хоёр эмэгтэйн хажууд сууж буй хоёр эрэгтэй ижил зүйлийг хийж байна.
8040947572.jpg|0|A football player in a red and black uniform bearing the number 3 and a black helmet is carrying the ball and is surrounded by opposing players wearing white and purple Pikesville uniforms .|3 дугаартай улаан, хар дүрэмт хувцастай, хар дуулгатай хөлбөмбөгчин бөмбөгийг авч явж байгаа бөгөөд түүний эргэн тойронд Пиксвиллийн цагаан, ягаан өнгийн хувцас өмссөн эсрэг багийн тоглогчид хүрээлэгдсэн байна.
8041003011.jpg|0|Cyclists are racing ; the leader is wearing red , has a red bike , and sports red sunglasses .|Унадаг дугуйчид уралдаж байна; удирдагч улаан өмссөн , улаан дугуйтай , спортын улаан нарны шилтэй .
8041006083.jpg|0|Stop motion photography clearly catches the image of a woman in full cycling gear competing in a bicycling day event .|Stop motion гэрэл зураг нь дугуйн өдөрлөгт уралдаж буй дугуйн хувцас өмссөн эмэгтэйн дүр төрхийг тод харуулдаг.
8042217958.jpg|0|A woman watching six televisions , while sitting on a hardwood floor in a beautiful room made of bricks with large windows , while a dark-haired man leaning on a windowsill is watching her .|Том цонхтой тоосгоор хийсэн гоёмсог өрөөнд хатуу модон шалан дээр суугаад зургаан зурагт үзэж байгаа эмэгтэй, цонхны тавцан дээр түшсэн хар үстэй эрэгтэй түүнийг харж байна.
8042519106.jpg|0|A football coach talking to a young football player while the other players stand off in the background .|Хөлбөмбөгийн дасгалжуулагч залуу хөлбөмбөгчинтэй ярилцаж байхад бусад тоглогчид ард зогсож байна.
8042519212.jpg|0|It 's football practice as a small group of players take a stance on the field watched by four onlookers on the sidelines .|Цөөн тооны тоглогчид талбай дээр байр сууриа эзэлдэг нь хөл бөмбөгийн бэлтгэл юм.
8042603870.jpg|0|Rock climber scaling a straight up and down rock with crack in middle .|Дунд нь хагаралтай, дээш доошоо шулуун чулуулагт авирагч .
8043180155.jpg|0|A young girl walks down the streets of a relatively low income neighborhood while others are doing their business in the background .|Залуу охин харьцангуй бага орлоготой хорооллын гудамжаар алхаж байхад нөгөө хэсэг нь бизнесээ хийж байна.
8045061561.jpg|0|Female athlete for the bulls is holding what looks to be a hockey stick , with rocks and trees in the back .|Бухын тамирчин эмэгтэй ар талдаа чулуу, модтой хоккейн саваа барьж байна.
8046655694.jpg|0|A small child being held by a woman , holding on to her shirt .|Цамцнаас нь тэвэрсэн эмэгтэйд тэврүүлсэн бяцхан хүүхэд .
80474519.jpg|0|An older woman dressed in pink with a black fanny pack is outside with some trees and an interesting architectural design next to her .|Гадаа ягаан өнгийн хувцас өмссөн, хар сэнстэй хөгшин эмэгтэй модтой, сонирхолтой архитектурын загвартай гадаа байна.
8047664455.jpg|0|Two football teams are in the middle of a play as white jerseys and the opposing green jerseys are in all positions of motion while scrambling for the football .|Хөлбөмбөгийн хоёр баг тоглолтын дундуур цагаан өмсгөлтэй, эсрэг багийн ногоон өмсгөл бүхий л байрлалд хөдөлгөөн хийж, хөл бөмбөгийн төлөө тэмцэж байна.
80479586.jpg|0|A man in a suit with his arm in a blue sling is walking down the sidewalk in front of a pink building while two women are standing there together .|Цэнхэр дүүгүүртэй гартай костюм өмссөн эрэгтэй ягаан өнгийн барилгын урд явган хүний замаар алхаж байхад хоёр эмэгтэй хамт зогсож байна.
8048055083.jpg|0|A group of men dressed in red uniforms play drums while the man in front holds up his hand and holds a scepter in the other hand .|Улаан дүрэмт хувцас өмссөн хэсэг хүмүүс бөмбөр тоглож байхад урд байгаа хүн гараа өргөөд нөгөө гартаа очирт таяг барина.
8049107365.jpg|0|Monster truck flies over grassy knolls on a sunny afternoon .|Нарлаг үдээс хойш мангас ачааны машин өвс ногоотой хонгил дээгүүр нисч байна.
8051568083.jpg|0|A young man wears a helmet and protective clothing as he races his dirt bike through a muddy track .|Залуу эрэгтэй хамгаалалтын малгай өмсөж, шороон дугуйгаа шавартай замаар уралдаж байна.
8052328504.jpg|0|A football player holding a football rolling on the field with three other football players watching him .|Хөлбөмбөгийн тоглогч талбай дээр өнхөрч буй хөл бөмбөг барьж, өөр гурван тоглогч түүнийг харж байна.
8052380671.jpg|0|It 's raining during a football game outside- number 94 in a dark jersey is trying to take down an opponent who is wearing a white jersey .|Гадаа хөл бөмбөгийн тэмцээний үеэр бороо орж байна- 94 дугаартай бараан өнгийн өмсгөлтэй цагаан өмсгөл өмссөн өрсөлдөгчөө буулгаж авахыг оролдож байна.
8052387530.jpg|0|Four football players in black are tackling the opposing team 's player , shown in white , while it is raining .|Бороо орж байхад хар хувцастай дөрвөн хөлбөмбөгчин цагаанаар дүрслэгдсэн эсрэг багийн тоглогчтой барилдаж байна.
8052391339.jpg|0|A dogpile of football players dressed in blue and red with one player in blue trying to jump over the dogpile .|Цэнхэр, улаан өнгийн хувцастай, нэг тоглогч цэнхэр хувцастай, нохойн дээгүүр харайх гэж оролдсон хөл бөмбөгийн тоглогчид .
8052397902.jpg|0|Young defensive football players executing a tackle on a member of the opposite team during a football game .|Хөлбөмбөгийн тоглолтын үеэр эсрэг багийн гишүүн рүү цохиж буй хамгаалалтын залуу хөлбөмбөгчид.
8052575239.jpg|0|Hundreds of people are watching a soccer game between a team wearing green jerseys and a team wearing blue jerseys .|Ногоон өмсгөл өмссөн баг болон цэнхэр өмсгөл өмссөн багийн хоорондох хөл бөмбөгийн тоглолтыг олон зуун хүн үзэж байна.
8053033868.jpg|0|One soccer team , wearing red shirts , and one wearing black shirts appear on the field in a crowded stadium .|Хүн хөл хөдөлгөөн ихтэй цэнгэлдэх хүрээлэнд улаан цамц өмссөн нэг хөлбөмбөгийн баг, хар цамц өмссөн нэг баг талбайд гарч ирэв.
805682444.jpg|0|Two nearly identical dogs try to paw a ball out of muddy water .|Бараг ижилхэн хоёр нохой шаварлаг уснаас бөмбөг тавиулах гэж оролдож байна.
8057415401.jpg|0|Two elderly gentleman , one in a red plaid shirt and the other in a gray shirt , playing checkers on a granite table .|Нэг нь улаан дөрвөлжин цамцтай нөгөө нь саарал цамцтай, боржин чулуун ширээн дээр даам тоглож буй хоёр хөгшин ноёнтон.
8058635660.jpg|0|A person of indeterminate sex wearing a dark hat , neutral pants , and a red shirt walking up a rocky slope at high altitude in the daytime .|Өдөр өндөр уулын хад чулуурхаг энгэрээр хар өнгийн малгай , саармаг өмд , улаан цамц өмссөн хүйс нь тодорхойгүй хүн .
8060043940.jpg|0|Several men are on a soccer field passing a ball to one another during a soccer game where there are several attendees watching .|Хөлбөмбөгийн талбай дээр хэд хэдэн оролцогчид үзэж байгаа хөлбөмбөгийн тоглолтын үеэр хэд хэдэн эрэгтэй бие биедээ бөмбөг дамжуулж байна.
8060276063.jpg|0|Several soccer players are in a stadium playing soccer while a large audience watches them .|Хэд хэдэн хөл бөмбөгчид цэнгэлдэх хүрээлэнд хөл бөмбөг тоглож байхад олон үзэгчид тэднийг харж байна.
8063007.jpg|0|A blond girl and a bald man with his arms crossed are standing inside looking at each other .|Шаргал үст охин хоёр гараа зөрүүлэн халзан эр хоёр бие биенээ хараад зогсож байна.
8063022480.jpg|0|A boy on a mountain bike is performing on a dirt track before spectators under a tent .|Уулын дугуйтай хүү майхан дор үзэгчдийн өмнө шороон зам дээр тоглож байна.
8063802042.jpg|0|A bicyclist performs a stunt on a ramp , going into the air while twisting .|Унадаг дугуйчин налуу зам дээр мушгиж байхдаа агаарт гарч трюк хийж байна.
8063954905.jpg|0|A young girl in a traditional white karate uniform demonstrates her skill .|Уламжлалт цагаан каратэгийн дүрэмт хувцастай залуу охин ур чадвараа харуулж байна.
8064150004.jpg|0|A kid on a mountain bike performing a trick high above the ground in a wooded setting .|Уулын дугуй унасан хүүхэд модтой орчинд газраас өндөрт мэх хийж байна.
8064982845.jpg|0|A man surfs on a medium sized wave while holding a paddle that seems to steer him in the direction he wants to go .|Эр хүн түүнийг хүссэн зүг рүү нь чиглүүлж байгаа мэт сэлүүрээ барин дунд зэргийн долгион дээр сэлгэж байна.
8065680234.jpg|0|A train approaches a stop at an indoor station as several people walk and sit inside the building .|Барилга дотор хэд хэдэн хүн алхаж суухад галт тэрэг дотоод буудлын зогсоол руу ойртож байна.
8066184290.jpg|0|An extremely skilled man surfing a gigantic wave in the ocean .|Далайд аварга том давалгаагаар аялж буй маш чадварлаг хүн .
8066894280.jpg|0|There are children and adults from an Asian culture , and two of the adults are wearing clown noses and are standing on either side of a young boy , while one of the adults has a pink tube in his hand and is pointing at the pink tube in the young man 's hand .|Азийн соёл иргэншилтэй хүүхэд, насанд хүрэгчид байгаа бөгөөд томчуудын хоёр нь алиалагчийн хамар зүүж, залуу хүүгийн хоёр талд зогсож байгаа бол томчуудын нэг нь гартаа ягаан хоолойтой, залуугийн гарт байгаа ягаан гуурсыг зааж .
8067051359.jpg|0|A marathon biker with the number 701 smiles while standing and holding his bike up .|701 дугаартай марафон гүйлтийн дугуйчин дугуйгаа дээш барин зогсоод инээмсэглэж байна.
8067143747.jpg|0|Two men are watching a cyclist , adorn in orange and black , cycling uphill in dirt on a tree lined hill , in what could be a competition .|Хоёр эр улбар шар, хар өнгөөр гоёсон дугуйчинг харж байна, модтой толгод дээр шороон дунд өгсөж, ямар тэмцээн болох вэ.
8067655952.jpg|0|Two women in colorful swimming suits are leaping above a pool while two other women in the pool watch .|Өнгө өнгийн усны хувцастай хоёр эмэгтэй усан сан дээгүүр харайж байгаа бол усан сан дахь өөр хоёр эмэгтэй харж байна.
8067804631.jpg|0|A middle-aged woman in a burgundy dress with short black hair stands at a music stand as two people in the back are blurred while holding hands while leaning back .|Богино хар үстэй бургунд даашинзтай, дунд эргэм насны эмэгтэй хөгжмийн тавцан дээр зогсож байгаа хоёр хүн хойшоо тонгойн хөтлөлцөн зогсоход бүдэг бадаг .
8067811449.jpg|0|Six musicians - four violinists , a cellist , and a drummer , play on stage for an audience .|Дөрвөн хийлч, нэг виолончельчин, бөмбөрчин гэсэн зургаан хөгжимчин үзэгчдийн өмнө тайзан дээр тоглож байна.
8068863852.jpg|0|A bicyclist in a marathon is having trouble when his bike falls to the front and he is about to fall over , while two men watch in amusement .|Марафон гүйлтийн дугуйчин хоёр хүн зугаацан харж байхад дугуй нь урд талдаа унаж, унах гэж байхад асуудалтай байна.
8070675236.jpg|0|A black and silver formula one car driven by a racer with a red helmet is going down a racetrack .|Улаан дуулгатай уралдаанчны жолоодож явсан хар мөнгөн өнгийн Формула 1 машин уралдааны зам руу явж байна.
807078665.jpg|0|Two men play in a band , one on electric guitar and the other on drums , on stage in front of a crowd .|Хоёр эрэгтэй хамтлагт нэг нь цахилгаан гитар, нөгөө нь бөмбөр дээр тайзан дээр олны өмнө тоглож байна.
8071166084.jpg|0|Men in a single line facing a neatly placed sets of fruits on a table , all are in a solemn mood with other men in similar mood behind them .|Ширээн дээр нямбай байрлуулсан жимснүүдийн дэргэд нэг эгнээнд зогссон эрчүүд бүгд ижил төстэй ааштай эрчүүдтэй хамт баяр хөөртэй байна.
807129.jpg|0|An older gentleman with a long , white beard , sits along a metal background in the city playing the flute .|Урт цагаан сахалтай, өндөр настай эрхэм хотод төмөр дэвсгэр дээр сууж, лимбэ тоглож байна.
8071401660.jpg|0|Two little blond girls with their hair pulled back in pigtails are holding hands , standing near a horse drawn carriage .|Үсээ гэзэг болгочихсон шаргал үстэй хоёр охин хөтлөлцөн зогсч, морин тэрэгний дэргэд зогсож байна.
8074724619.jpg|0|One boy in a blue shirt and jeans on a bicycle jumping over concrete steps in front of a building .|Цэнхэр цамц, жинсэн өмд өмссөн унадаг дугуйтай хүү барилгын урд талын бетонон шатаар үсэрч байна.
8076223643.jpg|0|A pensive young man of Indian descent , sitting on the ground resting against a tree , with other people engaged in conversation in the background .|Энэтхэг гаралтай залуу, модонд налан газар суугаад бусад хүмүүстэй ярилцаж сууна.
8077305139.jpg|0|A skateboarder getting ready to perform on a half-tube rink where there are trees in the background .|Скейтбордчин цаадах модтой хагас гуурсан гулгуурын талбайд тоглолт хийхээр бэлдэж байна.
