image_name|comment_number|comment|corrected_comment
3608022021.jpg|0|A person is playing a large version of checkers on a deck overlooking water .|Ус руу харсан тавцан дээр нэг хүн даамны том хувилбар тоглож байна.
3608400551.jpg|0|a man with tatoos playing fetch with a white dog with a black ear|хар чихтэй цагаан нохойтой авч тоглож буй шивээстэй эр
3608567609.jpg|0|The girl with red sunglasses and a white shirt is sitting on a bench next to the girl in the black tank top .|Улаан нарны шил, цагаан цамц өмссөн охин хар цамцтай охины хажууд сандал дээр сууж байна.
3608585041.jpg|0|A man gliding in the sky with the sunset on the horizon in the background .|Ар талд нар жаргах тэнгэрийн хаяанд тэнгэрт гулсаж буй хүн .
3608651253.jpg|0|A member of a Japanese survey crew kneels at the side of the road while holding a wooden 2x4 .|Японы судалгааны багийн гишүүн 2х4 хэмжээтэй модон барин замын хажууд сөхрөн сууж байна.
3608661756.jpg|0|A woman in a blue shirt is walking across the street of an older looking district .|Цэнхэр цамцтай эмэгтэй хуучин дүүргийн гудамжаар алхаж байна.
3608663656.jpg|0|A man climbs up the side of a steep rock that overlooks a river .|Гол руу харсан эгц хадны хажуугаар нэгэн эр авирч байна.
3608752424.jpg|0|a couple of dogs running through the water with trees in the background|Усан дундуур гүйж буй хоёр нохой цаана нь модтой
3608849440.jpg|0|Three children are playing with balls near to an American flag .|Гурван хүүхэд Америкийн төрийн далбааны дэргэд бөмбөгөөр тоглож байна.
3608858344.jpg|0|A woman in a short black dress and black boots dances around with fire torches .|Богино хар даашинз, хар гутал өмссөн эмэгтэй галын бамбар барин бүжиглэж байна.
3609026563.jpg|0|Two newborn puppies are being held by a pair of human hands .|Дөнгөж төрсөн хоёр гөлөг хүний хос гарт баригдаж байна .
3609027309.jpg|0|The little boy in the red shirt is dancing with the lady in the brown shirt and blue jeans while two people look on .|Улаан цамцтай бяцхан хүү бор цамц, цэнхэр жинсэн өмд өмссөн бүсгүйтэй бүжиглэж, хоёр хүн харж байна.
3609032038.jpg|0|A motorcycle rider on a path of rocks with a person holding a camera in the background with trees all around .|Эргэн тойрон модтой, цаана нь камер барьсан хүнтэй хадан зам дээр мотоцикль унасан хүн .
3609061538.jpg|0|A crowded vehicle , filled with tourists , drives on a road through a wooded area .|Жуулчдаар дүүрсэн машин ойн дундуур замд явж байна.
3609233201.jpg|0|A young blond boy with sneakers , athletic shorts , and a white T-shirt is throwing a basketball towards the basket .|Пүүз, шорт, цагаан цамц өмссөн шаргал үстэй залуу сагсан бөмбөгөө сагс руу шидэж байна.
3609259984.jpg|0|"A man in a blue shirt and jeans appears to be sleeping on a chair outside of a building next to an orange safety cone and a sign that says , """" OUVERT. "|"Цэнхэр цамц, жинсэн өмд өмссөн эрэгтэй улбар шар өнгийн хамгаалалтын конус болон """" OUVERT гэсэн бичээсийн хажууд байрлах сандал дээр унтаж байгаа бололтой."
3609375096.jpg|0|Two boys , one in a red shirt , the other in a white shirt are splashing around in the water .|Нэг нь улаан цамцтай, нөгөө нь цагаан цамцтай хоёр хөвгүүн усанд үсэрч байна.
3609377404.jpg|0|A man throws his young boy playfully into the air standing on a beach .|Далайн эрэг дээр зогсож байсан эрэгтэй хүүгээ хөгжилтэйгээр агаарт шидэв.
3609448700.jpg|0|The number eight rollerskater is taking the lead and pulling away from her black and red dressed opponents .|Найман дугаартай дугуйт тэшүүр тэргүүлж, хар, улаан хувцастай өрсөлдөгчдөөсөө холдож байна.
360947664.jpg|0|A gentleman is taking a rest in a child 's playhouse .|Хүүхдийн тоглоомын газарт нэгэн эрхэм амарч байна .
3609645320.jpg|0|A group of people sit on the cement steps in the woods and smile .|Ойн доторх цементэн шатан дээр хэсэг хүмүүс суугаад инээмсэглэнэ.
3609663465.jpg|0|A man wearing no shirt is lifting a shovel by a wheelbarrow as he works outside .|Цамц өмсөөгүй эр гадаа ажиллаж байхдаа хүрзээ түрдэг тэргээр өргөж байна.
3609952704.jpg|0|a young boy carrying a large soccer ball with a soccer feild in the background|цаана нь хөл бөмбөгийн талбай бүхий том бөмбөг үүрсэн залуу хүү
3609999845.jpg|0|A boy hits a ball , with a bat , outside , while others in the background watch him .|Хүү гадаа бөмбөгийг цохиураар цохиж байхад цаана нь бусад нь түүнийг харж байна.
3610051443.jpg|0|A brunette is outside a fruit and vegetable shop selecting groceries to purchase .|Бүдгэр залуу жимс, хүнсний ногооны дэлгүүрийн гадаа хүнсний бүтээгдэхүүн сонгох гэж байна.
3610189629.jpg|0|The brown dog is watching the white dog chewing the blue string .|Хүрэн нохой хөх утсыг зажлах цагаан нохойг харж байна.
361019101.jpg|0|Three men working on some sort construction or repair .|Ямар нэгэн барилга, засварын ажил хийдэг гурван хүн.
3610460852.jpg|0|A blond woman in a black shirt is standing behind a counter .|Хар цамцтай шаргал үст эмэгтэй лангууны ард зогсож байна.
3610683688.jpg|0|The dog is walking out into the water and the sun is casting a reflection off of the water .|Нохой ус руу гарч, нар усны тусгалыг тусгаж байна.
3610687607.jpg|0|A man is jumping with his body forward toward a photograph screen and a large photography light .|Эр хүн биеэрээ урагшаа гэрэл зургийн дэлгэц болон гэрэл зургийн том гэрэл рүү үсэрч байна.
3610830444.jpg|0|A group of students , all dressed in white shirts , ties and maroon pants , walking down a street .|Цагаан цамц, зангиа, хүрэн улаан өмд өмссөн хэсэг оюутнууд гудамжаар алхаж байна.
3610836023.jpg|0|a man in a gray t-shirt is sitting on a rock in front of a waterfall .|хүрхрээний урд хадан дээр саарал цамцтай хүн сууж байна.
3610836768.jpg|0|A group of mostly black men work together to pull a rope on the rocky shore .|Хар арьстан голдуу хэсэг бүлэг хүмүүс хад чулуун эрэг дээр олс татахаар хамтран ажиллаж байна.
361092202.jpg|0|A man hiking with a large backpack and two poles near a collection of pointy white rocks .|Том үүргэвч, хоёр шонтой, үзүүртэй цагаан хадны цуглуулгын дэргэд явган алхаж буй хүн.
3611039179.jpg|0|A little boy is smiling and wet , running through shallow water , wearing a blue shirt and dark shorts that have designs on them .|Хөх цамц, хээтэй хар шорт өмссөн бяцхан хүү гүехэн усаар гүйж, нойтон инээмсэглэж байна.
3611124440.jpg|0|A number of people are on a moving roller coaster and their reflections are seen in a body of water below them .|Хөдөлгөөнт галзуу хулгана дээр хэд хэдэн хүмүүс байгаа бөгөөд тэдгээрийн тусгал доор нь усан санд харагдаж байна.
3611603026.jpg|0|A girl in a short dress carrying a silver purse looks at food in a bakery .|Богино даашинзтай мөнгөн түрийвч барьсан охин талх нарийн боовны дэлгүүрт хоол харж байна.
3611672054.jpg|0|A shirtless man in colorful shorts spikes a volleyball during a beach volleyball game .|Өнгө өнгийн шорт өмссөн цамцгүй эр далайн эрэг дээрх волейболын тоглолтын үеэр гар бөмбөг шивэв.
3611694228.jpg|0|Two men kickboxing , the man in the red shorts is kicking while the man in the black is blocking .|Хоёр хүн кикбоксоор хичээллэж байна, улаан шорт өмссөн хүн өшиглөж байхад хар хувцастай хүн хааж байна.
361183669.jpg|0|Three people are organizing diving equipment on the deck of a boat .|Гурван хүн завины тавцан дээр шумбах хэрэгслийг зохион байгуулж байна.
3611925069.jpg|0|Many people are practicing in a field and a woman in a black tank top is watching a man do a high kick in the air .|Олон хүмүүс талбайд бэлтгэл хийж байгаа бөгөөд хар цамц өмссөн эмэгтэй эрэгтэй хүний агаарт өндөр цохилт хийж байгааг харж байна.
3612192955.jpg|0|A man is on a boat in the water looking towards the camera .|Усан дотор завин дээр сууж буй хүн камер руу харж байна.
3612249030.jpg|0|A young boy wearing a spider-patterned shirt on the sand .|Элс дээр аалзны хээтэй цамц өмссөн залуу хүү .
3612451934.jpg|0|A little Asian girl is holding two big trophies in a picture with two adults standing behind her .|Бяцхан Ази охин хоёр том цом барьж, ард нь хоёр том хүн зогсож байна.
3612484827.jpg|0|Two teenagers are playing wrestling game in the park .|Өсвөр насны хоёр хүүхэд цэцэрлэгт хүрээлэнд бөх тоглож байна.
3612485097.jpg|0|A man in midair with his back touching that of another man hunched over|Агаарт өөр хүний нурууг шүргэж, бөгтийсөн эрэгтэй
3612485611.jpg|0|Two young men in sportswear are running and jumping on the grass by a brick building .|Спортын хувцастай хоёр залуу тоосгон байшингийн дэргэдэх зүлгэн дээгүүр гүйж харайж байна.
3612538549.jpg|0|A young boy falls back with his mouth open when sand is falling on him .|Бага насны хүү дээр нь элс унах үед амаа ангайж унасан байна.
3612825666.jpg|0|In the far distance , a boy is sliding his skateboard down a handrail .|Алсын зайд нэгэн хүү тэшүүрээ бариулаас доош гулсуулж байна.
3612989048.jpg|0|A young girl in a green shirt and shorts out riding her bike past a very nice apartment building .|Ногоон цамц, шорт өмссөн залуу охин маш сайхан орон сууцны хажуугаар дугуйтайгаа явж байна.
3613005134.jpg|0|An opposing wrestler is jumping off the top ropes onto another wrestler .|Өрсөлдөгч бөх дээд уяанаас өөр бөх рүү үсэрч байна.
3613027188.jpg|0|Young men from two Japanese-sponsored teams play a game of indoor field hockey .|Японы ивээн тэтгэсэн хоёр багийн залуус заалны талбайн хоккей тоглож байна.
3613030730.jpg|0|The toddler is splashing water in the tub with suds all over .|Хөлд орсон хүүхэд ваннд ус цацаж байна.
3613175012.jpg|0|A group of four people prance away from the camera , one pushing a shopping cart and another leaping along side .|Дөрвөн хүнтэй хэсэг бүлэг хүмүүс камернаас холдож, нэг нь тэрэг түрж, нөгөө нь хажуу тийш харайж байна.
3613242966.jpg|0|A tan dog splashes as he swims through the water .|Усан дундуур сэлж байхдаа бор шаргал нохой цацаж байна.
3613264553.jpg|0|White dog on mountainside turns to face something offstage , sky in background .|Уулын энгэрт байгаа цагаан нохой тайзны гадна талд ямар нэгэн зүйл рүү эргэж харав.
3613323772.jpg|0|There is a kid doing tricks on a skateboard in a rural area .|Хөдөө орон нутагт скейтборд дээр мэх хийж буй хүүхэд байна .
3613375729.jpg|0|A uniformed rider is riding an endorsement-covered motorcycle .|Дүрт хувцастай морьтон батламжаар бүрсэн мотоцикль унаж байна.
3613424631.jpg|0|A helmeted man sits on steps with graffiti on them , and a bike nearby .|Дуулгатай эр граффити бүхий довжоон дээр сууж, хажууд нь дугуй .
3613585080.jpg|0|A woman with scarves in her head sits with 3 others staring at the camera with no expression .|Толгойдоо ороолттой эмэгтэй 3 хүний хамт камер руу ямар ч хувиралгүй ширтэж сууна.
3613667665.jpg|0|A black dog runs across the water at a beach while another follows .|Далайн эрэг дээр нэг хар нохой усан дээгүүр гүйж байхад нөгөө нь дагаж байна.
3613705104.jpg|0|A man does a jump on a skateboard , surrounded by graffiti .|Эр хүн граффитигаар хүрээлэгдсэн скейтборд дээр үсэрч байна.
3613734337.jpg|0|A woman in sunglasses sitting in front of a wall that is in two shades of blue .|Цэнхэр өнгийн хоёр сүүдэртэй хананы урд сууж буй нарны шилтэй эмэгтэй .
3613800013.jpg|0|A white dog with a brown patch over his eye runs through a grassy field covered in dandelions .|Нүдэндээ хүрэн толботой цагаан нохой данделиар бүрхэгдсэн өвслөг талбай дундуур гүйж байна.
3613955682.jpg|0|Sports team poses on field with crowd in the background .|Спортын баг талбай дээр цугласан олон хүмүүсийн дунд зургаа авахуулж байна.
3613994164.jpg|0|A boy in a blue shirt , a girl in a white shirt , a man in a black shirt and black cap , and a goateed man in a white shirt stand next to an inflatable slide while a boy in a white shirt and jeans bounces downwards .|Цэнхэр цамцтай хүү, цагаан цамцтай охин, хар цамц, хар малгайтай эрэгтэй, цагаан цамцтай ямаан эр, хийлдэг гулсуурын дэргэд зогсож байхад цагаан хувцастай хүү цамц, жинсэн өмд доошоо үсэрч байна.
36139994.jpg|0|A woman with short hair is singing passionately into a microphone on stage .|Богино үстэй эмэгтэй тайзан дээр микрофонд догдолж дуулж байна.
3614130083.jpg|0|A boy in a black shirt and red pants is hanging onto a pole with his hands and feet .|Хар цамц, улаан өмд өмссөн хүү гар, хөлөөрөө шон дээр өлгөөтэй байна.
36142198.jpg|0|A man in a red shirt and jacket leads a group of other man with a large group of spotted dogs .|Улаан цамц, хүрэм өмссөн хүн олон тооны толботой нохойтой бүлэг хүмүүсийг удирдаж байна.
3614269018.jpg|0|A young man in a yellow rain suit stands beneath a street lamp .|Шар борооны хувцастай залуу гудамжны дэнлүүний доор зогсож байна.
3614542901.jpg|0|Four women and a bride stand on a street while one of them points at something in the distance .|Дөрвөн эмэгтэй сүйт бүсгүй гудамжинд зогсож байтал нэг нь алсад байгаа зүйл рүү чиглүүлж байна.
3614582606.jpg|0|The red-hair woman wearing a black tartan hat holds a baby with flowers on her head .|Хар тартан малгай өмссөн улаан үстэй эмэгтэй толгой дээрээ цэцэгтэй нялх хүүхдээ тэвэрч байна.
3614595423.jpg|0|Several children are in a tree , laughing and with their hands on their chins .|Хэд хэдэн хүүхэд модонд инээж, гараараа эрүүгээ наан зогсож байна.
36147990.jpg|0|Two onlookers stand by as a man lines up his pool shot on a bright green pool table in a room with red walls .|Улаан ханатай өрөөнд тод ногоон бильярдны ширээн дээр буудсан хүн усан сангаа эгнүүлэн зогсоход хоёр хүн зогсож байна.
3614881872.jpg|0|a lone snowboarder jumping in midair with a snow covered mine in the background|Цад талд цасан бүрхүүлтэй уурхайтай агаарт үсэрч буй ганц цасан урлалын тамирчин
3615175165.jpg|0|A man and woman are riding bikes on a street with a gray van visible in the background next to other cars .|Гудамжаар эрэгтэй, эмэгтэй хүмүүс дугуй унаж, бусад машины хажууд саарал өнгийн фургон харагдана.
3615239961.jpg|0|A man sits on the edge of a brige , looking out , fishing poles behind him .|Хүн гүүрний захад сууж, ард нь загас агнуурын шон харан сууж байна.
361565925.jpg|0|A Toddler wearing a dark blue jacket and knit cap is standing on gravel and pointing upward , with stone columns and a wooden display board in the background .|Хар хөх өнгийн хүрэм өмсөж, сүлжмэл малгай өмссөн бяцхан хүүхэд хайрган дээр дээшээ чиглэн зогсож, цаана нь чулуун багана, модон дэлгэцийн самбар байна.
3615730936.jpg|0|A person wearing a helmet rides a dirty bike on a dirt path in the woods .|Дуулга өмссөн хүн ойд шороон замаар бохир дугуй унаж байна.
3616525288.jpg|0|Horse jockeys racing on horses in a race .|Уралдаанд мориор уралдаж буй хурдан морины уяачид .
3616566999.jpg|0|A child in a brightly colored dress peaks through a crack in a fence .|Тод өнгийн даашинзтай хүүхэд хашааны цоорхойг даван гарч байна.
3616638478.jpg|0|A woman in a skirt and green t-shirt has her arm draped over the shoulder of a younger woman in a white skirt and orange t-shirt .|Банзал, ногоон подволк өмссөн эмэгтэй цагаан банзал, улбар шар өнгийн футболк өмссөн залуу эмэгтэйн мөрөн дээр гараа зүүсэн байна.
3616771728.jpg|0|A jockey in yellow and a jockey in blue are racing their horses down a grassy raceway .|Шар хувцастай морьтон, цэнхэр өнгийн морьтон өвс ногоотой уралдах замаар морьдоо уралдаж байна.
3616808182.jpg|0|A biker in protective gear is riding through a countryside with cliffs .|Хадан цохиотой хөдөө хээрээр хамгаалалтын хувцас өмссөн дугуйчин явж байна.
3616846215.jpg|0|Two women and a man smile at the camera with rakes in their hands standing in an unfinished greenhouse .|Дуусаагүй хүлэмжинд гартаа тармуур барьсан хоёр эмэгтэй, эрэгтэй хоёр камер руу инээмсэглэж байна.
3616927733.jpg|0|A man is painting a portrait of an outside scene that includes a street sign with a bicycle chained to it .|Эр хүн унадаг дугуй гинжээр холбосон гудамжны тэмдэг бүхий гаднах дүр зургийг зурж байна.
3616949634.jpg|0|Two men wearing safety striped work clothes are sitting at a table surrounded by red and white work cones .|Аюулгүйн судалтай ажлын хувцас өмссөн хоёр эрэгтэй улаан цагаан ажлын боргоцойгоор хүрээлэгдсэн ширээний ард сууж байна.
3618115051.jpg|0|A man in blue and a woman in brown , with orange hair , are hugging .|Цэнхэр хувцастай эрэгтэй, бор хувцастай улбар шар үстэй эмэгтэй хоёр тэврэлдэж байна.
361831875.jpg|0|A person in a green coat looks upwards while leaning against a fixture in front of a tree .|Ногоон пальтотой хүн модны урд байрлах бэхэлгээг налан дээшээ харж байна.
3618407668.jpg|0|An elderly man with a double chin , who is wearing a blue visor and a jacket , and a young man , wearing a gray hood and a jacket , are standing next to a counter at an outdoor food stand .|Цэнхэр халхавч, хүрэм өмссөн давхар эрүүтэй өндөр настан, саарал юүдэн, хүрэм өмссөн залуу хоёр гадаа хоолны тавиур дээр лангууны хажууд зогсож байна.
3618504267.jpg|0|A man is encouraging a small white dog to stand on its hind legs in a dog show .|Нохойн үзүүлбэрт нэгэн эрэгтэй бяцхан цагаан нохойг хойд хөл дээрээ зогсохыг уриалж байна.
3618525295.jpg|0|Two pedestrians passing a restaurant look at the dog that is looking at them .|Зоогийн газрын хажуугаар явж байсан хоёр явган зорчигч өөрсдийг нь харж буй нохой руу харав.
3618908551.jpg|0|A kid in a blue shirt and blue shoes attempts a trick on a skateboard above the lip of a bowl .|Цэнхэр цамц, цэнхэр гутал өмссөн хүүхэд аяганы уруулын дээгүүр скейтборд дээр мэх хийхийг оролдож байна.
3618932839.jpg|0|A woman in blue running next to a black and white dog as it jumps over an obstacle .|Цэнхэр хувцастай эмэгтэй хар цагаан нохойны хажуугаар гүйж, саадыг давж байна.
3618951584.jpg|0|A child smiling while holding a knob and pushing a button on a control panel .|Хүүхэд бариулыг бариад, хяналтын самбар дээрх товчлуурыг дарж инээмсэглэж байна.
3618969705.jpg|0|Many students are sitting in a lecture hall , paying attention and taking notes .|Олон оюутнууд лекцийн танхимд анхаарлаа хандуулан тэмдэглэл хөтөлж сууна.
3619232550.jpg|0|Three musicians are posing for a photograph in a soundproof studio booth .|Гурван хөгжимчин дуу нэвтэрдэггүй студийн лангуунд зургаа авахуулж байна.
3619316324.jpg|0|A gentleman in a suit and sneakers dancing with a woman in a long scarf .|Урт ороолттой эмэгтэйтэй бүжиглэж буй костюм, пүүз өмссөн эрхэм .
3619322150.jpg|0|A young couple dressed in matching red outfits performing a romantic dance .|Улаан өнгийн хувцас өмссөн залуу хос романтик бүжиглэж байна.
3619324782.jpg|0|A man and a woman are embracing each other facing each other , they both are wearing red clothing , the woman has a red dress on and the man is wearing a red shirt and black pants .|Эрэгтэй, эмэгтэй хоёр бие биенээ өөд өөдөөсөө харан тэврээд хоёулаа улаан хувцастай, эмэгтэй нь улаан даашинзтай, эрэгтэй нь улаан цамц, хар өмд өмссөн байна.
3619381206.jpg|0|A man in a wetsuit and helmet walks in front of a bright red building .|Год улаан барилгын урдуур усны хувцас, дуулга өмссөн эрэгтэй алхаж байна.
3619416477.jpg|0|A white dog catches a green ball while standing in shallow water .|Цагаан нохой гүехэн усанд зогсож байхдаа ногоон бөмбөг барьж авав.
