image_name|comment_number|comment|corrected_comment
2071830584.jpg|0|A woman wearing a black coat and orange scarf standing in a subway station in BismarckstraBe waiting for her train .|Хар пальто, улбар шар ороолт өмссөн эмэгтэй Бисмаркстра дахь метроны буудал дээр галт тэргээ хүлээж байна.
2072040759.jpg|0|Three men and a woman posing on and around a large tree with many branches .|Олон мөчиртэй том модны эргэн тойронд болон эргэн тойронд зургаа авахуулсан гурван эрэгтэй, эмэгтэй .
2072154465.jpg|0|Through windows into a building , we see on one floor people eating at a nice restaurant , while on the floor below we see a working man looking out at us from where he kneels between shelves and boxes .|Барилгын цонхоор бид нэг давхарт сайхан ресторанд хооллож буй хүмүүсийг харж байхад доод давхарт тавиур, хайрцагны завсар өвдөглөн суугаад биднийг харж буй ажилчин эр харагдана.
207216904.jpg|0|A boy in a dark blue jacket laughs with a young girl in a light blue sweater .|Хар хөх хүрэмтэй хүү цайвар цэнхэр цамц өмссөн залуу охинтой инээж байна.
207225205.jpg|0|An Asian woman dressed in a colorful outfit laughing .|Өнгө өнгийн хувцас өмссөн ази эмэгтэй инээж байна.
2072268965.jpg|0|Teenage boys in the middle of making pie with ingredients spread out over the kitchen counter .|Гал тогооны өрөөний лангуун дээр дэлгэсэн орц найрлагатай бялуу хийж байгаа өсвөр насны хөвгүүд .
2072331027.jpg|0|A Chinese + man and younger boy in some type of worship place worshiping .|Хятад + эрэгтэй, бага насны хүү зарим төрлийн мөргөлийн газарт мөргөл үйлдэж байна.
207237775.jpg|0|One person does a flip in the middle of the field while their friend takes a picture .|Нэг хүн талбайн голд эргэлдэж байхад найз нь зураг авч байна.
207240631.jpg|0|Several men were playing basketball in a public park when a fight erupted between two players .|Олон нийтийн цэцэрлэгт хүрээлэнд хэд хэдэн эрэгтэй сагсан бөмбөг тоглож байх үед хоёр тоглогчийн хооронд зодоон гарчээ.
2072574835.jpg|0|Greyhound dogs wearing racing stripes are running out of a gate on a track .|Уралдааны судлууд өмссөн саарал нохойнууд зам дээрх хаалганаас гарч гүйж байна.
207275121.jpg|0|A dog runs on the grass in a yard , a gazebo in the background .|Нохой хашаан дахь зүлгэн дээр гүйж байна, цаана нь бест .
2072907691.jpg|0|A bald man in a black and orange robe is standing with a fan in front of burning plants with a crowd encircling him .|Хар улбар шар дээлтэй халзан эр сэнс барин шатаж буй ургамлын өмнө түүнийг тойрон хүрээлсэн олон хүн зогсож байна.
2073105823.jpg|0|A man in a black hoodie and jeans skateboards down a railing .|Хар юүдэнтэй цамц өмссөн, жинсэн өмд өмссөн эрэгтэй хашлага доош унаж байна.
2073174497.jpg|0|A dark-skinned man is cycling in a street full of traffic .|Хар арьст хүн хөл хөдөлгөөн ихтэй гудамжинд дугуй унаж байна.
207344485.jpg|0|A man wearing a helmet , red pants with white stripes going down the sides and a white and red shirt is on a small bicycle using only his hands while his legs are up in the air , while another man wearing a light blue shirt with dark blue trim and black pants with red stripes going up the sides is standing nearby , gesturing toward the first man and holding a small figurine of one of the seven dwarves .|Дуулга өмссөн, хажуу талдаа цагаан судалтай улаан өмд, цагаан, улаан цамц өмссөн эрэгтэй жижиг унадаг дугуй дээр хөл нь агаарт байх үед зөвхөн гараараа явж байгаа бол өөр эрэгтэй дугуй өмссөн байна. Хажуу талдаа хар хөх өнгийн обудтай цайвар цэнхэр цамц , хажуу талдаа улаан судалтай хар өмд зогсож, эхний хүн рүү дохиж, долоон одойн нэгний жижигхэн баримал барьж байна.
207347050.jpg|0|A group of seven adults are stopping to take photos while hiking in the woods .|7 насанд хүрэгчдийн бүлэг ойд зугаалж байхдаа зураг авахуулахаар зогсоод байна.
2073756099.jpg|0|The black dog is jumping into the pool to catch a rubber chicken in its mouth .|Хар нохой амандаа резинэн тахиа барихаар усан сан руу үсэрч байна.
2073964624.jpg|0|A woman wearing black clothes , a purple scarf , and a pink hat is riding a bike .|Хар хувцас , нил ягаан ороолт , ягаан малгай өмссөн эмэгтэй дугуй унаж байна .
2074146683.jpg|0|A woman wearing a white hat and carrying a baby , a grocery bag , and a blue tote bag , sorts her money .|Цагаан малгай өмсөж нялх хүүхэд , хүнсний барааны цүнх , цэнхэр цүнх үүрсэн эмэгтэй мөнгөө ангилж байна .
2074244690.jpg|0|A group of men and women are facing in the direction of something that is happening off-camera .|Хэсэг эрэгтэй, эмэгтэй хүмүүс камерын гадна байгаа ямар нэг зүйлийн зүг өөд өөдөөсөө харж байна.
2074430847.jpg|0|A young man wearing a dark suit is giving a lecture to a group of people seated in a classroom .|Харанхуй хослол өмссөн залуу ангид сууж буй хэсэг хүмүүст лекц уншиж байна.
2074557615.jpg|0|A group of motorcyclists are parked along side and riding down a road .|Хэсэг мотоцикльчид хажуугийн хажууд зогсоод зам уруу явж байна.
2074642785.jpg|0|A young woman , who is wearing a blue floral dress , is applying lip liner in a mirror .|Цэнхэр цэцэгтэй даашинз өмссөн залуу бүсгүй толинд уруулын будгаа түрхэж байна.
2074686457.jpg|0|Man in blue robes stands between a cloud of brown smoke and a crowd taking photos .|Цэнхэр дээлтэй хүн бор утааны үүл болон зураг авахуулах хүмүүсийн дунд зогсож байна.
2074764331.jpg|0|A small puppy stands on his hind legs to bite a bigger dog who is lying on the stairs .|Бяцхан гөлөг шатан дээр хэвтэж буй том нохойг хазахаар хойд хөл дээрээ зогсож байна.
2074781877.jpg|0|An older woman bringing a cake to a group of sitting and excited children .|Хөгшин настай эмэгтэй догдолж суугаа хүүхдүүдийн дунд бялуу авчирч байна.
2074835945.jpg|0|A brown-haired girl in a pink hoodie and blue pants walks behind a pigeon on the street .|Ягаан юүдэнтэй, цэнхэр өмдтэй бор үстэй охин гудамжинд тагтааны ард алхаж байна.
2075041394.jpg|0|A white dog is walking through the leafy grass while a brown dog is about to bite it .|Хүрэн нохой хазах гэж байхад навчит өвсний дундуур цагаан нохой явж байна.
2075321027.jpg|0|A man wearing a beret rides his bicycle on a recreation trail .|Борка өмссөн эрэгтэй дугуйгаа зугаалах замаар явж байна.
2075493556.jpg|0|Three boys in sports casual clothing are posing in front of a blue building|Спортын энгийн хувцас өмссөн гурван хөвгүүн цэнхэр байшингийн өмнө зургаа авахуулж байна
2075627357.jpg|0|Two policemen in black and neon colors watch a light rail car go by .|Хар, неон өнгөтэй хоёр цагдаа хажуугаар нь явж буй хөнгөн вагоныг харж байна.
207584893.jpg|0|Two parasailors on one parasail landing on a sandy beach in front of a large rocky boulder and the water .|Нэг шүхэртэй хоёр шүхэрчин элсэн эрэг дээр том хад чулуу, усны урд бууж байна.
2075893362.jpg|0|En exotic young lady looks perplexed while speaking with an older gentleman .|Эн чамин залуу хатагтай хөгшин ноёнтой ярилцаж байхдаа эргэлзсэн харагдана.
207601580.jpg|0|Two women cheer and clap while watching through a fence people holding flags .|Хоёр эмэгтэй хашхирч, алга ташиж, туг барьсан хүмүүсийг хашааны завсраар харж байна.
2076208076.jpg|0|A woman in a pink outfit and a woman in an orange shirt walk across a street .|Ягаан хувцастай эмэгтэй, улбар шар цамц өмссөн эмэгтэй гудамжаар алхаж байна.
2076428547.jpg|0|A man with a hiking backpack on is standing in front of a lake with a forest in the background .|Явган аялалын үүргэвчтэй хүн цаана нь ой модтой нуурын өмнө зогсож байна.
2076524082.jpg|0|A man and a young girl pose next to a red car that is parked in a driveway .|Эрэгтэй залуу охин хоёр зам дээр зогсож байсан улаан машины хажууд зургаа авахуулж байна.
2076865206.jpg|0|Man standing on edge of stream while casting his fishing line .|Голны ирмэг дээр зогсож буй хүн загас барих шугамаа цутгаж байна.
2076906555.jpg|0|A young man with a denim jacket and writing on his hand smiles in front of a bookcase full of videos .|Гартаа бичээстэй жинсэн хүрэмтэй залуу бичлэг дүүрэн номын шүүгээний өмнө инээмсэглэж байна.
2077063153.jpg|0|A man has finished climbing a set of stairs , between two tall , conical structures .|Эр хүн хоёр өндөр, конус хэлбэрийн байгууламжийн дундах шатаар авирч дууслаа.
2077079696.jpg|0|Hiker walking along high rocks in front of a blue sky with puffy white clouds .|Хэв цагаан үүлтэй хөх тэнгэрийн өмнө өндөр хад даган алхаж буй явган аялалчин .
207731022.jpg|0|Looking over the prow of a boat at another boat on a foggy lake .|Манантай нууран дээрх өөр завины завины хошууг харж байна.
2077346067.jpg|0|A man dressed in black and holding a package in his hands is walking on a sidewalk near a police sign asking for witnesses to a road dealth to step forward .|Гартаа боодол барьсан хар хувцастай нэгэн эр явган хүний зам дээр цагдаагийн тэмдэгтийн дэргэд алхаж, замын хөдөлгөөний гэрчүүдийг урагшлуулахыг хүсч байна.
2077433632.jpg|0|A woman in front of white bars puts her hand to her forehead and talks on the phone .|Цагаан баарны урд байгаа эмэгтэй гараа духан дээрээ тавиад утсаар ярьж байна.
2077649684.jpg|0|An Asian woman holding a green bag has fallen asleep on the train while onlookers in suits stand in front of her|Ногоон цүнх барьсан ази эмэгтэй галт тэргэнд унтсан бөгөөд түүний өмнө костюм өмссөн хүмүүс зогсож байв.
2078016024.jpg|0|This is the image of an Indian woman squatting near a row of assorted vegetables , spread out on the ground .|Энэ бол газар дээр дэлгэсэн олон төрлийн хүнсний ногооны хажууд хэвтэж буй Энэтхэг эмэгтэйн дүр зураг юм.
2078020414.jpg|0|A man in a black shirt , jeans , and wearing a hat is dangling from a rope with two buckets with him while painting the exterior of a building with a brown paint .|Хар цамц , жинсэн өмд , малгай өмссөн эрэгтэй барилгын гадна талыг бор будгаар будаж байхдаа хоёр хувинтай олсноос унжиж байна .
207822513.jpg|0|A man in a white t-shirt and jean shorts is putting one foot up on a stand belonging to a purse and makeup vendor .|Цагаан цамц, жинсэн өмд өмссөн эрэгтэй түрийвч, нүүр будалтын худалдагчийн тавиур дээр нэг хөлөө тавьж байна.
2078311270.jpg|0|Two women walking near some trees in warm , dark-colored garments , one with a hat , one with an upraised collar .|Нэг нь малгайтай, нөгөө нь өргөсөн захтай хар бараан дулаан хувцастай зарим модны дэргэд алхаж буй хоёр эмэгтэй.
207857944.jpg|0|A mother attentively shows her other two children the new baby .|Ээж бусад хоёр хүүхдэдээ шинэ нярайг анхааралтай харуулж байна.
2078665663.jpg|0|Asian shoppers pass by the Carpintaria , all carrying shopping bags filled with items .|Азийн худалдан авагчид Карпинтариагийн хажуугаар өнгөрч, бүгд эд зүйлээр дүүргэсэн уут үүрч явна.
2078709661.jpg|0|Two children raise their hands to ask a question to the two women at the front of their classroom .|Хоёр хүүхэд ангийнхаа урд талын хоёр эмэгтэйгээс асуулт асуухаар гараа өргөж байна.
2079110798.jpg|0|A young boy takes time to read during his trip to the bookstore .|Залуу хүү номын дэлгүүрээр аялахдаа ном унших цаг гаргадаг.
2079152458.jpg|0|A golden-colored dog , with his eyes alert , holds a brightly colored tennis ball in his mouth .|Нүд нь сэргэлэн, алтан өнгөтэй нохой амандаа тод өнгийн теннисний бөмбөг барьдаг.
207930963.jpg|0|A man looking down wearing racing clothes with a motorcycle to the right .|Баруун талд мотоцикльтой уралдааны хувцас өмссөн эрэгтэй доош харж байна.
2079491560.jpg|0|A woman with long red-hair is standing in her white kitchen holding a sponge and smiling to the person taking the photograph .|Урт улаан үстэй эмэгтэй цагаан гал тогооны өрөөндөө хөвөн бариад зогсож байгаа бөгөөд гэрэл зураг авсан хүн рүү инээмсэглэж байна.
2079499010.jpg|0|Two women stand in the front of an elementary classroom while little children are setting in front of them .|Бага ангийн хүүхдүүд урд нь суулгаж байхад хоёр эмэгтэй бага ангийн урд зогсож байна.
207950260.jpg|0|Four young men , one with a beer , and one woman , are standing on a pier or deck of a boat .|Дөрвөн залуу, нэг нь шар айраг, нэг эмэгтэй хоёр хөлөг онгоцны тавцан эсвэл тавцан дээр зогсож байна.
207952798.jpg|0|Two men are in intent conversation while a third looks on in what appears to be a bar .|Хоёр эрэгтэй харилцан яриа өрнүүлж байгаа бол гурав дахь нь баар бололтой зүйлийг харж байна.
2079554580.jpg|0|A Dalmatian dog running downhill through leaves in a wooded area .|Модтой газар навчны дундуур уруудан гүйж буй Далмат нохой .
207955925.jpg|0|Two women are giving each other a hug while a man holding a glass is looking at the camera .|Хоёр эмэгтэй бие биенээ тэвэрч байхад хундага барьсан эрэгтэй камер руу харж байна.
207958110.jpg|0|A man wearing a stained blue shirt is surrounded by other people .|Тохирсон цэнхэр цамц өмссөн эрэгтэй бусад хүмүүсээр хүрээлэгдсэн байна.
2080033499.jpg|0|A brown dog with a lease is running with a person behind the dog .|Түрээстэй бор нохой нохойны ард хүн дагуулан гүйж байна .
208025491.jpg|0|A man with a beer and another man facing each other , talking .|Шар айраг барьчихсан, өөр хүн өөд өөдөөсөө харан ярилцаж байна.
20803565.jpg|0|A person with long blond-hair , white shirt , and black pants holds a plate with a colorful burger on it .|Урт шаргал үстэй , цагаан цамц , хар өмдтэй хүн өнгө өнгийн бургер хийсэн таваг барьдаг .
20804307.jpg|0|That hotdog just was n't going down right , was it the drinking or the burnt dog ?|Тэр хотдог зүгээр л доошоо буусангүй, архи уусан уу эсвэл шатсан нохой уу?
2080474604.jpg|0|Two young Snowman builders take delight in their creation .|Хоёр залуу цасан хүн бүтээж байгаадаа баяртай байна.
208053776.jpg|0|These people are sitting down in chairs watching a game .|Энэ хүмүүс сандал дээр суугаад тоглоом үзэж байна.
20805896.jpg|0|A young man with a beard and a young man with glasses lying in an oversized chair together with a comforter over them .|Сахалтай залуу, нүдний шилтэй залуу хоёр том сандал дээр тайтгаруулагчтай хамт хэвтэж байна.
208062991.jpg|0|A group of people are sitting outside of a stone building on the ground and underneath a beige covering .|Хэсэг хүмүүс чулуун барилгын гадаа газар болон шаргал бүрээсний доор сууж байна.
2081033707.jpg|0|A girl with brown hair and a brown shirt is building a gingerbread house .|Хүрэн үстэй, бор цамцтай охин цагаан гаатай байшин барьж байна.
2081041537.jpg|0|A brown-haired boy with a white shirt looking out the window of a bus or subway .|Автобус, метроны цонхоор харан цагаан цамцтай бор үстэй хүү .
2081141788.jpg|0|Three children are jumping into the air into a swimming pool at a resort .|Гурван хүүхэд амралтын газрын усан сан руу үсэрч байна.
2081446176.jpg|0|A person wearing a hat and scarf looks to the right .|Малгай ороолт өмссөн хүн баруун тийшээ харна.
2081615901.jpg|0|The backs of two girls dressed identically in black shirts and black and red plants as they climb on a fence .|Хар цамц, хар улаан ургамлаар ижилхэн хувцасласан хоёр охины нуруу хашаан дээр авирч байна.
2081679622.jpg|0|A boy smiles at the camera and jumps in the air over the couch .|Хүү камер руу инээмсэглэн буйдан дээгүүр агаарт үсэрч байна.
2081721157.jpg|0|A man wearing a white coat and apron is grilling sausages .|Цагаан пальто, хормогч өмссөн эрэгтэй хиам шарж байна .
2082005167.jpg|0|A black and brown dog is playing on the ice at the edge of a lake .|Нуурын эрэг дээрх мөсөн дээр хар бор нохой тоглож байна.
2082399131.jpg|0|People walking through a crowded food festival on a closed off street .|Хаалттай гудамжинд хөл хөдөлгөөн ихтэй хоолны баяраар явж буй хүмүүс .
2082620071.jpg|0|"A woman in a blue winter coat and a person in a black winter vest are crossing the street when the "" Do n't Walk "" sign is lit ."|"Цэнхэр өвлийн хүрэмтэй эмэгтэй, хар өвлийн хантааз өмссөн хүн гудамжаар хөндлөн гарч байхад "" Бүү алх"" гэсэн тэмдэг асах үед."""
2082663150.jpg|0|An elderly gentleman sits on a couch while holding a small dog as another small dog investigates the situation .|Хөгшин настай ноён буйдан дээр суугаад жижиг нохой тэвэрч, өөр нэг нохой нөхцөл байдлыг судалж байна.
2083434441.jpg|0|Older woman wearing glassses riding a bicycle with a shopping bag on the handle , yellow car is in the background .|Нүдний шил зүүсэн хөгшин эмэгтэй бариул дээр нь дэлгүүрийн ууттай дугуй унаж, цаана нь шар өнгийн машин байна.
2083673004.jpg|0|A woman in an orange shirt is leaning into a doorway , smiling and smoking a cigarette .|Улбар шар өнгийн цамцтай эмэгтэй үүдэнд тонгойн инээмсэглэн тамхи татаж байна.
2083778090.jpg|0|a man in the snow wearing a furry hat and a black jacket with a red scarf|үслэг малгай, улаан ороолттой хар хүрэм өмссөн цасан дээр суусан эрэгтэй
2083844357.jpg|0|A young Indian male is hitting a red ball with a bat next to a brown chair .|Энэтхэг залуу хүрэн сандлын хажууд сарьсан багваахайгаар улаан бөмбөг цохиж байна.
208408910.jpg|0|A woman is smiling at the camera while holding her newborn baby .|Нярай хүүхдээ тэвэрсэн эмэгтэй камер руу инээмсэглэж байна.
2084103826.jpg|0|A black and white dog with a mask on its face is running in a field .|Нүүрэндээ баг зүүсэн хар цагаан нохой хээр талд гүйж байна.
2084157130.jpg|0|The black and white dog along with the brown dog are galloping outside|Хар цагаан нохой бор нохойтой хамт гадаа давхиж байна
2084217208.jpg|0|A person in a blue jacket , wearing a bicycle helmet is riding a bike|Цэнхэр хүрэмтэй, дугуйн дуулга өмссөн хүн дугуй унаж байна
2084622444.jpg|0|Two African American boys are walking with a ball and bat in a park .|Африк гаралтай хоёр хүү цэцэрлэгт хүрээлэнд бөмбөг, цохиур бариад алхаж байна.
208469029.jpg|0|The tow boys , one older , the other younger , are looking at the camera .|Чирэх хөвгүүдийн нэг нь том, нөгөө нь бага камер руу харж байна.
208471765.jpg|0|A tattooed man holds a young child who is clutching money .|Шивээстэй эр мөнгө атгасан бага насны хүүхдийг тэвэрч байна .
208472767.jpg|0|A girl , wearing a white blouse , is holding a ball , and pointing to a frisbee .|Цагаан цамц өмссөн охин бөмбөг барьж, фрисби рүү зааж байна.
208473386.jpg|0|Two young children sit apart from a larger group of children in a dirty street outside a building .|Барилгын гадаа бохир гудамжинд бага насны хоёр хүүхэд том бүлгээс тусдаа сууж байна.
2084851847.jpg|0|A group of middle-aged women and men sit around a table with beverages and documents having a meeting .|Дунд эргэм насны эмэгтэйчүүд, эрэгтэй хүмүүс ундаа, бичиг баримт барин ширээ тойрон сууж уулзалт хийж байна.
2085078076.jpg|0|A small boy standing near muddy water with something in his hand while someone beside him washes clothing in buckets .|Бяцхан хүү шаварлаг усны дэргэд гартаа ямар нэгэн зүйл барин зогсож байхад хажууд нь хэн нэгэн хувингаар хувцсаа угааж байна.
2085255128.jpg|0|Person in yellow shorts , gray shirt with logo jumping from bank into the water .|Шар шорт өмссөн, эрэг дээрээс ус руу үсэрч буй логотой саарал цамцтай хүн.
2085284792.jpg|0|People milling around acting as if they are waiting for an answer from someone or something .|Хүмүүс хэн нэгнээс хариу хүлээж байгаа юм шиг аашилж байна.
