image_name|comment_number|comment|corrected_comment
3551170666.jpg|0|Golden female dog feeding newborn litter of puppies .|Нярай гөлөг тэжээж буй алтан эм нохой .
3551281733.jpg|0|The bird that is flying has a very long beak .|Нисэж буй шувуу маш урт хушуутай.
3551447084.jpg|0|A person on a dirt bike is riding up a hill while people watch on the side .|Хороотой дугуйтай хүн уул өөд гарч байхад хажуу талд нь хүмүүс харж байна.
3551637285.jpg|0|There are three woman in a yellow painted room , sitting at a table , having fun playing a card game .|Шар будсан өрөөнд гурван эмэгтэй ширээний ард суугаад хөзрийн тоглоом тоглож хөгжилдөж байна.
3551698034.jpg|0|A large brunette mom walks with her son holding a leash attached to his dog-shaped backpack .|Том бор үстэй ээж хүүтэйгээ нохой шиг үүргэвчнээсээ оосор бариад алхаж байна.
3551717658.jpg|0|There a lot of people aboard a large plane , and many are asleep .|Том онгоцонд олон хүн сууж, олон хүн унтаж байна.
3551781969.jpg|0|Young child in a bright red shirt smiles with enjoyment as she is hoisted into the air .|Год улаан цамцтай бяцхан хүүхэд агаарт хөөрөхдөө баярлан инээмсэглэж байна.
3551787566.jpg|0|Woman in blue workout attire and helmet rides through dirt path|Цэнхэр дасгалын хувцас, дуулга өмссөн эмэгтэй шороон замаар давхиж байна
3551834525.jpg|0|A man and a woman facing each other are sitting above a brick-lined canal just above a dark tunnel .|Харанхуй хонгилын чанх дээгүүр тоосгон доторлогоотой суваг дээр бие бие рүүгээ харсан эрэгтэй эмэгтэй хоёр сууж байна.
3552136801.jpg|0|In a baseball game , one of the players is about to throw the ball , with a runner in the background and a teammate close behind .|Бейсболын тоглолтонд тоглогчдын нэг нь бөмбөг шидэх гэж байгаа бөгөөд ард нь гүйгч, багийн анд нь ойрхон байна.
3552142982.jpg|0|Two men are on a beach bending down with one foot and one arm in the air at the same time .|Хоёр эрэгтэй далайн эрэг дээр нэг хөл, нэг гараа агаарт зэрэг бөхийлгөж байна.
3552206648.jpg|0|The large white bird swoops down hovering above the water .|Том цагаан шувуу усан дээгүүр нисч байна.
3552435734.jpg|0|A black and white dog running through shallow water .|Гүехэн усаар гүйж буй хар цагаан нохой .
3552491248.jpg|0|A young man sitting on a fence in a rural pastoral area with the sun setting in the background .|Хөдөөгийн бэлчээрийн хашаан дээр сууж буй залуу, цаанаа нар жаргаж байна .
3552507374.jpg|0|A elephant carrying two people , one of them a passenger in a chair on top of the elephant , and one of them guiding the elephant .|Хоёр хүн ачсан заан , нэг нь зааны орой дээрх сандал дээр суусан зорчигч , нэг нь зааныг удирдаж байна .
3552552910.jpg|0|Three elephants , each carrying a group of people , walking through the water .|Гурван заан тус бүрдээ хэсэг хүмүүс тээж, усан дундуур алхаж байна.
3552613836.jpg|0|A lone street musician performs on a rain-soaked , car-lined urban sidewalk with the tall buildings of the city in the background .|Гудамжны ганц хөгжимчин бороонд норсон, машин доторлогоотой хотын явган хүний зам дээр ард нь хотын өндөр барилгууд эгшиглэж байна.
3552633607.jpg|0|The sun comes beaming through the window of a large room while two men in conversation enjoy cups of coffee .|Нар том өрөөний цонхоор тусч, ярилцаж буй хоёр эрэгтэй аяга кофе ууж байна.
3552796830.jpg|0|Two men in camouflage pants are running past a parking lot .|Зогсоолын хажуугаар өнгөлөн далдалсан өмд өмссөн хоёр эрэгтэй гүйж байна.
3552829441.jpg|0|Guy without a shirt in black pants doing stunts on his skateboard .|Хар өмд өмссөн цамцгүй залуу скейтборд дээрээ трюк хийж байна.
3552934805.jpg|0|In a white-walled gymnasium , a shirtless male gymnast does a handstand on the parallel bars as another man watches him in the background .|Цагаан ханатай гимнастикийн зааланд цамцгүй эрэгтэй гимнастикч зэрэгцээ төмөр дээр гараа барьж байгаа бөгөөд цаана нь өөр хүн түүнийг харж байна.
3553056438.jpg|0|A little boy kisses a little girl as they sit on a hay bale with pumpkins and a Halloween display in the background .|Бяцхан хүү хулуутай өвсний боодол дээр суугаад бяцхан охиныг үнсэж, ард нь Халловины баярын үзүүлбэр үзүүлж байна.
3553204471.jpg|0|A student music ensemble rehearses a piece of music .|Оюутны хөгжмийн чуулга нэг уран бүтээлийн бэлтгэл хийж байна.
3553225222.jpg|0|A young child dressed in a graduation gown is throwing a graduation cap in the air .|Төгсөлтийн даашинз өмссөн бага насны хүүхэд төгсөлтийн малгайгаа агаарт шидэж байна.
3553374585.jpg|0|Three young men in white walking near tented area with banner advertisement .|Цагаан хувцастай гурван залуу сурталчилгааны сурталчилгаатай майхан талбайн дэргэд алхаж байна.
3553434575.jpg|0|A young lady in a bikini walking in the water on a cloudy day .|Үүлэрхэг өдөр усанд алхаж буй бикинитэй залуу бүсгүй .
3553476195.jpg|0|Two black dogs are tugging at an orange toy that is between them .|Хоёр хар нохой дундах улбар шар тоглоомыг чирч байна.
3554210976.jpg|0|a person in a blue tracksuit carrying a package is standing on a snowy mountain|Цэнхэр спорт хувцастай, боодолтой хүн цаст ууланд зогсож байна
3554277535.jpg|0|A little boy is in a swimming pool with goggles on , covering his mouth and nose with his hands just above the surface of the water .|Бяцхан хүү усан санд нүдний шил зүүж, усны гадаргуугаас дээш гараараа ам хамраа таглаж байна.
3554391279.jpg|0|Two women , one wearing a purple shirt and the other a green shirt , are climbing their way up an electrical pole with safety equipment with onlookers .|Нэг нь нил ягаан цамц, нөгөө нь ногоон цамц өмссөн хоёр эмэгтэй аюулгүйн хэрэгсэл бүхий цахилгааны шон дээр авирч байгаа хүмүүстэй хамт авирч байна.
3554444952.jpg|0|A blond woman with a braid in her hair is riding the bus .|Үсээ сүлжсэн шаргал үстэй эмэгтэй автобусанд сууж байна.
355444658.jpg|0|Man with rifle , glasses , hat , in camouflage takes picture next to dog , in front of a field .|Буутай, нүдний шилтэй, малгайтай, өнгөлөн далдалсан хүн нохойны хажууд, талбайн урд зургаа авахуулж байна.
3554634863.jpg|0|Man in yellow-gold suit and hat leaning forward with musical instruments to his right .|Баруун талд нь хөгжмийн зэмсэг барин урагш бөхийж буй шар алтан костюм, малгай өмссөн эр .
3555086376.jpg|0|Two young children , one in an inflatable life vest , swim in a pool .|Бага насны хоёр хүүхэд нэг нь хийлдэг хантаазтай усан санд сэлж байна.
3555231025.jpg|0|A small girl , wearing a pink top and jeans , stands on a field , with others in the background .|Ягаан цамц, жинсэн өмд өмссөн бяцхан охин талбай дээр зогсож байгаа бөгөөд цаана нь бусад хүмүүс байна.
3555376013.jpg|0|Woman with a red helmet and red and black stockings playing roller derby .|Улаан дуулгатай, улаан хар оймс өмссөн эмэгтэй галзуу дерби тоглож байна.
3555573680.jpg|0|A man in a flowered bathing suit waterskies on one ski while being pulled by a rope .|Цэцэгтэй усны хувцастай хүн олсоор татан цанаар гулгаж байна.
3555729342.jpg|0|The boy in the gray t-shirt is standing next to the girl in the green dress and cowboy hat on the beach .|Саарал цамцтай хүү далайн эрэг дээр ногоон даашинз, ковбой малгай өмссөн охины хажууд зогсож байна.
3556037801.jpg|0|A woman in a red shirt is examining one of many bicycles while a man in a blue shirt is adjusting a wheel .|Улаан цамцтай эмэгтэй олон унадаг дугуйны аль нэгийг шалгаж байхад цэнхэр цамцтай эрэгтэй дугуйгаа тааруулж байна.
3556039987.jpg|0|A girl playing kicking a soccer ball , in her team uniform green shorts white shirt and green socks .|Хөл бөмбөг өшиглөн тоглож буй охин багийнхаа дүрэмт хувцастай ногоон шорт цагаан цамц, ногоон оймс өмссөн байна.
3556081361.jpg|0|Small child in a orange top sitting in a purple and white chair on a graveled yard .|Хайрган хашаан дээр нил ягаан, цагаан сандал дээр сууж буй улбар шар өнгийн цамцтай бяцхан хүүхэд .
3556181622.jpg|0|A female rollerblader in a black , red and white uniform and red helmet with a star on it , and MC squared tattoo on her upper right arm , competes with her team .|Хар, улаан, цагаан дүрэмт хувцас, улаан дуулга өмссөн, дээр нь одтой, баруун дээд гартаа MC дөрвөлжин шивээстэй дугуйчин эмэгтэй багтайгаа өрсөлдөж байна.
3556375808.jpg|0|A small child sits in the water , holding on to a bit of wood while smiling for a picture .|Бяцхан хүүхэд усанд суугаад жаахан мод бариад зураг авахаар инээмсэглэж байна.
3556390715.jpg|0|A brown and white dog with a brown and black bandanna running very fast .|Хүрэн хар банданатай бор цагаан нохой маш хурдан гүйж байна.
3556485995.jpg|0|two men each carrying a stick playing a sport competition|спортын тэмцээн тоглож буй тус бүр саваа барьсан хоёр эрэгтэй
3556571710.jpg|0|This is a picture of three young men , dressed in suits with one on a bike , and of a young lady wearing a white dress .|Энэ бол костюм өмссөн гурван залуу, нэг дугуйтай, цагаан даашинз өмссөн залуу бүсгүйн зураг юм.
3556598205.jpg|0|A person on an all-terrain vehicle , sending up clouds of dust .|Тоос шороон үүл илгээж яваа хүн .
3556702089.jpg|0|Three gentlemen wearing jackets and holding microphones standing around a table , waiting to either begin or continue sportscasting .|Хүрэм өмсөж, микрофон барьсан гурван эрхэм ширээний ард зогсоод, спортын нэвтрүүлэг эхлэх эсвэл үргэлжлүүлэхийг хүлээж байна.
3556792157.jpg|0|A bunch of children sitting in chairs and standing on wooden floors .|Сандалд суугаад модон шалан дээр зогсох бөөн хүүхдүүд .
3556944378.jpg|0|A man with a very large backpack on his back walks through a large lobby filled with people .|Нуруундаа маш том үүргэвчтэй хүн хүмүүсээр дүүрсэн том үүдний танхимаар алхаж байна.
3557148230.jpg|0|A little baby on a tricycle seems to not be wearing any clothes .|Гурван дугуйтай бяцхан хүүхэд ямар ч хувцас өмсөөгүй бололтой.
3557295488.jpg|0|A man in a red and white jersey is hitting a man in a blue and white jersey during a field hockey game .|Хөлийн хоккейн тоглолтын үеэр улаан цагаан өмсгөлтэй эрэгтэй хөх цагаан өмсгөлтэй хүнийг цохиж байна.
3557316485.jpg|0|A person is skateboarding in a skate hole|Хүн тэшүүрийн нүхэнд тэшүүрээр гулгаж байна
3557324238.jpg|0|A boy with glasses on standing in the sand throws a yellow balloon in the air .|Элс дээр зогсож буй нүдний шилтэй хүү агаарт шар өнгийн бөмбөлөг шидэж байна.
3557595549.jpg|0|A young boy in orange swimming trunks gets ready to jump off the diving board .|Улбар шар өнгийн усан сантай залуу усанд шумбах тавцангаас үсрэхэд бэлдэж байна.
3557871242.jpg|0|A group of runners standing in front of a red car in Europe .|Европ дахь улаан машины урд зогсож буй хэсэг гүйгчид .
3557886648.jpg|0|A boxer wearing white shorts and red gloves punches another boxer wearing blue in the face .|Цагаан шорт, улаан бээлий өмссөн боксчин цэнхэр өмссөн өөр нэг боксчны нүүр рүү цохиж байна.
355814651.jpg|0|Two people are walking through a path with branches from neighboring trees overhead .|Хөрш зэргэлдээх модны мөчиртэй замаар хоёр хүн алхаж байна.
355817951.jpg|0|An Asian woman cleans off the window inside of a cafe .|Ази эмэгтэй кафены цонхыг цэвэрлэж байна.
3558251719.jpg|0|The man has a dog on a leash and appears to be teaching it to stand on its hind legs .|Энэ хүн оосортой нохойтой бөгөөд хойд хөл дээрээ зогсохыг зааж байгаа бололтой.
3558267192.jpg|0|A cowboy is viciously thrown about as he attempts to hold on to a horse he is riding in a rodeo competition .|Родео уралдаанд унасан морио барьж авах гэж оролдсон ковбой харгис хэрцгий шидэж байна.
3558370311.jpg|0|A cyclist is airborne over a jump in a public skate and bike park .|Унадаг дугуйчин олон нийтийн тэшүүр болон дугуйн цэцэрлэгт хүрээлэнд үсрэлт хийж байна.
3558438174.jpg|0|two scantily clad girls holding checkered flags standing on each side of a classic red car .|Сонгодог улаан машины хоёр тал дээр алаг туг барьчихсан дутуу хувцасласан хоёр охин зогсож байна.
3558683579.jpg|0|Three men are playing basketball and one of them blocked the others shot while people play in the back .|Гурван эрэгтэй сагсан бөмбөг тоглож байх ба тэдний нэг нь бусдын цохилтыг хааж ард нь хүмүүс тоглож байхад .
355869840.jpg|0|Three people wearing hats and all with orange tubs are working on brickwork on the ground .|Малгай өмссөн, улбар шар савтай гурван хүн газар дээр тоосгоны ажил хийж байна.
3558796959.jpg|0|A tennis player on a clay court runs to the ball .|Шавар талбай дээрх теннисчин бөмбөг рүү гүйж байна.
3559119662.jpg|0|A man is walking down a street passing a garage door covered in graffiti .|Граффитигаар хучигдсан гаражийн хаалганы хажуугаар нэг эрэгтэй гудамжаар алхаж байна.
3559327762.jpg|0|Large group of people in a building looking at a large mostly white color ball being rolled .|Барилга доторх олон тооны хүмүүс цагаан өнгийн том бөмбөг өнхрүүлж байгааг харж байна.
3559357704.jpg|0|A red rally-car is making its way through a muddy part of the race course , as photographers look on and take pictures of the vehicle .|Гэрэл зурагчид тээврийн хэрэгслийн зургийг харж, зураг авч байх үед уралдааны талбайн шаварлаг хэсгээр улаан ралли машин явж байна.
3559374748.jpg|0|The blue and gray vehicle is racing through the gravel .|Цэнхэр саарал өнгийн машин хайрган дундуур уралдаж байна.
3559425864.jpg|0|A man is in the air with his bike and there 's another guy on his bike in the back with the water close by .|Нэг хүн унадаг дугуйтайгаа агаарт явж байгаа бөгөөд цаана нь устай өөр нэгэн дугуйтай залуу байна.
3559429170.jpg|0|A man without a shirt , wearing a helmet , jumping a bike in the air near water .|Цамцгүй, дуулга өмссөн, усны ойролцоо агаарт дугуй үсэрч буй эрэгтэй .
3559693175.jpg|0|A group of people at a counter with a young man in a black shirt and hat helping them from the other side .|Лангууны дэргэд хар цамц, малгайтай залуутай хэсэг хүмүүс нөгөө талаас тусалж байна.
3559694091.jpg|0|A young man kneeling down in front of a mini grill tending to some bratwurst and hamburgers .|Мини гриллийн өмнө өвдөг сөгдөн гамбургер идэж буй залуу .
3559781965.jpg|0|A brown greyhound is wearing a blue muzzle and blue collar .|Хүрэн буурал хөх амтай, цэнхэр захтай.
3559993787.jpg|0|Person on bike in air above two large boulders with sun overhead .|Дээшээ нартай хоёр том чулуун дээгүүр агаарт дугуйтай хүн .
3560081723.jpg|0|person wearing a helmet on a four wheeled bike in air|агаарт дөрвөн дугуйтай дугуй дээр дуулга өмссөн хүн
3560125106.jpg|0|A light brown dog jumps through a ring of fire while two people watch .|Хоёр хүн харж байхад цайвар хүрэн нохой галын цагираг дундуур үсэрч байна.
3560502528.jpg|0|Three young men , one of which is wearing a white hat , are huddled together around bicycles on a wooden platform .|Нэг нь цагаан малгай өмссөн гурван залуу модон тавцан дээр унадаг дугуйн эргэн тойронд бөөгнөрөн зогсож байна.
3560503470.jpg|0|A row of bicycles are lined up next to several people sitting on a wood dock located between a marina and across from a grassy field .|Далайн усан онгоцны зогсоол болон өвслөг талбайн эсрэг талд байрлах модон хөлөг онгоцны зогсоол дээр сууж буй хэд хэдэн хүний хажууд эгнэн унадаг дугуй эгнэн байна.
3560504626.jpg|0|Three men are working in a bike shop , surrounded by bicycle frames , one of the men is sitting down , possibly reading something , another man is checking his phone , and the third man is smiling , looking around at the shop .|Дугуйн дэлгүүрт гурван эрэгтэй дугуйны жаазаар хүрээлэгдсэн, нэг нь суугаад юм уншиж байгаа байх, өөр хүн утсаа шалгаж, гурав дахь нь инээмсэглэн эргэн тойрноо харж байна. дэлгүүр.
3560513546.jpg|0|A female rides her bike by a wall in front of other cyclists .|Бусад дугуйчдын өмнө нэгэн эмэгтэй дугуйгаа хананы дэргэд унаж байна.
3560620846.jpg|0|A person is hanging on a wet ledge above a waterfall , looking down below him .|Хүрхрээний дээгүүр нойтон ирмэг дээр өлгөөтэй хүн доошоо харж байна.
3560726559.jpg|0|The man in the black suit and hat is holding the hand of the girl in the green dress whilst looking away from each other .|Хар костюм, малгай өмссөн залуу бие биенээсээ харцаа буруулан ногоон даашинзтай охины гараас атгаж байна.
3560771491.jpg|0|A dirty-blonde girl wearing a white tank top and blue jeans is standing in the middle of a green field and playing with dandelions .|Цагаан цамц, цэнхэр жинсэн өмд өмссөн халтар шаргал үст охин ногоон талбайн голд зогсоод данделио тоглож байна.
3560891822.jpg|0|Someone skateboarding down a wheelchair ramp in front of a tall yellow building .|Өндөр шар байшингийн урд талын тэргэнцэрт зориулсан налуугаар гулгаж буй хүн .
3560965055.jpg|0|A band on stage playing a cello and guitars while singing into microphones .|Тайзан дээр микрофоноор дуулж байхдаа морин хуур, гитар тоглож буй хамтлаг .
3560977956.jpg|0|A man and a woman are sitting in a rowboat on calm water .|Эрэгтэй, эмэгтэй хоёр тайван усан дээр завин дээр сууж байна.
3561130207.jpg|0|A large group of people are watching something , screaming , and taking pictures .|Бүлэг хүмүүс ямар нэг юм үзэж , хашгирч , зураг авч байна .
3561314880.jpg|0|A older man is wearing a torn up suit and is leaning on an orange shopping cart full of items .|Хөгшин эр урагдсан костюм өмсөж, бараа дүүрэн улбар шар өнгийн сагсанд налан зогсож байна.
3561363155.jpg|0|A boy in a red shirt is standing in front of a building and a girl in a red shirt is walking away from the building .|Барилгын өмнө улаан цамцтай хүү зогсож, улаан цамцтай охин барилгаас холдон алхаж байна.
3561404991.jpg|0|A group of people are hiking up a mountain in the snow .|Хэсэг хүмүүс цасан дунд ууланд алхаж байна.
3561433412.jpg|0|Wolf-like dog chasing white wiffle ball through a green field .|Чоно шиг нохой ногоон талбай дундуур цагаан бөмбөлөг хөөж байна.
356143774.jpg|0|A pair of long necked birds swimming .|Урт хүзүүтэй хос шувууд сэлж байна.
3561498139.jpg|0|A tall dining room chair in a dry field with a woman with cat 's eyeglasses and a frilly green dress having just jumped off it .|Хуурай талбайд муурны шил зүүсэн эмэгтэйн өндөр хоолны өрөөний сандал дээрээс үсэрч дөнгөж бууж ирсэн .
3561537309.jpg|0|A young boy wearing blue swim trunks on the beach walking into the water .|Далайн эрэг дээр усанд сэлэх цэнхэр өмд өмссөн залуу хүү усанд орж байна.
3561543598.jpg|0|Men in uniform , with flags , are gathered outdoors for a ceremony .|Дүрт хувцастай, туг барьсан эрчүүд ёслолын ажиллагаанд гадаа цугларч байна.
3561578941.jpg|0|A soccer player numbered 24 , wearing a yellow shirt , blue shorts , and blue socks , takes to the vibrant green field .|Шар цамц, цэнхэр шорт, цэнхэр оймс өмссөн 24 дугаартай хөлбөмбөгчин эрч хүчтэй ногоон талбайд гарч байна.
3561635009.jpg|0|A group of people walk across snow with walking sticks in their hands .|Хэсэг хүмүүс гартаа таяг бариад цасан дээгүүр алхаж байна.
3561639055.jpg|0|A cyclist in a helmet is driving down a slope on his bike .|Дуулга өмссөн дугуйчин дугуйтайгаа энгэр уруу явж байна.
3561734666.jpg|0|The man is pitching a baseball on a dirt mound .|Хүн шороон овоон дээр бейсбол шидэж байна.
