image_name|comment_number|comment|corrected_comment
289262112.jpg|0|Officials in black suits observe a karate competition between men , who are dressed in white with red and blue colored gloves identifying their teams .|Хар костюмтай албаны хүмүүс багаа тодорхойлсон улаан, цэнхэр өнгийн бээлийтэй цагаан хувцас өмссөн эрэгтэйчүүдийн каратэгийн тэмцээнийг ажиглаж байна.
289262437.jpg|0|Two men are competing in a martial arts tournament and one of them is receiving what appears to be a powerful roundhouse kick from the other .|Хоёр эрэгтэй тулааны урлагийн тэмцээнд өрсөлдөж байгаа бөгөөд тэдний нэг нь нөгөөгөөсөө хүчтэй цохилтыг хүлээн авч байна.
289262516.jpg|0|Two martial artists , one blue belt and one red belt , fight in front of an audience .|Үзэгчдийн өмнө нэг цэнхэр, нэг улаан бүс гэсэн хоёр тулаанч тулаан хийж байна.
2892843393.jpg|0|a woman wearing a Chinese straw hat operating some sort of stainless steel machine in what appears to be a park .|Хятад сүрэл малгай өмссөн эмэгтэй цэцэрлэгт хүрээлэнд зэвэрдэггүй ган машин ажиллуулж байна.
2892844237.jpg|0|Asian male in baseball cap , striped polo shirt , sitting on ground , with white thread , stitching up a shoe .|Бэйсболын малгайтай, судалтай поло цамц өмссөн, газар сууж, цагаан утастай, гутал оёж буй Ази эрэгтэй.
2892989340.jpg|0|Youth in white T-shirt on a white surfboard in the water .|Цагаан цамцтай залуучууд усан дахь цагаан сэлэлтийн тавцан дээр .
2892992529.jpg|0|A large black and white dog is catching a Frisbee in the park with a crowd of people behind him .|Том хар цагаан нохой цэцэрлэгт хүрээлэнд олон хүнтэй фрисби барьж байна.
2892995070.jpg|0|A black dog is running along the beach beside a brown dog in midair catching a stick in its mouth .|Агаарт бор нохойн дэргэд хар нохой далайн эрэг дагуу амандаа саваа бариад гүйж байна.
2893238950.jpg|0|the skateboard racers are coming around a curve in the road .|скейтбордын уралдаанчид замын муруйг тойрон ирж байна.
2893374123.jpg|0|A motorcyclist rides down a ramp held up by colorful barrels .|Мотоцикльчин өнгө өнгийн торхоноор өргөгдсөн налуу замаар уруудаж байна.
2893476169.jpg|0|A youth riding a skateboard is airborne amongst the basketball courts .|Скейтборд унаж буй залуу сагсан бөмбөгийн талбайн дунд агаарт нисч байна.
2893515010.jpg|0|A football player in an orange jersey tries to escape with the ball from the tackler .|Улбар шар өнгийн өмсгөлтэй хөлбөмбөгчин бөмбөгийг цохигчоос зугтахыг оролдов.
2893518092.jpg|0|This picture shows a group of soldiers in body armor with red shields|Энэ зураг дээр улаан бамбай бүхий хуяг дуулгатай хэсэг цэргүүдийг харуулж байна.
2893551710.jpg|0|Four entertainers dressed in Roman style garb are performing at an outdoor theater .|Ром маягийн хувцас өмссөн дөрвөн жүжигчид гадаа театрт тоглож байна.
2893618834.jpg|0|A man on a bicycle going down the street while a man stands nearby on the sidewalk in a striped shirt taking a picture of a sign with an orange cone placed atop it .|Унадаг дугуйтай эрэгтэй гудамжаар явж байхад хажууд нь судалтай цамц өмссөн эрэгтэй хажууд нь улбар шар өнгийн боргоцой байрлуулсан тэмдгийн зургийг авч байна.
289387198.jpg|0|2 men are working to clean the roof of a building with another man watching .|Барилгын дээврийг цэвэрлэхээр 2 хүн ажиллаж байгаа бөгөөд өөр хүн харж байна.
2894008505.jpg|0|A woman is running along the side of a road , casting her shadow on a concrete wall .|Замын хажуугаар нэгэн эмэгтэй сүүдрээ бетон хананд тусган гүйж байна.
2894217628.jpg|0|Two young men on the same football team are wearing orange and white uniforms and playing on an outside field while coaches and other players watch .|Нэг хөлбөмбөгийн багийн хоёр залуу улбар шар, цагаан хувцас өмсөж, гадаа талбайд тоглож байхад дасгалжуулагч болон бусад тоглогчид харж байна.
2894229082.jpg|0|A small child wearing a pink hat , blue jeans , and white shirt standing in a grass field .|Ягаан малгай, цэнхэр жинсэн өмд, цагаан цамц өмссөн бяцхан хүүхэд зүлгэн дээр зогсож байна.
2894309943.jpg|0|Three men dressed in white shirts and white hats , ( two with baseball caps , the leader with a white construction helmet ) , pounding sticks on steel and plastic drums .|Цагаан цамц, цагаан малгай өмссөн гурван эрэгтэй (хоёр нь бейсболын малгайтай, цагаан барилгын дуулгатай удирдагч), ган болон хуванцар бөмбөр дээр саваа цохиж байна.
2894576909.jpg|0|a lone person in a red boat on a wild river with only one padel|Ганцхан падельтэй зэрлэг голын улаан завин дээр ганц бие хүн
2894634533.jpg|0|A practicing martial artist is photographed in mid leap slicing through bamboo with his sword .|Тулааны дасгал хийж буй тамирчин сэлмээрээ хулс мод хэрчиж буй зургийг авчээ.
2894850774.jpg|0|Two older women conversing near a wall as seen from the driver 's seat of a parked vehicle .|Хананд зогсож буй машины жолоочийн суудлаас харахад хоёр настай эмэгтэй хананы дэргэд ярилцаж байна.
2894893895.jpg|0|A dj with headphones on is moving knobs up and down on his dj equipment .|Чихэвч зүүсэн DJ өөрийн dj төхөөрөмжийн товчлууруудыг дээш доош хөдөлгөж байна.
2895403073.jpg|0|One dog is bearing its teeth at the other two dogs as they run beside the water .|Нэг нохой нь усны хажууд гүйж байхад нөгөө хоёр нохой руу шүдээ барьж байна.
2895548671.jpg|0|A view of a few people , mostly wearing dark colors , crossing a city crosswalk .|Хотын гарцаар гарч буй голдуу бараан өнгийн хувцас өмссөн хэдэн хүний дүр зураг.
2895580381.jpg|0|Two women are sitting and watching a man and a woman walk passed them .|Хоёр эмэгтэй хажуугаар нь өнгөрөх эрэгтэй эмэгтэй хоёрыг хараад сууж байна.
289560545.jpg|0|A baby dressed in a one piece hooded pink and white outfit lies in a bed of fallen leaves|Нэг хэсэг юүдэнтэй ягаан, цагаан хувцас өмссөн хүүхэд унасан навчны орон дээр хэвтэж байна
2895700779.jpg|0|The girl has red-hair and eyebrows , multi-piercings in her ear , and a tattoo on her back .|Охин улаан үс хөмсөгтэй , чихэндээ олон цоолбортой , нуруундаа шивээстэй .
289583589.jpg|0|An older woman in a red blouse standing in front of her wares .|Улаан цамц өмссөн өндөр настай эмэгтэй барааныхаа өмнө зогсож байна.
2895966469.jpg|0|Person in kayak with water splashing up and over person and kayak .|Дээш, дээгүүр ус асгаж буй кайактай хүн болон завиар .
289599470.jpg|0|A person with dark hair is eating a very large ear of corn .|Хар үстэй хүн маш том эрдэнэ шиш идэж байна.
289616152.jpg|0|A guy on Rollerblades , sliding across a rail .|Роллербладтай залуу төмөр зам дээгүүр гулгаж байна.
2896180326.jpg|0|A group of people are sitting on dirt bikes in a grassy field .|Хэсэг хүмүүс өвстэй талбайд шороон дугуй дээр сууж байна.
289620419.jpg|0|A soccer team prepares for the day 's match under the gaze of the stadium spectators .|Хөл бөмбөгийн баг цэнгэлдэх хүрээлэнгийн үзэгчдийн харц дор өдрийн тоглолтонд бэлтгэж байна.
2896237618.jpg|0|A woman wearing gray pants , a white blouse and a black vest is jumping with one hand in the air as she goes through an indoor stadium .|Саарал өмд, цагаан цамц, хар хантааз өмссөн эмэгтэй тасалгааны цэнгэлдэх хүрээлэнгээр явж байхдаа нэг гараараа агаарт үсэрч байна.
289625522.jpg|0|A soccer team player in a green shirt is running off the field .|Ногоон цамцтай хөлбөмбөгийн багийн тоглогч талбайгаас гүйж байна.
289628492.jpg|0|Fans watch as players rest between sessions in a football game .|Хөлбөмбөгийн тоглолтын үеэр тоглогчид хэрхэн амарч байгааг шүтэн бишрэгчид нь харж байна.
2896298341.jpg|0|The little girl is carrying a pink and blue toy as she walks on the path .|Бяцхан охин ягаан, цэнхэр өнгийн тоглоом үүрээд зам дээр алхаж байна.
289636441.jpg|0|There are a bunch of soccer players standing around the soccer field in the middle of a game .|Тоглолтын дундуур хөл бөмбөгийн талбайн эргэн тойронд бөөн хөл бөмбөгчид зогсож байна.
289637262.jpg|0|Soccer teams are standing on a green pitch and are surrounded by a large stadium .|Хөл бөмбөгийн багууд ногоон талбай дээр зогсож, том цэнгэлдэх хүрээлэнгээр хүрээлэгдсэн байдаг.
289638061.jpg|0|Sports team on a field wearing yellow jerseys with a goal net to the right .|Баруун талд хаалганы тортой шар өнгийн цамц өмссөн талбай дээр байгаа спортын баг.
289638863.jpg|0|A professional soccer player wearing a yellow and gray jersey prepares to throw in the ball as the referee and fans look on .|Шүүгч болон хөгжөөн дэмжигчдийг харж байхад шар, саарал өнгийн өмсгөл өмссөн мэргэжлийн хөлбөмбөгчин бөмбөг шидэхээр бэлтгэж байна.
289639811.jpg|0|A group of men playing soccer in a stadium full of people .|Хүмүүсээр дүүрэн цэнгэлдэх хүрээлэнд хөл бөмбөг тоглож буй хэсэг эрчүүд .
2896464687.jpg|0|A blond woman dressed all in black is sitting backwards in a chair , in a field , looking to the right .|Бүтэн хар хувцас өмссөн шаргал үстэй эмэгтэй талбай дээр сандал дээр хойшоо суугаад баруун тийшээ харж байна.
2896483502.jpg|0|A white dog with black spots catches a bright green and pink Frisbee in a field .|Хар толботой цагаан нохой хээр талд тод ногоон, ягаан фрисби барьж байна.
2896529993.jpg|0|A young boy wearing a red , white and blue striped shirt is holding a spider in his right hand as he looks at .|Улаан, цагаан, цэнхэр судалтай цамц өмссөн залуу хүү баруун гартаа аалз атгаж, түүнийг харж байна.
2896640216.jpg|0|A woman leading a gray and black spotted dog in a red bandanna through a competition .|Улаан бандаантай саарал хар толботой нохойг хөтлөн тэмцээнд оролцож буй эмэгтэй .
2896668718.jpg|0|One football player wearing an orange jersey and one wearing a white jersey are set at the starting line .|Улбар шар өнгийн өмсгөл өмссөн нэг хөлбөмбөгчин, цагаан өмсгөл өмссөн нэг тоглогч гарааны шугаманд тавигдсан.
2896804690.jpg|0|These are ladies and a man , in a bar , passing out something in a basket .|Эдгээр нь бааранд сагсан дотор ямар нэгэн зүйл тарааж буй эрэгтэй, эмэгтэй хүмүүс юм.
2897141031.jpg|0|An Indian man is in a hospital getting help from a nurse while a woman watches .|Энэтхэг эр эмнэлэгт сувилагчаас тусламж авч байхад нэгэн эмэгтэй харж байна.
2897143731.jpg|0|An older man with glasses and gray hair is wearing a red striped robe while sitting and staring off in the distance .|Нүдний шилтэй, буурал үстэй ахимаг насны эр улаан судалтай дээл өмсөж, хол ширтэн сууж байна.
2897147853.jpg|0|A man in a white and red shirt is sitting on a brown couch in front of a white refrigerator and floral drapes .|Цагаан, улаан цамцтай эр цагаан хөргөгч, цэцэгсийн хөшигний урд бор буйдан дээр сууж байна.
289742991.jpg|0|A young woman in a white shirt and black pants holding a top hat entertaining some people sitting at a table|Цагаан цамц, хар өмд өмссөн залуу эмэгтэй дээд малгай барьж, ширээний ард сууж буй хүмүүсийг зугаацуулж байна
2897832422.jpg|0|A man wearing a black hat , coat and pants and a white shirt sitting at an outdoor table reading .|Хар малгай, пальто, өмд, цагаан цамц өмссөн эрэгтэй гадаа ширээний ард сууж байна.
2897978268.jpg|0|A man in a beige shirt and tan slacks sits in a chair next to a hospital patient wearing a blue gown who is sitting cross-legged on his hospital bed .|Шаргал цамц, бор өмд өмссөн эрэгтэй эмнэлгийн орон дээр завилан сууж буй цэнхэр халаад өмссөн эмнэлгийн өвчтөний хажууд сандал дээр сууж байна.
2897990634.jpg|0|A man in shorts and a white garment stands at the base of stairs framed by black railing .|Ширт өмд, цагаан хувцастай эр хар хашлагатай шатны ёроолд зогсож байна.
2898177660.jpg|0|Three people are in a room together and one man has an arm sling on .|Гурван хүн нэг өрөөнд байгаа бөгөөд нэг хүн гартаа дүүжлүүр зүүсэн байна.
2898189446.jpg|0|A man in shorts and a woman in a red long dress are walking down a road with a small white car in the background .|Богино өмд өмссөн эрэгтэй, улаан урт даашинзтай эмэгтэй хоёр ард талд жижиг цагаан машинтай замаар алхаж байна.
2898304260.jpg|0|The man performs tricks on his skateboard in the skateboarding park .|Эр хүн скейтбордын цэцэрлэгт хүрээлэнд скейтборд дээрээ мэх хийж байна.
2898332758.jpg|0|Indian children are sitting on a bike and talking in the middle of an Indian marketplace .|Энэтхэг хүүхдүүд Энэтхэгийн захын дунд дугуй унан, ярилцаж байна.
289860281.jpg|0|A girl in a bikini , glasses and black hat laying on a white towel on the beach .|Далайн эрэг дээр цагаан алчуур дээр хэвтэж буй бикини, нүдний шил, хар малгайтай охин.
2898690285.jpg|0|a man in a white shirt is metal detecting , while two other men watch .|Цагаан цамцтай эр төмөр илрүүлж байхад өөр хоёр эрэгтэй харж байна.
2898710898.jpg|0|A man in a black shirt , and black shorts is walking down the street , holding hands with a woman in a black sundress .|Хар цамц, хар шорт өмссөн эрэгтэй гудамжаар хар саравчтай эмэгтэйтэй хөтлөлцөн алхаж байна.
2898810636.jpg|0|A child wearing a blue shirt is jumping in the air .|Цэнхэр цамц өмссөн хүүхэд агаарт үсэрч байна.
2899089320.jpg|0|A blond girl in shorts sits on the top of monkey bars .|Сармагчны баарны орой дээр шорт өмссөн шаргал үст охин сууж байна.
2899276965.jpg|0|The young man with black pants and a white t-shirt is riding along the top of the wall with his skateboard .|Хар өмд, цагаан футболк өмссөн залуу скейтбордтойгоо хананы оройг дагаж давхиж байна.
2899374885.jpg|0|A toddler plays in a water fountain with his mouth open and ready for a drink .|Хөлд хөлд орсон хүүхэд усан оргилуурт амаа ангайлгаж, уухад бэлэн тоглож байна.
289939071.jpg|0|A couple is sitting along side a canal and kissing , while a woman in red sits near them and looks uncomfortable .|Хосууд сувгийн хажууд суугаад үнсэлцэж байх хооронд улаан хувцастай эмэгтэй тэдний дэргэд суугаад эвгүй харагдана.
2899501488.jpg|0|Riders on colorful motorcycles lean into a turn on a racetrack .|Өнгө өнгийн мотоцикль унасан хүмүүс уралдааны зам дээр эргэлдэж байна.
2899527576.jpg|0|A young man and woman in shorts and t-shirts are playing a video game .|Шорт болон подволк өмссөн залуу эрэгтэй эмэгтэй видео тоглоом тоглож байна .
2899549022.jpg|0|"Four women dance together at an "" Aloha "" party at someone 's home while a man in a blue t-shirt stands nearby ."|"Хэн нэгний гэрт болсон "" Aloha "" үдэшлэгт дөрвөн эмэгтэй хамтдаа бүжиглэж байхад хажууд нь цэнхэр цамцтай эрэгтэй зогсож байна."
2899550625.jpg|0|Three men wearing white safety hats , yellow vests and red pants all sit in lawn chairs around a sand castle .|Цагаан хамгаалалтын малгай, шар хантааз, улаан өмд өмссөн гурван эрэгтэй элсэн цайзын эргэн тойронд зүлгэн сандал дээр сууж байна.
2899594400.jpg|0|Two men and a dog are playing with a ball in front of the boats in the ocean .|Далайд хоёр эрэгтэй, нохой хоёр завины өмнө бөмбөгөөр тоглож байна.
2899622876.jpg|0|The man is being pulled behind a boat and doing tricks .|Хүнийг завины ард татан мэх хийж байна.
2899783188.jpg|0|A woman wearing a red and white striped shirt outside , surrounded by trees .|Улаан цагаан судалтай цамц өмссөн гадаа модоор хүрээлэгдсэн эмэгтэй .
2900048238.jpg|0|A young man in a blue shirt sits in front of a group of blue and white umbrellas .|Цэнхэр цамцтай залуу хөх цагаан шүхрийн өмнө сууж байна.
290019324.jpg|0|A black and white dog with a spotted face is running through a dirt field .|Шороон дундуур алаг царайтай хар цагаан нохой гүйж байна.
2900213085.jpg|0|A crowd of people casually dressed are watching a band with two members .|Энгийн хувцасласан олон хүмүүс хоёр гишүүнтэй хамтлагийг үзэж байна.
2900242501.jpg|0|A person in a yellow top and green shorts stands in a field by a soccer goal .|Шар топ, ногоон шорт өмссөн хүн талбай дээр хөл бөмбөгийн хаалганы дэргэд зогсож байна.
2900265091.jpg|0|Concert in what seems to be a very small venue with a fair amount of people .|Цөөн тооны хүн цугларсан маш жижигхэн газар болох концерт.
2900271867.jpg|0|A man in a green jacket and captain 's hat is on stage performing in front of an audience .|Тайзан дээр ногоон хүрэм, ахмадын малгай өмссөн эр үзэгчдийн өмнө тоглож байна.
2900274587.jpg|0|A water scene with a sunset in the background .|Ар талд нар жаргаж буй усан зураг .
2900418076.jpg|0|Two male construction workers in safety vests , sitting in a fenced in area on a street , reading newspapers .|Хамгаалалтын хантаазтай барилгын ажилчин хоёр эрэгтэй гудамжинд хашаанд сууж сонин уншиж байна.
2900560501.jpg|0|A group of young people take shots in a Mexican setting .|Хэсэг залуус Мексикийн орчинд зураг авалт хийж байна.
2900680078.jpg|0|An older man in khakis sits in a small , donkey-drawn open carriage .|Илжиг чирсэн илжигтэй жижиг тэргэн дээр хакис өмссөн өндөр настай эр сууж байна.
2900701525.jpg|0|Four men are relaxing under a large tree on a very nice day .|Дөрвөн эрэгтэй маш сайхан өдөр том модны дор амарч байна.
2900905937.jpg|0|A man in a green shirt is working under a blue vehicle .|Ногоон цамцтай хүн цэнхэр тээврийн хэрэгслийн доор ажиллаж байна.
2901074943.jpg|0|A young child plays with sidewalk chalk by dropping it on the gound .|Бага насны хүүхэд явган хүний замын шохойг газар дээр нь хаяж тоглож байна.
2901341974.jpg|0|Two people in a Mexican restaurant posing for a picture with Mexican hats on .|Мексик ресторанд хоёр хүн Мексик малгай өмссөн зургаа татуулж байна.
2901375404.jpg|0|A man wearing blue pants is standing on a ladder , working on building the roof of a dome on a white building .|Цэнхэр өмд өмссөн эрэгтэй шат дээр зогсож, цагаан байшин дээр бөмбөгөр дээвэр барьж байна.
2901462003.jpg|0|Many people walk on a sidewalk filled with blue street signs next to a row of buildings including one with yellow balconies .|Цэнхэр гудамжны тэмдэглэгээгээр дүүрсэн явган хүний замаар олон хүн алхаж, шар тагттай барилгуудын хажууд байна.
2901880865.jpg|0|a lone surfboarder on a white surfboard flying through the air over a wave|цагаан самбар дээр давалгаан дээгүүр агаарт нисч буй ганцаарчилсан гулгагч
2902269566.jpg|0|The red motocross bike and its rider are airborne above the trees .|Улаан мотокрос унадаг дугуй болон түүний унадаг дугуй моднуудын дээгүүр агаарт байна.
2902383833.jpg|0|A woman with a tattoo and safety glasses working on an anvil .|Шивээстэй, хамгаалалтын шилтэй эмэгтэй гон дээр ажиллаж байна.
2902486045.jpg|0|Two dogs are urinating on the red fire hydrant .|Улаан галын цорго дээр хоёр нохой шээж байна.
2902599503.jpg|0|A man wearing a fanny pack and a woman are walking down a crowded street .|Хүн ихтэй гудмаар алхаж байна.
2902661518.jpg|0|A bald headed man in black balances his skateboard on a cement wall and his shadow follows .|Хар хувцастай халзан толгойтой эр цементэн ханан дээр скейтбордоо тэнцвэржүүлж, сүүдэр нь дагаад явж байна.
2902844125.jpg|0|The boy in the yellow shirt is riding a skateboard along a red bar .|Шар цамцтай хүү улаан баарны дагуу скейтборд унаж байна.
