image_name|comment_number|comment|corrected_comment
842960985.jpg|0|A man in a tan trench coat and blue jeans walks with a black umbrella open over his head .|Толгой дээрээ хар шүхрээ онгойлгоод бор өнгийн тренч пальто, цэнхэр жинсэн өмд өмссөн эрэгтэй алхаж байна.
842961005.jpg|0|A woman in heels , black skirt and white shirt , holds her blue umbrella over her head while walking on a sidewalk near a parking meter .|Өсгийтэй гутал, хар юбка, цагаан цамц өмссөн эмэгтэй зогсоолын дэргэд явган хүний замаар алхаж байхдаа цэнхэр шүхрээ толгой дээрээ барьдаг.
843218288.jpg|0|Several people , including a man in a pink and black striped shirt who is taking a picture of something off-camera , are in a city park .|Камераас гадуур ямар нэг зүйлийн зургийг авч буй ягаан, хар судалтай цамцтай эрэгтэй зэрэг хэд хэдэн хүн хотын цэцэрлэгт хүрээлэнд байна.
843616798.jpg|0|A black and white dog is herding a group of sheep on a dusty road .|Тоостой зам дээр хар цагаан нохой хэсэг хонь хариулж байна .
843843809.jpg|0|A boy plays with a soccer ball under a clothesline in an alley .|Хүүхэд гудамжинд хувцасны оосор дор хөл бөмбөг тоглож байна.
844258711.jpg|0|A young child stands in the street of a downtrodden neighborhood , while another person walks in his direction .|Бага насны хүүхэд сүйрсэн хорооллын гудамжинд зогсож байхад өөр хүн түүний зүг алхаж байна.
8443156.jpg|0|A child dressed in blue jeans with rolled cuffs and a pink hoodie waits outdoors at the foot of the stairs with an axe .|Хүүхдэд ханцуйвчтай цэнхэр жинсэн өмд өмсөж, ягаан юүдэнтэй сүх барин гадаа шатын ёроолд хүлээж байна.
845047334.jpg|0|Along side a red brick building , two men in summer clothes are on a scaffold doing a window or door repair .|Улаан тоосгон барилгын хажууд зуны хувцастай хоёр эрэгтэй шатан дээр цонх, хаалга засвар хийж байна.
84507882.jpg|0|Two boys in the sand are standing near a structure with yellow railings .|Элсэн дээр байгаа хоёр хүү шар хашлагатай байгууламжийн дэргэд зогсож байна.
84509412.jpg|0|A little boy in an orange sweater and sunglasses plays at the beach .|Улбар шар өнгийн цамц, нарны шил зүүсэн бяцхан хүү далайн эрэг дээр тоглож байна.
84509831.jpg|0|Young boy dressed in long pants and a plaid shirt is holding a shovel near the ocean .|Урт өмд, хавтгай цамц өмссөн залуу далайн ойролцоо хүрз барьж байна.
84514007.jpg|0|A person is standing at the top of a large , rolling sand dune .|Хүн эргэлдэж буй том элсэн манханы оройд зогсож байна.
8454235.jpg|0|Several people work at circular fabric dye pools .|Дугуй даавууны будгийн усан санд хэд хэдэн хүн ажилладаг.
845623658.jpg|0|A barefoot man is performing a roundhouse kick on a punching bag with others in the background watching him .|Хөл нүцгэн эр цаад талд нь түүнийг харж байгаа бусад хүмүүс цоолтуурын цүнх рүү цохиж байна.
845940422.jpg|0|A child with two dolls being handed to an older man with military members surrounding the pair .|Хоёр хүүхэлдэйтэй хүүхэд хоёр хүүхэлдэйг тойрон хүрээлсэн цэргийнхэнтэй ахмад эрд өгч байна.
846070499.jpg|0|A woman in black shoes with pink laces , jeans , and a gray jacket talks with a man wearing black jeans and a shirt and holding a white bag over his shoulder .|Ягаан хоншоор, жинсэн өмд, саарал хүрэмтэй хар гутал өмссөн эмэгтэй хар жинсэн өмд, цамц өмссөн, мөрөн дээрээ цагаан цүнх барьсан эрэгтэйтэй ярилцаж байна.
846085364.jpg|0|A young child dressed in snowpants and blue hat tentatively steps on snow-covered ice .|Цасан өмд, цэнхэр малгай өмссөн бага насны хүүхэд цасанд хучигдсан мөсөн дээгүүр түр алхаж байна.
846516819.jpg|0|A man wearing sunglasses , white shirt , and a smile plays the drums .|Нарны шил, цагаан цамц өмссөн, инээмсэглэсэн эрэгтэй бөмбөр тоглож байна.
84713990.jpg|0|A group of people paddle their blue inflatable raft down the rapids .|Хэсэг хүмүүс цэнхэр хийлдэг салаа сэлүүрдэн хурдацтай даган гүйж байна.
847782643.jpg|0|Two children re laying on a rug with some wooden bricks laid out in a square between them .|Хоёр хүүхэд дөрвөлжин талбайд хэдэн модон тоосго тавьсан хивсэн дээр хэвтэж байна.
848007330.jpg|0|Men at work setting up a crane on a highway construction site .|Эрчүүд хурдны замын барилгын талбай дээр кран суурилуулж байна.
848180689.jpg|0|a woman and a little girl are playing with a ball in the pool underneath some water chutes .|Эмэгтэй бяцхан охин хоёр усан санд, усны хоолой дор бөмбөг тоглож байна.
84819693.jpg|0|A man in a coconut palm tree smiles down and seems to offer a coconut to the person taking the picture .|Наргил модны далдуу модтой хүн инээмсэглэн зураг авч буй хүнд наргил мод санал болгож байгаа бололтой .
84824317.jpg|0|A muscular man sitting on the ground cutting fruit in half with a machete .|Газар дээр сууж буй булчинлаг эр махетаар жимс зүсэж байна.
848293676.jpg|0|A boy in red shorts is jumping into a swimming pool with a red chair beside it .|Улаан шорт өмссөн хүү хажууд нь улаан сандал тавьсан усан сан руу үсэрч байна.
84864687.jpg|0|A balding man with a checkered shirt and khaki pants naps on his recliner with his keys on his lap .|Алаг цамц, хаки өмд өмссөн халзан эр түшлэгээ өвөр дээрээ тавиад зүүрмэглэж байна.
84927810.jpg|0|A dark-skinned male with dark hair stands outside of a building with a display of sunglasses in one hand and one hand above his head .|Барилгын гадаа нэг гартаа нарны шилтэй, нэг гартаа толгойнхоо дээгүүр хар үстэй хар арьстай эрэгтэй зогсож байна.
84962837.jpg|0|A man with brown hair and glasses wearing a dark overcoat , suit and tie reading a newspaper on the subway or train .|Хүрэн үстэй, нүдний шилтэй хар пальто, костюм, зангиа зүүсэн эрэгтэй метро, галт тэргэнд сонин уншиж байна.
85014310.jpg|0|Jewish wedding picture of the bride and groom with their guest .|Бэр, хүргэний зочны хамт еврей хуримын зураг .
85139806.jpg|0|An overweight woman in a bright yellow shirt holding a paper walking with an overweight male in a burgundy t-shirt and plaid shorts .|Цагаан барьсан тод шар цамцтай илүүдэл жинтэй эмэгтэй бургунд цамц, дөрвөлжин шорт өмссөн илүүдэл жинтэй эрэгтэйтэй хамт алхаж байна.
851566221.jpg|0|A woman with a blond ponytail and a white hat is riding a white horse , inside a fence with a horned cow .|Шаргал гэзэгтэй, цагаан малгайтай эмэгтэй цагаан морь унаж, эвэрт үхэртэй хашаан дотор байна.
852427632.jpg|0|A woman in a cowboy hat holding a rope and riding a horse chases down a calf as part of a rodeo .|Ковбой малгай өмссөн эмэгтэй олс барин морь унаж тугал хөөж байна.
852469220.jpg|0|A black and white dog is swimming through some water .|Усан дундуур хар цагаан нохой сэлж байна.
85306246.jpg|0|A man with facial hair works on some sort of stone sculpture .|Нүүрний үстэй хүн чулуун баримал дээр ажилладаг.
85306247.jpg|0|Man in a hood fingers are covered in clay as he works on piece of pottery .|Хүрээстэй хүн вааран дээр ажиллаж байхдаа хуруунууд нь шаварт хучигдсан байдаг.
85306249.jpg|0|A ma with white shoes , and a blue shirt looking at something to his left .|Цагаан гуталтай, цэнхэр цамцтай ээж зүүн талд нь ямар нэг юм харж байна.
85306254.jpg|0|A man wearing an orange shirt with tans shorts and a baseball cap is bent over in a small pit , scooping up pale mud with his hands .|Үлбар шар өнгийн шорт, бейсболын малгайтай улбар шар цамц өмссөн эрэгтэй жижиг нүхэнд бөхийж, гараараа цайвар шаврыг шүүж байна.
85318252.jpg|0|A woman selling bamboo sticks or brooms talking to two men on a loading dock .|Ачих тавцан дээр хулсан саваа юм уу шүүр зарж буй эмэгтэй хоёр эрэгтэйтэй ярилцаж байна.
85318261.jpg|0|An older male in a plaid shirt working on making an object .|Үзүүлэлт хийхээр ажиллаж буй дөрвөлжин цамцтай, өндөр настай эрэгтэй .
85326165.jpg|0|A young man in blue shorts using a machete to open coconuts .|Цэнхэр богино өмд өмссөн залуу кокос онгойлгохдоо мачет ашиглаж байна.
854333409.jpg|0|The dog on the right has a red object in his mouth , and the other dog has biting it .|Баруун талын нохой амандаа улаан юмтай, нөгөө нохой нь хазаад байна.
854623746.jpg|0|Several individuals getting together to play the bagpipes and eat some cuisine .|Хэд хэдэн хүн цулбуур тоглож, хоол идэж байна.
854749.jpg|0|A man wearing a black shirt and gray pants is in a large grocery store pushing a shopping basket in front of a candy isle .|Хар цамц, саарал өмд өмссөн эрэгтэй том хүнсний дэлгүүрт чихрийн арлын урд сагс түлж байна.
854848076.jpg|0|A man standing behind DJ equipment that sits on a table covered in a white cloth .|Цагаан даавуугаар хучсан ширээн дээр сууж буй DJ төхөөрөмжийн ард зогсож буй эрэгтэй .
85519095.jpg|0|A young boy , dressed in a gray and blue baseball uniform , preparing to hit the ball off of the t-ball stand while onlookers watch from behind a chain link fence .|Саарал, цэнхэр бейсболын дүрэмт хувцас өмссөн залуу хүү бөмбөгийг гинжин хашааны цаанаас харж байхад бөмбөгний тавцангаас бөмбөг цохихоор бэлтгэж байна.
855430954.jpg|0|A man wearing a colorful shirt is sitting with a plastic bucket on a wooden raft-type structure in brownish water with a canoe nearby , very close to the shore which is covered with greenery .|Өнгө өнгийн цамц өмссөн хүн ногоон хувингаар бүрхэгдсэн эрэгт маш ойрхон завиар завиар хүрэн усан дотор модон сал маягийн байгууламж дээр хуванцар хувин бариад сууж байна.
85574732.jpg|0|A young boy in a yellow , insulated coat imitates an adult , who is using a broom to sweep the paving stones near an open storage unit on a festive Chinatown sidewalk .|Чайнатауны баярын явган хүний зам дээр байрлах задгай агуулахын ойролцоох шүүр ашиглан чулуу шүүрдэж буй шар өнгийн дулаалгатай пальтотой залуу хүү насанд хүрсэн хүнийг дуурайж байна.
85600252.jpg|0|Two men talking to an older lady ( one with a red hat and black shirt and the other with a brown jacket .|Хөгшин эмэгтэйтэй ярилцаж буй хоёр эрэгтэй (нэг нь улаан малгай, хар цамц, нөгөө нь бор хүрэмтэй .
85676478.jpg|0|A smiling man wearing a black shirt is standing in a room with a television and a table with food and a vase of flowers on top of it .|Хар цамц өмссөн инээмсэглэсэн эр зурагт, ширээн дээр хоол, дээр нь цэцэг тавьсан ваартай өрөөнд зогсож байна.
856985136.jpg|0|A woman in capri jeans crouches on the edge of a fountain with her left foot kicked out to touch the falling water .|Капри жинсэн өмд өмссөн эмэгтэй унж буй усанд хүрэхийн тулд зүүн хөлөө гарган усан оргилуурын ирмэг дээр бөхийв.
85707684.jpg|0|A man in a plaid jacket is cutting fabric with several colorful strands of fabric behind him .|Нэгэн өнгийн хүрэм өмссөн эрэгтэй ардаа хэд хэдэн өнгийн даавуугаар даавуу хайчилж байна.
85707689.jpg|0|A man in a red hat balances himself on a rooftop among the slums .|Улаан малгайтай хүн ядуусын хорооллын дээвэр дээр өөрийгөө тэнцвэржүүлж байна.
857914283.jpg|0|Two little blond boys play on a bed in a room with wood paneling .|Шаргал үст хоёр бяцхан хүү модон хавтантай өрөөнд орон дээр тоглож байна.
858747984.jpg|0|Two boys climbing down a rock with an older blond man talking to more people at the top of the rock .|Хоёр хөвгүүн хадны орой дээр ахимаг насны шаргал үстэй залуутай хамт хад руу авирч байна.
859620561.jpg|0|A dog leaps high in the air to catch a toy over the green grass .|Нохой ногоон зүлгэн дээгүүр тоглоом барьж авахаар агаарт үсэрч байна.
860060733.jpg|0|An asian street craftsman fashions items for sale .|Азийн гудамжны урчуудын хувцас зарна.
8601145.jpg|0|A man without a shirt is standing next to two other men in front of a large boat .|Цамцгүй хүн том завины өмнө өөр хоёр хүний хажууд зогсож байна.
860271719.jpg|0|farmers are performing their agriculture during the day .|Тариаланчид газар тариалангаа өдрийн цагаар хийж байна.
860526919.jpg|0|A zoo worker is inside an exhibit , playing with a tiger that is climbing up a tree .|Амьтны хүрээлэнгийн ажилтан үзмэрийн дотор модонд авирч буй бартай тоглож байна.
860840598.jpg|0|A young boy dressed in black and green is laying down in a tent outside with items surrounding him .|Хар ногоон хувцастай залуу хүү гадаа майханд хэвтэж, эргэн тойронд нь эд зүйлс .
860928274.jpg|0|A smiling boy plays inside an inflatable yellow and white toy .|Инээж буй хүү шар цагаан хийлдэг тоглоом дотор тоглож байна.
86109322.jpg|0|There is 3 people standing and one of the women with a scarf around her neck and a black shirt on , is holding a blue cup .|Тэнд 3 хүн зогсож байгаа бөгөөд хүзүүндээ ороолттой, хар цамц өмссөн эмэгтэйчүүдийн нэг нь цэнхэр аяга барьдаг.
86109631.jpg|0|A woman in red leans her head on the shoulder of the woman next to her .|Улаан хувцастай эмэгтэй хажуугийн эмэгтэйн мөрөн дээр толгойгоо наан .
86112634.jpg|0|A large man smiles as he reaches past a display counter with jewelry in it , pointing at something , while his younger , dark-haired friend looks on smiling .|Үнэт эдлэлтэй лангууны хажуугаар өнгөрөхөд том биетэй эр ямар нэгэн зүйл рүү чиглүүлэн инээмсэглэж байхад залуу хар үстэй найз нь инээмсэглэн харна.
86112682.jpg|0|A man prepares food at an outdoor event before a table spread with multiple fresh vegetables .|Гадаад арга хэмжээн дээр олон шинэ ногоо дэлгэсэн ширээний өмнө нэгэн эр хоол бэлдэж байна.
86112730.jpg|0|A chef standing behind a large pan of pepperoni pizza with one-fourths of the pizza missing .|Том тогоотой пепперони пиццаны ард зогсож буй тогооч пиццаны дөрөвний нэг нь алга.
86112808.jpg|0|a woman is at a table offering palm readings and tarot readings|эмэгтэй ширээний ард далдуу мод болон тарот уншихыг санал болгож байна
86112875.jpg|0|A woman with a hair bun appears to be making cigars next to another woman .|Үсээ боосон эмэгтэй өөр эмэгтэйн хажууд навчин тамхи хийж байгаа бололтой.
86112925.jpg|0|A woman in a patterned shirt hands a plate of food to another woman in an apron , while two women work in the background .|Хээтэй цамцтай эмэгтэй тавагтай хоолоо хормогчтой өөр эмэгтэйд өгч байхад цаана нь хоёр эмэгтэй ажиллаж байна.
86112958.jpg|0|A family poses for a photograph outside a shopping center with a character dressed up as SpongeBob SquarePants .|Гэр бүл худалдааны төвийн гадаа хөвөн Бобын дөрвөлжин өмд шиг хувцасласан дүртэй зургаа авахуулж байна.
86120374.jpg|0|A tanned man with white hair wearing plastic gloves making cotton candy in front of a small fair with parents and children .|Цагаан үстэй борлосон эр хуванцар бээлий өмсөж, эцэг эх, хүүхдүүдтэйгээ бяцхан үзэсгэлэнгийн өмнө хөвөнтэй чихэр хийж байна.
86120427.jpg|0|People passing through an open market , while an older woman leans in front of a chilled bin on=f seafood .|Хүмүүс задгай захаар өнгөрч байхад хөгшин эмэгтэй хөргөсөн савны өмнө тонгойж, далайн хоолон дээр .
86120479.jpg|0|A worker in a blue shirt and white hard hat is climbing a scaffolding .|Цэнхэр цамц, цагаан малгайтай ажилчин шат руу авирч байна.
86120569.jpg|0|A white wedding style cake topped with white roses sits atop a stainless steel table while a man decorates an egg shaped cake with a scroll pattern in the background .|Цагаан сарнайгаар чимэглэсэн хуримын хэв маягийн цагаан бялуу нь зэвэрдэггүй ган ширээн дээр сууж байхад нэгэн эр ард нь гүйлгэх хээтэй өндөг хэлбэртэй бялууг чимэж байна.
86120657.jpg|0|A bearded man , thumbs on straps of waterproof orange bib overalls , stands in front of a grocery cooler full of fish .|Ус нэвтэрдэггүй улбар шар өнгийн цамцны оосор зүүсэн сахалтай эр загас дүүрэн хүнсний хөргөлтийн урд зогсож байна.
86120682.jpg|0|A lady wearing a navy blue stripe tank top cargo pants has a yellow glow of on her left hand holding a long stick getting ready to burn glass in front of an incinerator|Хар хөх өнгийн судалтай цистернтэй ачааны өмд өмссөн эмэгтэйн зүүн гартаа шар туяатай, урт саваа барьж, шатаах зуухны өмнө шил шатаахаар бэлдэж байна
86120741.jpg|0|A woman is holding a microphone toward another woman who is part of a group of people on the street .|Гудамжинд байгаа хэсэг бүлэг хүмүүсийн нэг эмэгтэй рүү нэг эмэгтэй микрофон барьж байна.
86120813.jpg|0|A man in overalls , a hat , and gloves holds on to the handlebars of a large machine .|Комбинзон, малгай, бээлий өмссөн эрэгтэй том машины бариулаас барина.
86120845.jpg|0|six men are sitting or laying on a patch of earth in a wooded area .|Зургаан эрэгтэй ой модтой газар шороон дээр сууж эсвэл хэвтэж байна.
86120876.jpg|0|A man wearing a blue shirt , blue cap , and jeans is washing a window while hanging from a rope .|Цэнхэр цамц , цэнхэр малгай , жинсэн өмд өмссөн эрэгтэй олсноос дүүжлэгдэж цонх угааж байна .
86120978.jpg|0|A gentlemen in a burgundy long-sleeve shirt is at a fruit stand selling watermelon .|Бургунди урт ханцуйтай цамц өмссөн эрхэм тарвас зарж буй жимсний лангуунд .
86124605.jpg|0|An asian lady in a brown shirt with glasses is making some food .|Хүрэн цамц өмссөн нүдний шилтэй ази эмэгтэй хоол хийж байна.
86127083.jpg|0|A man is going through his scrap book and admiring the mementos from his travels to China .|Нэг хүн хаягдал номоо үзэж, Хятадад хийсэн аялалынхаа дурсгалыг биширч байна.
86131617.jpg|0|A large billboard of a woman wearing a white shirt and lavender cami is being hung by 2 people in mechanical lift and one man standing on the ledge behind the billboard .|Цагаан цамц, лаванда ками өмссөн эмэгтэйн том рекламны самбарыг 2 хүн механик өргөгчөөр өлгөж, самбарын арын тавцан дээр нэг эрэгтэй зогсож байна.
86131989.jpg|0|Group of Police officers in uniform standing in a parking lot , smiling and talking .|Дүрт хувцастай хэсэг цагдаа нар зогсоол дээр зогсоод инээмсэглэн ярилцаж байна.
86132021.jpg|0|A man wearing only a hat , boots , and underwear is walking the sidewalk with a guitar strapped around his shoulder .|Зөвхөн малгай , гутал , дотуур хувцас өмссөн эр мөрөндөө гитар оосортой явган хүний замаар алхаж байна .
861608773.jpg|0|A dog running at a park , with a park bench in the background .|Цаана цэцэрлэгт хүрээлэнгийн сандалтай цэцэрлэгт хүрээлэнд гүйж буй нохой .
861661418.jpg|0|A dog with big ears is holding a small stick in its mouth .|Том чихтэй нохой амандаа жижиг саваа барьж байна.
861795382.jpg|0|a boy in a blue t-shirt is taking an orange bicycle over a jump in the street .|Цэнхэр цамцтай хүү улбар шар дугуйтай гудамжинд үсэрч байна.
86198383.jpg|0|A person is scrubbing a toilet while wearing a gas mask , and oddly no gloves .|Хүн хийн баг зүүж бие засах газар угааж байна, хачирхалтай нь бээлийгүй.
862054277.jpg|0|A little girl in a swimsuit and braids is in front of the water , in the grass , with her arms crossed in front of her chest|Усны хувцастай, сүлжсэн бяцхан охин өвсөн дунд гараа цээжиндээ зөрүүлэн зогсож байна.
862156271.jpg|0|Two women , one with a head bandanna , are standing next to each other while one holds a bottle .|Нэг нь толгойн боолттой хоёр эмэгтэй хажууд нь зогсож байхад нэг нь шил бариад зогсож байна.
862177617.jpg|0|A person with blue hair , a baseball cap , and a hood on stands outdoors in a crowd .|Цэнхэр үстэй, бейсболын малгайтай, юүдэнтэй хүн гадаа олны дунд зогсож байна.
