image_name|comment_number|comment|corrected_comment
2670560883.jpg|0|Four young children playing on a stone bear with people in the background .|Дөрвөн бага насны хүүхэд чулуун баавгай дээр хүмүүстэй тоглож байна.
267062347.jpg|0|A man with a beige suit and gray trousers holds a guitar in his hands and a harmonica in his mouth .|Шаргал костюм, саарал өмд өмссөн эр гартаа гитар, амандаа гармоник барьдаг.
2670637584.jpg|0|A child in a blue shirt sitting on a forest floor , looking through binoculars .|Цэнхэр цамцтай хүүхэд ойн шалан дээр суугаад дурангаар харж байна.
2671167487.jpg|0|"A woman on a boat named "" El Corazon "" drops black weights into the water ."|" El Corazon """" нэртэй завин дээрх эмэгтэй хар туухайг ус руу унагаж байна ."""
2671168017.jpg|0|A person wearing an orange shirt is riding a bike with something tide to the bike .|Улбар шар өнгийн цамц өмссөн хүн унадаг дугуй руу ямар нэг зүйл түрхээд дугуй унаж байна.
2671267709.jpg|0|A woman in a multi-color shirt is sitting on the floor working with a white product .|Олон өнгийн цамц өмссөн эмэгтэй шалан дээр сууж цагаан бүтээгдэхүүн хийж байна.
2671560649.jpg|0|A person sitting on a ledge using a machine to look out over the city .|Хотыг харахын тулд машин ашиглан ирмэг дээр сууж буй хүн .
2671602981.jpg|0|A little girl wearing a black tankini is jumping in the air with water in the background .|Хар танки өмссөн бяцхан охин цаана нь устай агаарт үсэрч байна.
267162122.jpg|0|A small black dog is standing over a small white dog laying on his side .|Түүний хажуугаар хэвтсэн жижигхэн цагаан нохойн дээр жижигхэн хар нохой зогсож байна.
267164457.jpg|0|There man on top of an snow covered mountain with a lake behind him .|Цастай уулын орой дээр, ард нь нууртай хүн байна.
2671880562.jpg|0|An oriental man performing physical strengths on the floor .|Дорнын хүн шалан дээр биеийн хүчний дасгал хийж байна.
26720379.jpg|0|This is the image of a young child with his head slanted back , and is sleeping in a green stroller with white plastic bags hanging from the back .|Энэ бол толгойгоо хойш наасан, нуруунаасаа цагаан гялгар уут унжсан ногоон тэргэн дээр унтаж буй бяцхан хүүхдийн дүр юм.
267216971.jpg|0|A man in a gray shirt works behind the counter at a fish market .|Саарал цамцтай эр загасны зах дээр лангууны ард ажилладаг.
267223366.jpg|0|A crates of fish in the middle of a group of people .|Бүлэг хүмүүсийн дунд хайрцагтай загас .
2672354635.jpg|0|Several brown dogs playing with a tennis ball in a grassy field .|Өвстэй талбайд теннисний бөмбөгөөр тоглож буй хэдэн бор нохой .
2672445419.jpg|0|A young boy smiles as he hangs onto bars at the playground .|Залуу хүү тоглоомын талбайн бааранд өлгөж байхдаа инээмсэглэж байна.
2672588619.jpg|0|Three kids , one holding a closed umbrella , run around on a sidewalk next to a river .|Гурван хүүхэд, нэг нь битүү шүхэр барьсан, голын хажуугийн явган хүний зам дээр гүйж байна.
2672634212.jpg|0|A woman in a pink shirt walking with a man walking in the other direction in the background .|Ягаан цамцтай эмэгтэй цаана нь нөгөө зүг рүү явж буй эрэгтэйтэй хамт алхаж байна.
2672705063.jpg|0|Several bicyclists are riding their bikes in a city street .|Хотын гудамжинд хэд хэдэн дугуйчид дугуй унаж байна.
2673148534.jpg|0|A dog runs past an empty chair and a tripod , between stretched strings , marking a path through a grassy field .|Нохой хоосон сандал болон гурван хөлийн хажуугаар сунгасан утаснуудын дундуур гүйж, өвслөг талбайн замыг тэмдэглэж байна.
2673209105.jpg|0|A barefooted little girl in a pink dress is mid-flight in a jump .|Ягаан даашинзтай хөл нүцгэн охин үсрэлтээр нисч байна.
267325341.jpg|0|A black dog is running through the grass carrying something red in its mouth .|Хар нохой амандаа улаан юм үүрээд өвсөн дундуур гүйж байна.
2673564214.jpg|0|A young boy poses behind the netting of an enclosed play area while three other children play .|Залуу хүү хаалттай тоглоомын талбайн торны цаана гурван хүүхэд тоглож байхад зургаа авахуулж байна.
2674452595.jpg|0|A mechanic fixing a wheel on a car of a train .|Галт тэрэгний вагонд дугуй засах засварчин .
2674742398.jpg|0|A man dressed in blue pants and a blue shirt poses in an alleyway with a camera and a piece of paper .|Цэнхэр өмд, цэнхэр цамц өмссөн эрэгтэй камер, цаас барин гудамжинд зургаа авахуулж байна.
2674784195.jpg|0|Two boys are laying in the ocean close to the beach .|Хоёр хүү далайн эрэгт ойрхон далайд хэвтэж байна.
2675190069.jpg|0|A woman in a bikini sits in shallow water with a man sitting next to her .|Бикинитэй эмэгтэй гүехэн усанд сууж, хажууд нь эрэгтэй сууж байна.
2675323741.jpg|0|A dark-haired woman with a small star tattoo on her arm wears a gray t-shirt and jeans and checks her cellphone while sitting at a small table with a book and a cold drink .|Гартаа жижиг одтой шивээстэй хар үстэй эмэгтэй саарал цамц, жинсэн өмд өмсөж, жижиг ширээний ард ном, хүйтэн ундаа барин сууж байхдаа гар утсаа шалгаж байна.
2675365025.jpg|0|A man with a blue shirt and white shorts prepares a charcoal barbecue while two other men look on .|Цэнхэр цамц, цагаан шорт өмссөн эрэгтэй нүүрсэн шарсан мах бэлдэж байхад өөр хоёр эрэгтэй харж байна.
2675397335.jpg|0|A black dog is running through a field of grass and dandilions .|Хар нохой өвс, дандилиан дундуур гүйж байна.
2675643250.jpg|0|Men , wearing red traditional garb , appear to be taking part in a religious Buddhist tradition outside a temple .|Уламжлалт улаан хувцас өмссөн эрчүүд сүмийн гадаа шашны буддын шашны уламжлалд оролцож байгаа бололтой.
2675685200.jpg|0|a young boy making a big mess on the floor and table while eating cereal|залуу хүү үр тариа идэж байхдаа шал, ширээгээ эмх замбараагүй болгож байна
26758039.jpg|0|A group of people are walking around a crowded area next to a Pizza Hut in an Asian country .|Азийн нэгэн улсын Pizza Hut-ын хажууд хөл хөдөлгөөн ихтэй газраар хэсэг хүмүүс алхаж байна.
267593659.jpg|0|Two men wearing bright green shirts are looking for something by a bush .|Тод ногоон цамц өмссөн хоёр эр бутны дэргэд ямар нэгэн зүйл хайж байна.
2676015068.jpg|0|The man with the white t-shirt is sitting in a stream looking at a rock .|Цагаан цамцтай эр горхинд суугаад чулууг харж байна.
2676184321.jpg|0|The girl stands outside in the cold wearing a warm hat and looking off into the distance .|Охин гадаа хүйтэнд дулаан малгай өмсөөд алсын зүг харж зогсоно.
2676292940.jpg|0|A little girl in a red and white dress is running in a field with a wooden table and tall yellow grass in the background .|Улаан цагаан даашинзтай бяцхан охин модон ширээ, цаана нь өндөр шар өвстэй талбайд гүйж байна.
2676537026.jpg|0|A female martial artist demonstrating a sword form in front of her instructor and other students .|Багаш багш болон бусад оюутнуудын өмнө сэлэм үзүүлж буй эмэгтэй тулаанч .
2676648667.jpg|0|Woman in gray shirt and dark skirt sitting in blue chair with white stars in front of a brick wall .|Саарал цамц, бараан банзал өмссөн эмэгтэй тоосгон хананы өмнө цагаан одтой цэнхэр сандал дээр сууж байна.
2676649969.jpg|0|An aged woman is looking into the camera while the inside of her hut is shown .|Хөгшин эмэгтэй овоохойнхоо дотор талыг харуулсан камер руу харж байна.
2676651833.jpg|0|A young girl on a blue and yellow merry-go-round , with a blurry background .|Цэнхэр, шар өнгийн зугаалга дээр , бүдэг дэвсгэртэй залуу охин .
2676764246.jpg|0|The greyhounds are running quickly in this race .|Энэ уралдаанд буурлууд хурдан уралдаж байна.
2676937700.jpg|0|A man in a kilt follows a girl and another man in a kilt and holds a girl wearing silver shoes .|Өнгө нөмрөгтэй эр охиныг дагаж, бас нэг өмд өмссөн эрэгтэйг дагаж, мөнгөн гутал өмссөн охиныг тэвэрлээ.
2677109430.jpg|0|A few people sitting on pews listening to a choir performing at the front of a church next to a large crucifix and in front of a large religious tapestry .|Сүмийн өмнө том загалмайн дэргэд болон шашны том хивсэнцэрийн өмнө найрал дууны тоглолтыг сонсож буй хэдэн хүмүүс индэр дээр сууж байна.
2677296582.jpg|0|A man works with some machinery on a subway car or train .|Эр хүн метроны вагон эсвэл галт тэргэнд машин механизмтай ажилладаг.
2677377747.jpg|0|Two girls in shorts sit beside bookshelves filled with books and toys while one reads a large children 's picture book .|Богино өмд өмссөн хоёр охин ном, тоглоомоор дүүрэн номын тавиурын дэргэд сууж байхад нэг нь хүүхдийн том зурагтай ном уншиж байна.
2677528593.jpg|0|Four Caucasian kids are standing on a pier watching one of their friends jump off into the ocean .|Дөрвөн Кавказ хүүхэд усан онгоцны зогсоол дээр зогсоод нэг найзынхаа далай руу үсрэхийг харж байна.
2677565007.jpg|0|A man and a woman fighting in the street .|Гудамжинд зодолдож буй эрэгтэй эмэгтэй .
2677614492.jpg|0|A small white and brown dog is jumping over a horizontal pole .|Бяцхан цагаан бор нохой хэвтээ шон дээгүүр харайж байна.
2677656448.jpg|0|A dog in a swimming pool swims toward sombody we cannot see .|Усан бассейнд байсан нохой бидний харж чадахгүй байгаа хэн нэгэн рүү сэлж байна.
2678171436.jpg|0|A man in a white shirt holding a brown stick , looking at the ground .|Хүрэн саваа барьсан цагаан цамцтай хүн газар ширтэн .
2678193588.jpg|0|Several children are sitting at a table as a little boy wearing a red shirt with a white design looks towards the camera .|Цагаан загвартай улаан цамц өмссөн бяцхан хүү камер луу харж байхад хэдэн хүүхэд ширээний ард сууж байна.
267821422.jpg|0|An old woman in brown carrying a bag is holding hands with a child in a pink shirt as they walk on the grass in front of a brick building .|Цүнх барьсан бор өвгөн эмгэн ягаан цамцтай хүүхэдтэй хөтлөлцөж, тоосгон барилгын урд зүлгэн дээр алхаж байна.
2678315125.jpg|0|A young woman in a blue tank top and baseball cap dances along a beach barefoot .|Цэнхэр цамц, бейсболын малгай өмссөн залуу эмэгтэй хөл нүцгэн далайн эрэг дагуу бүжиглэж байна.
2678343915.jpg|0|A metal worker , wearing a leather apron , red gloves , and a face mask , is grinding a weld flat .|Савхин хормогч , улаан бээлий , нүүрний маск зүүсэн төмөрчин гагнуурын талбайг нунтаглаж байна .
267836606.jpg|0|a black dog is running with its mouth open across a grassy field .|Хар нохой өвстэй талбай дээгүүр амаа ангайлган гүйж байна.
2678612999.jpg|0|A small kid is about to kick a soccer ball while two other kids are chasing him .|Бяцхан хүүхэд хөл бөмбөг өшиглөх гэж байхад өөр хоёр хүүхэд түүнийг хөөж байна.
2678668581.jpg|0|People gather under a white tent while some sit at tables .|Хүмүүс цагаан майхан дор цугларч байхад зарим нь ширээний ард сууж байна.
2678685955.jpg|0|A crowd of people with one person on skates facing the opposite of everyone .|Тэшүүр дээр нэг хүнтэй бөөгнөрсөн хүмүүс бүгд эсрэгээрээ .
2678747865.jpg|0|A man is peddling a bike attached to a pole with a harness around his neck suspended in air .|Хүзүүндээ уяагаар дүүжлүүлсэн шоннд бэхлэгдсэн дугуйг эр хүн худалдаалж байна.
2678778191.jpg|0|A young man wearing a bandanna on his head stands leaning on a short brick wall , with flowers behind him .|Толгой дээрээ бандана зүүсэн залуу богино тоосгон хананд налан зогсож байгаа бөгөөд ард нь цэцэг ургасан байна.
2678792892.jpg|0|A young girl wearing a blue t-shirt is sitting on a towel eating a snow cone with a spoon .|Цэнхэр цамц өмссөн залуу охин алчуур дээр суугаад халбагаар цасан боргоцой идэж байна.
2678798732.jpg|0|A photographer is kneeling in front of a railing that is protects falling into water .|Усанд унахаас хамгаалсан хашлагын өмнө гэрэл зурагчин өвдөглөн сууж байна.
2679015215.jpg|0|Two men are looking toward the ground while one is wearing gloves and holding a tool .|Нэг нь бээлий өмсөж, багаж барьсан хоёр эрэгтэй газар өөд харж байна.
2679381280.jpg|0|A cello player wearing flip-flops and a blue shirt playing the instrument .|Цэнхэр цамц өмссөн хийл хөгжимчин хөгжим тоглож байна.
2679382388.jpg|0|A young Asian man with long black hair in a t-shirt and shorts sits in front of a large musical drum .|Том цамц, шорт өмссөн урт хар үстэй Ази залуу том хөгжмийн бөмбөрийн урд сууж байна.
2679382862.jpg|0|a microphone is the vocal point , but there is a man with glasses holding a guitar , and in the background someone in a yellow shirt on the drum set .|Микрофон бол дууны цэг боловч гитар барьсан нүдний шилтэй хүн, цаана нь шар цамцтай хүн бөмбөрийн тавцан дээр байна.
2679494234.jpg|0|A young girl in a bikini top is touching a young boy in swimming trunks while getting splashed by water .|Бикинитэй залуу охин усанд үсэрч байх үедээ усан сантай хүүд хүрч байна.
2679565682.jpg|0|A man with a long white beard is examining a camera and another man with a black shirt is in the background .|Урт цагаан сахалтай хүн камер үзэж байгаа бол цаана нь хар цамцтай өөр хүн байна.
2679851489.jpg|0|Two dogs , one coming toward the camera while one walks in the background .|Хоёр нохой, нэг нь камер руу ирж, нөгөө нь цаана нь явж байна.
2679926555.jpg|0|Little girl is spinning around on the grass in a flowing purple skirt .|Бяцхан охин нил ягаан юбкатай зүлгэн дээр эргэлдэж байна.
2680418020.jpg|0|Several women in headscarves are standing in a cobbled courtyard .|Хатан чулуун хашаанд толгойн алчууртай хэдэн эмэгтэй зогсож байна.
268044066.jpg|0|A young man and young woman wearing backpacks are placing or removing an item from an old white tree snag , with other people standing or sitting in the background .|Үүргэвчээ үүрсэн залуу эрэгтэй, эмэгтэй хоёр хөгшин цагаан модны хорхойд ямар нэгэн зүйл тавьж эсвэл авч байгаа бөгөөд ард нь бусад хүмүүс зогсож эсвэл сууж байна.
26805148.jpg|0|Two children , one boy and one girl , sitting in a garden behind a bean fence .|Нэг хүү, нэг охин хоёр хүүхэд буурцагны хашааны ард цэцэрлэгт сууж байна.
2680619645.jpg|0|The black and brown dog is standing with its legs apart on the beach .|Хар бор нохой далайн эрэг дээр хоёр хөлөө салгаад зогсож байна.
2680852294.jpg|0|A man who appears to be homeless , sitting on the ground with a blue jacket on and a bald spot in the middle of his head .|Цэнхэр хүрэм өмсөж, толгойн дундуур халзан сууж буй орон гэргүй бололтой эрэгтэй .
2680990587.jpg|0|A child pushes another that is sitting in a swing near playground equipment .|Хүүхэд тоглоомын талбайн тоног төхөөрөмжийн ойролцоох савлуур дээр сууж буй өөр нэгийг түлхэж байна.
2681215810.jpg|0|a young topless man wearing sunglasses and shorts is holding a football .|Нарны шил, шорт өмссөн цээж нүцгэн залуу хөл бөмбөг барьж байна.
2682194299.jpg|0|A black and white dog is running down some white steps .|Хар цагаан нохой хэдэн цагаан шатаар гүйж байна.
268223986.jpg|0|A family sits by a handbag shop at a crowded plaza as the two girls consult a magazine .|Хоёр охин сэтгүүл үзэж байхад нэгэн гэр бүл хөл хөдөлгөөн ихтэй талбайд гар цүнхний дэлгүүрийн дэргэд сууж байна.
268224691.jpg|0|A group of three men , all of whom are wearing blue jeans , are walking on a sidewalk .|Цэнхэр жинсэн өмд өмссөн гурван эрэгтэй хэсэг явган хүний замаар алхаж байна.
2682382530.jpg|0|A young man practices a martial art kicking skill in front of his home in the early morning .|Өглөө эрт гэрийнхээ үүдэнд нэгэн залуу тулааны урлагаар өшиглөж байна.
2682536830.jpg|0|Five men , all white and somewhat old , are playing various musical instruments .|Цагаан арьстай, хөгшин таван эрэгтэй янз бүрийн хөгжмийн зэмсэг тоглож байна.
2682546912.jpg|0|Three men , two in black business suits and one in a black dress shirt are reviewing notes for a presentation .|Гурван эрэгтэй, хоёр хар ажил хэрэгч костюмтай, нэг хар даашинзтай цамцтай танилцуулга хийх тэмдэглэлээ хянаж байна.
2682739228.jpg|0|A lady wearing a black and white patterned dress and velcro shoes with a cane in her hand sitting on a bench .|Хар цагаан хээтэй даашинз, гартаа таягаа барьчихсан, нэхий гутал өмссөн эмэгтэй вандан сандал дээр сууж байна.
268293751.jpg|0|An elderly Asian man in a blue coat with a cane sits outside a brick and cement older building .|Цэнхэр пальтотой, таягтай ази хөгшин эр тоосго, цементэн хуучин барилгын гадаа сууж байна.
2682938578.jpg|0|Red , green , yellow , and blue umbrellas are providing shade for the tables outside and three people are sitting under the green umbrella .|Улаан, ногоон, шар, цэнхэр өнгийн шүхэр гадаа ширээг сүүдэрлэж, ногоон шүхэр дор гурван хүн сууж байна.
26833964.jpg|0|A black dog is standing on a street while a group of cars and a truck are parked in the background .|Гудамжинд хэсэг машин, ачааны машин зогсож байхад хар нохой зогсож байна.
268365231.jpg|0|A man and a woman dressed in black walk towards a gate near a wooded area .|Хар хувцастай эрэгтэй эмэгтэй хоёр ой модтой газрын ойролцоох хаалганы зүг алхаж байна.
2683823978.jpg|0|Two people one in a brown shirt wearing a backpack and the other wearing a pick sweater and bike helmet are kneeling at a bicycle tire .|Хүрэн цамцтай нэг нь үүргэвчтэй, нөгөө нь цамц, малгай өмссөн хоёр хүн дугуйн дугуйн дэргэд өвдөг сөгдөн сууж байна.
2683963310.jpg|0|A toddler in a diaper is playing in a sandbox near a shovel and other sand toys .|Живх өмссөн хүүхэд хүрз болон бусад элсэн тоглоомны дэргэд хамгаалагдсан хязгаарлагдмал орчинд тоглож байна.
2683985894.jpg|0|A girl in orange shirt and clown makeup stands in a park while others look on .|Улбар шар өнгийн цамцтай, алиалагч нүүр будалттай охин цэцэрлэгт хүрээлэнд зогсож байхад бусад нь харж байна.
2684322797.jpg|0|A person wearing a white tank top sits at a table with a beer .|Цагаан цамц өмссөн хүн шар айраг бариад ширээний ард сууж байна.
2684323357.jpg|0|A female in blue jean shorts and a black top sitting in a wicker chair .|Цэнхэр жинсэн өмд, хар топ өмссөн эмэгтэй зэгсэн сандал дээр сууж байна.
2684489465.jpg|0|the white dog is leaping over a red and green fence on an obstacle course .|цагаан нохой улаан ногоон хашаа давж, саадтай зам дээр харайж байна.
2684878115.jpg|0|A man wearing a long blue robe and black pants crouches beside two travel bags to play a black and gold studded stringed instrument on a cobblestone sidewalk .|Урт цэнхэр нөмрөг, хар өмд өмссөн эрэгтэй замын хоёр цүнхний хажууд бөхийж, чулуун зам дээр хар, алтлаг шигтгээтэй чавхдаст хөгжим тоглож байна.
2685139184.jpg|0|A gray-haired , shoeless woman is sitting on a blanket under a lavendar umbrella on the side of a street .|Гудамжны хажуу талд лаванда цэцгийн шүхэр дор хөнжил дээр сууж буй саарал үстэй, гуталгүй эмэгтэй.
2685343089.jpg|0|A little boy is playing in water in the street and wearing a wet t-shirt , as a man in a red shirt and a woman in a blue shirt are walking on the sidewalk behind him .|Бяцхан хүү гудамжинд усанд тоглож, нойтон подволк өмсөж байхад түүний ард явган хүний зам дээр улаан цамцтай эрэгтэй, цэнхэр цамцтай эмэгтэй хоёр алхаж байна.
2685518281.jpg|0|Three guys wearing green collared T-shirts and green pants are walking by vehicles and past a pizza place .|Ногоон захтай подволк, ногоон өмд өмссөн гурван залуу тээврийн хэрэгслээр алхаж, пиццаны газрын хажуугаар өнгөрч байна.
