image_name|comment_number|comment|corrected_comment
263428541.jpg|0|A man wearing black pants , leggings , a white shirt , and a bright red vest rides a leaping , rearing mule in front of two outriders and a crowd of spectators .|Хар өмд, өмд, цагаан цамц, тод улаан хантааз өмссөн эрэгтэй хоёр даваачин, олон үзэгчдийн өмнө харайж, өсгөсөн луус унаж байна.
2634290212.jpg|0|A woman , dressed in a parade outfit , pointing her index finger to her opened mouth .|Анхсан ам руугаа долоовор хуруугаа харуулж, жагсаалын хувцас өмссөн эмэгтэй.
2634334121.jpg|0|A blond child wearing a hat , sitting alone on a train , and looking sad .|Малгай өмссөн шаргал үст хүүхэд галт тэргэнд ганцаараа сууж, гунигтай царайтай.
2634573005.jpg|0|A boy in his backyard grilling for his family .|Арын хашаандаа мах шарж байгаа хүү .
2634788737.jpg|0|A man in a white t-shirt and green baseball hat jumps in the air .|Цагаан цамц, ногоон бейсболын малгай өмссөн хүн агаарт үсэрч байна.
263480341.jpg|0|The little blond girl with the pink shirt is getting her bunny mask tied to her head by a grown woman with a black shirt and blue jeans , while two little girls , one wearing a brown shirt and one wearing a blue sweater , are watching .|Ягаан цамцтай шаргал үст охины том эмэгтэй хар цамц, цэнхэр жинсэн өмд өмссөн туулайн маскыг толгой дээрээ боож байгаа бол нэг нь бор цамц, нөгөө нь цэнхэр цамц өмссөн хоёр бяцхан охин цамц, харж байна.
2634907858.jpg|0|Boy with brownish red-hair playing in the middle of the street while his mother watches intently on the driver of the vehicle headed towards him .|Хүрэн улаан үстэй хүү гудамжны голд тоглож байхад ээж нь түүний зүг чиглэн ирж буй машины жолоочийг анхааралтай ажиглаж байна.
263491786.jpg|0|Two people standing on the curve looking at people run up the street .|Хүмүүсийг хараад муруй дээр зогсож буй хоёр хүн гудамжаар гүйж байна.
263494261.jpg|0|People run a marathon on a city street with a crowd watching .|Хүмүүс хотын гудамжаар марафон гүйж, олон хүн харж байна.
2635023078.jpg|0|Two guys stand outside of a building that has been spray painted with words .|Үгээр шүршиж будсан барилгын гадаа хоёр залуу зогсож байна.
2635164923.jpg|0|The little boy in the green jacket is riding a skateboard on a ramp .|Ногоон хүрэмтэй бяцхан хүү налуу зам дээр скейтборд унаж байна.
263522013.jpg|0|A brown dog , on a rocky ground , shakes off water from its body .|Хүрэн нохой , чулуурхаг газар биеэсээ усаа сэгсэрнэ .
2635248278.jpg|0|A man dressed in blue holding an orange bucket stands in the sea , with a swan-like bird in the distance .|Цэнхэр хувцастай, улбар шар хувин барьсан хүн далайд зогсож байгаа бөгөөд алсад хун шиг шувуу харагдана.
2635400219.jpg|0|A woman in a headscarf and a boy wearing blue look to the right while sitting against a wall .|Гол ороолттой эмэгтэй, хөх өмссөн хүү баруун тийшээ харан хана налан сууж байна.
2635483351.jpg|0|Two dogs look up at a person out of view of the camera .|Хоёр нохой камерын харалгүй хүн рүү дээш харж байна.
2635509973.jpg|0|A young boy wearing a red shirt with yellow writing on it and a red sports cap is squatted in shallow water and touching a yellow pail filled with sand .|Улаан цамц өмссөн, улаан спорт малгай өмссөн бяцхан хүү гүехэн усанд элгээрээ хэвтээд, элсээр дүүрсэн шар хувин дээр хүрч байна.
2635905544.jpg|0|Two small dogs playing in a grassy area with a large white and red striped ball .|Том цагаан, улаан судалтай бөмбөг бүхий өвслөг газар тоглож буй хоёр жижиг нохой .
2635908229.jpg|0|A small boy in sandals sits on a wooden post in a field .|Сандаал өмссөн бяцхан хүү талбайн модон шон дээр сууж байна.
2635938723.jpg|0|The wide eyed little boy is eating a red Popsicle .|Нүд нь томорсон бяцхан хүү улаан попсикл идэж байна.
2636020148.jpg|0|A band of older adults plays on a street with a crossing sign just behind them .|Ард нь гарцтай гудамжинд ахмад настнууд тоглож байна.
2636249609.jpg|0|A man stands with what appears to be a table of handbags in front of a deli in a city .|Нэг хүн хотын нэгэн хоолны газрын өмнө гар цүнхтэй ширээтэй зогсож байна.
2636454827.jpg|0|Three people in hiking gear smile at the camera with mountains and rocks in the background .|Явган аялалын хувцас өмссөн гурван хүн ард уул, хадтай камер руу инээмсэглэж байна.
2636514498.jpg|0|A small child is wearing a blue outfit with blue shoes .|Бяцхан хүүхэд цэнхэр гуталтай хөх өнгийн хувцас өмссөн байна.
2636570551.jpg|0|These five site seers are on the ocean looking out the man is taking pictures the others are looking at the beautiful blue sea .|Эдгээр таван сайт үзмэрч далай дээр байгаа бөгөөд тэр хүн зураг авч байгаа нь бусад нь үзэсгэлэнтэй цэнхэр далайг харж байна.
2636663855.jpg|0|A young boy in a orange and with blue stripes is sitting on the ground surrounded by other children , and smiling at the camera .|Улбар шар хувцастай, цэнхэр судалтай залуу хүү бусад хүүхдүүдээр хүрээлэгдсэн газар сууж, камер руу инээмсэглэж байна.
2636668640.jpg|0|A little asian girl in a yellow shirt and blue shirt standing in front of a little boy with a sleeveless shirt and shorts on .|Шар цамц, цэнхэр цамц өмссөн бяцхан ази охин ханцуйгүй цамц, шорт өмссөн бяцхан хүүгийн өмнө зогсож байна.
2636876892.jpg|0|two dogs in the middle of a heavily wooded forest|маш их модтой ойн дундах хоёр нохой
2636930201.jpg|0|A dressed bride brushes her teeth at the last moment after her friend reminds her about the first kiss as husband and wife !|Хувцасласан сүйт бүсгүй найз нь эхнэр, нөхрийн анхны үнсэлтийнхээ тухай түүнд сануулсны дараа эцсийн мөчид шүдээ угааж байна!
2637335836.jpg|0|A photographer 's camera is peeking out from rocks along a rocky coastline .|Зурагчны камер хад чулуурхаг эрэг дагуух хаднаас гарч байна.
2637510448.jpg|0|A little girl in a pink and white ski suit and red helmet skies sideways on the snow covered slope .|Ягаан цагаан цанын хувцас, улаан дуулга өмссөн бяцхан охин цасан дээр хучигдсан энгэр дээр хажуу тийшээ эргэлдэж байна.
263764537.jpg|0|A bicyclist looks behind him to check on a girl riding a bike behind him .|Унадаг дугуйчин түүний ард дугуй унаж буй охиныг шалгахаар араас нь харав.
263765706.jpg|0|People are walking and cycling down this narrow road surrounded by grass .|Хүмүүс өвсөөр хүрээлэгдсэн энэ нарийхан замаар алхаж, дугуй унаж байна.
2637670767.jpg|0|A young child sits on some pillows with a green tray of chopped-up food in front of him .|Бага насны хүүхэд урдаа жижиглэсэн хоолтой ногоон тавиуртай дэрэн дээр сууж байна.
2637904605.jpg|0|A white and black dog leaps through long grass in a field .|Хээрийн урт өвсөн дундуур цагаан хар нохой үсэрч байна.
2637909455.jpg|0|A woman in a brightly patterned shirt uses tongs to tend to meat cooking on a grill .|Гэрэлт хээтэй цамц өмссөн эмэгтэй хавчаараар мах шарахдаа .
2637936161.jpg|0|A man in a blue and white striped shirt smiles for the camera over a table filled with picnic wares while a young blond-haired , blue eyed boy stares off into space .|Цэнхэр цагаан судалтай цамцтай эр пикникийн эд зүйлсээр дүүрсэн ширээний ард камерын өмнө инээмсэглэж байхад шаргал үстэй, цэнхэр нүдтэй залуу сансар огторгуйг ширтэж байна.
2637959357.jpg|0|A black and tan Doberman dog is jumping through some water .|Хар бор өнгөтэй Доберман нохой ус дундуур үсэрч байна.
2638054798.jpg|0|One child sits while another one kneels as they talk to each other .|Нэг хүүхэд сууж байхад нөгөө нь өвдөг сөгдөн хоорондоо ярилцана.
2638177115.jpg|0|Men in khaki green pants having a conversation on a busy street .|Хаки ногоон өмд өмссөн эрчүүд хөл хөдөлгөөн ихтэй гудамжинд ярилцаж байна.
2638207727.jpg|0|A man dressed in a black t-shirt with a white alien on the front , handing out newspaper propaganda .|Урд талдаа цагаан харь гарагийн хүнтэй хар цамц өмссөн хүн сонины сурталчилгаа тарааж байна.
2638369467.jpg|0|A little girl in white is looking back at the camera while carrying a water grenade .|Цагаан хувцастай бяцхан охин усан гранат бариад камер руу эргэж харж байна.
263850317.jpg|0|Girl wearing a mini dress and long sleve white jacket with a pink bag walking through a crowded area .|Мини даашинз, ягаан цүнхтэй урт ханцуйтай цагаан хүрэм өмссөн охин хөл хөдөлгөөн ихтэй газраар алхаж байна.
2638512789.jpg|0|A girl watching a guy try and fly off a cliff with a fisherman in the background that looks like he just hooked his own shorts .|Загасчинтай хамт хаднаас нисэх оролдлого хийж буй залууг харж буй охин, тэр зүгээр л шорт уясан бололтой.
263854883.jpg|0|Two small dogs that look almost identical are playing in the grass .|Бараг адилхан харагдах хоёр жижиг нохой өвсөн дунд тоглож байна.
2638884564.jpg|0|A lady walking in front of a building with blue jeans and a white shirt .|Цэнхэр жинсэн өмд, цагаан цамцтай барилгын урд алхаж буй эмэгтэй .
2638887069.jpg|0|Woman wearing a black sunhat , black dress and black Ugg clogs , walking in a city square .|Нарны хар малгай, хар даашинз, хар Ugg хувцас өмссөн эмэгтэй хотын талбайгаар алхаж байна.
2638981862.jpg|0|Two young boys dressed in formal clothes fight while sitting on a red carpeted step .|Улаан хивсэн шалан дээр сууж байхдаа албан хувцас өмссөн хоёр залуу зодолдож байна.
263912241.jpg|0|An asian girl and an asian guy is looking each other with sour faces in an underground station .|Газрын буудал дээр ази охин, ази залуу хоёр бие биенээ ширүүн царайлан харж байна.
2639718164.jpg|0|Two woman in flowered shirts hold hands as they attempt to cross a busy street .|Цэцэгтэй цамц өмссөн хоёр эмэгтэй хөл хөдөлгөөн ихтэй гудамжаар хөндлөн гарах гэж байгаад хөтлөлцөж байна.
2639766602.jpg|0|Two men in orange jumpsuits are walking down a cobbled road .|Улбар шар өнгийн комбинезон өмссөн хоёр эрэгтэй чулуун замаар алхаж байна.
263984805.jpg|0|A middle-aged man in a gray t-shirt and brown pants sitting on his bed reading a flyer-like paper .|Саарал цамц, бор өмд өмссөн дунд эргэм насны эрэгтэй орон дээрээ суугаад хуудас шиг цаас уншиж байна.
2640000969.jpg|0|A big brown dog jumps into a swimming pool on the backyard .|Том бор нохой арын хашаан дахь усан сан руу үсэрч байна.
264009676.jpg|0|Two men in the grocery store looking at orange juice and speaking to each other .|Хүнсний дэлгүүрийн хоёр эрэгтэй жүржийн шүүс харж, хоорондоо ярьж байна.
2640101451.jpg|0|A child and a woman lay out some papers with children 's drawings on them , on top of some sort of large white block .|Хүүхэд, эмэгтэй хоёр хүүхдийн зурсан цаасыг ямар нэгэн том цагаан блок дээр тавьжээ.
2640153227.jpg|0|A young girl with blond-hair and blue eyes is eating a cookie with one hand while holding another cookie in the other .|Шаргал үстэй, цэнхэр нүдтэй залуу охин нэг гараараа жигнэмэг идэж, нөгөө гартаа өөр жигнэмэг барьж байна.
2640260087.jpg|0|A group of friends , 3 boys and 2 girls , jump in the air holding hands for a photo .|Хэсэг найзууд 3 хүү, 2 охин гэрэл зураг авахаар хөтлөлцөн агаарт үсэрч байна.
2640869832.jpg|0|Three young men in this picture are seen trying on a new pair of shoes that they just bought from the local park 's swap meet .|Энэ зураг дээрх гурван залуу орон нутгийн цэцэрлэгт хүрээлэнгийн своп уулзалтаас саяхан худалдаж авсан шинэ гутлаа өмсөж байгаа харагдаж байна.
2640922346.jpg|0|A group od asians backdropped by a market painting of a lady in a green dress carrying a basket .|Сагс үүрсэн ногоон даашинз өмссөн хатагтайн зах зээлийн зургаар нэг хэсэг Азийнхан.
2641049916.jpg|0|This stone sculptor gently shaded seems to decorate a garden but here a young boy dressed in a US flag decorated t-shirt enjoys climbing on it .|Зөөлөн сүүдэрлэсэн чулуун барималч цэцэрлэгийг чимэглэж байгаа мэт боловч энд АНУ-ын далбаатай цамц өмссөн залуу хүү түүн дээр авирах дуртай байна.
2641098920.jpg|0|A woman in a white shirt , wearing jewelery , is sitting on a couch next to another female wearing a dark colored shirt .|Цагаан цамц өмссөн, үнэт эдлэл өмссөн эмэгтэй хар өнгийн цамц өмссөн өөр эмэгтэйн хажууд буйдан дээр сууж байна.
2641288004.jpg|0|A border collie jumps over a bed with a tennis ball in its mouth .|Хээрийн колли амандаа теннисний бөмбөгтэй ор дээгүүр үсэрч байна.
264141937.jpg|0|"A woman wearing dollar sign glasses , holding a dollar bill , stands with a suitcase that says """" Lucky """" that is overflowing with cash ."|"Долларын тэмдэгт нүдний шил зүүсэн эмэгтэй бэлэн мөнгөөр дүүрсэн """" Азтай "" гэж бичсэн чемодантай зогсож байна ."
2641770481.jpg|0|A man wearing a red jacket standing beside a yellow canoe on some rocks with water in the background|Улаан хүрэм өмссөн эрэгтэй, цаана нь устай зарим хадан дээр шар завины дэргэд зогсож байна
264177577.jpg|0|A girl with a green belt in karate is in a white karate uniform kicking , and she is surrounded by other people in white uniforms .|Каратэгийн ногоон бүстэй охин цагаан каратэгийн дүрэмт хувцастай өшиглөж байгаа бөгөөд түүнийг цагаан дүрэмт хувцастай бусад хүмүүс хүрээлж байна.
2641794279.jpg|0|A person in white clothes and a yellow safety vest is riding a bike along a road .|Цагаан хувцастай, шар хантаазтай хүн зам дагуу дугуй унаж байна.
2642247165.jpg|0|A physically fit man dives into the water , with mountains in the background .|Бие бялдрын хувьд чийрэг эр усанд шумбаж байна , цаана нь уул .
2642336024.jpg|0|A construction worker pointing to an object or area not seen in photo .|Барилгын ажилтан зураг дээр харагдахгүй объект эсвэл газар руу зааж байна.
2642350864.jpg|0|A young girl with a front tooth missing dressed in a plaid skirt and blue shirt riding on a shopping cart in a grocery store .|Хүнсний дэлгүүрт тэргэнцэр дээр дэрвэгэр юбка, цэнхэр цамц өмссөн урд шүд нь алга болсон залуу охин .
2642474867.jpg|0|A long-haired woman is wearing a grass cowboy hat and a striped shirt .|Урт үстэй эмэгтэй өвсөн ковбой малгай, судалтай цамц өмссөн байна.
2642475077.jpg|0|A young blond woman wearing a hat and sunglasses talks on her cellphone .|Малгай, нарны шил зүүсэн шаргал үст залуу гар утсаараа ярьж байна.
2642624688.jpg|0|A male is walking in an area that has 2 painted white lines .|2 будсан цагаан зураастай газар эрэгтэй хүн алхаж байна.
2642626914.jpg|0|A man tows a trailer with a small tractor-like vehicle .|Трактор шиг жижиг оврын машинтай чиргүүл чирэх эрэгтэй .
2642688531.jpg|0|The little boy in the yellow tunnel is wearing a yellow shirt .|Шар хонгилд байгаа бяцхан хүү шар цамц өмссөн байна .
2642772565.jpg|0|A woman with a ponytail , wearing a brown shirt and blue jean shorts is putting something in the backseat of a car .|Гэгзэгтэй, бор цамц, цэнхэр жинсэн өмд өмссөн эмэгтэй машины арын суудалд ямар нэгэн зүйл хийж байна.
2642993866.jpg|0|A blond head little boy with a red shirt , and blue shorts is sitting on a stool starting to paint on a stencil board with his paintbrush .|Улаан цамц, цэнхэр шорт өмссөн шаргал толгойтой бяцхан хүү сандал дээр суугаад будгийн самбар дээр будгийн сойзоор будаж эхлэв.
2643263887.jpg|0|A young boy smiling as he rides down an inflatable water slide .|Хийдэг гулсуур дээр унаж буй залуу хүү инээмсэглэж байна.
2643309379.jpg|0|A girl in a brown dress is moving through the green grass by a metal fence .|Хүрэн даашинзтай охин төмөр хашааны дэргэдэх ногоон зүлгэн дундуур явж байна.
264342682.jpg|0|Two women , one with a blue shirt , the other with a red and white striped shirt are shopping at target .|Нэг нь цэнхэр цамцтай, нөгөө нь улаан цагаан судалтай цамцтай хоёр эмэгтэй байндаа дэлгүүр хэсч байна.
264346756.jpg|0|Young white male child with blond-hair in a red shirt coloring with crayons outside with an adult .|Насанд хүрсэн хүнтэй гадаа өнгийн харандаагаар будсан улаан цамцтай шаргал үстэй залуу цагаан эрэгтэй хүүхэд.
2643601560.jpg|0|A girl wearing a red tank top and denim shorts with no shoes is walking in a parking lot towards a group of stores .|Улаан цамц, жинсэн шорт өмссөн гуталгүй охин зогсоол дээр хэсэг дэлгүүрийн зүг алхаж байна.
26439066.jpg|0|An elderly woman sits near a small Christmas tree holding an unwrapped present , and wearing a lampshade on her head .|Хөгшин настай эмэгтэй жижиг гацуур модны дэргэд суугаад боодолгүй бэлэг барьж, толгой дээрээ чийдэнгээ зүүж байна.
2644206088.jpg|0|Two women are outside with a basket picking produce .|Гадаа хоёр эмэгтэй сагс бариад бүтээгдэхүүн түүж байна.
2644277889.jpg|0|Two women kickboxing , the woman wearing red is blocking a kick from the other smirking woman wearing blue .|Кикбоксоор хичээллэж буй хоёр эмэгтэй, улаан өмссөн эмэгтэй хөх хувцас өмссөн инээж буй нөгөө эмэгтэйн цохилтыг хааж байна.
2644302353.jpg|0|Tourists stroll the streets between historic buildings .|Жуулчид түүхэн барилгуудын хоорондох гудамжаар зугаалж байна.
2644326817.jpg|0|A black and white dog with a red Frisbee standing on a sandy beach .|Элсэрхэг эрэг дээр зогсож буй улаан фрисбитэй хар цагаан нохой .
2644348489.jpg|0|"Two men and two women are in a living area playing the video game "" Rock Band . """|"Хоёр эрэгтэй, хоёр эмэгтэй зочны өрөөнд "" Рок хамтлаг видео тоглоом тоглож байна. """""""
2644430445.jpg|0|The girl in sunglasses holds up her phone to take a picture of something .|Нарны шил зүүсэн охин ямар нэг зүйлийн зургийг авах гэж утсаа өргөж байна.
2644470867.jpg|0|A lady is wearing jeans and a cardboard costume designed to look like the cartoon character Wall-E|Хүүхэлдэйн киноны баатар Wall-E шиг харагдахаар бүтээсэн жинсэн өмд, картон хувцас өмссөн эмэгтэй
264460711.jpg|0|A group of men and women are having a discussion in a restaurant .|Хэсэг эрэгтэй, эмэгтэй хүмүүс ресторанд ярилцлага хийж байна.
264461048.jpg|0|A blond girl sits at a bar next to a few other men who are not paying attention to her and she is sad .|Шаргал үст бүсгүй өөрт нь анхаарал хандуулахгүй байгаа хэдэн эрчүүдийн хажууд бааранд суугаад гунигтай байна.
2644719500.jpg|0|The newlyweds cutting their wedding cake at the reception with leis around their necks .|Шинэ гэрлэсэн хосууд хуримын бялуугаа хүзүүндээ зүүж, хүлээн авалт дээр хайчилж байна.
264483970.jpg|0|Four male cheerleaders are preparing the catch the female cheerleaders they just threw in the air .|Дөрвөн эрэгтэй хөгжөөн дэмжигчид дөнгөж сая агаарт шидсэн эмэгтэй хөгжөөн дэмжигчдийнхээ барьцыг бэлдэж байна.
2644906016.jpg|0|A group of people are dressed in multicolored clothes while performing an act .|Хэсэг хүмүүс олон өнгийн хувцас өмсөж жүжиг хийж байна.
2644916196.jpg|0|Small laughing child with blond-hair sitting at a table holding a green sippy cup .|Шаргал үстэй бяцхан инээж буй хүүхэд ногоон аяга барьсаар ширээний ард сууж байна.
2644920808.jpg|0|A person standing on top of some rocks with the sky behind .|Хүн хадны орой дээр зогсож, ард нь тэнгэр .
2645175777.jpg|0|A street vendor has a seat in the middle of his produce setup ; he is talking on a cellphone .|Гудамжны худалдаачин бүтээгдэхүүнийхээ дунд суудалтай; тэр гар утсаар ярьж байна.
2645241028.jpg|0|An Asian man is using a soldering tool on a green circuit board while seated at a gray table .|Ази эр саарал ширээнд сууж байхдаа ногоон хэлхээний самбар дээр гагнуурын хэрэгсэл ашиглаж байна.
