image_name|comment_number|comment|corrected_comment
3572872724.jpg|0|A member of the army is walking with a German Shepard while the dog has something in has mouth .|Нохой амандаа юмтай байхад армийн хүн герман овчарктай алхаж байна.
3572942419.jpg|0|A woman filling out some paperwork while another woman waits .|Бас нэг эмэгтэй хүлээж байхад нэг эмэгтэй бичиг баримт бөглөж байна.
3573202338.jpg|0|a young girl doing gymnastics on the shore of a beach while another is walking deeper into the beach .|Залуу охин далайн эргийн эрэг дээр гимнастик хийж байхад нөгөө охин далайн эргийн гүн рүү алхаж байна.
3573269476.jpg|0|Three young people standing outside of an open tailgate of a vehicle .|Тээврийн хэрэгслийн арын хаалганы гадаа зогсож буй гурван залуу .
3573436368.jpg|0|A woman in an orange dress walking across a stone bridge with a very blue sky behind her .|Улбар шар өнгийн даашинзтай эмэгтэй ард нь маш хөх тэнгэртэй чулуун гүүрээр алхаж байна.
357402532.jpg|0|A lady who has on a white shirt with green pants and black boots , who looks like she 's enjoying the leaves .|Ногоон өмд, хар гуталтай цагаан цамц өмссөн, навчис баясаж байгаа мэт эмэгтэй.
3574244361.jpg|0|A little girl with a white shirt and brown hair is swinging almost completely upside down in a park .|Цагаан цамцтай, бор үстэй бяцхан охин цэцэрлэгт хүрээлэнд бараг бүхэлдээ доошоо эргэлдэж байна.
3574378184.jpg|0|A man in a black shirt holds a smiling baby while another person in a blue shirt stands in the foreground .|Хар цамцтай эрэгтэй инээмсэглэж буй нялх хүүхдээ тэвэрч байхад цэнхэр цамцтай өөр хүн урд талд зогсож байна.
3574522127.jpg|0|One baseball player sliding into second base and another about to catch the ball in an effort to make the out .|Нэг бейсболын тоглогч хоёрдугаар суурин руу гулсаж, нөгөө нь бөмбөгийг барьж авах гэж байна.
3574627719.jpg|0|Three young men sing together while one plays the guitar .|Гурван залуу хамт дуулж, нэг нь гитар тоглож байна.
3574847368.jpg|0|A man is standing in what appears to be a parking lot and shaving his face , while his dog looks at the ground near his feet .|Нохой нь хөлнийхөө ойролцоо газар ширтэж байхад нэг хүн зогсоол бололтой газарт зогсоод нүүрээ хусаж байна.
3574930742.jpg|0|Most people are sitting at tables reading but one man looks like he 's sleeping .|Ихэнх хүмүүс ширээний ард суугаад ном уншиж байгаа ч нэг хүн унтаж байгаа бололтой.
3574955171.jpg|0|A man in a brown shirt with glasses talking with a woman in a white shirt .|Хүрэн цамцтай нүдний шилтэй эрэгтэй цагаан цамцтай эмэгтэйтэй ярьж байна .
3574962735.jpg|0|A girl with red-hair is standing outside and talking to a man in a white t-shirt and another man that is loosing his hair .|Улаан үстэй охин гадаа зогсоод цагаан цамц өмссөн эрэгтэй, үс нь унасан өөр залуутай ярилцаж байна.
3575330012.jpg|0|The baseball player in the white uniform caught the ball as it was reaching the outside edge of the playing field .|Цагаан дүрэмт хувцастай бейсболын тоглогч бөмбөгийг талбайн гадна талын ирмэгт хүрч байхад нь барьж авлаа.
3575330336.jpg|0|One Baseball player racing towards the base while another tries to catch up with him and score an out .|Нэг бейсболын тоглогч бааз руу уралдаж байхад нөгөө нь түүнийг гүйцэж, гоол оруулахыг оролдож байна.
3575947093.jpg|0|man in white shirt and striped shorts playing organ being observed by man wearing yellow shirt|цагаан цамц, судалтай шорт өмссөн эрэгтэй эрхтэн тоглож байгааг шар цамц өмссөн эрэгтэй ажиглаж байна
3575971480.jpg|0|A group of 15 men and women in light weight clothing congregate near a street corner at an intersection in a city with large buildings and trees .|Хөнгөн хувцастай 15 эрэгтэй, эмэгтэй хүмүүс том байшин, модтой хотын уулзвар дээрх гудамжны булангийн ойролцоо цугларчээ.
3576060775.jpg|0|A person dressed in jeans running with two dogs on the shore of a lake .|Жинс өмссөн хүн нуурын эрэг дээр хоёр нохойтой гүйж байна.
3576186562.jpg|0|A group of women going over the budget for there next charity .|Хэсэг эмэгтэйчүүд дараагийн буяны ажилд зориулж төсвөө давж байна.
3576250302.jpg|0|A person on a motorcycle is turning on a dirt track behind some bushes .|Мотоцикльтой хүн бутны цаанаас шороон зам дээр эргэлдэж байна.
3576259024.jpg|0|A man on a motorcycle is jumping over a dirt hill in front of spectators .|Мотоциклтой хүн үзэгчдийн өмнө шороон толгод дээгүүр үсэрч байна.
3576312396.jpg|0|A group of people in boats racing towards the shore .|Завинтай хэсэг хүмүүс эрэг рүү уралдаж байна.
3576387257.jpg|0|Woman wearing tennis shoes is stopped and looking at her cellphone .|Теннисний гутал өмссөн эмэгтэй зогсож, гар утас руугаа харж байна.
3576401807.jpg|0|A young black-haired girl smiles toward the camera while holding a large insect .|Залуу хар үстэй охин том шавж бариад камер руу инээмсэглэж байна.
3576445378.jpg|0|Young men drink coffee and read books just outside some buildings on a sunny day ; an older bearded man in a dark blue shirt glances at a younger man in a striped shirt , who has a red toy crab on the table next to him .|Нарлаг өдөр залуус зарим барилгын гадаа кофе ууж, ном уншдаг; хар хөх цамцтай настай сахалтай эр хажуугийн ширээн дээр улаан тоглоомон хавч байгаа судалтай цамцтай залуу руу харав.
3576536763.jpg|0|A girl dressed in a pink sweatshirt and pink and white striped skirt plays in the waves at the beach .|Ягаан цамц, ягаан, цагаан судалтай банзал өмссөн охин далайн эрэг дээр давалгаанд тоглож байна.
357658747.jpg|0|A truck with fruits that are being sold to the public , with one customer picking up a fruit and a young boy posing for the camera .|Олон нийтэд худалдаалагдаж буй жимс ачсан ачааны машин, нэг үйлчлүүлэгч жимс түүж, залуу хүү камерын өмнө зургаа авахуулж байна.
3576599481.jpg|0|Female with black hair , wearing pink striped winter gloves and gray coat , smiling broadly , a newspaper tucked under her arm .|Хар үстэй, ягаан судалтай өвлийн бээлий, саарал хүрэм өмссөн, нүүр дүүрэн инээмсэглэж, сониноо сугандаа хавчуулсан эмэгтэй.
357661999.jpg|0|A man in a blue plastic chair peels a vegetable into a bowl set on another blue plastic chair .|Цэнхэр хуванцар сандалтай хүн өөр цэнхэр хуванцар сандал дээр тавьсан аяганд хүнсний ногоо хальсалж байна.
3576741633.jpg|0|A boy is in midair doing a skateboard trick at a skate park while two women and a toddler walk behind him .|Хүү агаарт тэшүүрийн цэцэрлэгт хүрээлэнд скейтбордын трик хийж байхад түүний ард хоёр эмэгтэй, бяцхан хүүхэд алхаж байна.
3576840040.jpg|0|A person in a green and white suit does tricks midair on a black bike .|Ногоон, цагаан костюмтай хүн хар дугуйгаар агаарт мэх хийж байна.
3577235421.jpg|0|two wrestlers fighting in a rink with a referee in the backgroud|арын талбайд шүүгчтэй гулгуурын талбайд зодоглож буй хоёр бөх
357725852.jpg|0|The two people are on the end of the dock with a boat behind them , and they are surrounded by water .|Хоёр хүн усан онгоцны зогсоолын төгсгөлд, ардаа завьтай байх бөгөөд тэд усаар хүрээлэгдсэн байна.
3577309234.jpg|0|Gray-blue bird with white markings on neck and wings in flight .|Нислэгийн үеэр хүзүү, далавч дээрээ цагаан тэмдэгтэй саарал хөх шувуу.
3577744721.jpg|0|A younger man with a fedora has two empty bottles held up to his mouth .|Хүүхдийн биетэй залуу хоёр хоосон шилийг амандаа барьчихсан байна.
3577868513.jpg|0|A baby is playing outdoors on a sunny day sitting in a colorful kids chair playing with toys , biting the top of a blue toy , with a back drop of green grass and neighborhood fence .|Нарлаг өдөр гадаа тоглож буй хүүхэд өнгө өнгийн хүүхдийн сандал дээр суугаад тоглоомоор тоглож, хөх тоглоомын оройг хазаж, арын дусал ногоон зүлэг, хашааны хашаатай.
3577928139.jpg|0|infant boy with blond-hair in blue clog sandals , blue jumper , touching an orange traffic cone .|Цэнхэр өнгийн шаахайн өмссөн шаргал үстэй нялх хүүхэд, цэнхэр үсэрч, улбар шар өнгийн конусыг шүргэж байна.
357795992.jpg|0|A young girl drawing with a yellow crayon wearing her seat belt .|Суудлын бүсээ зүүсэн шар өнгийн харандаагаар зурж буй залуу охин .
3578068665.jpg|0|A yellow and white car driving on a track next to each other while spectators and cars can be seen in the background .|Зэргэлдээ зам дээр шар, цагаан өнгийн машин явж байх хооронд үзэгчид болон машинууд цаана нь харагдана.
3578070471.jpg|0|Two people , one standing and one hunched forward , stand on a large circular concrete fixture with trees in the background .|Нэг нь зогсож, нөгөө нь урагш бөхийсөн хоёр хүн цаад талд нь модтой том дугуй бетонон бэхэлгээ дээр зогсож байна.
3578138991.jpg|0|A lady in a black and white striped shirt and holding a bouquet of flowers , looks seriously at two gentlemen talking on the steps .|Хар цагаан судалтай цамцтай, цэцгийн баглаа барьсан хатагтай шатан дээр ярилцаж буй хоёр эрхэм рүү нухацтай харж байна.
3578140375.jpg|0|Child with dark hair and fair skin in striped shirt and jeans with stick in raised handstanding on floor of gazebo .|Судалтай цамц өмссөн хар үстэй, цайвар арьстай, саваатай жинсэн өмдтэй, гараараа дээш өргөгдсөн шалан дээр зогсож буй хүүхэд.
3578318751.jpg|0|A large audience of people seated at banquet tables is watching the happenings on a stage surrounded by blue curtains .|Цэнхэр хөшигөөр хүрээлэгдсэн тайзан дээр найрын ширээнд суусан олон үзэгчид болж буй үйл явдлыг үзэж байна.
3578366714.jpg|0|People converse the day while aboard a floating restaurant .|Хүмүүс хөвөгч ресторанд сууж байхдаа ярилцдаг.
3578372039.jpg|0|The person on a skateboard is carrying several bags of different sizes and shapes .|Скейтборд дээр байгаа хүн өөр өөр хэмжээтэй, хэлбэртэй хэд хэдэн цүнх үүрч байна.
3578477508.jpg|0|A boy wearing skates sliding down concrete railing of steps near a pole .|Тэшүүр өмссөн хүү шонгийн ойролцоох шатны бетон хашлага руу гулгаж байна.
357870895.jpg|0|A girl , with eyes closed , lays her head on the shoulder of a man wearing denim shorts and a hat in his lap .|Нүдээ анин нэг охин жинсэн шорт өмсөж малгай өмссөн хүний мөрөн дээр толгойгоо хэвтүүлэн өвөр дээрээ тавьж байна.
3578736330.jpg|0|A man is sitting on a bench with his eyes closed near some water .|Нэг хүн усны дэргэд нүдээ аниад сандал дээр сууж байна.
3578757767.jpg|0|A young boy running on a sandy beach wearing red , white , and blue swimming shorts .|Улаан, цагаан, цэнхэр усан шорт өмссөн элсэн эрэг дээр гүйж буй залуу хүү.
3578779636.jpg|0|A smiling blond-headed little girl is lying on the floor tummy down looking up while a line of dominoes sit beside her .|Инээж буй шаргал толгойтой бяцхан охин шалан дээр гэдсээ илэн дээш харан хэвтэж байхад түүний хажууд эгнсэн даалуунууд сууж байна.
3578835309.jpg|0|A couple is kissing on a sidewalk by a brick building with the girl in the shadow and the guy outside the shadow .|Тоосгон барилгын дэргэдэх явган хүний зам дээр сүүдэрт охин, сүүдрийн гадаа залуу хоёртой үнсэлцэж байна.
3578841731.jpg|0|a red and white rally car throws up dust behind it as drives away down the trail .|Улаан цагаан ралли машин жим уруудан явахдаа ардаа тоос шороо асгаж байна.
3578914491.jpg|0|Two dogs , one tan and one black , play tug-of-war on the grass near the pond .|Цөөрмийн ойролцоох зүлгэн дээр нэг бор, нэг хар гэсэн хоёр нохой олс татав.
3578945620.jpg|0|A group stands outside , focusing their attention on the man in the middle .|Гадаа хэсэг бүлэг зогсож, голд байгаа хүн рүү анхаарлаа хандуулав.
3578981202.jpg|0|a double exposure of a laughing baby with curly blond-hair and a flowery curtain|буржгар шаргал үстэй, цэцэгт хөшигтэй инээж буй хүүхдийн давхар зураг
3579131288.jpg|0|Two Asian women with short black hair talking with each other .|Богино хар үстэй Ази хоёр эмэгтэй хоорондоо ярилцаж байна.
3579148390.jpg|0|This is a scene where a large group , wearing name tags , has gathered for dinner in a restaurant .|Энэ бол нэрийн шошго зүүсэн томоохон бүлэг хүмүүс ресторанд оройн хоол идэхээр цугласан дүр зураг юм.
3579148506.jpg|0|Male in green plaid shirt and name tag , holding a microphone with right thumb in his blue jean 's pocket .|Цэнхэр жинсэн өмднийхөө халаасанд баруун эрхий хуруугаараа микрофон барьчихсан ногоон өнгийн дөрвөлжин цамцтай, нэрийн шошготой эрэгтэй.
3579149820.jpg|0|A man in a green shirt with a cigarette in his mouth is playing lawn bowling while three people watch .|Амандаа тамхи барьчихсан ногоон цамцтай хүн гурван хүн харж байхад зүлгэн дээр боулинг тоглож байна.
3579150322.jpg|0|Balding man with a beard who has fallen asleep leaning on another man next to him , against the rails of a set of stairs .|Шатны хашлагад хажуудаа өөр хүн түшээд унтсан сахалтай халзан эр.
357924786.jpg|0|Two beautiful women , one is wearing white and other is wearing black tops have some good time at a restaurant .|Нэг нь цагаан, нөгөө нь хар цамц өмссөн хоёр сайхан бүсгүй ресторанд цагийг зугаатай өнгөрүүлж байна.
3579368231.jpg|0|A young boy with white goggles swims in the water .|Цагаан нүдний шилтэй залуу хүү усанд сэлж байна.
3579457159.jpg|0|Several women dressed in gypsy-like clothing dance about in a forest .|Цыган шиг хувцас өмссөн хэдэн эмэгтэй ойд бүжиглэж байна.
3579686259.jpg|0|A white , black , and brown dog walks down a path in a forested area .|Цагаан , хар , хүрэн нохой ой модтой газар замаар алхаж байна .
3579842996.jpg|0|A person in a yellow shirt and jeans is running on a track .|Шар цамц, жинсэн өмд өмссөн хүн зам дээр гүйж байна.
3580082200.jpg|0|A man is using a ball-thrower to throw an object to his dog .|Нэг хүн бөмбөг шидэгч ашиглан нохой руу юм шидэж байна.
358012011.jpg|0|A meeting is going on and there are potato chips and Coke on the table .|Уулзалт болж, ширээн дээр төмсний чипс, кокс байна.
3580277210.jpg|0|An older man and a young girl tossing a ball back and forth with their sports equipment .|Хөгшин залуу охин хоёр спортын хэрэгслээр урагш хойшоо бөмбөг шидэж байна.
3580375310.jpg|0|An action shot of a young boy about to kick a soccer ball .|Хөлбөмбөгийн бөмбөг өшиглөх гэж буй бяцхан хүүгийн зураг авалт.
3580604460.jpg|0|A child wearing protective goggles fires a small gun .|Хамгаалалтын нүдний шил зүүсэн хүүхэд жижиг буугаар буудаж байна.
3580741947.jpg|0|Smartly dressed Asian women are passing by a doorway in the street .|Ухаалаг хувцасласан ази эмэгтэйчүүд гудамжинд хаалганы хажуугаар өнгөрч байна.
3580941967.jpg|0|A person with long hair stares out of the window on the top level of a double decker bus .|Давхар автобусны дээд давхрын цонхоор урт үстэй хүн ширтэж байна.
3580949553.jpg|0|On a college campus a person in a gray shirt is laying atop a short brick wall .|Коллежийн хотхонд саарал цамцтай хүн богино тоосгон ханан дээр хэвтэж байна.
358114269.jpg|0|The bicycle rider is wearing a yellow jacket and a blue helmet while riding on a road during winter time .|Унадаг дугуйчин өвлийн улиралд зам дээр шар хүрэм, цэнхэр дуулга өмссөн байна.
358127240.jpg|0|A young boy about two years old lays on the hardwood floor at christmas time playing with a yellow truck as a dog sniffs his head .|Зул сарын баяраар шар өнгийн ачааны машинтай тоглож буй хоёр настай хүү модон шалан дээр хэвтэж, нохой толгойгоо үнэрлэж байна.
3581416218.jpg|0|A black girl in a pink dress sits outside ; she has a plant growing in a sandal .|Гадаа ягаан даашинзтай хар охин сууж байна; тэр шаахайн дотор ургадаг ургамалтай .
3581451227.jpg|0|There is a young girl in a yellow dress and a young boy in a white suit standing in a field of grass .|Зүлгэн дээр шар даашинзтай залуу охин, цагаан костюмтай залуу хүү зогсож байна.
3581538034.jpg|0|A dog being held by a harness on a waterboard over splashing water with a tube structure in the background .|Ар талд нь хоолойтой бүтэцтэй ус цацаж буй усан тавцан дээр морины уяанаас барьж буй нохой .
3581549187.jpg|0|A bearded man in a black coat and black cap stands near a young girl who is inside a large brown open container .|Хар пальтотой, хар малгайтай сахалтай эр том бор задгай сав дотор байгаа залуу охины дэргэд зогсож байна.
3581818450.jpg|0|A big light brown dog runs on the green grass .|Ногоон зүлгэн дээр том цайвар хүрэн нохой гүйж байна.
3582025630.jpg|0|The teenage boys in black shirts skateboarding in a skate park , surrounded by people .|Хар цамцтай өсвөр насны хөвгүүд хүмүүсээр хүрээлэгдсэн тэшүүрийн цэцэрлэгт хүрээлэнд тэшүүрээр гулгаж байна.
3582048078.jpg|0|A man and a boy are in the swimming pool .|Усан санд эрэгтэй, хүү хоёр байна.
3582066525.jpg|0|A man is jumping from a rock into the ocean while others are watching .|Бусад хүмүүс харж байхад нэг хүн чулуунаас далай руу үсэрч байна.
3582362126.jpg|0|A man wearing a black jacket , jeans and a warm hat with his daughter fooling around the trashcan .|Хар хүрэм, жинсэн өмд, дулаан малгай өмссөн эрэгтэй охинтойгоо хогийн саванд тэнэгтэж байна.
3582380628.jpg|0|A small child wearing a red jacket and blue pants is hanging onto the white cross bar of a blue metal swing set which is in the corner of the yard near the little white bench and the stacked firewood .|Улаан хүрэм, цэнхэр өмд өмссөн бяцхан хүүхэд хашааны буланд байрлах жижиг цагаан вандан сандал, овоолсон түлээний дэргэд байрлах цэнхэр төмөр савлуурын цагаан хөндлөвч дээр өлгөөтэй байна.
3582465732.jpg|0|A young lady is wearing bright pink sunglasses and sitting on a small trampoline .|Залуу бүсгүй тод ягаан нарны шил зүүж, жижиг трамплин дээр сууж байна.
3582539812.jpg|0|Five men in team uniforms , on horses playing polo with a white fence and trees in the background .|Багийн хувцастай, цагаан хашаатай, модод модтой поло тоглож буй морьтой таван эрэгтэй.
3582685410.jpg|0|Two women in bathing suits climb rock piles by the ocean .|Усны хувцастай хоёр эмэгтэй далайн эрэг дээрх чулуун овоолго руу авирч байна.
3582689770.jpg|0|One boys sits on a giant mortar gun as another boy walks toward him .|Нэг хөвгүүн аварга том миномётын буу дээр сууж байхад өөр нэг хүү түүний зүг алхаж байна.
3582742297.jpg|0|A black dog and two brown and white dogs are romping in the mud .|Хар нохой, бор цагаан хоёр нохой шаварт эргэлдэж байна.
3582814058.jpg|0|Six individuals of varying ages stand in front of a stone wall covered in graffiti .|Граффитигаар хучигдсан чулуун хананы өмнө янз бүрийн насны зургаан хүн зогсож байна.
3582914739.jpg|0|A woman with a gray helmet and black safety pads skates past the photographer .|Саарал малгай, хамгаалалтын хар дэвсгэртэй эмэгтэй гэрэл зурагчны хажуугаар гулгаж байна.
3582914905.jpg|0|Guy with something in his mouth in rushing water holding red and white striped rope|Улаан, цагаан судалтай олс барьж, амандаа ямар нэгэн зүйл тээглэсэн залуу
3582920844.jpg|0|A man wading in a lake dips his long hair into the water and quickly throws his head back making a brief rainbow of water overhear .|Нууранд тэнэж яваа нэгэн эр урт үсээ усанд дүрж, толгойгоо арагшаа шидээд, солонго шиг гялалзах нь сонсогдов.
3583065748.jpg|0|A black and white dog chases a bigger dog across the grass .|Хар цагаан нохой өвсөн дээгүүр том нохойг хөөж байна.
