image_name|comment_number|comment|Translated Comment
2226449279.jpg|0|Several people dressed for cold weather wait on a subway or monorail train-car .|Хүйтэн цаг агаар хүйтэн цаг агаартай хэдэн хүн Метро эсвэл Монораил галт тэрэгний машинаар хүлээх хэрэгтэй.
2226534154.jpg|0|The woman in the purple dress is looking towards the people at the door with her hand running through her hair .|Нил ягаан өнгийн даашинзтай эмэгтэй нь гараараа гараа үсээ гүйж буй хүмүүс рүү чиглүүлж байна.
2226587791.jpg|0|A small baby with his mouth open in a green diaper being held in the water .|Амныхаа амтай жижиг хүүхэд нахиалдаг Ногоон живхэнд нахиалдаг ногоон живх.
22267437.jpg|0|One man working at a fish market while a couple of men and one woman are browsing for fish .|Загасны зах зээл дээр ажиллаж байсан нэг хүн хоёр эрэгтэй, нэг эмэгтэй загасыг үзэх гэж байна.
2226811586.jpg|0|A young child wearing jeans and a multicolored shirt stands on a sidewalk in front of a building .|Жимс өмссөн залуу хүүхэд өмссөн залуу хүүхэд, олон өнгийн цамц нь барилгын урд талын явган хүний зам дээр зогсож байв.
2226898412.jpg|0|A person wearing a hat stands in a bright greenish-yellow field , holding reins which are attached to an ox 's bridle .|Малгай өмссөн хүн нь Гялалзсан ногоон өнгөтэй ногоон талбайд зогсож, үхэрт бэхэлсэн гүүрнүүд.
222714744.jpg|0|A man is sitting near a desk lamp and is observing items on a desk .|Эр хүн ширээний дэнлүү ойрхон сууж, ширээн дээр байгаа зүйлийг ажиглаж байна.
2227179257.jpg|0|A child poses in the snow holding a partially formed piece of snow .|Хэсэгчилсэн цасыг цас барих цасанд хүүхэд тавьдаг.
222759342.jpg|0|A small girl dressed in a yellow dress with flowers on it bends over near a large pile of watermelons .|Жижигхэн охин нь том овоолготой шар даашинзтай шар айрагны том овоолсон тарвасны ойролцоо байрлуулна.
2227599410.jpg|0|A group of parents and children strapped in safety helmets ride their bikes down a path .|Аюулгүй байдлын дуулга, хүүхдүүдийн бүлэгт, хүүхдүүд нь явган аялалд ордог.
2228022180.jpg|0|Many school children dressed in the same uniform are sitting on stairs .|Ижил дүрэмт хувцас өмссөн олон сургуулийн хүүхдүүд шатан дээр сууж байна.
2228156682.jpg|0|Woman tennis player wearing a light blue tennis outfit winds up to hit the tennis ball as the crowd watches .|Хөнгөн теннис тоглодог эмэгтэй цэнхэр теннисний хувцас өмсдөг.
2228167286.jpg|0|Toddler boy wearing airplane shirt , in stroller with large beads .|Хүүхэд хөвгүүн, олон тооны цамц өмссөн онгоцнууд, том бөмбөлгүүдийг ашиглан аялгууны цамц өмсдөг.
2228329399.jpg|0|A man with jeans and a brown shirt is bending over to examine the wheel of a black train that is on a railroad track .|Жинсэн жинсэн өмд, хүрэн цамц нь төмөр замын дугуй дээр байгаа хар галт тэрэгний дугуйг шалгаж нугалж байна.
2228361155.jpg|0|Three backlit figures on a bridge while a crowd walks below .|Гурван арын тоон зураг дээрх гүүрэн дээрх гурван тоонууд доор алхдаг.
2228381169.jpg|0|A man in all black holds on to a railing while a white dog wraps itself about his legs .|Блэкт байгаа эр хүн хөлнийхөө хөлийнхөө тухай боож байхад хашгиралтанд хашгирч байна.
2228619706.jpg|0|A child at the bowling alley throwing a small orange ball down the isle with another child in the background .|Боулингийн зам дээр байгаа хүүхэд нь жижиг улбар шар бөмбөг шидэж, ар араасаа өөр хүүхэдтэй хамт жижиг улбар шар бөмбөг шидэж байна.
222867549.jpg|0|A boy wearing sports pajamas sleeps on a large , padded armchair .|Спортын унтлагын өмд өмссөн хөвгүүд том, сэлүүрт сандал дээр унтдаг.
222878446.jpg|0|Two men wearing yellow caution cones as hats and one is about to get hit with a ball to the head .|Шар илбэ өмссөн хоёр эрэгтэй малгай өмсдөг, малгай өмсдөг, нэг нь бөмбөг рүү цохих гэж байна.
2229108152.jpg|0|A man wearing jeans and a button down shirt leads a brown horse wearing a saddle on a horse racing dirt track .|Жинсэн өмд өмссөн хүн, товчлуур нь морины уралдааны шороон зам дээр эмээл өмссөн бор морьтон нь морины уралдааны шороон зам дээр эмээл өмсдөг.
2229177914.jpg|0|A light brown dog jumping over a hurdle that has fire on each end .|Хөнгөн хүрэн нохой, төгсгөл бүрт гал гарч ирэв.
2229179070.jpg|0|A medium size dog is jumping through hoops which are being held by men .|Дунд зэргийн хэмжээтэй нохой нь эрчүүдийг барьж байгаа цагирагаар үсэрч байна.
2229180161.jpg|0|A side profile of a man with a mustache and goatee wearing a suit and tie .|Мөрөөдөлтэй, Гоусе, Гоуэ, костюм, зангиа зүүж, уяхтай хүний хажуугийн профайл.
2229237521.jpg|0|A bald man picking up a blue crap with tongs and putting it into a pot on the stove|Халзан хүн хөх хавчаар аваад, зууханд тавган дээр тавьж, зууханд тогоонд оруулдаг
2229509318.jpg|0|A woman is standing in front of a dog that 's standing on its hind legs .|Эмэгтэй хүн хойд хөл дээрээ зогсож байгаа нохойны урд зогсож байна.
2229571601.jpg|0|There is a man sitting on a bus holding his head in his hands .|Толгойгоо гараараа барьж байсан автобусанд сууж байгаа хүн байдаг.
2229737667.jpg|0|A man in an orange vest and a cap stands outside a ladies ' bathroom .|Улбар шар биелэгдэнэ, улбар шар өнгийн биелэгдэж, малгай нь эмэгтэйчүүдийн угаалгын өрөөнөөс гадуур зогсож байна.
2230067846.jpg|0|Two boys hold their feet in their hands while balancing on one foot .|Хоёр хөлийг нэг хөлөөр тэнцвэржүүлэхдээ хөл дээрээ хөлөө барьдаг.
2230134548.jpg|0|A chef is currently preparing food in a kitchen looking outside .|Тогооч одоогоор гадаа байгаа гал тогооны өрөөнд хоол бэлдэж байна.
2230140329.jpg|0|Three men standing with drinks in their hands having a conversation under an outdoor shelter , one man appears to be wearing a jewish cap .|Гадаа байрандаа хийсэн гурван хүн гараараа эсвэл гадаа байрандаа гардаг, нэг хүн гадаа гараараа зогсож байна, нэг хүн еврей малгай өмсөж байгаа бололтой.
2230206919.jpg|0|A boy wearing a skullcap is sitting in a chair next to a table with a pink tablecloth .|Тэнгэрт өмссөн хүү нь ягаан ширээний хажууд ширээний хажууд сандал дээр сууж байна.
2230260635.jpg|0|A person with a yellow umbrella squats alone on a beach , looking towards the water .|Шар шүхэртэй хүн ганцаараа далайн эрэг дээр ганцаараа байдаг.
2230347683.jpg|0|Young Girls wearing skirts run hand in hand in some grass .|Залуу охидууд банзал өмссөн залуу охидууд гараараа гараа сунгана.
2230363237.jpg|0|There is a lot of women wearing skirts at this meeting , some wearing professional wear , while others went casual .|Энэ уулзалт дээр банзал өмсөж, зарим нь мэргэжлийн хувцас өмссөн, зарим нь мэргэжлийн хувцас өмсдөг.
2230363312.jpg|0|An older man wearing a brown jacket and a hat stands outside and reaches into his pocket .|Браун хүрэм өмсөж, малгай өмсөж, гадаа зогсож, халаасандаа хүрч байна.
2230396241.jpg|0|Two girls sing into a microphone while reading of a piece of paper together .|Хоёр охин хамт цаас уншиж байхдаа микрофон руу дуулдаг.
2230411771.jpg|0|Many people talking and gathering outside for a special festival with food and games .|Олон хүмүүс хоол, тоглоомоор тусгай наадамд оролцож, гадаа цугларч, гадаа цуглардаг.
2230458748.jpg|0|A smiling woman in an apron stirs a pot on the stove while pasta hangs to dry in the foreground .|Хормогч дахь инээмсэглэсэн эмэгтэй нь зууханд тогоонд тогшоод гарч ирнэ.
2230482572.jpg|0|A young man and woman in the middle of the road on grass holding up a Huckabee sign , while other Huckabee signs are on the floor .|Замын голд байгаа залуу эрэгтэй, эмэгтэй хүн Хакабегийн тэмдгүүдийг барьж, бусад Huckabee тэмдгүүд шалан дээр байдаг.
2230503574.jpg|0|A gray-haired man with a white shirt and black jacket attempts to place a brown mask over his face .|Цагаан цамц, хар цамц бүхий саарал үстэй хүн.
2230620391.jpg|0|A baby in an orange suit is playing with some strings of beads .|Улбар шар өнгийн костюм өмссөн хүүхэд нь бөмбөлгүүдийг хатгасан тоглодог.
2230693384.jpg|0|A blond woman wearing a gray tank top takes a photo of herself and a young blond boy while they are seated on a bed .|Саарал савны дээд хувцас өмссөн шаргал үстэй эмэгтэй нь өөрийгөө болон залуу шаргал хүүг орон дээр сууж байхдаа зураг авдаг.
2230813326.jpg|0|A man carries a picket sign that resembles a restaurant menu , while a woman in a pink , printed sweatshirt gives an exaggerated pout .|Нэг хүн рестораны цэстэй төстэй пикет тэмдгийг агуулдаг бөгөөд ягаан, хэвлэмэл цамц өмссөн эмэгтэйд ижил төстэй пикет тэмдгийг дагуулдаг.
2230871228.jpg|0|A woman works at a chopping board on a table holding large containers of prepared food .|Эмэгтэй хүн бэлтгэсэн хүнсний том савыг барьж буй ширээн дээр цавчих самбар дээр ажилладаг.
2230885062.jpg|0|A woman with a ponytail and wearing a floral patterned dress is holding a teacup and saucer while speaking with another woman who is also wearing a floral patterned dress .|Гоо сайхны хувцас өмссөн эмэгтэй, цэцгийн хэв маягийн даашинз өмсөж, цэцэглэсэн хувцас өмссөн өөр эмэгтэйтэй хамт аялж, аялгууг зэргээр аялж, таваг барьж байна.
2230908726.jpg|0|A woman with sunglasses talks to a man who is holding his arms at his side .|Нарны шил бүхий эмэгтэй хүн түүний хажууд гараа барьж байгаа хүнтэй ярьдаг.
2230971412.jpg|0|Two elderly women with gray hair engaging in conversation .|Харилцаатай саарал үстэй хоёр настай эмэгтэй.
2230983294.jpg|0|The lady in red is very happy to see the young lady in white and black .|Улаан хатагтай цагаан, хар, хар өнгөтэй залуу хатагтайг харахад маш их баяртай байна.
2231041390.jpg|0|A large group of women has gathered , all holding hands , by some huts in front of a forest .|ХӨДӨЛМӨРИЙН ХӨДӨЛМӨРИЙН ГЭР БҮЛИЙГ ХҮСЭХГҮЙ, БҮХ ХҮНИЙГ ХҮСЭХГҮЙ БАЙНА.
2231048328.jpg|0|The back of a light brown dog sitting on sand looking out at a rock and the ocean .|Хөнгөн хүрэн нохойны ар тал нь хад, далай руу хардаг.
2231052760.jpg|0|A couple is fishing on a sandy beach while relaxing under an umbrella .|Хосууд шүхэр дор тайвширч байхдаа элсэрхэг далайн эрэг дээр загасчилж байна.
2231089996.jpg|0|A man in white wearing a Yarmulke is in front of a microphone with several other men in the background .|Юрулке өмссөн хүн yarulke өмссөн хүн бол арын хэсэгт хэд хэдэн эрчүүдтэй микрофоны урд байдаг.
2231193384.jpg|0|A Jewish man and a group of Jewish children , fill their plates from a buffet set out in a park .|Еврейчүүд, Еврейчүүдийн хүүхэд, бүлгийн хүүхдүүд, цэцэрлэгт хүрээлэнгийн хавтангууд нь цэцэрлэгт хүрээлэнд байрлуулсан буфетаас дүүргэдэг.
2231220920.jpg|0|While standing in front of several cafe tables , a woman wearing an off-white blouse and a dark colored skirt speaks with a woman who is wearing white sunglasses , a white shirt and a green skirt .|Хэд хэдэн кафе ширээний урд зогсож байхдаа цагаан цамц өмсдөг эмэгтэй, цагаан өнгийн цэнхэр өнгийн цамц өмссөн эмэгтэй, цагаан цамц, ногоон цамц өмссөн эмэгтэйтэй ярьж байна.
2231225870.jpg|0|Two men standing on a wooden walkway looking at a woman in a dress who is talking to them .|Тэдэнтэй ярьж буй даашинзтай эмэгтэй хүнийг хардаг модон явган замаар зогсож байв.
2231245129.jpg|0|A man is swinging his racket as he plays a tennis match .|Нэг хүн теннис тоглохдоо цохиурыг дүүжлэв.
2231551206.jpg|0|A young man wearing a hoodie , pants , and athletic shoes is sitting on a red lounge chair and watching hi-def tv .|Hoodie, өмд өмссөн залуу, цамц, спортын гутал улаан амралтын өрөөнд сууж, Hi-De-def tv үзэх.
2231843419.jpg|0|A young couple consults a book while sitting on a rock in the ruins of the Roman forum .|Залуу хосууд Ромын форумын балгас дээр сууж байхдаа номон дээр зөвлөж байна.
2231847779.jpg|0|A young baby with food on her face in a purple shirt and both fingers up her nose|Нил ягаан өнгийн цамц өмссөн залуу цамцтай, нүүрэн дээрээ хуруугаа хоёуланг нь хамараа
2231977553.jpg|0|A man wearing a black and white jump suite is jogging down a road .|Хар ба цагаан үстэй үсрэлт өмссөн хүн зам дээр гүйж байна.
223203610.jpg|0|Two middle-aged men in business clothing on their laptops in a bar scenario .|Баарны хувилбар дээр миний зөөврийн компьютер дээр бизнесийн хувцас өмссөн хоёр дунд насны эрэгтэй.
2232255534.jpg|0|A young man in jogging slacks is checking information on his mobile devise while listening to something on a crowded commuter rail car .|Гулжиргатай залуу хүн хөл хөдөлгөөн ихтэй зорчих замын автомашины машин дээр ямар нэгэн зүйлийг сонсож байна.
2232518012.jpg|0|The dogs are ready to race and are all wearing their muzzles .|Нохойнууд уралдахад бэлэн байна, бүгдээрээ тэдний дууг өмсдөг.
2232694969.jpg|0|A naked child stands facing two wet objects that are lying in a small pool of liquid and green substances .|Нүцгэн хүүхэд нь шингэн, ногоон бодисын жижиг усан сан дээр хэвтэж буй хоёр нойтон объекттой тулгардаг.
2232718966.jpg|0|A woman in purple leggings and a black jack is standing in front of a building in a crowded city smoking .|Нил ягаан өнгийн leggings-д эмэгтэй, хар Жак, Хортой хот суурин газрын урд байрлах барилгын урд зогсож байна.
2232822316.jpg|0|A woman dressed in a light yellow tank top , white pants , and sunglasses looks to her right as she is drinking a bottle of water .|Хөнгөн шар өнгийн саванд өмссөн эмэгтэй, цагаан өмд, цагаан өмд, нарны шил нь нэг шил ус ууж байгаа шигээ харагддаг.
223299137.jpg|0|Three people are on a boat in the middle of the water while the sun is in the back .|Нарны нуруун дээр усны дунд гурван хүн усан дээр завин дээр сууж байна.
223299142.jpg|0|The grass has ice on it and there is a mountain in the background .|Өвс нь мөсөн дээр мөс байдаг бөгөөд арын хэсэгт уул бий.
223320049.jpg|0|People in blue flowing robes , asian style red hats and scarves watch as other similarly dressed people march by all with hands raised in a salute|Цэнхэр урсдаг дээл, Азийн хэв маягийн улаан малгай, ороолтууд нь бусадтай ижил төстэй хувцасласан хүмүүс мэндчилдэг
2233426944.jpg|0|Four dogs run toward a tennis ball while another stands in the background .|Дөрвөн ноход теннисний бөмбөг рүү гүйж байхад нөгөө нь арын хэсэгт зогсож байх үед.
223385817.jpg|0|A college-aged kid in a light blue striped polo is sleeping in a chair with a book in his hand in what looks like a study space in a library .|Гэрэл цэнхэр судалтай коллежийн насны хүүхэд, номын санд суралцах орон зай шиг номонд сандал дээр номонд унтаж байна.
2234018985.jpg|0|A small dog on a chain leash stands in a shadowed hallway alone .|Гинжний гинжний жижиг нохой нь дангаараа сүүдэртэй хонгилд байрладаг.
223424495.jpg|0|A woman in a traditional Muslim headdress is bringing her child into a gymnasium while the sun shines through the open doorway behind them .|Уламжлалт мусульман мусульман толгойтой эмэгтэй хүүхдэд хүүхдээ биеийн тамирын зааланд авчирдаг.
2234368402.jpg|0|Lille boy standing behind a glass door wearing a red hat and black jacket with a woman standing just out of his sight on the sidewalk .|Лилл хөвгүүн бол явган хүний зам дээр улаан малгай, хар хүрэмтэй, явган хүний зам дээр зогсож байв.
2234681386.jpg|0|Man rides a bicycle in a nearly empty courtyard in front of a large building .|Хүн томоохон байшингийн өмнө бараг хоосон хашаанд унадаг дугуй унадаг.
2234702530.jpg|0|A man with glasses and a red backpack standing in front of a brick wall|Нүдний шил, улаан үүргэвчиндээ тоосгон хананы өмнө зогсож байв
2234726075.jpg|0|A motorcyclist wearing blue jeans is riding his red motorcycle .|Цэнхэр жинсэн өмд өмссөн мотоцикльчууд улаан мотоцикль унаж байна.
2234842557.jpg|0|two men in formal wear talking next to people moving|Хажуугийн хажууд байрлах албан ёсны хувцас өмсдөг хоёр эрэгтэй
2234910971.jpg|0|Two people , one with a black jacket and one with a blue headscarf , are walking along a desert-like area .|Хоёр хүн, хар хүрэмтэй, нэг нь цэнхэр толгойтой, цэнхэр толгойтой, цөл шиг газар алхаж байна.
2234941793.jpg|0|A semi truck with a cement mixer on the trailer attached to it is parked on the street near a driveway .|Хагас ачааны машин нь зам дээр бэхэлсэн чиргүүлтэй хагас ачааны машин.
2235220530.jpg|0|A man wearing a green and burgundy coat , and a hat with some khakis pants is shoveling snow in his yard .|Ногоон, бурграйтай цув өмссөн хүн, зарим Хакис өмд өмссөн малгай хашаанд цас ордог.
2235958906.jpg|0|A man wearing a long green coat stands in front of a flower cart holding a purple flower arrangement .|Урт ногоон цув өмссөн хүн ягаан цэцгийн урд талын цэцгийн тэрэгний урд зогсож байв.
2236016316.jpg|0|two team players wearing green shirts running along the court .|Шүүх дагуу гүйж буй ногоон цамц өмссөн хоёр баг тоглодог.
2236059848.jpg|0|Several people are talking while they stand or sit in a lobby of a restaurant .|Хэд хэдэн хүн зогсож байхдаа зоогийн газар байрлаж байхдаа ярилцаж байхдаа ярьж байна.
2236756644.jpg|0|A woman in a tomato-colored jogging suit carries both a red purse and a navy blue messenger bag .|Улаан лоолийн өнгөт гүйлтийн костюм өмссөн эмэгтэй улаан түрийвч, Тэнгисийн цэргийн цэнхэр элч нар хоёулаа хоёуланг нь авч явдаг.
2236851350.jpg|0|Three men , two wearing white shirts , are beneath a red umbrella and watching the surroundings .|Гурван эрэгтэй, хоёр эрэгтэй цагаан цамц өмсөж, улаан шүхэр доор, хүрээлэн буй орчныг үзэж байна.
2236895638.jpg|0|Woman wearing a dark blue hat in the middle of a bunch of vegetables .|Нэгэнт хүнсний ногооны голд харанхуй цэнхэр малгай өмссөн эмэгтэй.
2237153173.jpg|0|A man in a winter coat walks along a deeply shadowed area of a sidewalk , by the broad wall of a building .|Өвлийн цув өмссөн эр нь явган хүний зам дагуу явган хүний зам дагуу явган хүний зам дагуу явдаг.
2237256401.jpg|0|A girls sports team putting their hands in a circle to do a bonding cheer .|Охидын спортын баг гараа тойрон хүрээлэхийн тулд гараа тойрогт оруулдаг.
2237350782.jpg|0|A man with a hat is smoking a cigarette in front of another person and a body of water can be seen reflecting a building in the background .|Малгайтай эр хүн өөр хүний өмнө тамхи татдаг, бие махбодийн биеийг ар араас нь тусгаж байгааг харуулж байна.
2237363031.jpg|0|A short-haired man in a pink striped shirt is turned away from the camera while holding a tray carrying a number of glasses , while a frizzy-haired woman looks on .|Ягаан өнгийн судалтай цамц өмссөн богино үстэй хүн хэд хэдэн нүдний шил зүүж байхдаа камерын тайрч ав.
2237364221.jpg|0|A man is running on a treadmill while wearing blue shorts and a white shirt .|Нэг хүн цэнхэр шорт, цагаан цамц өмсөж байхдаа гүйлтийн зам дээр гүйж байна.
2237436639.jpg|0|A group of workers cutting cement blocks with electric saws .|Цахилгаан хөрөө бүхий цементийн блокуудыг таслав.
223761052.jpg|0|Two men working on a car with a big red jack in front of it .|Энэ нь том улаан хүрэмтэй машин дээр ажилладаг хоёр эрэгтэй.
2238019823.jpg|0|Man surfing under the Golden Gate Bridge on a foggy day .|Хүн манантай өдөр алтан хаалганы гүүрэн дор явдаг.
2238166082.jpg|0|A girl in a purple coat on a red sled coasting down a snowy hill .|Нил ягаан өнгийн цув өмссөн охин цастай толгод дээр доошоо нил ягаан өнгийн дээл өмссөн охин.
