image_name|comment_number|comment|Translated Comment
22926817.jpg|0|a woman in a blue tennis dress getting ready to hit an incoming ball|Цэнхэр теннисний хувцас өмссөн эмэгтэй ирж буй бөмбөгийг цохиход бэлэн боллоо
22928793.jpg|0|A woman in a T-shirt and shorts walks with a racket on a tennis field .|Футболк өмссөн эмэгтэй, шорт нь теннисний талбай дээр цохиураар алхдаг.
22930048.jpg|0|A woman in a red tennis outfit and holding a tennis racket is standing on a clay tennis court .|Улаан теннисний хувцас өмсөж, теннисний цохиурыг барьж, теннисний цохиур нь шавар теннисний талбай дээр зогсож байна.
2293149170.jpg|0|A boy wearing a black shirt and khaki pants is laying down , and is surrounded by stuffed animals .|Хар цамц өмссөн хөвгүүн, Хаки өмд өмсөж, чихмэл амьтадаар хүрээлэгдсэн байдаг.
2293308835.jpg|0|A small girl rides on a woman 's back outdoors .|Жижигхэн охин гадаа эргээд гадаа унаж байна.
2293424366.jpg|0|The boy in the royal blue basketball uniform is dribbling the ball down court .|Хааны цэнхэр сагсан бөмбөгийн дүрэмт хувцастай хүү нь бөмбөгийг доош буулгаж байна.
229352841.jpg|0|Two men wearing white t-shirts at a butcher stand with many sausages hanging from the ceiling above them .|Хоёр эрийг цагаан футболк өмссөн хоёр эрэгтэй цагаан цамц өмсдөг.
229352848.jpg|0|Three men are standing on a rather large extended platform to a cherry picker , and they are posing for a group work picture .|Гурван хүн интоорын сонгон шалгаруулалтад илүү том өргөтгөсөн тавцан дээр зогсож байна, тэд бүлгийн ажлын зураг авахаар төлөвлөж байна.
2294231101.jpg|0|A woman with a light blond pageboy haircut smiles for the camera as she holds the straps of her big , orange backpack .|Гэрэл шаргал үстэй ploseboyboy үстэй эмэгтэй.
2294516804.jpg|0|A cubby cheeked baby in a yellow and red bib playing with a toy .|Шар, улаан, улаан, улаан өнгийн bib тоглоом тоглож тоглодог.
2294598473.jpg|0|A white dog is leaping in the air with a green object in its mouth .|Цагаан нохой нь агаарт үсэрч аманд ногоон объектоор үсрэв.
2294688426.jpg|0|A man wearing a black hooded sweatshirt smokes a cigarette at the side of a road .|Хар бүрээстэй цамц өмссөн эр хүн замын хажууд тамхи татдаг.
2294913223.jpg|0|Young Asian man jumps up on top of a padded rectangular metal structure .|Залуу Ази хүн сэлүүрт тэгш өнцөгт металлын бүтэц дээр үсрэв.
2295177295.jpg|0|A small barefoot boy standing on a circular flat decorative stone in the midst of a pebbled area that is part of a patio in a garden area .|Цэцэрлэгт хүрээлэнгийн нэг хэсэг нь цэцэрлэгт хүрээлэнгийн нэг хэсэг нь дугуй хэлбэртэй хавтгай гоёл чимэглэлийн чулуун дээр зогсож байв.
2295199606.jpg|0|A woman wearing a knit cap , a black sweater , and glasses crouches down next to a table or stand to smile at the camera .|Нэхмэл малгай өмссөн эмэгтэй, хар цамц өмссөн эмэгтэй, нүдний шил нь ширээний хажууд хэвтэж, камер дээр инээмсэглэх эсвэл
2295215289.jpg|0|A little Asian boy in a sweatshirt playing with a small dog who is also in a sweatshirt|Хөлс, цамцтай жижиг нохойтой тоглож байгаа бяцхан ази хүү
2295216243.jpg|0|a group of people dancing on a beach in front of a truck|Ачааны машины урд далайн эрэг дээр бүжиглэж буй бүлэг хүмүүс
2295399288.jpg|0|An older woman from Rajasthan or elsewhere in India or Pakistan faces the camera in traditional dress , earrings , large nose pin , and large wire necklace .|Энэтхэгт эсвэл Пакистанд эсвэл Пакистанд эсвэл Пакистанд, эсвэл Пакистан дахь хуучин эмэгтэй нь уламжлалт хувцаслалт, ээмэг, том, том зүүлт, том утас, том утас.
2295447147.jpg|0|A brown dog in two black collars running through a grassy field .|Өвс ногоо тариалангийн талбайгаар гүйж буй хоёр хар хүзүүвчтэй бор нохой.
2295489839.jpg|0|A man playing a keyboard and singing into a microphone .|Гар зүү тоглож, микрофон руу дуулдаг.
229565492.jpg|0|A white man with camouflage pants and a black and white print shirt covered in white foam or cream .|Цагаан хөөс эсвэл цөцгийтэй цагаан өнгийн өмд, цагаан өнгийн өмд, цагаан хөөсөнцөр, цагаан хөөсөнцөр.
229574079.jpg|0|Four large men are eating together in what looks like a food-eating contest .|Дөрвөн том эрчүүд хоол иддэг уралдаан шиг харагддаг.
2295750198.jpg|0|A girl is standing on one leg in the middle of the field .|Нэгэн охин талбайн голд нэг хөл дээрээ зогсож байна.
2295894587.jpg|0|The white dog is hard to see in the snow as it runs payfully .|Цагаан нохой нь хураамжтай болохоор цасыг харахад хэцүү байдаг.
2295920018.jpg|0|An Asian woman and her son are sitting on a bike on a walking path while the boy is pointing at something .|Азийн эмэгтэй, хүү, хүү нь хөвгүүн ямар нэгэн зүйлийг зааж байна.
2296139788.jpg|0|A smiling Indian woman driving a blue truck wearing a colorful orange , green , and white outfit .|Инээмсэглэсэн Индигийн эмэгтэй өнгөт улбар шар, ногоон, ногоон, цагаан хувцас өмсдөг цэнхэр ачааны машин жолооддог.
2296166785.jpg|0|Two children jumping in the sand on a beach , the sand is being kicked up and the water is bright blue .|Далайн эрэг дээр элсэн дээр үсэрч, элс өшиглөж, усыг нь өшиглөж, ус нь тод цэнхэр өнгөтэй байна.
2297345744.jpg|0|A man looking through a microscope and manipulating the contents of the slide .|Микроскопоор дамжуулж, гулсах агуулгыг удирдаж буй хүн.
229736617.jpg|0|A young asian girl at the beach , sitting in a pool of water , made from sand that was dug out .|Далайн эрэг дээр байгаа залуу ази охин, усан санд сууж, усан санд суув.
2297471897.jpg|0|The brown dog is walking along a grassy path with its tongue out .|Браун нохой нь өвсөнөөр өвсөн замаар алхаж байна.
2297744130.jpg|0|A kid in a yellow jacket and blue baseball cap jumping from a rock .|Шар хүрэм, цэнхэр бейсболын малгай нь чулуунаас үсэрч байв.
2298077331.jpg|0|Two dogs run and play together on a narrow dirt path in the middle of a field .|Хоёр ноход талбайн голд нэг нүүлгэн шилжүүлж, хамтдаа нягтралтайгаар тоглодог.
2298097636.jpg|0|A brown dog is running along side a black dog in a field .|Браун нохой талбайд хар нохойтой хамт гүйж байна.
2298283771.jpg|0|A man wearing glasses and a dark coat looks at something to the left of the picture .|Нүдний шил зүүж, хар бараан цув нь зурагны зүүн талд ямар нэгэн зүйл хардаг.
229862312.jpg|0|A brown puppy is laying on its back in the grass .|Браун гөлөг нь нуруун дээр нуруун дээрээ хэвтэж байна.
2298661279.jpg|0|A boy in red pants getting ready to slide down a metal slide .|Улаан өмд өмссөн хөвгүүн нь металл слайдыг доош гулсуулахад бэлэн болжээ.
2298946012.jpg|0|Four people on horseback look at a lake with mountains in the distance .|Морь дээр дөрвөн хүн хол зайд уулархаг газар нутгийг хардаг.
229897292.jpg|0|A young woman is drinking a beer while dressing in a pageant costume which includes lots of pink feathers and beads .|Залуу эмэгтэй нь олон тооны ягаан өд, бөмбөлгүүдийг багтаасан костюм өмсөж байхдаа шар айраг ууж байна.
2299427360.jpg|0|A dog runs through green grass with a tennis ball in its mouth .|Нохой нь теннисний бөмбөгтэй ногоон зүлэгээр дамждаг.
229944849.jpg|0|A black women with five black children around her and a white wall in the background .|Түүний эргэн тойронд таван хар арьстай, арын дэвсгэр дээр цагаан арьстай хар арьстнууд.
229951087.jpg|0|Man paddles a canoe through placid lake waters|Хүн Просидийн нуурын усан онгоцоор завиар сэлж байв
229954612.jpg|0|Some people are crossing a green bridge over a river .|Зарим хүмүүс голын дээгүүр ногоон гүүрэн гүүрэн гаталж байна.
229954873.jpg|0|Two men , one wearing a gray shirt , the other wearing a black shirt appear in a store while another accesses an upper shirt with a woman in a green hat in the foreground .|Хоёр хүн, саарал цамц өмссөн, нөгөө нь хар цамц өмссөн, нөгөө нь хар цамц өмссөн, нөгөө нь нүүрэн дээр нь ногоон малгайтай эмэгтэй хүнтэй эмэгтэй хүний нүүрэн дээр байгаа эмэгтэйтэй том цамц өмсдөг.
2299558545.jpg|0|Two boys , one in an olive green shirt and tan shawl , and the other in a navy shirt with a light tan shawl carrying an axe , are outside .|Хоёр хүү, нэг нь чидун ногоон цамц, Тэн алчуур, нөгөө нь сүх зөөдөг, нөгөө нь сүх зөөдөггүй тэнгисийн цэргийн цамцтай.
2299720433.jpg|0|A bald man is sitting at a red table with his hands on a laptop computer .|Халзан эр зөөврийн компьютер дээр гараараа улаан ширээн дээр сууж байна.
229978782.jpg|0|two men , one in a red shirt , running towards a Frisbee .|Хоёр эр, нэг нь улаан цамцанд, нөгөө нь Фрисби руу гүйв.
2299859649.jpg|0|A young boy wearing a red winter coat is eating and holding up a candy bar .|Улаан өвлийн цув өмссөн залуу хүү нь чихрийн барыг идэж, барьж байна.
2299867034.jpg|0|Two women standing and having a heated discussion , with a group of men and women in the background standing together and talking .|Хоёр эмэгтэй зогсож, халсан хоёр ярилцлага, арын дэвсгэр дээр хамтдаа зогсож, ярилцаж, ярилцаж, ярилцдаг.
230016181.jpg|0|a woman wearing an orange jacket sitting in a canoe on a lake with a dog behind her|Нохойтой нууран нууран дээр завиар завиар явж байсан улбар шар хүрэм өмссөн эмэгтэй
2300168895.jpg|0|A brown dog lying in the grass playing with a white rag .|Цагаан өөдөсөөр өвсөн дээр хэвтэж буй хүрэн нохой.
2300229745.jpg|0|A dog with floppy ears runs on the grass , a fence behind it .|Уян чихтэй нохой нь зүлгэн дээр ургадаг, ард нь хашгирдаг.
2300353380.jpg|0|An old man with a long white beard , a child in a striped shirt and a chicken are pictured standing outside a tent .|Урт цагаан сахалтай цамцтай хөгшин хүн.
23008270.jpg|0|A female tennis player in a white shirt and black tennis skirt getting ready to swing .|Цагаан цамц, хар теннисчин, хар теннисний банзал бүхий эмэгтэй теннис тоглуулагч.
23008340.jpg|0|A young woman with her back turned on a tennis court with a ball coming from behind her .|Нуруутай нэгэн залуу эмэгтэй теннисний талбай дээр теннисний ард ирэв.
23008408.jpg|0|A woman wearing a hooded sweatshirt and black pants with a ponytail playing tennis .|Теннис тоглож буй теннисний цамц, хар өмд өмссөн эмэгтэй.
2300920203.jpg|0|A fluffy dog plays with a small toy in a living room .|Сэвсгэр нохой зочны өрөөнд жижиг тоглоомоор тоглодог.
230100504.jpg|0|Two girls with long hair stand in front of a cluttered table .|Урт үстэй хоёр охин үймээн самуун ширээний урд зогсож байв.
230105501.jpg|0|a girls sitting pretty on the arm of a couch rads a card presented to her by a girl that 's standing sideways with a glass of wine in her hands .|"буйдан дээр хөөрхөн сууж буй охидууд гараараа хажуу тийшээ шилэн дарс бүхий ""хажуу тийшээ очсон охиныг"" хажууд нь шилэн дарс бүхий байгаа охин руу чиглүүлэв."
23010569.jpg|0|A female tennis player wearing a pink top and gray and white shorts swinging her tennis racquet .|Ягаан өнгийн дээд ба саарал, саарал, цагаан өнгийн шорт нь теннисний ракет руу дүүжлэв.
2301155278.jpg|0|A tow-headed toddler in a brown shirt and black pants is walking down a stone path in the middle of an indoor greenhouse , surrounded on both sides by green leaves and flowers .|Хүрэн цамц, хар өмд, хар өмд нь дотоод навч, цэцэгнээр хүрээлэгдсэн чулуун үүрэн дээр байрлах чулуун замаар алхаж байна.
23012542.jpg|0|A tennis player dressed in white swings her racket back preparing to hit the ball .|Цагаан хувцас өмссөн теннисчин цохиур түүний цохиурыг буцааж бөмбөг цохиход бэлдэж бэлдэж байна.
23012579.jpg|0|A blond , Caucasian female , wearing a white business jacket , pink blouse , sitting at a table draped in hot pink tablecloth , writing on a piece of paper .|Шаргал, Кавказын эмэгтэй, цагаан өнгийн цамц, ягаан цамц өмссөн, ягаан өнгийн цамц өмсөж, цаасан дээр сууж, цаасан дээр бичсэн.
23012662.jpg|0|A blond woman in white tennis clothes surveys the crowd at a tennis match .|Цагаан теннисний хувцас өмссөн шаргал хувцас нь теннисний тэмцээнд оролцдог.
23012796.jpg|0|A tennis player wearing a black and white top and black pants strikes the tennis ball .|Хар ба цагаан өнгийн дээд, хар өмд өмссөн теннисчин теннисний бөмбөгийг цохив.
230135931.jpg|0|An Asian Indian man in a yellow madras shirt asleep next to a woman in a red print dress .|Улаан хэвлэмэл даашинзтай эмэгтэй хүний хажууд унтаж буй Азийн Энэтхэг хүн.
2301379282.jpg|0|A little boy in a flannel shirt and light pants is thrown in the air .|Фламер цамц, хөнгөн өмдөндөө жаахан хүүхэд агаарт хаядаг.
2301467704.jpg|0|A blindfolded woman with green hair attempts to hit a pinata with a stick , while a man dressed in green watches .|Ногоон үстэй, ногоон үстэй эмэгтэй нь пинатаыг саваагаар цохихыг хичээдэг.
2301525531.jpg|0|A black and white dog runs over snow by a tree and bench .|Хар ба цагаан нохой нь мод, вандан сандал дээр цасаар гүйдэг.
23015660.jpg|0|A young woman tennis player dressed in black carries many tennis balls on her racket .|Блэк өмссөн залуу эмэгтэй теннис тоглуулагч нь түүний цохиур дээр олон теннисний бөмбөг явуулдаг.
23015940.jpg|0|A woman tennis player stands at center court as photographers take her picture .|Гэрэл зурагчид түүний зургийг авахад эмэгтэй теннисний тоглогч дээр зогсож байна.
23016091.jpg|0|A blond-haired woman with a tennis cap and sports tank top is holding up her left hand and smiling .|Теннисний малгай, спортын танкны дээд, спортын танкны дээд талд шаргал үстэй эмэгтэй зүүн гараа барьж, инээмсэглэж байна.
23016221.jpg|0|The girl in yellow shorts and white jacket has a tennis ball in her left pocket .|Шар шорт, цагаан хүрэмтэй охин зүүн халаасандаа теннисний бөмбөгтэй.
23016250.jpg|0|A young woman plays tennis while wearing a yellow outfit .|Шар хувцас өмсөж байхдаа залуу эмэгтэй теннис тоглодог.
23016347.jpg|0|A girl in a yellow tennis suit , green visor and white tennis shoes holding a tennis racket in a position where she is going to hit the tennis ball .|Теннисний бөмбөгийг цохиж, ногоон Теннисний цохиур, ногоон байгууламж, цагаан теннисний бүсгүй.
23017628.jpg|0|A female tennis player is about to hit the tennis ball with her racket .|Эмэгтэй теннис тоглогч теннисний бөмбөгийг цохиураар цохих гэж байна.
23017965.jpg|0|A female tennis player dressed in light blue prepares to hit an oncoming tennis ball .|Хөнгөн цэнхэр өнгийн хувцас өмссөн эмэгтэй теннис тоглож байсан эмэгтэйн хувцас өмсөж ирж буй теннисний бөмбөгийг цохиход бэлтгэдэг.
230182039.jpg|0|A guy wearing blue jeans and long-sleeve shirt is walking down the sidewalk .|Цэнхэр жинсэн өмд, урт ханцуйтай цамц өмсдөг залуу явган хүний зам дээр алхаж байна.
23018379.jpg|0|An older and a younger woman , both with tennis attire and rackets , smile side to side for the camera .|Хуучин, залуу эмэгтэй, теннисний хувцас, өлгүүртэй, хаалганы хажуугийн хажуугаар нь инээмсэглээрэй.
2301867590.jpg|0|Two children , one in red and one in blue , making snow angels .|Хоёр хүүхэд, нэг нь улаан, нэг нь цэнхэр өнгөөр цэнхэр өнгөтэй, цасан тэнгэр элчүүд хийж байна.
23018702.jpg|0|Woman in a white dress standing with a tennis racket and two people in green behind her .|Цагаан хувцас өмссөн эмэгтэй теннисний цохиур, түүний ард ногоон, хоёр хүн амьдардаг.
23022402.jpg|0|A graveyard worker is digging , or filling a grave , another person is on his cellphone , leaning on a tombstone .|Булшны ажилчин ухаж, булшийг ухаж, дүүргэж, өөр хүн гар утсан дээрээ гар утсан дээрээ байрлуулж, булшны чулуу дээр бөхийж байна.
2302336943.jpg|0|A woman wearing a brown fur coat and hat is walking outside in the winter in front of a white statues of a mother and child .|Браун үслэг цув өмссөн эмэгтэй, малгай нь ээж, хүүхдийн цагаан хөшөөний урд хэсэгт гадаа алхаж байна.
2302516347.jpg|0|"A man and a woman look at pictures on a machine marked "" other people 's photographs . """|"Эрэгтэй, эмэгтэй эмэгтэй ""бусад хүмүүсийн"" зураг дээр тэмдэглэгдсэн машин дээр зураг хардаг. """
2302523930.jpg|0|A woman in a polka-dot shirt and black boots is walking down the street and being approached by a man in a black jacket and jeans .|Polka-Dot цамц өмссөн эмэгтэй, хар гутал, хар гутал нь гудамжинд явж, хар хүрэм, жинсэн өмд өмсдөг.
230269706.jpg|0|A child , wearing a black hat , leather vest and chaps is petting a steer 's nose at a rodeo .|Хар малгай, арьсан биелэгдэнэ, арьсан биелэгдэнэ, халхавч өмсөж, rapeo нь родео руу чиглүүлэгчийг чиглүүлж байна.
230269912.jpg|0|There is a cow in this picture with a cowboy kid looking at it near a trailer .|Энэ зурган дээр ковбой хүүхэд чиргүүл рүү харж байна.
2302747917.jpg|0|A girl in green is running behind a boy in red in a sports arena whilst a girl in pink is running in the background .|Ногоон дахь охин нь ягаан өнгийн охинтой хамт улаан, хөвгүүдийн ард гүйж байна.
2302815083.jpg|0|A shirtless male gymnast in white tights spins on an Avai-brand sawhorse .|Цагаан трикон гимнастик гимнастик гашуун гимнастик гимнастик.
2302816463.jpg|0|2 guys one is a gymnast whom is performing , the other stretching and warming up both in red , in a dark room .|2 залуу бол нэг нь гимнастикч,, нөгөө нь улаан, харанхуй өрөөнд хоёуланд нь дулаацуулж, дулаацуулдаг.
230282077.jpg|0|People standing around one getting a ride in a car .|Машинд сууж байгаа хүмүүс машинд сууж байна.
2302955243.jpg|0|Japanese girls in plastic and karate suits to lose weight and there practicing with nun chucks .|Япон охидууд хуванцар, Карат, Карат, Карататын костюм жингээ хасахын тулд жингээ хасч, гэлэнмаа хийсэж байна.
2303016989.jpg|0|A black and white dog is running through the field to catch something in its mouth .|Хар ба цагаан нохой нь амандаа ямар нэгэн зүйлийг барьж авахын тулд талбайгаар дамждаг.
2303356248.jpg|0|Two kids in snow hats and blue and green coats are swinging on a tire swing out in the snow .|Цасан малгай, цэнхэр, ногоон өнгийн цув өмсдөг хоёр хүүхэд цасанд дүүжлэв.
230339366.jpg|0|An elderly Asian woman is holding an object in her hands .|Ахмад настан эмэгтэй эмэгтэй гартаа объект барьж байна.
2303426046.jpg|0|A dog appearing to be malnourished is standing on his hind legs about to jump .|Нохойн хоол тэжээлийн дутагдалтай гарч ирэв. Үсрэх гэж байгаа юм.
2303609756.jpg|0|A male gymnast from Romania , wearing all red , holding himself vertically while upside-down on rings suspended in the air .|Румын гимнастикч, бүх улаан гашуу, улаан өнгөөрөө агаарт түдгэлзүүлсэн цагираг дээр босоод өөрийгөө босоод босоод өөрийгөө барьдаг.
2303951441.jpg|0|One black dog is in midair whild one black dog is on the grass .|Нэг хар нохой нь Midair-д байдаг нэг хар нохой нь өвс дээр байдаг.
2304191667.jpg|0|A older lady is working with a mix master while two young boys stand next to her with aprons on helping her .|Хөгшин эмэгтэй нь холимог мастераар ажиллаж байхдаа хоёр залуу хөвгүүд түүнд туслахад хормогчтойгоо хамт ажилладаг.
2304374703.jpg|0|A brown dog plays with a bright orange ball in the snow .|Браун нохой цасанд тод улбар шар өнгийн бөмбөгөөр тоглодог.
2304444199.jpg|0|The little girl in a pink shirt and jeans is climbing up a rock climbing wall .|Бяцхан охин ягаан цамц, жинсэн өмд, жинсэн өмд нь хаданд авирах хананд авирч байна.
2304469976.jpg|0|A man shines another man 's shoes on the sidewalk of a busy street full of cars and parked motorcycles .|Эрэгтэй хүн машин, зогсоолоор дүүрэн завгүй гудамжаар явган хүний явган хүний гутал гэрэлтдэг.
