image_name|comment_number|comment|Translated Comment
4829029000.jpg|0|A gray-haired , bearded man is viewing items at an outdoor vendor .|Саарал үстэй, сахалтай эр нь гадаа борлуулагч дээр байгаа зүйлийг үзэж байна.
482907079.jpg|0|A figure is climbing up a rock while people on the grond watch .|Газар дээр хүмүүс харцаар явж байхад зураг авирч байна.
4829125933.jpg|0|A woman dressed up like Wonder Woman and holding a very large purse is standing on a brick sidewalk .|Гайхамшигтай эмэгтэй хувцас өмсөж, маш том түрийвчтэй, маш том түрийвчийг барьж, маш том түрийвчтэй явган хүний зам дээр зогсож байна.
4829253619.jpg|0|A woman in a pink cowboy hat and pink jean jacket holding a black purse smokes a cigarette while other people in cowboy hats man a stand giving away something free .|Ягаан өнгийн ковбой малгай, хар түрийвч, ягаан өнгийн хүрэмтэй эмэгтэй. Ковбой малгай өмсдөг бусад хүмүүс тамхи татдаг.
4829255593.jpg|0|A man with a brownish purple shirt and jeans is holding a large banana in one hand and his son 's hand in his other .|Браун хүрэн нил ягаан цамцтай эр, жинсэн өмд нь нэг гараараа том гадил жимсний нэг гартаа гараа барьж байгаа.
4829448811.jpg|0|Black male dressed in blue , in a blue car , with a white handkerchief .|Хар арьст эрэгтэй цэнхэр өнгийн хувцас өмссөн цэнхэр машин, цагаан алчуураар цэнхэр машинтай.
4829468998.jpg|0|A small group of people enjoy a row on a long canoe down a picturesque river .|Жижиг бүлгийн хүмүүс хөөрхөн канк дээр зүүдлээд голын эрэг дээр эгнээнд явдаг.
4829470214.jpg|0|An old woman wearing a white shirt and green shorts is standing on a sidewalk .|Цагаан цамц өмсөж, ногоон өнгийн шорт өмссөн хөгшин эмэгтэй явган хүний зам дээр зогсож байна.
4829533753.jpg|0|A man in a green shirt and red sunglasses walks by a cafe in Pescaderia as a woman trails in the background .|Нүдний ногоон цамц, улаан нарны шил, улаан нарны шил нь Кескадериа дахь кафе хамт кафед гардаг.
4829586088.jpg|0|Older white male in a pig 'n' whistle white t-shirt polishes his sunglasses while looking at traffic .|Хөгшин цагаан арьст цагаан арьст эрэгтэй цагаан арьстнуудын цагаан арьстнуудын цагаан цагаан футболк нь замын хөдөлгөөнийг харж байхдаа нарны шилээ өнгөлдөг.
48296039.jpg|0|There are four males standing and washing dishes in a kitchen with their back to the room .|Дөрвөн эрчүүдийг өрөөндөө буцааж өрөөнд орж, аяга таваг угааж, аяга таваг угаадаг.
48296285.jpg|0|Two men one in a red shirt and the other wearing a yellow shirt are in a lab .|Улаан цамцтай хоёр эрэгтэй, нөгөө нь шар цамц өмссөн, нөгөө нь шар цамц өмссөн байна.
4829698553.jpg|0|One smiling brunette man is wearing a red and green dress with two pink and white striped knitted caps attached by clothespins to the neckline of his dress and is accompanied by a bare-chested smiling brunette man with multi-color wings strapped to his back , wearing a pink necktie loosely around his bare neck .|Нэг инээмсэглэсэн Brunette эрэгтэй нь улаан, цагаан өнгийн судалтай сүлжмэл сүлжмэл сүлжмэл, нүцгэн инээмсэглэлтэй,ягаан хүзүүвч нь нүцгэн хүзүүг нь сулруулдаг.
4829856573.jpg|0|A man holding a motorcycle helmet stands on a sidewalk in front of a bright blue colored building which contains an ice cream shop named Murphy 's .|Мотоциклийн дуулга барьж буй тод цэнхэр өнгийн барилгын урд байрлах нь Мерфи нэртэй зайрмагны дэлгүүрийн урд талын явган хүний зам дээр зогсож байв.
4829869876.jpg|0|A young boy in a cowboy hat and holding some food sits in the back of a small vehicle while an adult leans over in the background next to a large blue device displaying the words 99 % Angel .|Ковбой малгай өмссөн залуу хүү, зарим хоол хүнс нь 99% сахиусан тэнгэрийг харуулсан том цэнхэр төхөөрөмжийн арын хэсэгт байдаг.
4829871518.jpg|0|An older black women wearing a straw hat and striped dress sits on periwinkle bench whilst grasping her cranberry-colored coat .|Нүүлтийн хар арьстнууд нь сүрэл малгай өмсөж, судалтай хувцас өмссөн вандан хувцас өмссөн вандан сандал дээр сууж байв.
4829882264.jpg|0|One person is standing beside a tree with the sun shining through the leaves .|Нэг хүн навчаар гэрэлтэж буй нартай хамт модны дэргэд зогсож байна.
4829887976.jpg|0|Well i think there amish but there carrying maybe a cellphone or walkie talkie .|За би тэнд байгаа гэж бодож байна, гэхдээ тэнд байгаа ч тэнд гар утас эсвэл явган аялал хийх боломжтой.
4829926526.jpg|0|A man in a black t-shirt jogs as others go about their day .|БУСАД НЭГ ХҮНИЙГ ХҮСЭХГҮЙ БАЙНА.
4830075359.jpg|0|a man in a black jacket talking into a microphone .|хар хүрэмтэй хүн микрофон руу ярьж байна.
4830101710.jpg|0|Two young boys wearing shorts play outside while a police officer watches .|Цагдаагийн ажилтан цаг цагдаагийн цаг үед шорт өмсдөг.
4830165439.jpg|0|An elderly man stands at a podium ready to speak into the microphone .|Хөгшин хүн микрофон руу ярихад бэлэн подиум дээр зогсож байна.
4830206078.jpg|0|Two children on the sidewalk in front of a building and one of the children is playing with hand shopping carts .|Барилгын урд талын явган хүний зам дээр хоёр хүүхэд, хүүхдүүдийн нэг нь гар дэлгүүрийн тэрэгтэй тоглож байна.
4830215458.jpg|0|Two ladies with long hair who are between a red and white stripe pole are about to kiss each other .|Улаан, цагаан өнгийн судалтай хоёрын хоорондох урт үстэй хоёр бүсгүйтэй хоёр бие биенээ үнсэх гэж байна.
4830258067.jpg|0|There is a group of many adults around a fake pirate ship dressed up as pirates .|Хуурамч далайн дээрэмчдийн хөлөг онгоцыг дээрэмчдийн хөлөг онгоцоор хувцасласан олон насанд хүрэгчдийн бүлэг байдаг.
4830292666.jpg|0|A woman with a red bag walks down the sidewalk by some old building and a cobblestone street .|Улаан ууттай эмэгтэй, зарим хуучин барилга, кобблестоны гудамжаар явган хүний зам дээр алхдаг.
4830293194.jpg|0|A couple sits in an antique automobile in a populated building .|Хосууд нь амьтан хүн амтай байранд байдаг эртний автомашинд сууна.
4830307454.jpg|0|A young man in a white t-shirt is looking at the photographer .|Цагаан футболк өмссөн залуучууд гэрэл зурагчинг харж байна.
4830309734.jpg|0|A smiling middle-aged man wearing over-sized red sunglasses and a colorful patterned shirt sits in the grass in front of a blue-green backdrop .|Улаан өнгийн улаан нарны шил зүүсэн инээмсэглэсэн дунд насны эр, өнгөлөг хэвлэмэл цамц нь цэнхэр ногоон ногоон арын хэсэгт зүлгэн дээр суудаг.
4830347956.jpg|0|A red , white , and yellow car racing through a curve , spinning wheels and kicking up dust .|Муруй, дугуйгаар дамжуулан улаан, цагаан, шар машины уралдаан, дугуйг дээшлүүлж, тоосыг өшиглөнө.
4830367822.jpg|0|A man with a goatee , glasses , hate with wings is examining what looks to be some kind of sound equipment .|Гиате, нүдний шил, далавчтай, далавчтай малгай, далавчтай ямар төрлийн дууны тоног төхөөрөмж болохыг шалгаж байна.
483039719.jpg|0|A teenage boy with a white headband looking right , a crowd in the background .|Цагаан толгойтой хүүтэй өсвөр насны хүү.
4830409466.jpg|0|A colorful array of motorcyclists gathered outdoors , with Joshua trees in the background and a pair of motorcyclists on a cherry-red cycle in the foreground .|Мотоциклийн цувралууд нь гадаа, нүүрэн дээр нь интоорын улаан мөчлөгтэй хамтлаг, хос мотоцикльтой хамт цуглардаг.
483041457.jpg|0|A male cook is using his apron as a backdrop to display the dish he has prepared on the grill .|Эрэгтэй тогооч түүний хормогчийг бэлтгэсэн аяга таваг ашиглан бэлтгэсэн аяга таваг ашиглан хийжээ.
4830504677.jpg|0|A young couple walking by a mural of an ice cream parlor that is painted on a roll up door in a graffiti covered building .|Залуу цөцгийтэй танхимын хажуугаар зурсан зайрмагны танхимыг граффити бүрхсэн байранд буддаг.
4830524551.jpg|0|The back of a woman bicyclist sitting on the edge of a stone walkway barrier , looking out over a choppy body of water with the far shore and sailboats in the background , and her fully visible bicycle in the foreground resting against the barrier .|Чулуу алхах, арын хэсэгт байрлах эмэгтэй дугуйны нуруун дээр байгаа эмэгтэйн арын хэсэг, арын хэсэгт нь далайн эрэг, далай тэнгисийн арын хэсэгт байрладаг.
4830620136.jpg|0|Three people walking in front of an old colonial looking building with a bright green streetlight above them .|Дээрх хуучин ногоон гэрэлтүүлэг бүхий хуучин колоничлолын харцны өмнө гурван хүн алхаж байна.
4830651041.jpg|0|Two women in military uniform are standing with other soldiers in formation .|Цэргийн дүрэмт хувцастай хоёр эмэгтэй форматлахад өөр цэргүүдтэй зогсож байна.
4830848641.jpg|0|A man in a red striped shirt talks in to a microphone .|Улаан судалтай цамцтай эрэгтэй микрофонтой ярилцаж байна.
4830850373.jpg|0|A man with a hiking equipment is tying his shoe in the woods .|Хөгжилтэй тоног төхөөрөмж бүхий хүн ойд гутлаа уяж байна.
4830850965.jpg|0|A group of young girls hold hands while wearing colorful skirts while other women dance and smile around them with two men discussing something in the background .|Бага залуу охидын бүлэг нь бусад эмэгтэйчүүдийг өмсөж, бусад эмэгтэйчүүд бүжиглэж, хоёр эрчүүдэд инээмсэглэж, эргэн тойронд инээмсэглэл тодруулж, эргэн тойронд инээмсэглэв.
4830853107.jpg|0|An Asian woman wearing a pink shirt is looking through the display viewfinder of a camera and is taking a picture .|Ягаан цамц өмссөн Азийн эмэгтэй. Камерын дэлгэцийн үзэмжээр дамжуулан камерын үзэмжээр харж, зураг авч байна.
4830853179.jpg|0|A group of girls wearing dresses and skirts gathers outside .|Хувцас өмсөж, банзал өмссөн охидууд гадаа цуглардаг.
4830857471.jpg|0|A woman wiping the brow of another woman , sitting down amongst a crowd of woman , drinking from a bottle .|Эмэгтэй хүн өөр эмэгтэйн хөмсөгний хөмсөг арчиж, нэг лонхноос ууж байв.
4830965524.jpg|0|A man wearing a black shirt is looking at a binder on a music stand while playing a guitar .|Хар цамц өмссөн эр гитар тоглож байхдаа хөгжмийн зогсож буй Хөгжимний зогсож байгаа биндэр дээр харагдаж байна.
4831015865.jpg|0|This short-haired man checks for cellphone service while hiking with his two female companions .|Энэхүү богино үстэй хүн хоёр эмэгтэй хамтрагчтайгаа явган аялал хийхдээ гар утасны үйлчилгээг шалгаж байна.
4831245697.jpg|0|A man in a blue shirt is in the distance at a bar .|Цэнхэр цамц өмссөн хүн бааранд зайд байдаг.
4831266350.jpg|0|A man in a white button-up shirt looks to the side while sitting at a table by the street .|Цагаан товчлуурын цамцтай хүн гудамжаар ширээн дээр сууж байхдаа хажуу тийшээ хардаг.
4831324228.jpg|0|A young man with a mohawk and a black Dio shirt wearing a backpack looks at his phone .|Мохавк, хар өнгийн давхар цамц өмссөн хар арьст цамц нь үүргэвчиндээ утсаа хардаг.
483136916.jpg|0|A beagle looking over his shoulder as he stand on a sandy slope .|Сэнди налуу дээр зогсож байхдаа мөрөн дээр нь харлаа.
4831412806.jpg|0|Seven people wearing green T-shirts are walking on the beach and one of them is waving .|Ногоон футболк өмссөн долоон хүн далайн эрэг дээр алхаж, тэдний нэг нь даллаж байна.
4831421234.jpg|0|three men stand on stage in tuxedos , the man on the left can be seen shaking the hand of someone .|Гурван эр Техно дахь тайзан дээр зогсож, зүүн талд байгаа хүн, зүүн талд байгаа хүн хэн нэгний гарыг сэгсрэх боломжтойг харж болно.
4831446722.jpg|0|A group of people with a woman in a black dress , an older woman in a beige blouse , a man in a blue collared shirt and another in a red and brown striped shirt , and a younger girl in a black dress are sitting together .|Хар хувцастай эмэгтэй хүнтэй эмэгтэй хүн, шаргал үстэй, цэнхэр өнгийн хүзүүвч, цэнхэр хүзүүвчтэй цамц, цэнхэр өнгийн цамц, нөгөө нь хар даашинзтай, залуу хүзүүвчтэй цамц өмсөж, хар хувцастай, залуу хувцас өмсдөг.
4831482968.jpg|0|A young woman holding an oriental umbrella takes photos on the roof of a building .|Дорно дахины шүхэр барьж байгаа залуу эмэгтэй байшингийн дээвэр дээр зураг авдаг.
4831573541.jpg|0|People that are in a wooded area where a man with cooler and women with a blanket appear to be going on a picnic .|Хөнжилтэй, хөнжилтэй, эмэгтэй хүмүүстэй хамт сэрүүн, эмэгтэй хүн зугаалгаар явж байгаа хүмүүс зугаалгаар явж байгаа мэт харагдаж байна.
4831642430.jpg|0|A young man with sunglasses and a blue tank top is playing guitar and kicking up his right leg .|Нарны шил, цэнхэр танкийн шилдэг залуу, цэнхэр өнгийн топ бол гитар тоглож, баруун хөлөө өшиглөж байна.
4831663766.jpg|0|In a small , shallow boat in the water just off the beach , a boy sits while a man navigates with a long pole .|Жижигхэн, гүехэн завин дээр далайн эрэг дээр зүгээр л далайн эрэг дээр гараад, хүү нь урт туйлтай навчит байхад хүү сууж байна.
4831683216.jpg|0|A young girl in a bathing suit drinking a beverage in a green bottle .|Ногоон саванд ундаагаар ууж байгаа нэг залуу охин.
4831684754.jpg|0|A young boy stands barefoot on the beach wearing a green hat and a striped towel .|Залуу хүү нь ногоон малгай, судалтай алчуур өмсдөг далайн эрэг дээр хөл нүцгэн хөл нүцгэн зогсож байв.
4831855344.jpg|0|A woman is walking through town out of the way of traffic where a whole bunch of taxis are collected .|Эмэгтэй хүн бүхэл бүтэн такси цуглардаг замын хөдөлгөөнд явж байна.
4832188862.jpg|0|A bunch of people are walking down a paved street while a man is looking at something .|Хүн ямар нэг юм харж байхад нь хатуу хучилттай гудамжаар алхаж байна.
4832224164.jpg|0|A man in a white shirt and black bag stands by a tree with a group of others mostly dressed in black .|Цагаан цамц, хар цүнхэнд нэг хүн хар өнгөтэй бүлэгтэй модтой, хар өнгөөр хувцасладаг.
4832320050.jpg|0|A young man wearing a red t-shirt and black pants performs a front wheel stand on a bicycle .|Улаан футболк өмссөн залуу, хар өмд нь урд дугуйгаар дугуйгаар зогсож байв.
4832372673.jpg|0|A person in black clothing wearing a backpack is walking down a cobblestone pathway .|Үдэшлэг өмссөн хар хувцас өмссөн хүн бол Cobblestone-ийн зам дээр алхаж байна.
4832759582.jpg|0|A woman walking with a purple tank top turned over on itself so that her blue bra and stomach show .|Нил ягаан өнгийн савтай алхаж буй эмэгтэй өөрөө цэнхэр хөхний даруулга, ходоодны шоуг өөрөө эргүүлэв.
483286214.jpg|0|Four people work in a green field , two wearing white and two wearing red , with green bushes and trees in the background .|Дөрвөн хүн ногоон талбайд ажилладаг, цагаан, хоёр цагаан хувцас өмссөн цагаан, хоёр нь ногоон, ар араараа ногоон хувцас өмсдөг.
4833051916.jpg|0|A person in a striped sweatshirt lifts a log in a park , while children play on a playground .|Судалтай цамцанд байгаа хүн Park-д нэвтрэн орж, хүүхдүүд тоглоомын талбай дээр тоглодог.
483307396.jpg|0|Three children playing on swings in a small park , one little girl wearing pink has her stomach on the swing , a little boy wearing navy track pants and a yellow shirt is half on and half off the swing , and the last little boy is standing in front of the boy on the swing .|Жижиг цэцэрлэгт хүрээлэнд дүүжлэв, нэг бяцхан хүүхэд өмссөн, нэг бяцхан охин дүүжлүүрээр дүүжлүүр нь хөхөрсөн, шар өнгийн цамц өмссөн бяцхан хүү, шар өнгийн цамц нь хагас, шар өнгийн цамц өмсөж, сүүлчийн бяцхан хүү нь зогсож байнадүүжин хүүгийн урд.
4833088018.jpg|0|A man is working or cleaning a door with a towel over his shoulder .|Эр хүн мөрөн дээрээ алчуураар алчуураар хийж, цэвэрлэж байна.
4833270517.jpg|0|Two men dressed in jeans and coats walking down the street with messenger bags .|Гудамжинд гарч буй жинсэн өмд, цув өмссөн хоёр эрэгтэй.
4833342189.jpg|0|two women , one holding a beer bottle and smiling , the other holding a blue cup and looking down .|Нэг эмэгтэй, нэг нь шар айрагны сав барьж, нөгөө нь цэнхэр аяга, доошоо харав.
4833518053.jpg|0|While others gather in areas , a man in a brown shirt sits with reading material in hand .|Бусад хүмүүс газар нутагт цугларч, хүрэн цамцтай эр хүн гартаа унших материалаар сууж байв.
4833518473.jpg|0|There is a suit , shoes and accessories in a display window in the road .|Зам дахь дэлгэцийн цонхонд костюм, гутал, хэрэгслүүд байдаг.
4833520397.jpg|0|A young girl is walking up to a bridge near dusk and is about to pass by a statue .|Залуу охин Дускийн ойролцоо гүүрэн дээр алхаж, хөшөө өгөх гэж байна.
4833609984.jpg|0|A man trying to get ready for work in an evening shift in his family owned restaurant|Гэр бүлийнхээ байранд үдшийн ажил хийхэд бэлэн байх гэж оролдож буй хүн
4833687683.jpg|0|A man and woman with a child are looking through the windows of a shop that sells , at least , sandwiches .|Хүүхэдтэй эрэгтэй, эмэгтэй хүн, дор хаяж сэндвич зардаг дэлгүүрийн цонхоор харж байна.
4833879670.jpg|0|A man is standing on the sidewalk , playing a guitar and singing , with a container of tips by him .|Нэг хүн явган хүний зам дээр зогсож байна, гитар тоглож, гитар тоглож, түүнтэй хамт зөвлөгөө өгөх болно.
4833918883.jpg|0|A man stands on the sidewalk near a lamp post as well as a pillar forming part of an edifice .|Эрэгтэй хүн явган хүний зам дээр зогсож, шалан дээр байрладаг ба дэнлүүний пост-гийн хэсэг, баглаа боодлын хэсэг.
4833952388.jpg|0|A blond girl with a leather jacket on smiles at her friend while they stand in the rain at a concert .|Найздаа инээмсэглэлтэй, борооны хүрэмтэй хамт инээмсэглэлтэй хүрэм.
4834101921.jpg|0|Four people gather together amidst multiple lanterns in the darkness .|Дөрвөн хүн харанхуйд олон дэнлүүг цуглуулдаг.
4834104127.jpg|0|Some men are sitting in a circle by a cart of fruits and vegetables , and trays of fruits or vegetables sitting on some stacked boxes .|Зарим эрчүүд олон тооны жимс, хүнсний ногоо, ногоо, хүнсний ногоо, хүнсний ногоо, хүнсний ногоо, хүнсний ногоо, хүнсний ногоо тариалдаг.
4834121945.jpg|0|Two men are fishing beside a dam one is sitting down and the other one is baiting his hook .|Хоёр хүн далангийн хажууд загасчилж сууж байна.
4834128530.jpg|0|A woman in a burgundy apron is reaching over a table that has brightly colored chairs .|Бургунди Хормогч дахь эмэгтэй хүн тод өнгийн сандал дээр хүрч байгаа хүснэгтэд хүрч байна.
4834128818.jpg|0|A man in a gray and black striped jacket holding artwork is leaning against a chain rope in the street .|Саарал, хар судалтай хүрэмтэй хүн урлагийн бүтээлийг гудамжинд гинжин хэлхээнд бөхийж байна.
4834129500.jpg|0|A man is standing in the doorway of a building with a large mural portrait of a woman on the wall outside .|Эрэгтэй хүн гадаа ханан дээр байгаа эмэгтэйн томоохон хэлтэй эмэгтэйн үүдний хаалганы үүдэнд зогсож байна.
4834129930.jpg|0|A man sitting indian style in front of a ground painting , there are two men and a woman sitting on the curb in front of him and the picture .|Газрын зурагны өмнө Энэтхэгийн хэв маягаар сууж буй хүн түүний өмнө, зураг дээр сууж буй хоёр эрэгтэй, эмэгтэй хүн байдаг.
4834130488.jpg|0|A group of people relax and site see at an outdoor statue design .|Бүлэг нь гадаа амрах, сайт нь гадаа хөшөөний дизайны дагуу харж байна.
