image_name|comment_number|comment|Translated Comment
3701699584.jpg|0|A man in a white and yellow shirt and black shorts is attempting to hit a tennis ball flying his way with a tennis racket .|Цагаан, шар өнгийн цамц, хар шорт, хар шорт нь теннисний бөмбөгийг теннисний цохиураар нисэх гэж оролдож байна.
3701878677.jpg|0|A young child is riding a bike in the dirt along a brick walkway in a park .|Залуу хүүхэд цэцэрлэгт хүрээлэнд парк дахь тоосгоны явган замаар дугуй унаж байна.
370197474.jpg|0|A man in a dark blue jacket sitting on the sidewalk making flowers and birds and attaching wire to the bottom of them .|Явган хүний зам дээр явж буй хар хөх хүрэм, шувуу, шувуу, шувууны ёроолд бэхлэх, утас хавсаргах.
3702038926.jpg|0|A girl runs through an obstacle course outside as some boys watch .|Охид зарим хөвгүүдийн цаг үед гадаа саад тотгороор дамждаг.
3702372756.jpg|0|A man with black hair and a black mustache sitting down and putting his hand above some burning embers while holding a metal bowl .|Хар үстэй хүн, хар сахал, гараа доошоо суулаа
3702436188.jpg|0|a boy wearing a white shirt and pink shoelaces jumping on a railing|Цагаан цамц өмссөн цагаан цамц, ягаан өнгийн шаахай өмссөн хөвгүүд хашлага дээр үсэрч байв
370256193.jpg|0|Wearing a brown jacket , multicolored scarf and purse , an adult female walks along a sidewalk while looking downward next to a green pole with plastic wrapped around it .|Хүрэн хүрэм, олон өнгийн ороолт, түрийвч, түрийвч,
3702607829.jpg|0|Two blond-hair ladies are sitting on a park bench near a body of water .|Хоёр шаргал үстэй хатагтай нар бие махбодийн ойролцоо цэцэрлэгт хүрээлэнгийн вандан сандал дээр сууж байна.
3702634572.jpg|0|A girl is performing a wheelie on her bicycle in front of a gray cinder block building .|Нэгэн охин саарал өнгийн саарал өнгийн саарал өнгийн блокийн байрны урд дугуйгаар дугуйгаа хийж байна.
3703035378.jpg|0|One little girl standing with another little girl piggybacking on her back look at an object .|НЭГ НЭГ НЭГ НЭГ НЭГ НЭГ НЭГ ХҮНИЙГ ХҮСЭХГҮЙ БАЙНА.
3703107969.jpg|0|An extreme bicyclist is performing a jump with his bicycle and rotating the bicycle while he is in the air .|Хэт их унадаг дугуйчин нь унадаг дугуйгаар үсэрч, унадаг дугуйгаа агаарт эргүүлж, унадаг дугуйг эргүүлж байна.
3703188393.jpg|0|A bus that 's being driven by a man that seems to be giving a tour by the woman .|Эмэгтэй хүн аялан тоглолтыг өгч байгаа юм шиг санагдаж байна.
3703413486.jpg|0|Two young boys lean out the window of a white RV with their stuffed toy snake .|Хоёр залуу хөвгүүд чихмэл тоглоомын могойтой цагаан RV-ийн цонхыг гадагшлуулна.
3703960010.jpg|0|a man and a woman sit back to back on a bench in front of a building with a colorful painted door .|Эрэгтэй, эмэгтэй хүн өнгөлөг будсан хаалгатай байшингийн урд сандал дээр буцаж сууна.
3704097614.jpg|0|A man in a black shirt is walking in front of a billboard with an animated dinosaur on it .|Хар цамцтай эр хүн үүн дээр хөдөлгөөнт үлэг гүрвэлийн урд алхаж байна.
3704209910.jpg|0|A man in a gray sweater and khaki pants is standing next to a small red and yellow building , where there is an array of raw meat hanging from a pole outside a window .|Саарал цамцтай хүн, өмд өмд, цонхноос гадуур өлгөгдсөн түүхий махны дэргэдэх жижиг улаан, шар өнгийн байшингийн хажууд байдаг.
370442541.jpg|0|A man and a woman and a young child surrounded by various birds .|Эрэгтэй, эмэгтэй, эмэгтэй хүн төрөлхтүүд хүрээлэгдсэн байдаг.
3704431444.jpg|0|A black and brown dog runs along the sand , avoiding an oncoming wave .|Хар ба Браун нохой нь элсэн дээр элсэн дагуух гүйж очдог.
370445133.jpg|0|The cowboy is struggling to stay on the horse inside of the bullpen as he goes around the red , white , and blue barrel .|Ковбой улаан, цагаан, цэнхэр торхыг тойрон гарахдаа Булчингийн морь доторх морь дотор байхын тулд тэмцэж байна.
3704588601.jpg|0|Men working with electrical equipment on a building .|Байшин дээр цахилгаан тоног төхөөрөмжөөр ажилладаг эрчүүд.
3704642429.jpg|0|A woman in a black t-shirt and light tan long skirt sing at the microphone while her band members play in the background .|Хар футболк, гэрэлтэй эмэгтэй нь хамтлагийн гишүүд арын хэсэгт тоглож байхдаа микрофон дээр дуулдаг.
3704698586.jpg|0|Three people on bikes racing through the orange cones .|Дугуй дээр гурван хүн улбар шар өнгийн боргоцоор уралдаж байна.
3704709223.jpg|0|A man in a tuxedo smiles while standing in front of a microphone and next to a man in a black hat on the electric guitar .|TUXEDO-д эр хүн микрофон, цахилгааны гитар дээрх хар малгайтай хүний хажууд зогсож байхдаа инээмсэглэв.
3704725503.jpg|0|A young girl lying down wearing a light purple top strokes the face of a crying infant|Нил ягаан өнгийн дээд хувцас өмссөн залуу охин нь нялх хүүхдийг уйлж буй нялх хүүхдийн нүүр царайг харав
3704816755.jpg|0|A little girl in pink pajamas brushing her teeth , and a baby laying on the couch behind her .|Ягаан унтлагын өмд цамц өмссөн бяцхан охин шүдээ угааж, түүний ард буйдан дээр хэвтэж байна.
3704836369.jpg|0|Two UFC fighters are fighting in a ring , the opponent on top has flames on his shorts and is about to deliver a punch to his opponent whom he has pinned .|Хоёр UFC тулаанчид цагираг дээр тулалдаж байна, дээд талд нь өрсөлдөгч нь түүний шорт дээр дөлөнд дөл гарч, түүний зүүсэн өрсөлдөгчөө дээшлүүлж, цоолсон өрсөлдөгчөө өргөж ав.
3704995657.jpg|0|A person rides a snowmobile over the snow and does a stunt .|Хүн цасны дээгүүр цас мотоцикль, хоцролт хийдэг.
3705430840.jpg|0|A man wearing a long-sleeved blue shirt and jeans is riding a unicycle down a street .|Урт ханцуйтай цэнхэр цамц өмсөж, жинсэн өмд өмссөн хүн гудамжинд унадаг дугуй унаж байна.
3705470430.jpg|0|A girl wearing a short-sleeve floral print dress with a watch on has a microphone and appears to be speaking or singing to a man with a sports coat , orange shirt and hat on who is playing a guitar .|Богино ханцуйтай цэцэгсийн хувцас өмссөн охин микрофонтой хувцас өмссөн охин микрофонтой, спортын цув, улбар шар цамц, гитар тоглож байгаа хүнтэй хамт ярьж, дуулдаг.
3705560226.jpg|0|A man with clown makeup on is holding a guitar and a harmonica while standing in front of a microphone .|Микрофоны урд зогсож байхдаа алиалагч нүүр будалт, гармоника гитар, гармоника барьж байна.
3705585216.jpg|0|A guy with a painted face and a top hat on stage smiling with two other people .|Будсан нүүр царайтай, нөгөө нь тэй тайзан дээр,
3705688385.jpg|0|A shirtless boy throwing something with the sunlight low on the water|Цамцгүй хөвгүүн нарны гэрэлд ямар нэг юманд ямар нэг юм урсаж байна
3705781399.jpg|0|A man in red trunks with tattoos on his right arm is boxing a man in black trunks inside a boxing ring .|Баруун гар дээр шивээс хийлгэсэн улаан хонгилд эрэгтэй хүн боксын цагирган дотор хар хүрэн өнгөтэй хүн хайрцаглаж байна.
3705976184.jpg|0|A woman is running with a dog in a grassy field with trees in the background .|Эмэгтэй хүн нохойтой хамт өвс ногоотой хамт ургадаг.
3706019147.jpg|0|A boat full of Asian people is sailed through reeds and bushes .|Азийн хүмүүсээр дүүрэн завь нь зэгс, бут сөөгөөр явагддаг.
3706019259.jpg|0|"A couple , who appear to be Indian or Pakistani , walk on a path beside a body of water , the mother carrying a child in a diaper , the father wrapped in a blanket with the logo of the humanitarian organization "" Save the Children . """|Хосууд, Энэтхэг эсвэл Пакистан, бие махбодийн дэргэдэх биений хажууд гараараа алхаж байгаа бол аав нь хүмүүнлэгийн зохион байгуулалттай байдаг.
3706020467.jpg|0|A boy is sitting on a small boat with two flags flying from it not far from the coast with some trees in the background .|Хөвгүүн жаалхүү нь эргээд, энэ нь эргийн арын хэсэгт газар холгүй газар нисч байсан хоёр туг дээр сууж байна.
3706064643.jpg|0|A boy contorts his face while holding an electronic device .|Хөвгүүн нь цахим төхөөрөмжийг барьж байхдаа нүүрээ зааж өгдөг.
370614244.jpg|0|A greasy haired man with a mustache explaining what is wrong with the object in his hand .|Тариалангийн үстэй, түүний гарт байгаа зүйлийг буруу зүйл гэж тайлбарласан сахалтай үстэй хүн.
370614351.jpg|0|A person in a kilt and a sports jersey and a Mohawk is in a store .|Kilt болон Spore Jersey, Mohawk дэлгүүрт байгаа хүн дэлгүүрт байна.
3706356018.jpg|0|Five children on a white-metal midair ride called the frog hopper .|Цагаан металл Midair Midair дээр FROG HOPPER гэж нэрлэдэг.
3706579316.jpg|0|Four people wearing flip-flops , three of which have sunglasses on , posing for a picture near a body of water .|Flip-Flops өмссөн дөрвөн хүн, нарны шил, усны биений ойролцоо зураг авахад зориулагдсан гурван хүн.
3706602030.jpg|0|A young man with a beard is about to drive off in a red GoKart from Moto Rent in Colonia .|Баавгайтай залуу хүн Колони улсад Мото түрээсийн улаан гокарт руу явах гэж байна.
3706653103.jpg|0|a bicyclist wearing a helmet jumping a trick on his back tire|Дуулга өмссөн унадаг дугуйчин нь арын дугуй дээр хуурч байна
3706980933.jpg|0|An older man wearing jeans and a baseball cap sits on a lawn chair in a busy section of an urban area .|ХӨДӨЛГӨӨНИЙ ЖИНХЭНЭ, ХӨДӨЛМӨРИЙН ХӨДӨЛМӨР, ХӨДӨЛМӨРИЙН ХӨДӨЛМӨРИЙН ЗОРИУЛСАН МЭДЭЭЛЛИЙГ ХӨДӨЛГӨӨНД ЗОРИУЛЖ БАЙНА.
3707077198.jpg|0|A person in the air while skateboarding , in front of a wall of graffiti .|Тэшүүрээр явж байхдаа тэшүүрээр ажилладаг хүн граффитигийн өмнө.
370713359.jpg|0|Crowded Mexican restaurant , empty chair in foreground .|Мексикийн зоогийн газар хөл хөдөлгөөн ихтэй, нүүрэн дээрх хоосон сандал.
3707283973.jpg|0|Three people on a walk down a cement path beside a field of wildflowers with skyscrapers in the background .|Арын ткайккрер бүхий зэрлэг цэцэг бүхий зэрлэг цэцэгсийн хажууд очиж,
3707585013.jpg|0|A woman sings and plays guitar while young adults mill around in the background .|Залуу насанд хүрэгчдийн тээрэмдэж байхдаа эмэгтэй хүн гитар дуулж, тоглодог.
3707649986.jpg|0|Three handlers lead a string of 11 camels , each carrying a pair of riders , through shallow water on a beach .|Гурван гарын авлага нь 2 тэмээний мөрийг хөтөлдөг, тус бүр нь далайн эрэг дээр гүехэн усаар дамждаг.
3707738261.jpg|0|A little girl in a pink jacket throws leaves over her head in front of a fence .|Ягаан хүрэмтэй бяцхан охин нь хашааны урд толгойноос навчис шиддэг.
3707902579.jpg|0|"Five men in white t-shirts are looking at something underneath a McDonalds sign that states "" Bag of ice .99 "" ."|"Цагаан футболк дахь таван эр МакДональтууд ""МакГональчууд"" МакГональчууд ""мөсний уут."
3707990914.jpg|0|A girl in pink and yellow on a pink and orange surfboard cuts through the wave .|Ягаан, шар, улбар шар, улбар шар өнгийн гадаргуу дээр ягаан, улбар шар өнгийн самбараар тайрдаг.
3708172446.jpg|0|Two men are sitting on a bench looking at a water fountain|Хоёр хүн усан оргилуур руу хардаг вандан сандал дээр сууж байна
3708177171.jpg|0|A youth with brown hair is doing an ollie over a bench with his skateboard .|Хүрэн үстэй залуучууд Тэшүүрээр Тэшүүрээраа вандан сандал дээр байрладаг.
3708244207.jpg|0|A man stands on a dock near several boats , while 2 other men are on one of the boats .|Нэг хүн хэд хэдэн усан онгоцны дэргэд буухаар зогсож, 2 бусад нь завины нэг дээр байдаг.
3708266246.jpg|0|A black and white dog is going through an obstacle course .|Хар ба цагаан нохой нь саад бэрхшээлийг даван туулж байна.
3708441539.jpg|0|A city street with a telephone booth , passing cars , a parked bicycle , and a blond woman with a purse and young girl with a backpack walking away .|Утасны лангуутай хотын гудамж, автомашин, зогсоол, зогсоол бүхий унадаг дугуй, шаргал үстэй, шаргал үстэй, шаргал үстэй, шаргал үстэй
3708743823.jpg|0|A person snowboarding leaps over an obstacle to continue down the hill .|Хэн нэгэн цасан урлалын уналтыг толгод дээрээс доошоо үргэлжлүүлэн хий.
3708748633.jpg|0|A man wearing a coat and a plaid green skirt is playing a bagpipe .|Бээлий өмссөн хүн, барьцаалан ногоон банзал өмсдөг хүн цүнх тоглож байна.
3708839890.jpg|0|A black dog leaps from the water near a wooded shoreline|Хар нохой нь ой модтой эрэг дээр ойролцоо уснаас үсрэв
3709030554.jpg|0|This boy , wearing a red shirt and blue shorts , is running .|Энэ хүү, улаан цамц, цэнхэр өнгийн шорт өмссөн, гүйж байна.
3709301369.jpg|0|A man is in an ornate , wood paneled room , standing and playing an unusual semi-circular instrument while being accompanied by a wind ensemble composed of young people who are sitting behind him .|Эрэгтэй хүн гоёл чимэглэл, модон самбар дээр сууж, зогсож байхдаа Салхи, цаана нь сууж,
3709522287.jpg|0|A woman in a kitchen holds a can surrounded by bowls .|Гал тогооны өрөөнд байгаа эмэгтэй нь аяганд хүрээлэгдсэн байдаг.
3710050559.jpg|0|A little boy in shorts and sandals is sitting in the grass .|Богино, шаахайнууд, шүлсний дунд бага зэрэг хүү сууж байна.
3710073758.jpg|0|A person rides a jump high into the air and upside down on a bicycle .|Хүн агаарт үсэрч, унадаг дугуйгаар доошоо үсэрч унадаг.
3710176138.jpg|0|A little boy landing with a splash on a very wet slip & slide .|Маш нойтон гулсалт, слайд дээр жаахан хүүхэд буух.
3710353645.jpg|0|A young girl wearing a pink dress jumps through the air over playground equipment .|Ягаан өнгийн даашинз өмссөн залуу охин нь тоглоомын талбайн тоног төхөөрөмжөөр дамждаг.
3710468717.jpg|0|Two children and a dog play in the snow with a woods behind them .|Хоёр хүүхэд, нохой цастай хамт цастай хамт оёх.
3710520638.jpg|0|The black dog with a red collar is jumping through the water .|Улаан хүзүүвчтэй хар нохой нь усаар үсэрч байна.
3710607005.jpg|0|Young man with eyeglasses and goatee , wearing striped pajama pants and a blue sport 's shirt , sitting on his bed , mouth wide open .|Нүдний шил, gooeegees, gooee-тэй, судалтай унтлагын өмд өмд өмсөж, цэнхэр спортын цамц, орон дээрээ,
3710674892.jpg|0|child with a green apple in his mouth is wearing a red life jacket|аманд нь ногоон алимтай хүүхэд улаан амьдралын хүрэм өмсдөг
3710675147.jpg|0|A man and a woman are sitting , while working on the wheel of a blue vehicle .|Эрэгтэй, эмэгтэй хүн цэнхэр тээврийн дугуй дээр ажиллаж байхдаа сууж байна.
3710916676.jpg|0|A group of African girls in colorful clothing sitting Indian style on the ground .|Газар дээр нь Энэтхэгийн хэв маягаар нь Африкийн охидын бүлэг.
3710971182.jpg|0|Men play some type of sport on the field with what looks like hockey sticks .|Эрэгтэйчүүд хоккейн саваа шиг харагддаг зүйл дээр хэдэн төрлийн спортоор хичээллэдэг.
3711030008.jpg|0|A woman in a pink hooded sweatshirt carrying advertisement signs down a sidewalk .|Хостой цамцтай цамц нь явган хүний зам дээр гарын үсэг зурдаг.
3711113772.jpg|0|Two young women are talking with a young man in a wheelchair , while two other young men look on .|Хоёр залуу эмэгтэй тэргэнцэртэй залуутай ярилцаж байна, харин бусад хоёр залуу эрчүүдийг харж байна.
371121323.jpg|0|A young man with a shaved head and glasses is sitting at a kitchen table using a computer .|Хуссан толгой, шил, нүдний шил нь гал тогооны өрөөний гал тогооны өрөөнд сууж байна.
371123959.jpg|0|Man watching cartoons on television with the arm of a second person across from him reaching for candy in a dish and a Christmas tree in the background .|Хүн телевизийн хүүхэлдэйг телевизээр телевизээр телевизээр телевизээр телевизээр ая тухтай байдалд хүрч, арын дэвсгэр дээр тавь.
3711253664.jpg|0|Man with a baby strapped to his chest looking off into the distance .|Нялх хүүхэдтэй хүн түүний цээжин дээрээс хол зайд харав.
3711340791.jpg|0|An ariel view of a man in an orange hard hat and harness fixing something that is up above the city behind him with some kind of tool .|Улбар шар хатуу малгайтай хүний харц, бэхэлгээтэй, бэхэлгээ нь түүний араас хол байгаа юм
3711344791.jpg|0|A man wearing an orange shirt and orange hard hat is working on something high above other buildings and a street below .|Улбар шар өнгийн цамц өмссөн эр, жүржийн хатуу малгай нь бусад барилга байгууламж, гудамжинд өндөр зүйл дээр ажиллаж байна.
3711346809.jpg|0|A man wearing an orange helmet is sitting on a crane seat looking down .|Улбар шар өнгийн малгай өмссөн эр хүн ширүүн харцаар сууж байна.
3711352975.jpg|0|A very young naked baby with a feeding tube in it 's nose is being washed by a female in a Rubbermaid type container filled with soap suds .|Хоол тэжээлийн хоолойтой маш залуу нүцгэн нялх хүүхэд.
3711354907.jpg|0|A man wearing an orange hard hat is being lowered down the side of a building .|Улбар шар өнгийн хатуу малгай өмссөн хүн барилгын хажуу талыг доошлуулж байна.
371139037.jpg|0|A man in a black shirt and a woman in black and red sit at a table eating together .|Хар цамц, хар цамц, эмэгтэй хүн хамтдаа хоол идэж буй ширээн дээр сууж байв.
3711539753.jpg|0|Two people are looking at a fancy motorcycle while a woman inside a restaurant is looking at them .|Хоёр хүн ресторанд байгаа эмэгтэйг харж байхад хоёр хүн зугаатай мотоциклийг харж байна.
3711606914.jpg|0|A little boy is riding a dirt bike with the number seven on it going down a hill .|Бяцхан хүү нь толгод дээр доошоо буусан дугаартай шороон дугуй унаж байна.
3711611500.jpg|0|The black dog is wearing a red collar and is jumping into the water after a Frisbee .|Хар нохой улаан хүзүүвч өмсөж, Фрисби дараа ус руу үсэрч байна.
3711664623.jpg|0|A family of two young boys and a woman and man pose in front of a scenic background .|Хоёр залуу хөвгүүд, эмэгтэй хүний гэр бүл, эрэгтэй, эрчүүд үзэсгэлэнт арын урд байрладаг.
3711826708.jpg|0|A dog is running through a very wooded area with large white flowers .|Нохой том цагаан цэцэг бүхий маш том модтой талбайгаар гүйж байна.
3711851074.jpg|0|Shoppers purchase produce from a busy grocery store in Asia .|Дэлгүүрийн дэлгүүрүүд Ази дахь завгүй хүнсний дэлгүүрээс худалдаж авдаг.
3712008738.jpg|0|A woman splashes in water , with others in the background .|Эмэгтэй хүн усанд цацаж, бусадтай бусад хүмүүстэй хамт байдаг.
37120680.jpg|0|A brunette with her hair in a bun is located near color coded buckets and is wearing a hoodie with a doll embroidered onto the hood .|Бундтай үстэй үстэй үстэй үс нь өнгөний кодлогдсон хувингийн ойролцоо байрладаг бөгөөд бүрээс дээр хатгамалтай хамт цийлэгнэж, хумс өмссөн хүүхэлдэйтэй хулай өмсдөг.
3712463209.jpg|0|A man works on the rear tire of a bike while a baby looks on from behind the bike .|Нялх хүүхэд унадаг дугуйны арын дугуйны арын дугуй дээр ажилладаг.
3712574653.jpg|0|A lady brings a drink to a seated couple comprised of a woman wearing a long white dress and a man in a dark suit .|Нэгэн хатагтай нь урт цагаан даашинз, харанхуй хувцас өмссөн эмэгтэйгээс бүрдсэн эмэгтэйгээс бүрдсэн хосуудаас бүрддэг.
371269133.jpg|0|An older man in sunglasses , a hat and a leather jacket plays the trumpet on a fall day .|Нарны шил, малгай, малгай, савхин хүрэм нь бүрээ нь бүрээ дээр бүрээ тоглодог.
3712720433.jpg|0|Two young boys and a young girl wrestle around outside atop leaves while two other spectators are off to the left .|Хоёр залуу хөвгүүд, залуу охин зүүн гараад бусад хоёр үзэгчид зүүн тийш явна.
3712742641.jpg|0|A black and white dog is swimming in a large green lake .|Хар ба цагаан нохой том ногоон нууранд сэлж байна.
