image_name|comment_number|comment|Translated Comment
3874741721.jpg|0|A man wearing a black hat , buttoned shirt , tie , dark shorts , and black and red shoes speaks loudly as bystanders see flames in the street .|Хар малгай өмссөн эр, товчлууртай цамц, зангиа, харанхуй шорт, хар, улаан гутал нь гудамжинд галын дөлөөр чанга ярьдаг.
3875226464.jpg|0|A man and a woman are having a conversation , while the man drinks a beer .|Эрэгтэй, эмэгтэй хүн яриа өрнүүлж байхад хүн шар айраг ууж байх үед.
3875347394.jpg|0|A man is holding a blue fishing net in front of some rocks .|Эр хүн зарим чулуулгийн урд цэнхэр загас барих тор барьж байна.
3876652419.jpg|0|A guy in a black shirt is looking to catch a water-melon with two other boys present .|Хар цамцтай залуу нь бусад хоёр хөвгүүдтэй усан үзмийн гараараа ус барихыг хайж байна.
3876751750.jpg|0|A man is wearing black and yellow with a black and yellow helmet riding a mountain bike .|Эрэгтэй хүн хар, шар өнгийн малгайтай хар, шар өнгийн малгай өмссөн байна.
3876949547.jpg|0|A woman sits in a chair on the beach , backdropped by the ocean .|Эмэгтэй хүн далайн эрэг дээр сандал дээр сууж, далайгаар буулгасан.
387697067.jpg|0|A man wearing a black cap and white shirt rowing a boat on open water .|Хар малгай, цагаан цамц өмссөн хүн.
3877209225.jpg|0|One child holds another child 's hand as the second child slides down a blue side face forward .|Нэг хүүхэд хоёр дахь хүүхэд нь цэнхэр талыг урагш хойшлуулаад өөр хүүхдийн гарыг барьдаг.
3877389540.jpg|0|A painter is sitting at a street corner and has completed the majority of a painting of the Cafe across the street from himself .|Зураач гудамжны буланд сууж байна, гудамжны дийлэнх нь кафены дийлэнх хувийг өөрөө төгссөн.
3877444622.jpg|0|This dark-skinned man checks his phone while riding in what looks like a bus .|Энэхүү харанхуй арьстай хүн автобусанд сууж байхдаа утсаа шалгаж байхдаа утсаа шалгадаг.
3877444976.jpg|0|Two men in blue one standing the other hanging onto the window of a tram car just looking out .|Хөх цэнхэр өнгөөр хоёр эр нэг хүн трамвайны машины цонх руу зогсож байв.
3877788776.jpg|0|A woman in an orange sari sits in front of a low wall among baskets of vegetables that include potatoes .|Улбар шар саран дахь эмэгтэй хүн төмс агуулсан ногооны дунд бага ханан дээр сууна.
387822740.jpg|0|A little child with a sweater , blue shirt and black pants , holding a broom in a kitchen .|Намрын цамц, цэнхэр цамц, хар өмд, гал тогоонд шүүрч авав.
387830531.jpg|0|a brown dog about to jump on a smaller black and tan dog|Браун нохой нь жижиг хар ба тан нохой дээр үсрэх гэж байна
3878630626.jpg|0|Man in black pants , white shirt playing a flue as a lady in pink dances|Хар өмд, цагаан цамц өмссөн цагаан цамц нь ягаан өнгийн бүжиг шиг эмэгтэй
3878693122.jpg|0|Three guys outside on the grass one guy doing a somersault , the other two guys seem to be resting while the crowd standing around watching them|Нэг залуугийн гадаа гурван залуу хүн нэг залуу хийж байна, нөгөө залуу нь
387963391.jpg|0|A adult man negotiates a city lane on a three wheel bicycle which is carrying a large blue plastic drum used to hold water which he might use or be delivering|Насанд хүрэгчдийн хүн Хотын эгнээгээр хотын эгнээтэй, түүнийг ашиглаж болох, эсвэл хүргэхэд ашигладаг том цэнхэр өнгийн дугуйтай хотын эгнээний эгнээ
387974450.jpg|0|A dark colored dog running in a field with multilple birds in the background .|Нээрээ олон шувуутай талбайд талбайд гүйдэг харанхуй өнгөт нохой.
3879927955.jpg|0|A woman is sitting in a street market stand where there are various items for sale , such as fish .|Загас гэх мэтээр зарагдах гудамжны зах зээл дээр эмэгтэй гудамжинд сууж байна.
3879971251.jpg|0|A closeup view of a guitarist in a red shirt standing outside , with a group of children playing around him .|Гадаа улаан цамцтай улаан цамцтай, түүний эргэн тойронд тоглож байгаа хүүхэдтэй хамт олон тооны хүүхэд.
3880125306.jpg|0|A young boy balancing on a board in a lake , his arms raised and appearing to be standing on just the water .|Нуурангийн самбар дээр нэг залуу хүү тэнцвэржүүлж, гараа өргөж, зүгээр л усан дээр зогсож байв.
38803368.jpg|0|Two young men are on a vast , level expanse of grass , and the man in the red shirt is catching the white Frisbee .|Хоёр залуу эрэгтэй хүний өргөн уудам, түвшний том хэмжээтэй өвс, улаан цамц өмссөн хүн цагаан цамцтай эрийг барьж байна.
3880366728.jpg|0|A dancing couple is performing a dip where the man is crouched nearly to the floor .|Бүжиглэх хос нь эрэгтэй хүнийг бараг л шалан дээр хусаж байгаа дүрмийг гүйцэтгэж байна.
3880471209.jpg|0|A blond man in a striped shirt and jeans sitting at a table with a computer and talking on a cellphone .|Судалсан цамц, жинсэн өмд, эмэгтэй хүн компьютертэй хамт ширээн дээр сууж, гар утсаар ярих ширээн дээр сууж байсан.
3880726770.jpg|0|Spices and other goods are being put in display in what appears to be a local village shop .|Орон нутгийн тосгоны дэлгүүр болж буй амтлагч болон бусад бараа бүтээгдэхүүнийг харуулах болно.
3880770726.jpg|0|A man who wears glasses , a blue shirt and a Chicago White Sox cap holds a young boy who also wears a blue shirt .|Нүдний шил зүүж, цэнхэр цамц өмсдөг хүн, цэнхэр цамц, Чикаго Цагаан Кап нь цэнхэр цамц өмсдөг залуу хөвгүүдийг эзэмшдэг.
3880775790.jpg|0|A couple of camels laying on the beach , one of them has a little girl as a rider .|Далайн эрэг дээр хэвтэж байсан хоёр тэмээ нь тэдний нэг нь бяцхан охинтой бол бяцхан охинтой.
388088725.jpg|0|Three men wearing black jackets are talking to two ladies in tanks tops .|Хар хүрэм өмссөн гурван эрчүүд танк дээр хоёр эмэгтэйтэй ярилцаж байна.
3881645432.jpg|0|An aisle at Best Buy with an employee standing at the computer and a Geek Squad sign in the background .|Компьютер дээр зогсож байгаа ажилтан, Geek Squad тэмдэг дээр байгаа ажилтантай хамт хамгийн сайн худалдаж аваарай.
3882399405.jpg|0|An elderly person wearing a red hat is holding a child wearing an adult sized jacket .|Улаан малгай өмссөн хөгшин хүн насанд хүрэгчдийн хэмжээтэй хүрэм өмссөн хүүхдийг барьж байна.
3882404731.jpg|0|Woman is detained by police in front of a crowd of onlookers .|Эмэгтэй хүн цагдаа нар цагдаа нарыг үзэгчдийн өмнө саатуулжээ.
3883055159.jpg|0|A group of older men sit around a table full of food in a restaurant , it looks to be a good time .|Хөгшин бүлэг бүлэг хүмүүс ресторанд хоол дүүрэн ширээн дээр сууж байна.
3883110262.jpg|0|A middle-aged lady holds a young girl in her arms as they sleep in an indoor booth .|Дунд насны бүсгүй, дотор нь унтаж байхдаа залуу охиныг гартаа барьдаг.
3883179400.jpg|0|A yellow taxi and a person riding a bicycle travel in the same direction .|Шар такси, унадаг дугуй унаж буй хүн нэг чиглэлд аялдаг.
3883192246.jpg|0|A man in a blue uniform works beside a train on train tracks .|Галт тэрэгний зам дээр галт тэрэгний хажууд цэнхэр жигд ажилладаг хүн.
388386075.jpg|0|A young boy pulling down his eyeglasses and looking a toy trains|Залуу хүү түүний нүдний шилээ доош татаж, тоглоомын галт тэрэг хайж байна
3884010975.jpg|0|A woman in a white shirt stands behind a counter , in the kitchen of an empty restaurant with brick walls .|Цагаан цамцтай эмэгтэй хүн тоолуурын ард зогсож, хоосон зоогийн газрын гал тогооны өрөөнд хоосон зоогийн газар байрладаг.
3884461163.jpg|0|A young African woman is holding up an octopus while sitting down in the sand .|Африкийн залуу эмэгтэй элсэн дээр сууж байхдаа найман цахим эмэгтэйг барьж байна.
3884704036.jpg|0|Two officials in white and black uniforms speak with pedestrians in the street at night .|Цагаан, хар дүрэмт хувцастай хоёр албан тушаалтнууд шөнийн цагаар гудамжинд явган зорчигчтой ярьдаг.
3885034832.jpg|0|A white man wearing a ball cap and backpack is riding a bicycle while flipping the camera an obscene gesture .|Бөмбөгийн малгай өмссөн цагаан арьст хүн, үүргэвчиндээ дугуй унах үед дугуй унаж байх үед дугуй унаж байна.
3885251820.jpg|0|A woman stands on a wide , flat beat holding up a squid or octopus by a sting .|Эмэгтэй хүн өргөн, хавтгай цохилтоор хавтгай, хавтгай цохилтыг хулгайлж, octopus эсвэл octopus.
388526913.jpg|0|A young girl stands behind sever knick-knacks , such as dolls , a statue of jesus , and a statue of the virgin mary , outdoors|Залуу охин нь knick-Knick-Knacks-ийн ард зогсож,, Есүсийн хөшөө, онгон Мэри, гадаа хөшөө
388546416.jpg|0|A woman and two men walking down a hill on a sandy beach .|Эмэгтэй, хоёр эр элсэрхэг далайн эрэг дээр толгод дээр алхаж байв.
388604469.jpg|0|Four guys in striped shirts playing music instruments in a restaurant .|Ресторанд хөгжмийн зэмсэг тоглож буй судалтай цамц өмссөн дөрвөн залуу.
3886962927.jpg|0|Black man in blue trunks covered in soap suds taking a bath in a source of water near stairs .|Шатны ойролцоо усаар хучигдсан цэнхэр их биед хар хүн усанд ордог.
3887428186.jpg|0|A worker in a safety vest and hat is unloading equipment from the back of a truck .|Аюулгүй байдлын хантааз, малгай, малгай өмссөн ажилчин бол ачааны машины арын төхөөрөмжөөс ачигдсан тоног төхөөрөмж юм.
388747389.jpg|0|An older man in shorts , showing healthy-looking legs , astride a bicycle , pauses at an intersection|ХӨДӨЛГӨӨНД ЭРҮҮЛ МЭНДИЙН ХУДАЛДАА, ХУВИЙН ХУДАЛДААНЫ ХУГАЦАА, ХӨДӨЛГӨӨН, УРИГИЙН ХУДАЛДАН АВЧ БАЙНА
3887487086.jpg|0|This is a closeup of a young , innocent-looking boy with tousled hair who is holding with both hands what seems to be a plastic , green and orange beach ball with a butterfly design as the sun shines upon him from his right .|Энэ бол хоёр гараараа барьж байгаа залуу, гэмгүй, ногоон, улбар шар, улбар шар, улбар шар, улбар шар, улбар шар, улбар шар өнгийн эрэг
3887721909.jpg|0|Two ladies in matching dresses and shoes , both wearing straw hats pulled down over their faces , are napping on a bench next to a rolling suitcase .|Хоёулаа таарч, гутал өмссөн хувцас, гутал өмссөн хоёр бүсгүйд хоёр эмэгтэй сүрэл малгай өмсдөг, хоёулаа нүүрэн дээр нь доош нь татдаг.
388790511.jpg|0|A chinese child in a yellow old navy sweatshirt and brown camouflage pants is shown sitting on a red couch and playing with a phone .|Хуучин Хуучин Хуучин Хуучин Тэнгисийн цамц, хүрэн өнгөлөн далд өмд өмд нь улаан буйдан дээр сууж, утсаар тоглож, утсаараа тоглож байна.
388813855.jpg|0|A boy wearing a red shirt practicing calligraphy while being watched by other children .|Улаан цамц өмссөн улаан цамц өмссөн улаан цамц өмсдөг.
3888267140.jpg|0|An older woman is working behind a counter at a restaurant .|Хөгшин эмэгтэй ресторанд лангуун дээр ажиллаж байна.
388836789.jpg|0|Two girls , one wearing a pink shirt and the other wearing a white shirt , are throwing hay in the air .|Хоёр охин, нэг ягаан цамц өмссөн ягаан цамц, нөгөө нь цагаан цамц өмсдөг, нөгөө нь агаарт өвс хаядаг.
388837010.jpg|0|Two children looking at horses through a small fence .|Жижиг хашаа дундуур адууг харж байна.
3888575744.jpg|0|A man leans against a street post behind a large , green mask .|Хүн том, ногоон маскны ард гудамжны албан тушаалд тулгардаг.
388913235.jpg|0|A person wearing a hat sits in a store with coats and other articles of clothing hanging on the walls .|Малгай өмссөн хүн дэлгүүр, ханан дээр өлгөөтэй хувцас өмссөн дэлгүүрт сууж байна.
3889526603.jpg|0|Several people gathered in front of the sunrise over a mountain range , while sitting on prayer mats .|Залбирлын дэвсгэр дээр нар мандах үеэр нар мандахын урд цугларав.
3889711490.jpg|0|Five women wearing scarves , sitting in a row , on the ground in front of an old stone wall working with their hands .|Оро ороолт өмсөж, дараалан сууж, хуучин чулуун ханан дээр гараа дээшлүүлдэг хуучин чулуун ханан дээр байрладаг.
3890054701.jpg|0|Three men , dressed in casual attire , are jumping in the air above a flat artificial surface .|Гурван эрэгтэй, энгийн хувцас өмссөн, энгийн хувцас өмсөж, хавтгай хиймэл гадаргуу дээр үсэрч байна.
3890223491.jpg|0|A man with a white t-shirt and red hat is working outside a house .|Цагаан футболк, улаан малгай байшингийн гадна ажиллаж байна.
3890244554.jpg|0|A dance instructor gives instruction to a group of people in a sea of foam .|Бүжгийн багш нь хөөс далайн тэнгисийн бүлэгт заавар өгдөг.
3890247909.jpg|0|A man in a blue shirt and khaki shorts is playing with his black and yellow dogs in a large grassy field .|Цэнхэр цамцтай эр, Хаки Хаки шорт нь хар, шар нохойтойгоо том өвслөг талбайд тоглож байна.
3890981926.jpg|0|Woman in black jacket and blue pants rides bike on shoulder through construction area .|Хар хүрэм, цэнхэр өмдтэй эмэгтэй барилгын талбайгаар дугуй унадаг дугуй унана.
3890984576.jpg|0|An older man in a suit jacket and dress shoes is riding a bicycle in the street .|Ахмад хүн костюм, даашинз, даашинзны гутал гудамжинд унадаг дугуй унаж байна.
3891014226.jpg|0|A person with a blue backpack and a purple helmet rides a bicycle over a narrow bridge .|Цэнхэр үүргэвчинтэй хүн, ягаан дуулга, ягаан дуулга нь нарийн гүүрэн дээр унадаг дугуй унадаг.
3891229941.jpg|0|An experienced young surfer in California enjoying the waves on a sunny Saturday .|Калифорнийн туршлагатай залуу сугалагч нар нарлаг бямба гаригт давалгаа өнгөрөөсөн.
389136029.jpg|0|A young woman partying at a local nightclub with her friends and is wearing a sports bra .|Найз нөхөдтэйгээ орон нутгийн шөнийн цагаар үдэшлэг зохион байгуулж, спортын хөхний даруулга өмссөн залуу эмэгтэй.
3891886294.jpg|0|A groom picks up his bride and kisses her underneath an enclosure at factory .|Хүргэн ирж байгаа нь сүйт бүсгүйгээ авч, үйлдвэрт хашааны доор үнсэж байна.
3892428805.jpg|0|A woman in a knitted brown jacket looking at the camera while sitting in front of a table covered in food and food preparation tools .|Хоол хүнс, хүнсний бэлтгэлд хамрагдсан хүснэгтийн урд сууж байхдаа сүлжмэл хүрэн хүрэмтэй эмэгтэй.
3892563639.jpg|0|Two adult llamas sitting , while one baby llama rubs against its parent and another rubs against its owner|Насанд хүрэгчдийн хоёр лламууд сууж байхдаа нэг хүүхэд Ллама эцэг эхийнхээ эсрэг эцэг эхийнхээ эсрэг, нөгөө нь түүний өмчлөгчийн эсрэг ургадаг
3892971736.jpg|0|A young man does n't understand why there is an egg on the table in front of him .|Залуу хүн яагаад түүний өмнө ширээн дээр өндөг байдаг гэдгийг ойлгодоггүй.
3893021168.jpg|0|Young girl reads the description of park statue ; there are trees in the background .|Залуу охин Паркийн хөшөөний тайлбарыг уншдаг;Арын дэвсгэр дээр мод байдаг.
3893267383.jpg|0|A group of children , each carrying a handful of balloons , being led by a child waving a colorful flag .|Нэг бүлэг хүүхдүүд, цөөн хэдэн бөмбөлөг авч, хүүхэд нь өнгөлөг далбаа даллаж байв.
3893397403.jpg|0|A man wearing a blue blazer using a cane to help him walk across the crosswalk .|Загварын замаар алхахад нь туслахын тулд Cane-ийг ашиглан цэнхэр өнгийн Blazer өмссөн хүн.
3893510114.jpg|0|Men gather around during a chess game played in a pool .|Усан санд тоглож байсан шатрын тоглоомын үеэр эрчүүд цуглардаг.
3893700052.jpg|0|An older caucasian couple is having their picture taken by a stone statue of a man and woman kissing .|Хуучин Кавказын хосууд нь эрэгтэй, эмэгтэй үнсэлтийн чулуун хөшгийг авсан зурагтай.
3893946197.jpg|0|Two people with on bicycles riding along while wearing helmets and shorts .|Дуулга, шорт өмсөж байхдаа унадаг дугуй унаж байгаа хоёр хүн.
3894241635.jpg|0|Two young men and two boys are sitting down on a boat next to an anchor and watching the water .|Хоёр залуу эрэгтэй, хоёр хөвгүүд зангуу, усыг харж, усыг ажиглаж байна.
3896057129.jpg|0|On the sidewalk , near the store 's entrance , a local entertains all , by playing the accordion .|Явган хүний зам дээр, дэлгүүрийн ойролцоо, орон нутгийн ирмэгийг бүхэлд нь зугаацуулж,
389643437.jpg|0|A girl in a white cap eats a slice of fruit next to a girl in a blue cap who is eating chocolate .|Цагаан малгай өмссөн охин нь шоколад идэж буй цэнхэр малгайтай охины хажууд нэг зүсэм жимс иддэг.
3896878460.jpg|0|An old woman with a flowered print dress stirring some type of food in large barrels .|Флорал хэвлэлийн хувцастай хуучин эмэгтэй том торхонд зарим төрлийн хоолыг хутгана.
3897245055.jpg|0|A lady with orange hair and a yellow t-shirt is pouring a glass of draft beer .|Улбар шар өнгийн үстэй хатагтай, шар өнгийн футболк нь ноорог шар айрагны шилийг асгаж байна.
3897459678.jpg|0|A lone person stands in front of a yellow shingled shed like building on an empty street while above them sits a bike resting on a railing .|Дээрх дээр нь гялалзсан гудамжны урд талын гялалзсан шарилж байгаа шар зонхилох нь мөрөн дээр байрладаг.
3897909588.jpg|0|A surfer in black attempts a 180 turn against a cascading wave with a white surfboard .|Хар сугалааны давалгаанд 180-р шатанд өртөх нь цагаан гадаргуутай долгионтой долгионыг эргүүлнэ.
3897909602.jpg|0|Two men wearing surfing suits surf on a medium sized wave on a clear sunny day .|Surfing Serfing Suits Suits Suits Suits Suits Surf Surf-ийг олон тооны нарлаг өдөр дээр илтгэнэ.
3897974076.jpg|0|Two children and a woman climb up the stairs on a metal electric pole-like structure .|Хоёр хүүхэд, эмэгтэй шатан дээр шатаар авирч, төмөр цахилгаан шон шиг бүтэцтэй.
3898684147.jpg|0|Two males are playing volleyball and one is jumping and his right arm is away from his body .|Хоёр эрэгтэй нь волейбол тоглож, нэг нь үсэрч, баруун гар нь түүний биеэс хол байна.
3899196513.jpg|0|A motorcyclist with a backpack traveling on his blue bike .|Цэнхэр дугуй дээрээ аялж буй үүргэвчинтэй мотоцикльчууд.
3899250752.jpg|0|A little girl smelling a fresh mushroom that her mother is showing her .|Ээж нь түүнийг харуулж байгаа шинэ мөөг үнэрлэж байна.
3899256790.jpg|0|A short-haired blue bird it may be wearing a black tank top and white pants is carrying a little girl with blond-hair as she holds on to her missing shoe|Богино үстэй цэнхэр шувууны дээд, цагаан өмд өмсөж болох нь түүний сураггүй болсон гутлаар шар өмд өмсөж болох юм
3899294432.jpg|0|The little blond girl has blue frosting stuck to her mouth as she momentarily stops eating her cupcake to look at another little girl .|Бяцхан шаргал үстэй охин нь өөр бяцхан охиныг харахаа больж, нэг бяцхан охиныг харахаа больсон цэнхэр царцдас амандаа гацдаг байв.
3899733725.jpg|0|four men sit on a stage playing woodwind instruments looking at the four music stands in front of them which have the words The Thistle on them .|Дөрвөн эр Тайзан дээр Woodwind-ийн утсаар тоглож, тэдний урд талын загвар өмсөгч нь тэдний урд байдаг.
3901773161.jpg|0|A woman dressed in blue hits a tennis ball with an intense expression on her face .|Цэнхэр өнгөөр хувцасласан эмэгтэй теннисний бөмбөгийг нүүрэн дээрээ хүчтэй илэрхийлэлээр цохино.
3901882052.jpg|0|A surfer wearing a wetsuit and using a light colored board catches some air .|Сумер арчигч өмсөж, цайвар өнгөт самбарыг ашиглан зарим агаарыг барьж авав.
3902127239.jpg|0|A young man walks through Grand Central Station with his shadow cast by the light cascading down from the windows behind .|Залуу хүн Гранд төв станцаар сүүдрээр дамжин сүүдрээр дамжуулж, цонхны араас доошоо харав.
