image_name|comment_number|comment|Translated Comment
3666020875.jpg|0|a ballerina in an empty worn room standing on 1 foot with her arm and other leg in the air|Хоосон зүүтэй, гараа гар, бусад хөлөөрөө агаарт зогсож байв
3666056567.jpg|0|Four people are walking along a city sidewalk , while the one in the green hat talks on a cellphone .|Дөрвөн хүн хотын явган хүний зам дагуу алхаж байна, ногоон малгай нь гар утас дээр ярьдаг.
3666169738.jpg|0|A small baby dressed in blue shorts and a blue hat tries to balance with the help of an adult hand behind him .|Цэнхэр шорт өмссөн жижиг хүүхэд, цэнхэр малгай нь насанд хүрэгчдийн гарны тусламжтайгаар насанд хүрэгчдийн гарны тусламжтайгаар тэнцвэртэй байхыг хичээдэг.
3666179842.jpg|0|A man with khaki shorts on is holding a little girls hand while she walks in the water of a creek .|Хаки шорттой нэгэн эр бага зэрэг охидын гарыг нууранд алхаж байхдаа бяцхан охидын гарыг барьж байна.
3666188047.jpg|0|A child in a yellow shirt is playing a red arcade ride .|Шар цамц өмссөн хүүхэд улаан аркадын унаа тоглож байна.
3666188658.jpg|0|A man wearing a long brown robe is playing the guitar while another person is sitting at the drums and yet another is wearing a long gray robe and singing .|Урт хүрэн хүрэн нөмрөг өмссөн эр гитар тоглож байна.
3666269240.jpg|0|A man , wearing all black clothing , is running down the street as a car comes toward him with its headlights on .|Хүн, бүх хар хувцас өмссөн хүн, гудамжинд гараад машинаа асаа.
3666324102.jpg|0|Two girls swing over a red patterned surface .|Улаан хэв маягаар хоёр охин дүүжлэв.
3666537170.jpg|0|A boy in orange and white swimming trunks is falling into water at a beach or lake .|Улбар шар, цагаан усан сэлэлтийн хонгилд хөвгүүн далайн эрэг эсвэл нууранд усанд унаж байна.
3666574371.jpg|0|A rugby player wearing a colored top has scored a try as the players in black are running towards him .|Регби тоглуулагч өмссөн регбигийн тоглогч нь хар өнгөөр тоглодог тоглогчдод оролцсон тоглогчдод чиглэнэ.
3666796674.jpg|0|A woman in jeans is walking past a woman dressed in red in a plaza .|Жинсэн өмд өмссөн эмэгтэй нь Плаза дахь улаан өнгөөр хувцасласан эмэгтэйн хажуугаар алхаж байна.
3667035672.jpg|0|Several people appear to be at an outside event where there is a fire blazing in a barrel .|Хэд хэдэн хүн нэг баррель дээр гал гарч буй гал гардаг гаднах үйл явдалд байдаг.
366713533.jpg|0|Two men , a woman , and two young boys stand in front of a large gathering of people outside a building .|Хоёр эрэгтэй, эмэгтэй, хоёр залуу хөвгүүд байшингаас гадуур олон хүмүүсийн цугларалтын урд зогсож байна.
3667157255.jpg|0|an Olympic winner wearing her two gold medals and a gray jacket showing a peace sign and a wave|Олимпийн ялагч нь түүний хоёр алтан медаль, саарал хүрэм, энх тайвны тэмдэг, долгионыг харуулсан саарал хүрэм
3667318593.jpg|0|The young girl is sitting on the swing seat waiting for the carnival ride to begin .|Залуу охин Карнавал унахаар хүлээж буй дүүжин суудал дээр сууж байна.
3667404919.jpg|0|A man in a white uniform rides a motocross bike down a forest trail .|Цагаан өнгийн жигд хүн, ойн зам дээр дугуй унадаг дугуй унадаг.
3667492609.jpg|0|A man is falling backward in swim gear over a large body of water nearby an urban area .|Хүн хот суурин газрын ойролцоо том усны их хэмжээний усанд унаж байна.
3667781063.jpg|0|a group of people are in venice using the boat system to get around .|Бүлгийн бүлэг хүмүүс завьны системийг тойрон гарахын тулд Венецид байдаг.
3667788497.jpg|0|Under a blue sky with white clouds , a child reaches up to touch the propeller of a plane standing parked on a field of grass .|Цэнхэр тэнгэрийн дор цагаан үүлний доор, өвсний талбай дээр зогсож байсан онгоцны буудлын сэнс хүрч ирэв.
3667822570.jpg|0|Soccer players get in a scuffle as one puts the other in a head lock .|Хөл бөмбөгийн тоглогчид нэг нь толгойг нь цоожны түгжээг тавьдаг тул Scuffle-д ордог.
3667908724.jpg|0|A young girl in a white dance outfit and black shoes is dancing in front of music equipment|Цагаан бүжгийн хувцас, хар гутал, хар гутал нь хөгжмийн тоног төхөөрөмжийн урд бүжиглэж байна
3667939633.jpg|0|A young man and young woman walk toward the camera while two young men walk away from the camera in a small town near a shop called Hello Berlin .|Хоёр залуу, залуу эмэгтэй Камер руу алхаж байхад хоёр залуу,
3668027351.jpg|0|A woman wearing a white tank top and white and red floral print skirt jumps for joy at the pier .|Цагаан савны дээд ба цагаан, улаан өнгийн цэцэглэж буй эмэгтэй хөлөг онгоцонд баяр хүргэе.
3668118382.jpg|0|A man in a white shirt and shorts prepares to serve a tennis ball .|Цагаан цамц, шорт нь теннисний бөмбөг үйлчлэхэд бэлддэг.
3668244651.jpg|0|Women are sitting on the ground with a doll , while a child pretends to take care of the doll .|Эмэгтэйчүүд хүүхэлдэй дээр газар сууж байна, хүүхэд хүүхэлдэйг халамжлах дүр эсгэдэг.
3668259129.jpg|0|The guy is wearing a blue shirt and doing an ollie .|Тэр залуу цэнхэр цамц өмсөж, Олли хийж байна.
3668413622.jpg|0|A group of people standing outside a building surrounded in smoke .|Утаанд хүрээлэгдсэн барилгууд гадаа зогсож байгаа бүлэг хүмүүс.
3668518431.jpg|0|A race with motor boats and all the people are wearing red helmets and life jackets .|Мотор завьтай уралдаан, бүх хүмүүс улаан дуулга, амьдралын хүрэм өмсдөг.
3668520111.jpg|0|Many people in colorful clothing at some sort of festival , sitting and standing around .|Зарим хүмүүс өнгөлөг хувцастай олон төрлийн хувцас өмсөж, сууж, зогсож байв.
3668734264.jpg|0|Women sit at a bar that has dark cabinets , menus written on the walls , and a light hanging above the bar .|Ханан дээр бичсэн харанхуй шүүгээ, бааранд бичсэн харанхуй шүүгээнд эмэгтэйчүүд сууж, бааранд сууна.
3668741784.jpg|0|"An older woman with arm crutches is dressed in white and going through her white purse in front of a poster that reads "" Lack of money is the root of all evil . """|ХӨДӨЛМӨРИЙН ХӨДӨЛГӨӨНИЙ ХУГАЦАА ХУДАЛДАН АЖИЛЛАГААНЫ ХУДАЛДАН АЖИЛЛАГААНЫ ХУДАЛДАН АЖИЛЛАГАА.
3668900592.jpg|0|A young male surfer wearing a yellow shirt rides a wave in the ocean on his whiteboard .|Шар цамц өмссөн залуу эрэгтэй цамц өмссөн залуу цамц нь далайн самбар дээр далайд давж гардаг.
3668984985.jpg|0|A girl wearing boots stands next to a swimming pool and four people seated on a bench .|Гутал өмссөн охин нь усан сан, усан сангийн хажууд зогсож, вандан сандал дээр суув.
3669056658.jpg|0|A man wearing a black cowboy styled hat drawing his finger through sand .|Хар ковбой хэв маягаар өмссөн эр хуруугаараа хуруугаараа хуруугаараа зурдаг.
3669069522.jpg|0|Three middle-aged people sitting on a park bench , with a rock wall in the background .|Паркийн вандан дээр сууж буй гурван настай хүмүүс
3669315178.jpg|0|A woodcarver is carving a bald eagle out of wood at a carnival as spectators look on .|Вудкарвер нь халзан бүргэдийг кардивээс сийлбэрлэж байна.
3669472958.jpg|0|The man in the plaid shorts is building a large sand sculpture while two other men buried in sand are looking on from beneath a blue umbrella .|Пласгар шортонд байгаа хүн том элсэн баримлыг бий болгож, нөгөө нь элсэнд оршуулагдана.
3669527584.jpg|0|A Indian women displaying her cultural heritage with painted red fingers and an extravagant head piece .|Энэтхэг эмэгтэй түүний соёлын өвийг толилуулсан улаан хуруугаараа будсан улаан хуруугаараа харуулсан.
3669564923.jpg|0|The girls are both eating and the girl wearing the color red has cake icing on her upper lip .|Охидууд хоёулаа хоол идэж, улаан өнгөтэй охин хоёулаа улаан уруул дээр нь бялууг мөстдөг.
3669635757.jpg|0|A black woman supervising a young white child in a play pit filled with plastic balls .|Тоглоомын нүхээр дүүрэн хар цагаан хүүхэдийг хуванцар бөмбөлөгөөр дүүргэсэн залуу цагаан хүүхэд.
366978558.jpg|0|A teenage girl in a white turtleneck pulls some of her hair to the side in the mirror .|Цагаан яст мэлхий дэх өсвөр насны охин нь түүний зарим үсийг толинд хажуу тийш нь татдаг.
3670075789.jpg|0|a little girl is sliding down a short slide into an inflatable paddling pool .|Бяцхан охин нь богино гулсалтыг хийлдэг сэлүүрт усан сан руу гулсуулж байна.
3670131152.jpg|0|A little girl in front a pink food tray is getting her bike helmet on by a woman .|Урд талын ягаан хоолтой бяцхан охин эмэгтэй хүний дугуйн дуулга авч байна.
3670184928.jpg|0|A crowd of people is surrounding and watching a black male in black jeans , a black shirt , a black hat and white sneakers who appears to be dancing .|Олон хүн олон хүн хар жинсэн өмд, хар эрэгтэй, хар цамц, хар цамц, хар цамц, хар цамц, хар цамц, хар малгай, хар малгай, хар малгай, цагаан өнгийн пүүз юм.
3670205710.jpg|0|A large group at a concert or fair all looking at a man in a white shirt .|Цагаан цамцанд байгаа эрэгтэй, шударга харцаар бүхэнтэй том бүлэг.
3670492902.jpg|0|People make their way onto an orange bus from doors at both the front and back .|Хүмүүс урд болон арын аль алинд нь улбар шар өнгийн автобусаар явдаг.
3670681503.jpg|0|Theses people is taking a picture of a pink pig lying on the ground .|Хүмүүсийн дипломын ажил нь газар дээр хэвтэж буй ягаан гахайн зургийг авч байна.
3670907052.jpg|0|A BMX rider in a red and black outfit is jumping on his motorcycle .|Улаан, хар хувцастай BMX морьтон мотоцикль дээр үсэрч байна.
3670918456.jpg|0|The blond-haired girl wearing the flowered dress is swinging on a swing towards the blue sky .|Цэцэглэсэн даашинз өмссөн шаргал үстэй охин цэнхэр тэнгэр рүү дүүжлэв.
3670974981.jpg|0|An athletic woman sprints off the starting blocks on a track .|Атлетик эмэгтэй зам дээр эхлэх блокуудыг суулгаарай.
3670987768.jpg|0|A white man wearing a blue shirt and black apron is ready to take down orders for food .|Цэнхэр цамц өмссөн цагаан цамц, хар хормогч хоолонд захиалга авахад бэлэн боллоо.
3671206280.jpg|0|Many people walking on a street with a barricade and trash littered on street|Гудамжинд баррикад, хог хаягдалтай гудамжаар алхаж буй олон хүмүүс
3671262694.jpg|0|A skateboarder is riding his board on a ramp in a skate park .|Тэшүүрчин самбарыг тэшүүрийн парк дээр налуу зам дээр унаж байна.
3671612380.jpg|0|A young boy wearing a blue shirt is walking in the street with his father in the background .|Цэнхэр цамц өмссөн залуу хүү нь гудамжинд эцгийнхээ арын хэсэгт алхаж байна.
3671694723.jpg|0|Three girls in gold ' Native American ' costumes dance on a football field while several young men in dark blue uniforms play drums behind them .|Хөлбөмбөгийн хоёр эмэгтэйд хэд хэдэн залуу цэнхэр өнгийн хувцас өмсдөг Хөлбөмбөгийн аль нэг нь хөлбөмбөгийн талбайд гурван охин хөлбөмбөгт бүжиглэдэг.
3671701607.jpg|0|A guy wearing a Red shirt and a black hat , white gloves is holding a trumpet .|Улаан цамц өмссөн залуу, хар малгай өмссөн залуу, цагаан бээлий, цагаан бээлий бүрээ барьж байна.
3671777903.jpg|0|A man is flying through the air hanging from a paraglider while others are water-skiing .|Хүний цанаар гулгах үед параглерид өлгөгдсөн агаараар нисч байна.
3671851846.jpg|0|A woman holds her little white dog and points to a big brown dog at the bottom of the hill .|Эмэгтэй хүн түүний бяцхан цагаан нохойг барьж, толгодын ёроолд том хүрэн нохойнд зааж өгдөг.
3671931745.jpg|0|A man in a blue unbuttoned shirt is walking through a local street market that is selling various fabrics .|Цэнхэр тарган цамцтай цамц нь янз бүрийн даавуу зарж буй орон нутгийн гудамжны зах зээлээр алхаж байна.
3671933270.jpg|0|A bicyclist is drinking out of a bottle of water while riding .|Унадаг дугуйчин морь унахдаа нэг шил ус ууж байна.
3671935691.jpg|0|A woman is blowing bubbles and a little girl in a pink outfit is playing in front of her .|Эмэгтэй хүн бөмбөлөг үлээж, ягаан өнгийн хувцас өмссөн бяцхан охин түүний өмнө тоглож байна.
3671950830.jpg|0|Person on blue motorcycle with smoking back tire and people watching in the background .|Тамхи татдаг дугуй, арын дэвсгэр дээр нь
3671957239.jpg|0|Vendors are selling their goods , in an outdoor food market , while shoppers make purchases .|Борлуулагч нь бараа бүтээгдэхүүн зарж байгаа бөгөөд гадаа хүнсний зах зээл дээр зарж байгаа тул дэлгүүрүүд худалдан авалт хийдэг.
3672057606.jpg|0|"A woman leaning against the wall in the "" Dupont Circle "" subway station with a trashcan to the right ."|"""Дупонт тойрог"" -ын ханан дээр ""Dupont Cound"" -ын ханан дээр баруун тийш нь баруун тийш."
3672105089.jpg|0|A group of boys shower with one another outside , while a few girls dance together .|Хөвгүүдийн хамт нэг нэгэнтэй хамт шүршүүрт орж, хэдэн охид хамтдаа бүжиглэдэг.
3672105509.jpg|0|The two dogs are interested in the gravel ground surrounded by concrete .|Хоёр нохой нь бетоноор хүрээлэгдсэн хайрган газрыг сонирхож байна.
3672106148.jpg|0|A man lays on the grass in a field and reads a book .|Эрэгтэй хүн талбай дээр өвс дээр хэвтэж, ном уншдаг.
3672109677.jpg|0|A group of teenage girls do a synchronized dance in Hanna Montana costumes .|Өсвөр насны охидын бүлгийн охид Ханна Монтанагийн хувцастай синхрон бүжиг хийдэг.
3672309620.jpg|0|A beautiful mountainous view with a couple in the distance looking over the edge .|Ирмэг дээр харцаар харсан холын зайтай үзэсгэлэнтэй уулархаг харц.
367248403.jpg|0|Two friends await their demise as a man with a giant snowball held above his head waits for the perfect time to strike|Хоёр найз нь толгойгоо дээшлүүлсэн аварга том цасан бөмбөлгийг барьж, толгойгоо цохих нь төгс цагийг хүлээх болно
3672505256.jpg|0|Men dressed in red , white , and black are lined up , each with a trumpet in hand .|Улаан, цагаан, цагаан хувцас өмссөн эрчүүд, хар бүр нь бүрээ гартаа бүрээ бүхий бүрдүүлдэг.
3672738000.jpg|0|There are a few tents , one blue and one white , at a small street market .|Цөөхөн хэдэн майхан, нэг цэнхэр, нэг цагаан, жижигхэн гудамжны зах дээр.
3672758184.jpg|0|A man and a woman in summer outfits walk down a street market .|Зуны гадуур хувцас өмсдөг эрэгтэй, эмэгтэй хүн гудамжны зах зээлд гардаг.
3672940355.jpg|0|A little girl in a pink shirt kicks a blue ball .|Ягаан цамцтай бяцхан охин цэнхэр бөмбөгийг өшиглөдөг.
3672944692.jpg|0|Two men wear funny looking black suits while climbing a mountain on a clear sunny day .|Хоёр эрчүүд нартай өдөр ууланд авирахдаа инээдтэй хар костюм өмсдөг.
3673032164.jpg|0|Two young girls are arm wrestling in their hotel room while another girl watches .|Хоёр залуу охидууд зочид буудлын өрөөнд гараа бөхийлгөдөг.
3673035152.jpg|0|A little girl in an orange striped outfit is airborne whilst bouncing on a bed .|Улбар шар өнгийн судалтай жижигхэн охин нь орон дээр үсэрч байхдаа агаарт агаарт гардаг.
3673069138.jpg|0|A young Indian man sits atop a concrete structure with a saw and is carving it while what appears to be a woman because of her dress and legs is in the background .|Залуу Энэтхэг хүн Зөөлөн бүтэцтэй сууж байсан бөгөөд түүний хувцас, хөл нь арын дэвсгэр дээр байдаг тул сийлж байгаа бөгөөд энэ нь эмэгтэй хүний арын дэвсгэр дээр байдаг.
3673098366.jpg|0|An Indian man is perching on top of a wall with a hammer and chisel .|Энэтхэг хүн Ханан дээрх ханан дээр алх, цүүцтэй хамт алж байна.
3673165148.jpg|0|A brown and white dog is standing in shallow water on a beach near a large rock outcrop .|Браун, цагаан нохой том чулуулгийн ойролцоох далайн эрэг дээр гүехэн усаар зогсож байна.
3673484638.jpg|0|The two children , one with a scarf tied around their forehead , walk down a modeling runway .|Хоёр хүүхэд, нэг нь тэдний духан дээр уяв.
3673642950.jpg|0|A girl wearing a festive dress looks into the distance while a show goes on behind her .|Шударга хувцас өмссөн охин нь түүний араас гарч байх үед зайг хардаг.
3673661352.jpg|0|A man in a uniform with black sunglasses stands behind a man with a red shirt and hat sitting on the ground .|Хар нарны шил бүхий хүн хар нарны шилтэй нэг хүн улаан цамц, малгай өмссөн хүний ард зогсож байна.
3673878924.jpg|0|Three girls dancing on the hardwood floor on an emty room .|Хатуу өрөөнд хатуу модны шалан дээр бүжиглэж буй гурван охин.
3673970325.jpg|0|A young girl kneels beside rows of candles while others walk by .|Залуу охин нь лааны шугамын хажууд өвдөг сөгддөг.
367400736.jpg|0|Standing outside in front of a red van , a man in a hat picks up a framed painting from a table full of such paintings and other art .|Улаан ванны урд зогсож, малгай өмссөн хүн ийм зураг, бусад урлагаар дүүрэн ширээн дээрээс гаргаж авдаг.
3674168459.jpg|0|A female martial artist kicking another female martial artist in the face|Эмэгтэй тул алдааны уран бүтээлч, нүүрэн дээр нь өөр эмэгтэй алдааны зураачийг өшиглөж байв
3674521435.jpg|0|Cyclists are riding bikes on an off road course beside a river .|Дугуйчид голын дэргэдэх замын хажуугаар замын чиглэлээр дугуй унаж байна.
3674565156.jpg|0|one girl wearing an orange tank top and black sunglasses smiling at the camera next to another girl .|Нэг охин улбар шар өнгийн савны дээд, хар нарны шилийг өөр охины хажууд инээмсэглэж байсан.
3675345761.jpg|0|A man with a blue shirt and glasses points to a picture in a book in front of a little girl and a stack of books .|Цэнхэр цамц, нүдний шил нь бяцхан охин, номын оврын зураг дээр зураг дээр зурдаг.
3675685612.jpg|0|a child is playing with a green , white and red spinning toy that turning on the ground .|Хүүхэд ногоон, цагаан, улаан, улаан ээрэх тоглоом тоглож байна.
3675742996.jpg|0|The blond little girl picks flowers in a field , wearing a white dress with flowers on it .|Шаргал бяцхан охин цэцэг дээр цэцэглэж, цагаан хувцас өмссөн цагаан хувцас өмссөн талбайд цэцэг авдаг.
3675825945.jpg|0|A skateboarder hanging off the edge of a bowl at a skate park .|Тэшүүрээр аяга тавагны ирмэгийг тэшүүрээр өлгөжээ.
3675878796.jpg|0|a woman siting in a black polka dot bathing suit top , and blue high waist underwear bottoms sitting in the sidewalk with three bags and a green bottle .|Хар Polka D цэгт сууж буй эмэгтэй нь гурван уут, цэнхэр өнгийн өндөр бүсгүйн түншүүд гурван уут, ногоон шилтэй.
367602066.jpg|0|A young girl is holding an end of the string of a yo-yo in one hand and the body of the pink yo-yo in the other .|Залуу охин нэг гартаа yo-yo-ийн мөрийг нэг гараараа барьж, нөгөө гараараа ягаан yo-yo-гийн биеийг барьж байна.
3676289259.jpg|0|A young , blond boy in a Transformers shirt raises both hands in front of him , showing all 10 fingers .|Трансформаторын цамц өмссөн залуу, шаргал хүү нь түүний өмнө хоёр гараа өргөж, бүх 10 хурууг харуулна.
3676432043.jpg|0|A woman in white and a man in black , with an earring , are kissing .|Цагаан, хар, эрэгтэй хүн хар, ээмэг нь үнсэлттэй байдаг.
3676460610.jpg|0|A woman rides a bike over a dirt path through the long grass .|Нэгэн эмэгтэй урт өвсөөр зугаа цэнгэлийн замаар дугуйн замаар унадаг дугуй унана.
3676561090.jpg|0|The yellow dog wears a blue dog tag and rolls on a green field .|Шар нохой нь цэнхэр нохойн шошго өмсөж, ногоон талбай дээр өнхрүүлдэг.
367673290.jpg|0|The woman wearing a black and white jacket and red boots is also wearing headphones .|Хар ба цагаан хүрэм өмссөн эмэгтэй нь бас чихэвч өмсдөг.
367677825.jpg|0|A man hides his face from the camera while eating dinner with friends .|Найз нөхөдтэйгээ оройн хоол идэж байхдаа эр хүн камераас нүүрээ нуудаг.
