image_name|comment_number|comment|Translated Comment
225221024.jpg|0|young man wearing blue jean shorts and a tank top balancing on his hand with his body in the air in the street while performing for bystanders .|Цэнхэр Жан шорт өмсөж байсан залуу, танкан дээр гараа биеэ авч явахдаа гараа гудамжинд хийж байхдаа гараараа гудамжинд гараа барьдаг.
2252264255.jpg|0|Two little boys eating apples climing over a retaining wall .|Хоёр бяцхан хүү нь алим хоолоо хадгалах ханан дээр авирдаг.
2252299132.jpg|0|a young boy running a race on a track with a painted face|Будсан нүүртэй зам дээр уралдаан гүйж буй залуу хүү
2252299187.jpg|0|Picture of a band performing in front of fans , one on drums , three guitars and a keyboard player .|Фенчнүүдийн урд тоглож буй хамтлагийн зураг, бөмбөр, гурван гитар, гар тоглогч.
2252311564.jpg|0|A heavyset woman reading in her seat on a city transportation vehicle .|Хотын тээврийн хэрэгсэлд суудалдаа сууж буй хүнд эмэгтэй.
2252403744.jpg|0|An Asian girl and boy playing on with a yellow ball on a black and white floor .|Азийн охин, Хөвгүүн, Хүү нь хар, цагаан өнгийн шалан дээр шар бөмбөг тоглож тоглодог.
2252613928.jpg|0|Some girls jumping rope on a street with a lot of people walking around .|Зарим охидууд тойрон алхаж буй олон охидууд олсоор үсэрч байв.
2252635585.jpg|0|Two dogs play in the snow on the ground near a tree , with one on top of the other .|Хоёр нохой нь модны ойролцоо цасанд байдаг, нөгөө нь
2252722473.jpg|0|"A person in heavy clothing and a plastic "" hood "" around the neck carries a second plastic bag in front of a large stone column ."|"Хүзүүнтэй хувцас, хүзүүний эргэн тойрон дахь хуванцар ""бүрээс"" нь том чулуун баганын өмнө хоёр дахь хуванцар уут хийдэг."
2252918695.jpg|0|Young girl in a gray jacket poses for a picture as a family on a small motorcycle drive past on a dirt road .|Саарал хүрэмтэй залуу охин зураг дээр жижиг мотоциклийн зам дээр өнгөрч буй жижиг мотоциклийн драйверын гэр бүлд зураг дээр зураг авах.
2253052296.jpg|0|A toddler is washing a window with cleaning spray and paper towels .|Хүүхдүүд цэвэрлэх шүршигч, цаасан алчуураар цонхоор угааж байна.
2253091968.jpg|0|woman in pink shirt riding bike next to man in white shirt and black shorts running|цагаан цамц, хар шорт, хар шорт гүйж буй хүний хажууд унадаг дугуй унадаг дугуйтай эмэгтэй
2253417961.jpg|0|A woman with a backpack and a child kneeling in the sand on a beach with boats in the background .|Үүрэн үүргэвчинтэй эмэгтэй, хүүхэд арын эрэг дээр завин дээр өвдөг дээрээ өвдөг дээрээ өвдөг дээрээ өвдөглөж байна.
2253938667.jpg|0|A man reads an advertisement at a bus stop , while another man sits on a bench .|Эрэгтэй хүн автобусны буудал дээр зар сурталчилгааг уншдаг, өөр хүн вандан сандал дээр сууж байхад.
2254100058.jpg|0|Two boys filling up a pan of water while wearing scout uniforms .|Скаутын дүрэмт хувцас өмсөж байхдаа хоёр хөвгүүн савыг дүүргэж өгдөг.
225434569.jpg|0|a male dressed in a white shirt with white shorts paints a white wall black .|Цагаан шорт бүхий цагаан цамц өмссөн эрэгтэй хувцас өмссөн цагаан цамц нь цагаан хананы хар өнгөөр буддаг.
2254442869.jpg|0|An elderly man and woman are seated at a dining table in front of a Christmas tree .|Христийн Мэндэлсний Баярын модны урд талд залуу эрэгтэй, эмэгтэй ширээн дээр сууж байв.
2254697851.jpg|0|Two young men are playing an interactive video game that simulates playing a guitar .|Хоёр залуу эрэгтэй гитар тоглохыг дууриаж байгаа интерактив видео тоглоом тоглож байна.
2254902963.jpg|0|Little boy in a green sweatshirt playing with his toy train .|Ногоон цамцтай бяцхан хүүхэд тоглоомон дээр тоглодог.
2254913901.jpg|0|Woman on the street window shops in front of the store , Louis Vuitton .|Дэлгүүрийн урд талын цонхны дэлгүүрүүд, Луис Вуиттон.
2254990707.jpg|0|Six people are attempting to move a car on a snowy street .|Зургаан хүн цастай гудамжинд машин хөдлөхийг оролдож байна.
2255252910.jpg|0|A man wearing a blue sweater is holding a Wii remote towards the television .|Цэнхэр цамц өмссөн хүн wii-ийг телевиз рүү чиглүүлж байна.
2255266906.jpg|0|A black bird sitting in a leafless tree .|Навчгүй модонд сууж буй хар шувуу.
2255280884.jpg|0|two girls are sitting together while playing their instruments .|Хоёр охин тэдний багаж хэрэгслийг тоглож байхдаа хамт сууж байна.
2255332561.jpg|0|A man is on the side of a mountain and hiking around huge rocks .|Эрэгтэй хүн уулын хажууд байдаг, асар том чулуулгийн эргэн тойронд явж байна.
2255338013.jpg|0|A man is repelling down the side of a mountain over the ocean .|Эр хүн далай дээгүүр уулын хажуу талыг нь няцаав.
2255342813.jpg|0|A person wearing black with a white helmet is going down a mountainside with water below .|Цагаан дуулга бүхий хар өмссөн хүн доорх уулархаг газар доорх уулархаг газар унаж байна.
2255375425.jpg|0|A man is repairing vessel , two other people are sitting and watching him .|Хүн хөлөг онгоцыг засаж байна, бусад хоёр хүн түүнийг сууж, харж байна.
2255631358.jpg|0|A woman is pulling a young girl on a sled through the snow .|Эмэгтэй хүн цасаар алхаж буй залуу охиныг татаж байна.
2255633616.jpg|0|A man dressed in all black is wearing shades and standing in snow and there is a red vehicle in back of him .|Бүх хар хувцас өмссөн эр сүүдэр өмсөж, цасанд зогсож, цасанд зогсож байгаа бөгөөд түүний ар талд улаан тээврийн хэрэгсэл байдаг.
2255685792.jpg|0|"Three people in skiing gear are standing behind a "" no skiing "" sign ."|"Цанаар гулгах араа дээр гурван хүн ""цанаар гулгах"" тэмдгийн ард зогсож байна."
2255753004.jpg|0|Two girls stand in front of two men selling what appears to be concert merchandise while a woman holding a microphone interviews the men behind the merchandise counter .|Микрофон барьсан эмэгтэй хүн барааны тоолуурын ард байгаа эмэгтэйг зарж байхдаа хоёр охины урд зогсож байсан.
2256000607.jpg|0|A woman is playing an upright piano outdoors near some flowers .|Эмэгтэй хүн зарим цэцэгний ойролцоо босоо төгөлдөр хуур тоглож байна.
2256091090.jpg|0|A blond boy is staring at a toy robot and looks like he wants to play with it .|Блонд Хүү нь тоглоомын робот руу ширтэж, түүнтэй тоглохыг хүсдэг шиг харагддаг.
2256133102.jpg|0|Someone dangles on a rope from a rocky cliff over the ocean .|Хэн нэгэн нь далайн эрэг дээр чулуурхаг хавцлаас олсоор явж байна.
2256138896.jpg|0|a man wearing a white helmet is abseiling down a sandy colored rock face .|Цагаан дуулга өмссөн эр элсэнд элсэрхэг өнгөт чулуун нүүрэн дээр байрлуулж байна.
2256218522.jpg|0|A dog bounding across the sandy landscape in front of people watching .|Хүмүүсийг үзэж буй хүмүүсийн урд талын элсэрхэг газар нутгаар
2256231539.jpg|0|A young boy in a blue uniform running with a football while playing a game of flag football .|Хөлбөмбөг тоглож байхдаа хөл бөмбөг тоглож байсан залуу жигнэмэг.
2256320794.jpg|0|A dog that looks like Lassie , making a funny face .|Ласси шиг харагддаг нохой, инээдтэй царайтай юм шиг харагддаг.
2256447557.jpg|0|Four young girls , one of which is wearing a skirt , or standing at the beach while an older adult looks on .|Дөрвөн залуу охин, нэг нь банзал өмсөж, эсвэл далайн эрэг дээр өмсөж, дээшээ насанд хүрсэн хүн харагдаж байна.
225692535.jpg|0|A young boy in pajamas tosses a red ball in the air .|Нүүр хувцас өмссөн залуу хүү агаарт улаан бөмбөгийг хаядаг.
2256976298.jpg|0|The young father was wearing his orange shirt while his daughter walked barefoot in the soft mossy grass .|Залуу аав нь жүржийн цамц өмсөж байхдаа зөөлөн хөвөн өвсөөр хөл нүцгэн алхаж байв.
225699652.jpg|0|Two dolphins jump out of the blue water with palm trees behind them .|Хоёр далайн гахайнууд цэнхэр уснаас гарч, тэдний араас нь цэнхэр уснаас үсрэв.
2257099774.jpg|0|An elderly Asian woman wearing a blue winter coat and red hat in front of a food counter .|Хоолны лангууны өмнө цэнхэр өвлийн улиралд цэнхэр өвлийн цув өмссөн өндөр настай эмэгтэй, улаан малгай өмсдөг.
2257233228.jpg|0|Two young girls exercising to keep up with playing soccer .|Хөл бөмбөг тоглохоор дасгал хийх хоёр залуу охид.
2257238490.jpg|0|A woman wearing a green scarf on the beach kicks her leg up while a blond small dog stands behind her .|Далайн эрэг дээрх ногоон ороолт өмссөн эмэгтэй нь хөлөө жижигхэн нохой түүний ард зогсож байхад хөлөө өшиглөв.
2257294002.jpg|0|Three children do jumping jacks in a public place while a man sits and looks on .|Эрэгтэй сууж, харж байхдаа гурван хүүхэд Жакийг олон нийтийн газар үсэрч, харж, хардаг.
2257332250.jpg|0|A young man is playing electric guitar in a building 's common area or lobby .|Залуу эр нь байшингийн нийтлэг газар эсвэл лобби дахь цахилгаан гитар тоглож байна.
2257631407.jpg|0|A couple of playful kids in sweats and jeans romp on the grass .|Хөлс, жинсэн өмд, жинсэн өмд зүлгэн дээр байдаг.
2257798999.jpg|0|As the brown dog looks the other way , a large black and white dog plays with a smaller black dog .|Браун нохой өөр аргаар харагддаг тул том хар, цагаан нохой жижиг хар нохойтой тоглодог.
2258277193.jpg|0|Some people looking out windows in a large building .|Зарим хүмүүс том байранд цонх гарч хардаг.
2258662398.jpg|0|A child in a black wetsuit is in the waves on a surfboard .|Хар хувцастай хүүхэд нь долгион дээр долгион дээр байдаг.
2258951972.jpg|0|Two gray , speckled dogs running down grass hill , trees in background .|Хоёр саарал, өвсний толгод дээр доошоо гүйж, арын хэсэгт мод ургадаг.
225909073.jpg|0|A wet German Shepherd dog is running out of the ocean with a ball in its mouth .|Нойтон Герман Хоньчин нохой нь далайгаараа бөмбөгөөр гүйж байна.
2259134148.jpg|0|With the dam in the distance , the boy piggy backed onto the man in the black jacket holding a frisbee .|Холын зайд далантай, хөвгүүн нь Филги Фрисби барьсан хар хүрэм дээр буцаж ирэв.
2259203920.jpg|0|Little white dog wearing a leash jumping after a red ball .|Улаан бөмбөгний дараа үсэрч буй бяцхан цагаан нохой.
2259336826.jpg|0|Men dressed in winter clothing stand against a railing on a snowy street|Өвлийн хувцас өмссөн эрчүүд цастай гудамжинд хашлага дээр зогсож байв
2260099785.jpg|0|Two men are on stage playing guitars while a third man wearing a baseball hat sings into a microphone .|Хоёр хүн тайзан дээр тоглож, гуравдагч этгээдийн тээглүүр тоглож байхдаа гитар тоглож байна.
2260369648.jpg|0|two young girls wearing green and yellow uniforms standing in front of each other .|Ногоон, шар, шар өнгийн дүрэмт хувцас өмссөн хоёр залуу, бие биенийхээ өмнө зогсож байв.
2260537673.jpg|0|An older gentleman wearing an elaborate headdress holding a white dog that has had its fur dyed several colors .|Хөгшин хүн үслэг эдлэл өмссөн том биетийг өмссөн цагаан нохойтой, үслэг эдлэл хэд хэдэн өнгөөр будсан байв.
2260560631.jpg|0|The furry dog is running through a grassy wooded area .|Furry нохой нь өвс ургамал ургасан газарт гүйж байна.
2260649048.jpg|0|Two dogs , one large and one small , are playing together in the grass .|Хоёр нохой, нэг том, нэг жижиг, өвсөөр хамт тоглож байна.
226065257.jpg|0|Four people sit on a subway two read books , one looks at a cellphone and is wearing knee high boots .|Дөрвөн хүн метро дээр сууж, нэг нь уншсан хоёр ном дээр сууж, нэг нь гар утас руу хардаг бөгөөд өвдөгний өндөр гутал өмсдөг.
2260891072.jpg|0|A man plays an acoustic guitar while sitting in front of a microphone .|Микрофоны өмнө сууж байхдаа эрэгтэй акустик гитар тоглодог.
226113880.jpg|0|A man in glasses and a striped shirt sitting down and looking toward the camera .|Нүдэнд шил, судалтай цамц өмсөж, камер руу чиглүүлж, камер руу чиглэв.
226115048.jpg|0|A man sitting on a chair with a beer in his hands roasting something to eat on a wooden stick .|Гаран дээр сандал дээр сууж буй хүн модон саваа дээр хоол идэж ямар нэгэн зүйл иддэг.
226115542.jpg|0|Several people stand near a cooking area in the woods while eating off of plates .|Хэдэн хүн плант хоол идэж байхдаа ойд хоол хийх газар ойрхон зогсож байв.
2261169495.jpg|0|A woman dances along with a dancing video-game projected on large screen behind her .|Эмэгтэй хүний араас том дэлгэцэн дээр төлөвлөсөн бүжиглэх видео тоглоомын хамт бүжиглэдэг.
2261257940.jpg|0|a brown dog is chasing a black dog through the snow in front of a wire mesh fence .|Браун нохой нь утсан торны хашааны урд цасаар цасаар хөөж байна.
2261264620.jpg|0|Young man shaving in the bathroom with razor and shaving cream .|Залуу эр угаалгын өрөөнд хусаж, хуссан цөцгийтэй хамт хусаж байв.
2261346505.jpg|0|Several people are walking on a rainy busy street in Asia with clear umbrellas .|Хэд хэдэн хүн айрагны завгүй гудамжаар анд нь андласны цомогт андласанд явж байна.
2261550615.jpg|0|A man in a cowboy hat is walking through a market and reaching into his pocket .|Ковбой малгай өмссөн хүн зах зээлээр алхаж, халаасандаа хүрэх болно.
2261962622.jpg|0|A woman watching herself on a big screen while she is playing a boxing video game .|Нэгэн эмэгтэй боксын видео тоглоом тоглож байхдаа том дэлгэц дээр өөрийгөө харж байна.
2262919211.jpg|0|Two people on a sidewalk , one of which is a man in a leather jacket holding some pink and red balloons and facing away from the street and the other is a woman in a cream jacket walking into the street .|Явган хүний зам дээр хоёр хүн ягаан, улаан, улаан өнгийн хүрэм өмсөж, гудамжны хүрэм, нөгөө нь гудамжинд гарч, нөгөө нь нь гудамжинд алхаж буй эмэгтэй юм.
226310408.jpg|0|A man with his shirt off standing in a work zone next to a pile of bricks .|Цамцынхаа хажууд байрлах ажлын бүсэд зогсож байсан эр хүн.
226310412.jpg|0|A shirtless tanned male , with black hair , wearing paint stained blue jeans and sneakers , putting plaster along a building 's wall .|Цамцгүй арьстай эр, хар үстэй, будсан цэнхэр жинсэн өмд өмссөн цэнхэр жинсэн өмд, пүүз, пүүз нь барилгын хананы дагуу гипс өмсдөг.
2263132077.jpg|0|A blond man with a beard operates a camera while a young boy in a green shirt stands beside him holding a microphone in his hand .|Баавгайтай шаргал үстэй хүн бол Бага хүүтэй, ногоон цамц өмсдөг залуу хөвгүүн түүний хажууд микрофон барьж байв.
2263655670.jpg|0|The German Shepherd dog is running after the white dog while they both are running on the grass .|Германы хоньчин нохой хоёулаа өвсөн дээр ажиллаж байхдаа цагаан нохойны дараа гүйж байна.
2264280779.jpg|0|A person wearing a mask is welding a metal object which is producing sparks .|Маск өмссөн хүн бол оч үүсгэдэг төмөр объектыг гагнах явдал юм.
2264316030.jpg|0|A brown and black dog walks in the snow with its tongue hanging out .|Браун, хар нохой нь цасан дээр хөлөө өлгөөтэй байдаг.
2264439641.jpg|0|A brunette woman holding a little girl dressed in pink is kneeling next to a grazing white and brown llama in the foreground of a hilly community .|Ягаан өнгийн хувцас өмссөн бяцхан охиныг толилж байгаа бяцхан охиныг толботой цагаан, бор, хүрэн ламаагаар өвдөг сөгдөж байна.
226456619.jpg|0|An older , somewhat obese man with no shirt and a tattoo is looking out from the porch of his house while a cat sits on the steps below .|Настай, зарим талаараа ямар ч цамцгүй, цамц, шивээс, шивээс нь түүний гэрээс гарч байх үед муурны үүдний үүднээс түүний байшингийн үүдний танхимаас гарч байхдаа.
226481576.jpg|0|A female police officer , wearing an officer 's hat and sunglasses , stands in uniform in front of a window-lined street block .|Ажлын цагдаа, офицерын малгай, нарны шил зүүж, цонхноос бүрдсэн гудамжны блокийн урд дүрэмт хувцас өмсдөг.
2265096094.jpg|0|A mule pulling a carriage with a man inside along a dirt path .|Шороон зам дагуу хүнтэй тэрэг татдаг луус.
2265100168.jpg|0|Blond boy in red shirt plays inside inflatable with blue balls .|Улаан цамцтай улаан цамц өмссөн шар өнгийн хөвгүүн нь цэнхэр бөмбөгөөр инээгээд тоглодог.
2265106886.jpg|0|A peasant woman sells a variety of vegetables on the street .|Тариачин эмэгтэй гудамжинд олон төрлийн ногоо зардаг.
226531363.jpg|0|A dog runs in the snow , a fence in the background .|Нохой цасанд гүйж, арын хэсэгт хашаа гүйдэг.
2265367960.jpg|0|The boy is wearing a hat and holding sandals .|Хүү нь малгай өмсөж, шаахайн өмсдөг.
226538968.jpg|0|A worker in a blue collared shirt and black pants walking by his orange work van .|Цэнхэр хүзүүвчтэй цамц, хар өмд, жүржийн ажлын вангаар алхаж буй хар өмд.
226539616.jpg|0|A group of people on a lawn , one of whom is filming something with a camera .|Зүлэг дээрх бүлэг хүмүүс, хэн нэгний камертай ямар нэгэн зүйлийг зураглаж байна.
226539844.jpg|0|Three police officers 2 male 1 female standing around a girl holding something in her hands .|Гурван цагдаагийн ажилтнууд 2 эрэгтэй 1 эмэгтэй гартаа ямар нэгэн юм барьж байгаа охиныг тойрон зогсож байв.
2266019996.jpg|0|An individual dressed in white ski top , red ski type pants , white helmet and black gloves is standing on a ski board and the photo was snapped while the skier is in midair .|Цагаан цанын орой, улаан цанын төрөл, улаан цанын өмд, цагаан дуулга, хар бээлий, хар бээлий нь цанын самбар дээр зогсож байхад зураг нь дундуур зогсож байв.
2266061169.jpg|0|A man sleeps in the lining of a boat that is propped against a brick wall .|Хүн тоосгоны хананд наалдсан завины дотор унтдаг.
226607225.jpg|0|The large green fish is jumping out of the water .|Том ногоон загас нь уснаас үсэрч байна.
2266142543.jpg|0|A man wearing a black cap and glasses is looking at an object in his hand .|Хар малгай өмссөн эр, нүдний шил нь түүний гарт байгаа объектыг харж байна.
2266144051.jpg|0|A biker is wearing all black gear with buildings and a tree with no leaves nearby .|Дугуйчин нь бүх хар араагаа барилга байгууламж, ойролцоох модтой хамт хар араа өмсөж байна.
226630666.jpg|0|A man with a big hat and a brightly colored shirt is standing by a pink Cadillac .|Том малгайтай эр, тод өнгийн цамц нь ягаан кадиллакт зогсож байна.
226631401.jpg|0|A woman in a blue shirt smiles at the camera while she stands next to a car that matches her shirt .|Цэнхэр цамц өмссөн эмэгтэй нь түүний цамцтай таарч байгаа машины хажууд зогсож байхдаа камер дээр инээмсэглэв.
226634003.jpg|0|Two women walking down a sidewalk hugging at the waist , both women are wearing hats .|Хажуугийн замыг хажуугаар нь алхаж буй хоёр эмэгтэй нь бэлхүүсийг тэврэн, эмэгтэй хоёулаа малгай өмсдөг.
226634801.jpg|0|A woman wearing a blue shirt is talking to two women wearing hats as they are walking down the street .|Цэнхэр цамц өмссөн эмэгтэй нь гудамжинд алхаж байхдаа малгай өмсдөг хоёр эмэгтэйтэй ярьж байна.
226642878.jpg|0|A woman in an army-green tank top with curlers in her hair gets her makeup applied by another woman , in front of an exotic animal-print backdrop .|Арми-Ногоон савны дээд хэсэгт байгаа эмэгтэй.
226646458.jpg|0|A dark-haired woman is fixing a blond woman 's hair .|Харанхуй үстэй эмэгтэй нь шаргал эмэгтэйн үсийг засч байна.
226653504.jpg|0|A woman dressed in black and holding flowers holds hands with a blond woman dressed in white .|Хар, барьсан цэцэгс хувцас өмссөн эмэгтэй нь цагаан хувцастай шаргал эмэгтэйтэй гараа барьдаг.
