image_name|comment_number|comment|Translated Comment
3778223207.jpg|0|A man , waist deep in a large body of water , has his arms high in the air as water is splashed around his body .|Эрэгтэй, бүсэлхийн гүн гүнзгий усны гүн гүнзгий ус, ус нь түүний биеийг тойрон эргэлддэг тул түүний гар нь агаарт гараа агаарт гардаг.
3778274494.jpg|0|A male with brown clothing standing on the side of the street with his thumb out with a big bag on his back .|Гудамжны хажууд байгаа хүрэн хувцастай эрэгтэй, гудамжинд том цүнхтэй том цүнхтэй.
377872472.jpg|0|One dog is standing whilst two other dogs are running in the snow .|Нэг нохой цас орж байгаа хоёр нохойтой зогсож байна.
377872672.jpg|0|Three dogs playing in the snow , with a city in the background .|Цасанд гурван нохой тоглож, арын хэсэгт хотоор тоглож байна.
3779116045.jpg|0|Scout Master Clown ringing the neck of a balloon snake in front of children to establish dominance .|Скаутын мастер алиалагч нь хүүхдүүдийн өмнө давамгайллыг бий болгохын тулд хүзүүвчний хүзүүг дууддаг.
37791887.jpg|0|A group of children divided into a maroon team and a blue team playing a soccer game .|Нэг бүлэг хүүхдүүд Марун багт хуваагдсан, хөл бөмбөг тоглодог цэнхэр баг.
3779596816.jpg|0|Two men wearing working clothes are brushing the street near a trash receptacle|Ажлын хувцас өмссөн хоёр эрэгтэй, хог хаягдлыг хогийн савны ойролцоо байрлуулж байна
3779886643.jpg|0|Tourists take photos in front of a green and red temple .|Жуулчид Ногоон, Улаан ариун сүмийн өмнө зураг авдаг.
3780234150.jpg|0|A woman in a red tank tee , black shorts , white and black socks , with white sneakers is playing tennis , but she is kneeing on the ground .|Улаан танк Тэн, хар шорт, цагаан, цагаан, хар оймс өмссөн эмэгтэй, цагаан пүүзээр теннис тоглож байгаа боловч тэр өвдөг дээрээ өвдөг дээрээ байна.
3780240908.jpg|0|Two men dressed in odd clothing are jumping on a basketball court .|Сондгой хувцас өмссөн хоёр эрэгтэй сагсан бөмбөгийн талбай дээр үсэрч байна.
3780768589.jpg|0|Four different men sitting outside on cement steps in front of a building .|Барилгын урд талд цементийн алхамууд дээр сууж буй дөрвөн өөр эрчүүд.
3781326288.jpg|0|A group of people are sitting on a ledge in front of a building .|Бүлгийн бүлэг хүмүүс байшингийн урд талд сууж байна.
3781481086.jpg|0|Little girl with black hair , peach shirt with a tree and cat on it , white skirt with black polka dots posing in front of a downtown skyline .|Бяцхан охин, мууртай бяцхан охин, Мод, муурны цамц, цагаан өнгийн банзал бүхий цагаан банзал бүхий цагаан банзал бүхий цагаан юбка.
3781571333.jpg|0|A young girl dressed for cool weather in a cap and long-sleeved sweater , about to climb a log ladder to a playground platform .|НЭГДҮГЭЭР НЭГДҮГЭЭР НЭГДСЭН НЭГДСЭН НЭГДСЭН НЭГДСЭН НЭГДСЭН НЭГДСЭН НЭГДСЭН НЭГДСЭН НЭГДСЭН НЭГДСЭН НЭГДСЭН НЭГДСЭН НЭГДСЭН НЭГДСЭН НЭГДСЭН НЭГДСЭН ХУУДАС
3781615817.jpg|0|Three men in uniform , one in a blue turban , sit under a tree on a raised stone platform .|Дүрэмт дүрэмт хувцастай гурван эрэгтэй, цэнхэр турбан дотор нэг нь хөхөрсөн чулуун тавцан дээр модонд сууна.
378170167.jpg|0|White dog traveling alone down a paved path through some woods|Цагаан нохой нь ганцаараа хатуу хучилттай зам дээр аялдаг
3782318456.jpg|0|Five men in asian inspired garb wrap clothes around their heads while people converse in the background .|Азийн ариун цэврийн өрөөнд таван эр хүн гарч ирэх үед хүмүүс толгойн эргэн тойронд хувцасаа ороосон.
3782404759.jpg|0|A young woman wearing a short black and white skirt and no shoes , carrying a toddler wearing a red outfit and a hat while walking into deeper water from the shallow water on a beach .|Богино хар, цагаан өнгийн юбка өмсдөг залуу эмэгтэй, гутал өмсдөг, гутал өмсдөг, гутал өмсөж, далайн эрэг дээр гүнзгий усаар аялгуу, малгай өмсдөг.
3782706998.jpg|0|Young lady diving into a swimming pool wearing only a bikini with half of her body submerged .|Залуу бүсгүй, бие махбодийн тал нь зөвхөн түүний биеийн хагасыг живсэн усан сан руу шумбаж байна.
3782716564.jpg|0|On a grass lawn , a girl comes towards the camera viewpoint on a slip and slide water toy plastic sheet , sending up a splash of water from the small inflated pool at the end of it .|Өвсний зүлгэн дээр, охин нь гулсмал, слайд усан сангийн үзүүр рүү гулсаж, дараа нь жижиг хийссэн усан сан руу шилжсэн.
378336163.jpg|0|A man poses in mid jump beside a left turn road sign and a recumbent bicycle in the snow , behind him there is a large body of water .|Зүүн эргэлтийн гарын үсэг, цасны ард, цасны ард, цасны ард, цастай унадаг дугуй нь цас ордог.
3783803365.jpg|0|One evening three young ladies chatting on the street .|Гудамжинд нэг орой гурван залуу хатагтай нар чатлаж байна.
378398142.jpg|0|Young person sitting in the doorway of a house with a water hand pump in front of the house .|Байшингийн урд талын усны гар шахуургатай байшингийн үүдэнд сууж буй залуу хүн.
3783987753.jpg|0|The female artist was painting a landscape picture in the outdoors using a variety of colors .|Эмэгтэй уран бүтээлч олон янзын өнгөнүүдийг ашиглан гаднах үзэсгэлэнт зургийг зуржээ.
378434971.jpg|0|A bulldozer works to demolish a decrepit building ; in the background , another brick building waits for its demise , its face covered with a grid of blackened window-holes .|Bulldozer нь бууралтыг нураахаар ажилладаг;Арын дэвсгэр дээр өөр нэг тоосго барилга нурангаа хүлээхийг хүлээв.
378453580.jpg|0|A dog is jumping over a log in a wooded area while carrying another log .|Нохой өөр бүртгэл хөтлөхдөө модон хэсэгт модон хэсэгт үсэрч байна.
3784574313.jpg|0|Two people in hard hats and safety vests working with cable in a grassy area .|Өвсний талбайд кабелиар ажилладаг хоёр малгай, аюулгүй байдлын хантааз дахь хоёр хүн.
3784577325.jpg|0|One construction worker talks on his cellphone while the other works on the ground by a black pipe .|Нэг барилгын ажилтан гар утсаараа хар тамхи дээр харан дээр харан дээр гардаг.
3784860302.jpg|0|A single girls stands on an empty plaza looking at the large buildings in a city across the river .|Ганц охидууд голын даяар хотын том байшингийн том барилгуудыг хардаг хоосон плаза дээр зогсож байна.
378503271.jpg|0|A blond girl pulls a funny face as she cubes Velveeta cheese and puts it in a bowl .|Шаргал охин нь инээдтэй царайг шоо авчирч, велвеета бяслаг, аяганд тавьдаг.
3785465924.jpg|0|A boy and a girl hidden behind tall weeds of green grass .|Хөвгүүн ба ногоон өнгийн өвс ургамлын ард нуугдсан охин.
3785698218.jpg|0|A crowd stands behind a smiling blond woman in a striped shirt , whose sunglasses are perched on her head .|Нүүрэн дээр олон хүн инээмсэглэсэн туузтай цамцны ард зогсож, нарны шил нь толгой дээрээ гардаг.
3786279352.jpg|0|A mother holding an infant up against her shoulder in a kitchen .|Гал тогооны өрөөний мөрөн дээр нялх хүүхдэд наалддаг ээж.
3787061402.jpg|0|A boy sits behind two children in a grassy park and touches another boys ears .|Хөвгүүн өвсөн цэцэрлэгт хүрээлэнд хоёр хүүхдийн ард суугаад өөр хөвгүүд чихэнд хүрдэг.
3787108012.jpg|0|A woman seated on couch in a children 's section of a library holds up small piece of cloth while four kindergarten sized children and another adult watch her .|Номын сангийн дэлгүүрт сууж буйдан дээр сууж байсан эмэгтэй жижиг даавуугаар байрладаг.
3787376866.jpg|0|Blond woman in glasses holds an Asian child wearing pink at a park .|Нүдний шилэнд шаргал үстэй эмэгтэй хүн парк дээр ягаан өнгийн хүүхэд өмсдөг.
3787437809.jpg|0|A man is bowing his head and clasping his hands together in front of a gold statue .|Эр хүн толгойгоо бөхийж, алтан хөшөөний өмнө хамт гараа бариад гараа хамтарч байв.
3787451302.jpg|0|A blond man stands with an axe slung over his shoulder in a wooded area .|Шаргалчид Мөрний дагуу мөрөн дээр нь мөрөн дээр нь гулсдаг.
3787801.jpg|0|two workers sit at their desks , one gazing off into the distance while the other looks at a piece of paper .|Хоёр ажилчид ширээ дээрээ сууж, нөгөө нь зайны цаасыг хараад зайг харав.
3787916331.jpg|0|A shirtless man wearing a backwards hat and blue jeans balances on his front bike tire with the back one in the air .|Цамцгүй эр арагшаа өмссөн цамцгүй эр агаарт урд дугуйны дугуйг арагшаа чиглүүлдэг.
378867026.jpg|0|A skier lays on his back , arms outstretched , on the snowy ground .|Цэнэглэгч нь нуруун дээрээ хэвтэж, гараа цастай газар сунгасан.
3788779998.jpg|0|Two Asian children , a boy and a girl , the girl looking squarely at the camera and the boy making a face .|Азийн хоёр хүүхэд, хөвгүүн, охин, охин, охин нь Камер дээр, хүү нь нүүр царайг нь хардаг.
3789230623.jpg|0|"Two men do construction work by a wall with the words "" A SEMBLANCE "" adorned upon it ."|"Хоёр эр ""нь"" дэмий хоосон ""гэсэн үгээр дамжуулан барилгын ажил эрхэлдэг."
3789378919.jpg|0|People stand along the sidewalk watching a bus come their way .|Явган хүний зам дагуу явж буй явган хүний зам дагуу явдаг.
378969539.jpg|0|A girl holding a banner overhead with a gymnastics competition in the background within a gymnasium that has a large capacity seating for an audience .|Гимнастикийн гимнастикийн тэмцээнд оролцож буй гимнастикийн өрсөлдөөнийг үзэж буй гимнастикийн өрсөлдөөнтэй охин.
378969774.jpg|0|A woman on the uneven bars doing a gymnastics exercise while people are watch her out of focus .|Ухаангүй бааран дээрх эмэгтэй хүн гимнастик дасгал хийж байхдаа гимнастик дасгал хийдэг.
378970234.jpg|0|A female gymnast , wearing a red and white leotard , is preparing to do a mat routine .|ГЭР БҮЛИЙН ГЭРЭЛ, Улаан, цагаан өнгийн ирвэс өмссөн эмэгтэйн гимнастик, дэвсгэр хийх бэлтгэлээ хийж байна.
378998340.jpg|0|Trumpet player with eyes closed , playing in the band dressed in a red uniform with black cuffs and white braid trim .|Нүдээ аньсан нүдээ аньсан нүдээ аньсан, хар хөх, цагаан өнгийн сүлжих шүргэх
379006645.jpg|0|The black and brown dog walks toward the camera , in an enclosed , snowy area .|Хар ба хүрэн нохой нь камер руу залгаж, хаалттай, цастай талбайд алхдаг.
3790112538.jpg|0|Five individuals jumping with their arms straight up in front of the ocean .|Далайн урд гараараа шууд гараа шулуун үсэрч байв.
3790208395.jpg|0|Elderly woman with green sweater picking out produce in outdoor market .|Гаднах зах зээл дээр гардаг ногоон цамцтай ногоон цамц.
3790755587.jpg|0|A young girl bends down to her green pail which she is using to mop the tile floor .|Залуу охин нь плитаны шалыг шүүрдэхэд ашигладаг ногоон сав руу бөхийлгөдөг.
3790770806.jpg|0|The lady in a pink sweater is showing the other lady the leaves .|Ягаан цамцтай хатагтай нөгөө хатагтай навчийг харуулж байна.
37908123.jpg|0|A man wearing blue jeans and a gray sweatshirt is pulling on a rope in a parking lot with an orange and white crane behind him .|Цэнхэр жинсэн өмд өмссөн эр, саарал цамц өмссөн хүн, түүний ард улбар шар, цагаан кран дээр олсоор татаж байна.
37908155.jpg|0|A man in a tool belt is directing a construction site where a large object is lifted .|Хэрэгслийн бүс дэх эр хүн том объектыг өргөж буй барилгын талбайг чиглүүлж байна.
379111807.jpg|0|A man in a brownish green shirting playing guitar singing into a microphone|Хүрэн ногоон өнгийн ногоон цамцтай, гитар тоглож, микрофон дуулж байна
3791132794.jpg|0|An oddly dressed man wearing a plaid skirt and knee-high black boots stands is in the middle of a crowded area .|Хачирхалтай юбка, өвдөгний өндөр хар гутал өмссөн хачин хувцас өмссөн хүн зогсож байна.
3791591952.jpg|0|Young female , dressed as Hip Hop artist singing to a young male breakdancer , balancing himself upside down on one arm .|Залуу эмэгтэй, хип хоп зураач шиг хувцасласан залуу эрэгтэй хүний дүрд дуулж, нэг гараараа өөрийгөө тэнцвэржүүлдэг.
3792020604.jpg|0|The older man in a tan and white striped shirt is expressing his opinions to the two men wearing dark shirts as others look on .|Тан, цагаан өнгийн судалтай цамц нь бусад хүмүүсийн харцаар харц өмссөн цамц өмссөн хоёр цамцыг илэрхийлж байна.
3792602083.jpg|0|Girl standing in front of a musical band , playing for a party .|Хөгжмийн хамтлагийн урд зогсож байгаа охин үдэшлэгт тоглож байна.
3793619579.jpg|0|A boy in a blue shirt holds a toy helmet in his hands while standing on a path in a park .|Цэнхэр цамц өмссөн хүү нь цэцэрлэгт хүрээлэнгийн зам дээр зогсож байхдаа тоглоомон дуулга барьж байв.
3793774643.jpg|0|Man giving a presentation at the Australian War Memorial on an Apple MacBook .|Apple Markbook дээр Австралийн дайны дурсгалд танилцуулга өгч буй хүн.
3793793899.jpg|0|At night , a kid in a white shirt rides the rails on his skateboard .|Шөнийн цагаар цагаан цамц өмссөн хүүхэд, хүүхэд нь тэшүүр дээр төмөр замаа унадаг.
3794595430.jpg|0|A woman in a blazer speaking into a mic in front of a crowd with a presentation .|Илжигнүүдтэй олон түмний өмнө микрофонтой ярьж байна.
379505240.jpg|0|Two men in pink jerseys , two men in white jerseys , and one man in a black jersey and black helmet , are playing field hockey .|Ягаан өнгийн өмсгөл, цагаан өмсгөлтэй хоёр эрэгтэй, цагаан өмсгөл, хар өмсгөлтэй, хар өмсгөл, хар дуулга
3795409752.jpg|0|A man is pointing with his whole hand at a large projection of how folic acid helps neurulation .|Фолик хүчил хэрхэн тусалдаг томоохон хувь хүн түүний гарыг бүхэлд нь чиглүүлж байна.
3795581431.jpg|0|A little girl is seated , wearing a flower-print dress with a blue and red birthday party hat , surrounded by party attendees .|Бага зэрэг охин нь цэнхэр, улаан төрсөн өдрийн үдэшлэг өмссөн, цэнхэр, улаан төрсөн өдрийн үдэшлэгийн малгай өмссөн, үдэшлэгт оролцдог.
379611444.jpg|0|Four speed skaters representing different countries are racing across ice in front of camera people .|Өөр өөр улс орнуудыг төлөөлж буй дөрвөн хурдны уран гулгагч нь камерын урд мөсөн дээгүүр мөсөөр дамждаг.
379612511.jpg|0|Four skaters are competing in a high speed skating competition , and turning on the track .|Дөрвөн уран гулгагч нь өндөр хурдны тэшүүрээр өрсөлдөж, зам дээр эргүүлж байна.
3796631367.jpg|0|A woman in a red long-sleeved shirt and blue jeans stands at the lectern speaking at or about GLAM U WIKI .|Улаан урт ханцуйтай цамц, цэнхэр жинсэн өмд, цэнхэр жинсэн өмд нь лекц дээр зогсож, эсвэл glam u wiki-ийн тухай ярьдаг.
3796818804.jpg|0|People mingling in the foreground and background , two of them are walking towards those in the background that are positioned nearby of a building that is overshadowed by a large number of trees , while the two in the foreground are tending to a horse drawn carriage .|Нүүрэн дээр болон арын хэсэгт байрладаг хүмүүс нь олон тооны модыг байрлуулж байсан бөгөөд энэ нь урд талдаа байрладаг.
3796854356.jpg|0|Two people are walking down a path in the forest preserves .|Хоёр хүн ойн хадгалалтад зам дээр явж байна.
379690103.jpg|0|A ruddy infant lies on a patterned sheet with his eyes closed , his mouth open , and his arm extended .|Рудди нялх хүүхэд нүдээ аньсан хэв маягаар хэвтсэн хуудсан дээр хэвтсэн, түүний ам нээгээд гараа сунгасан.
37969110.jpg|0|Brown-skinned girl pretends to do her homework while someone takes a picture for social services .|Браун-арьстай охин нь хэн нэгэн нийгмийн үйлчилгээнд зориулж зураг авахдаа гэрийн даалгавраа хийв.
3797123205.jpg|0|There is a person with a white hat , blue coat and blue scarf passing a group of stands with various items for sale .|Цагаан малгай, цэнхэр өнгийн цув, цэнхэр өнгийн ороолт нь Борлуулах зориулалттай янз бүрийн зүйлтэй хамт зогсож байгаа нэг хүн байдаг.
3797595159.jpg|0|A woman is standing by a young child who is doing something with a computer .|Эмэгтэй хүн компьютертэй ямар нэгэн зүйл хийж байгаа залуу хүүхэдтэй зогсож байна.
3797596279.jpg|0|A young female child , stands in front of an interactive media device .|Залуу эмэгтэй хүүхэд, интерактив медиа төхөөрөмжийн урд зогсож байна.
3798411098.jpg|0|Three woman , one wearing blue , one wearing red , and one wearing white look at a display of a potato wearing a wig .|Гурван эмэгтэй, нэг цэнхэр хувцас өмссөн, улаан өмссөн, улаан, нэг нь хиймэл үс өмсдөг төмс өмсдөг.
3798412244.jpg|0|A multicolored display of Mama Lucchetti products .|Мама Люсчетти бүтээгдэхүүний олон өнгийн дэлгэц.
3798453280.jpg|0|A man in a red t-shirt , jeans and white sneakers standing in front of an ATM machine .|Улаан футболк, жинсэн өмд, цагаан перс, цагаан пүүз нь ATM машинын урд зогсож байв.
3798486812.jpg|0|Three people , wearing orange and black jumpsuits , are working , one is climbing the pole while the other two are on the ground with a business in the background .|Гурван хүн, улбар шар, хар үсрэлт өмсөж, ажиллаж байна, ажиллаж байгаа бөгөөд нөгөө хоёр нь арын хэсэгт бизнес эрхэлдэг.
3798552554.jpg|0|A man standing up in the middle of a filled restaurant where red light fixtures are hanging down from the ceiling .|Улаан гэрлийн бэхэлгээнд дүүрсэн рестораны дундуур зогсож байсан нэгэн хүн.
3798592106.jpg|0|a man with a tall glass of water sitting at a table looking at his phone at a eating place .|Хоолондоо хоолоо идэж буй ширээн дээр ширтэж буй ширээн дээр сууж байсан эр хүн.
3799562471.jpg|0|An elderly man dressed in a red vest , bowtie & straw hat is holding a saw and speaking into a microphone .|Улаан хантааз өмссөн хөгшин эр хүн, нум, сүрэл малгай нь хөрөө, микрофон дээр ярьж байна.
3799563009.jpg|0|A old man wearing red , white and bluish gray playing music on a stage using a cross-cut saw .|Хөндлөн, цагаан, цэнхэр өнгийн саарал өнгийн хөгжим өмссөн үе шаттай, загалмайг ашиглан нэг тайзны үзүүрээр тоглож байсан.
3799701220.jpg|0|Two middle-aged Asian men with mustaches working with animal hides in a shop .|Дунд насны хоёр дунд насны Азийн эрчүүд
3799708677.jpg|0|Monks walk past a large stone building with stone women at the top .|Лам нар дээд талд байрлах чулуун эмэгтэйтэй том чулуун барилга барьж байв.
3799845307.jpg|0|A man in a black shirt painting a duplicate copy of another painting hanging in an art gallery .|Хар цамцтай эр хүн уран зургийн галерейд өлгөөтэй өөр зураг зурдаг.
3799847884.jpg|0|An older woman looks at the camera while young children play with many kinds of toys around the room in the background .|Настай эмэгтэй арын эргэн тойронд байгаа өрөөнүүдийг тойруулан олон төрлийн хүүхдүүд тоглож байхдаа Камерыг харж байна.
3799884014.jpg|0|A man in a sweatshirt and shorts is standing next to a donkey , cleaning out a large bowl .|Хөлс, шорт, шорт, шорт нь илжигний хажууд зогсож, том аягаж цэвэрлэнэ.
3799980514.jpg|0|One man is holding a guitar in front of a microphone while there are people standing behind tables at an event .|Нэг хүн микрофоны өмнө гитар барьж байгаа хүмүүс үйл явдлын ард зогсож байгаа хүмүүс байдаг.
3799984714.jpg|0|A man playing a banjo near a tree at an outdoor event .|Гадна үйл явдлын дэргэдэх модны ойролцоо Банжо тоглож байна.
3799987586.jpg|0|A man is seen singing into a microphone and playing banjo with a guitar nearby while sitting on a stool at a festival where there are booths featuring items for sale .|Эрэгтэй хүн микрофон дуулж, Банжаа зарах, зарагдах зүйлсийг агуулсан зүйлсээр сууж, Банжаар гитараар тоглож байсан.
