image_name|comment_number|comment|Translated Comment
16639719.jpg|0|A group of people camping out surrounding a fire pit , some are sitting in chairs others on the ground , and one is poking the fire in a nightly and dark surrounding .|Галын нүхийг тойрч гарах бүлэг хүмүүс, зарим нь газар дээр нь сандал дээр сууж байгаа.
166433861.jpg|0|A motorcyclist is riding their sponsored car along a roadway that has recently turned .|Мотоцикльчин саяхан эргэж ирсэн замын дагуу ивээн тэтгэсэн машинаа унаж байна.
1664475761.jpg|0|Two boys try to attach fruits to a bicycle on a dirt road .|Хоёр хөвгүүн нь жимсний зам дээр жимс жимсгэний зураг дээр хавсаргахыг хичээдэг.
1664475859.jpg|0|People mill around outside a compound in what appears to be a Middle Eastern country .|Ойрхи Дорнодын орон шиг болсон зүйлсийн гадна тал нь хүмүүс тээрэмддэг.
166507476.jpg|0|The two reptiles are standing on their back legs near deep water .|Хоёр хэвлээр явагч нь арын хөлнийхөө арын хөл дээр зогсож байна.
16653104.jpg|0|Teenager about to hit a baseball on the ground with a blow up plastic hammer .|Өсвөр насныхан бейсбол дээр бейсбол дээр цохих хуванцар алхаар цохих гэж байна.
166654939.jpg|0|Race cars are racing each other on a dirt racetrack and the green one is in the lead .|Уралдааны машинууд шороон уралдааны зам дээр бие биенээ уралдаж, ногоон нь хар тугалгатай байдаг.
166695748.jpg|0|A man with tattoos on his arm , wearing a yellow shirt and black helmet is standing in a room .|Гар дээр шивээс хийлгэж, шар цамц өмсөж, шар цамц өмсөж, хар дуулга өмссөн хүн өрөөнд зогсож байна.
166774567.jpg|0|Woman in a leopard print outfit , walking in the street and a man in a dark blue jacket and denim jeans walking in the opposite direction .|Ирвэсний хэвлэмэл хувцас өмссөн эмэгтэй, гудамжинд алхаж, гудамжинд алхаж, харанхуй хөх, жинсэн өмд нь эсрэг чиглэлд алхаж байв.
166779879.jpg|0|A baby sleeping on man who is sitting in front of a table covered with food with other people .|Бусад хүмүүстэй хамт хоолоор хучигдсан хүснэгтийн урд унтаж байгаа хүүхэд.
167001809.jpg|0|A firefighter sprays water onto a gigantic pile or burning ash that includes flames and dark smoke .|Гал сөнөөгч шүршинэ нь галын гуужуулагч эсвэл шатаж буй үнс нурж, шатаж буй үнс нурж, шатаж байна.
1670592963.jpg|0|There is a brown and white dog jumping off of a seesaw .|Браун, цагаан нохой нь сейзав руу үсэрч байна.
167063396.jpg|0|A man in a red shirt and jacket is looking to the side while surrounded by other men wearing helmets .|Улаан цамцтай эр, хүрэм, хүрэм нь дуулга өмссөн бусад эрчүүдэд хүрээлэгдсэн байдаг.
167094639.jpg|0|Pedestrians navigate their way up and down a busy city stairwell .|Явган зорчигч нар завгүй хот, завгүй хотыг чиглүүлдэг.
167282806.jpg|0|A man holds a drink , and another man drinks from a glass , while they both make silly faces .|Эрэгтэй хүн ундаа барьдаг, өөр хүн шилэн дээрээс ууж, хоёулаа нэг тэнэг царайтай болжээ.
167285940.jpg|0|A man wearing glasses and a white dress shirt looks intensely at a glass of beer as he lifts it to drink .|Нүдний шил зүүж, цагаан даашинз өмссөн эр үү?
167295035.jpg|0|A climber wearing a white helmet is perched on the side of a rock face .|Цагаан дуулга өмссөн уулчин нь хадны нүүрний хажуу талд байрладаг.
1673433891.jpg|0|A grinning man is just about to drill a hole into a pumpkin lying on a table .|Гайхамшигтай хүн ширээн дээр хэвтэж буй хулуу руу нүх гаргах гэж байна.
1673911365.jpg|0|A man in a blue jumpsuit and red helmet is climbing up a ladder and another man is watching him .|Цэнхэр өнгийн үсрэлт, улаан дуулга, улаан дуулга авирч, өөр хүн түүнийг харж байна.
1674159861.jpg|0|Cameramen and other men in orange hard hats stand atop a platform overlooking the wide open vista .|Камерамен болон бусад эрчүүд хатуу, эрэгтэйчүүд том малгай нь өргөн нээлттэй Vista-г үл тоомсорлодог платформууд дээр зогсож байна.
1674493314.jpg|0|An older woman dressed in the garments of an African tribe has her right hand in a cracked brown pot and holds her left hand over another brown pot .|Африкийн овгийн хувцас өмссөн хөгшин эмэгтэй нь баруун гараараа хагарсан хүрэн саванд хийж, зүүн гараа өөр хүрэн саванд барьж авав.
167452748.jpg|0|A man in a blue jacket standing next to a bus smiling with his back hand in his pocket .|Халамжинд автобусаар инээмсэглэсэн автобусны хажууд байрлах цэнхэр хүрэмтэй хүн.
1674612291.jpg|0|A dog is jumping to catch a Frisbee and casts a perfect shadow .|Нохой нь Фрисби барьж аваад төгс сүүдэрлэдэг.
167481877.jpg|0|A group of young Asians cooking on an outdoors barbecue in a park .|Гадаа цэцэрлэгт хүрээлэнг цэцэрлэгт хүрээлэнд хоол хийж байгаа залуу азичууд.
1675332284.jpg|0|An African American man with a black hat and black tank top plays the drums on some buckets for donations .|Хар малгай, хар танк, хар танкийн шилдэг хүн, хар танкийн дээд хэсэг нь хүрдэд хүрдүүддээ бөмбөр дээр тоглодог.
1675485579.jpg|0|A man with a surprised look on his face holds a large portfolio .|Гайхамшигтай харцтай хүн түүний нүүрэн дээр том портфолио барьдаг.
1675679141.jpg|0|A man stands on a concrete ledge and casts his fishing pole into the water below .|Эрэгтэй бетонон дээр зогсож, загас агнуурынхаа туйлыг доор нь хаядаг.
1676601498.jpg|0|A male and a female are leaning against railing looking off with the ocean in the background|Эрэгтэй, эмэгтэй хүн арын хэсэгт далай тэнгисийн арын хэсэгт байрлах хашлага руу бөхийж байна
1676898063.jpg|0|A beautiful little toddler has a beaming grin as she is held by a smiling older female .|Үзэсгэлэнт бяцхан хүүхэд настнууд инээмсэглэсэн хөгшин эмэгтэйг барьж байхдаа цацраг туяа цацардаг.
1678256882.jpg|0|A young man , in a baseball cap and blue striped shirt , is playing the guitar .|Бейсболын малгай, цэнхэр судалтай цамц, цэнхэр судалтай цамц өмсөж, гитар тоглож байна.
1678345419.jpg|0|A young man in a white shirt is sitting on a wall with his legs wrapped around a young girl , with their motorcycle helmets on the wall behind him .|Цагаан цамцанд байгаа залуу эмэгтэй хөлөөрөө хөлөөрөө орооцолдож, мотоциклийн малгайгаа мотоциклийн дээлээр боож байв.
1678396864.jpg|0|An elderly woman in a black dress holds a black umbrella over a small boy in a red jacket and brown pants on a pier with a boat in the background .|Хар хувцас өмссөн настай эмэгтэйг хар үстэй, цоорхойтой улаан шүхэр, хүрэн өмдтэй, цоорхойг цоолж, арын дэвсгэр дээр цоолж байна.
1678844410.jpg|0|A male child jumping off a ledge , he has a backpack on his back and a toy airplane in his left hand .|Эрэгтэй хүүхэд хэвтэж унав, түүний ар талдаа буцаж, тоглоомын онгоцонд байгаа, зүүн гартаа тоглоомын онгоцтой.
16793868.jpg|0|A man in a Las Vegas t-shirt smiles while meat is being cooked on a grill in the background .|Лас Вегас футболк өмсөж байхдаа махан дээр махан инээмсэглэж байх үед махыг ар араасаа чанаж болгосон.
1679557684.jpg|0|A white dog is watching a black dog jump on a lawn next to a pile of large rocks .|Цагаан нохой нь хар нохойг харан нохой дээр үсэрч, том хадны хажууд байрлах зүлгэн дээр үсэрч ажиглаж байна.
1679565118.jpg|0|Black dog jumping in the air with white dog standing on grass behind near pile of rocks .|Хар нохой агаарт үсэрч буй цагаан нохойтой хамт агаарт үсэрч, хадны цаана хадсан хадны ард байрладаг.
1679607622.jpg|0|A man sits in a chair on a bus or plane reading a newspaper .|Нэгэн хүн сонинд уншиж, нэг сонин уншиж байсан сандал дээр сууж байна.
1679617928.jpg|0|A basset hound is leashed to the rearview mirror of a yellow and white vehicle|Бассены ан амьтан нь шар, цагаан тээврийн арын хэсэгт арын толин тусгал руу ордог
1679732375.jpg|0|Two people , one in gray and one in white , sitting on a bench by a walking path looking over a field at a forest during autumn .|Хоёр хүн, нэг нь саарал, нэг нь Намрын үеэр ойд очиж усан санд сууж байв.
1680126311.jpg|0|A child is playing soccer with a blue and white soccer ball nearby onlookers .|Хүүхэд цэнхэр, цагаан хөлбөмбөгөөр тоглож, ойролцоо оёдолчинд хөл бөмбөг тоглож байна.
1680409989.jpg|0|A person with a purple shirt is painting an image of a woman on a white wall .|Нил ягаан цамцтай хүн цагаан ханан дээр эмэгтэй хүний дүр төрхийг зурдаг.
16806669.jpg|0|A boy looks through a microscope with papers beside him on the desk .|Хөвгүүн нь ширээн дээрх түүний хажууд байрлах цаасаар дамжуулан микроскопоор хардаг.
1680674943.jpg|0|Two little girls are playing in their house , one is on the floor grinning evilly wearing pink pajamas and the younger one is standing over her wearing a hairnet and mask and purple pajamas .|Хоёр бяцхан охин тэдний гэрт тоглож байгаа, нэг нь ягаан унтлагын өмд өмсөж, залуу хувцас өмсдөг, залуу нь үсчин, маск өмсөж, маск өмсдөг байв.
1681253990.jpg|0|A girl is outside painting a picture of a lady on the side of the wall using chalk|Нэгэн охин гадаа ханан дээрх эмэгтэйн зургийг шохойгоор зурдаг
168131914.jpg|0|A young lady is being videotaped while she 's sitting in her stroller in front of a Sysco truck on the sidewalk .|Залуу бүсгүй нь явган хүний зам дээр аялгууны ачааны машины урд сууж байхдаа видео бичлэг хийж байна.
1682079482.jpg|0|A young girl making a wide mouthed expression while swinging .|Дүүж байхдаа өргөн амтай том илэрхийлэл хийж байна.
1683444418.jpg|0|A man in a camouflage tank top standing next to a man in a gray t-shirt with a fountain in the background .|Арын дэвсгэрт саарал өнгийн футболкийн хажууд байдаг эр хүний хажууд байгаа эрэгтэй хүний хажууд байгаа хүн.
1683695914.jpg|0|Many people wait to eat dinner as the man at the head of the table says grace .|Олон хүмүүс оройн хоолонд оройн хоол идэхийг хүлээж байна.
168482401.jpg|0|Two men in black are clearing brush , one has black gloves and a tattoo , the other is holding a machete .|Хар арьстнууд нь хоёр эрийг цэвэрлэж байна, нэг нь хар бээлий, шивээс, нөгөө нь Мачет барьж байна.
168536743.jpg|0|A uniformed man smiling as he drives an old fashioned vehicle .|Дүрэмт хувцастай хүн хуучин загварлаг тээврийн хэрэгслийг жолоодож байхдаа инээмсэглэв.
1685463722.jpg|0|The woman in blue shorts and a brown vest has a black dog to the right of her and a dog behind her .|Цэнхэр шорт, хүрэн биелэгдэнэ, хүрэн биелэгдэнэ, хүрэн биелэгдэнэ, түүний баруун талд хар нохойтой.
1685990174.jpg|0|A bunch of kids run on a school play field .|Сургуулийн тоглолтын талбай дээр хүүхдүүд гүйлт хийдэг.
168728234.jpg|0|A man wearing in a white , purple and yellow outfit walking on stilts .|Цагаан, ягаан, ягаан, шар өнгийн хувцас өмссөн хүн.
1687886596.jpg|0|A guy sitting on a stool in a light tan shirt and darker tan shorts with glasses around his neck working on a project .|Өтгөнтэй, өтгөн цамц өмсөж, бараан өнгийн цамц, бараан өнгийн шорт нь хүзүүгээр нь шилжсэн.
1688699579.jpg|0|A smaller white dog is trying to get a hold of a stick that a bigger tri-colored dog has in its mouth .|Жижиг цагаан нохой нь илүү том три өнгөтэй нохой амандаа наалдаж авахыг хичээдэг.
1689265814.jpg|0|A person , wearing a costume with many flowers , is standing on the sidewalk trying to get the attention of people passing by .|Олон цэцэг бүхий хувцас өмссөн хүн, явган хүний зам дээр явж буй хүмүүсийн анхаарлыг татах гэж оролдож байна.
1689283621.jpg|0|A man wearing a green jacket and knit hat is sorting tomatoes at an outdoor market .|Ногоон хүрэм өмсөж, сүлжмэл малгай өмссөн эр нь гадаа зах зээл дээр улаан лоолийг эрэмбэлж байна.
1689658980.jpg|0|The two dogs are enjoying a run through the surf .|Хоёр нохой нь гадаргуугаар дамжин гүйж байна.
1689991150.jpg|0|A woman in red is standing in the background , watching a golden dog race through a field of tall grass .|Улаан өнгөтэй эмэгтэй ар араасаа зогсож, өндөр өвсний талбайгаар алтан нохойн уралдааныг ажиглаж байна.
169003493.jpg|0|Woman coming out from a building in an Asian city .|Ази хот дахь барилгаас гарч ирэв.
1690043294.jpg|0|A group of Asian men and women talk to each other as they walk down a busy street corner .|Азийн эрчүүд, эмэгтэй хүмүүсийн дунд завгүй гудамжны булан руу алхаж байхдаа бие биетэйгээ ярилцдаг.
1690350208.jpg|0|A group of indian people , one dressed in white and the other in red , are sitting on a rug , doing something with tea .|Энэтхэгийн бүлэг, нэг нь цагаан, нөгөө нь улаан өнгөөр хувцасласан, нөгөө нь улаан, улаан өнгөтэй, цай ууж байна.
1690926854.jpg|0|Two teammates from the USA team are jumping in the air to give high-fives while two teammates watch .|АНУ-ын багаас хоёр багийн тамирчид агаарт гарч, хоёр багийн тамирчин байхад өндөр гэр бүлд үсэрч байна.
1691038839.jpg|0|A kid in a blue and black hockey jersey has just scored a goal on a kid in a white and tan hockey jersey .|Цэнхэр, хар хоккей Жерси Жерси Цагаан, Тэн Хоккей Жерсигийн нэг зорилтот оноо авсан.
1691573772.jpg|0|A woman wearing a pink sweater rides a bike with a car behind her .|Ягаан цамц өмссөн эмэгтэй нь түүний араас машинаар дугуй унадаг.
1693115528.jpg|0|A woman sitting in a booth at a restaurant watching hockey on a flat screen TV .|Хавтгай дэлгэц дээр хоккейд хоккейд сууж байна
1693120546.jpg|0|A young woman 's attention is fixed on a television screen in a sports bar .|Залуу эмэгтэйн анхаарлыг спортын бааранд телевизийн зураг дээр засдаг.
16933558.jpg|0|Two boys performing what appears to be a kissing scene in lunch room .|Өдрийн өрөөнд үнсэлтийн дүр зураг харагдаж байгаа хоёр хүү.
1693733107.jpg|0|Two people sit in handicapped seats , one touching her ear while the other touches her eyes .|Хоёр хүн тахир дутуу суудалд сууж, нөгөө нь түүний нүдэнд хүрч байхад нөгөө нь түүний нүдэнд хүрдэг.
1694114389.jpg|0|A man wearing a jacket and hat rides his bicycle among bright rays of sunshine that is streaming between an array of Autumn leafs .|Намрын навчны цуврал нар, малгай өмссөн эрчүүдэд зориулсан тод туяаны дунд дугуй цэцгийн дунд унадаг дугуйгаа унадаг.
169450570.jpg|0|Six men sitting around a desk with computers while a woman dressed in a white suit looks through papers .|Цагаан костюм өмссөн эмэгтэйтэй байхдаа компьютерийн ширээн дээр сууж буй зургаан эрэгтэй.
1694555858.jpg|0|An asian man wearing a business suit is sleeping on the subway or some other sort of public transportation .|Бизнесийн костюм өмссөн Азийн хүн метро, эсвэл бусад нийтийн тээврээр унтдаг.
169490297.jpg|0|A boy in a blue , yellow , and orange shirt holding his arms out from his sides .|Цэнхэр, шар, шар, улбар шар цамц нь түүний гараас гараа барьж байв.
169629403.jpg|0|A group of people wearing blue shirts stand outside in front of a tree .|Цэнхэр цамц өмссөн хүмүүс модны өмнө гадаа зогсож байдаг.
16988097.jpg|0|Man in dark business suit , sitting by a marble water fountain , wearing eyeglasses and talking on his cellphone with newspaper on his lap .|Бараан бизнесийн костюмтай, гантиг усны усан оргилуур, нүдний шил зүүж, өвөр дээрээ сонинд гар утсаараа ярих.
1698837338.jpg|0|A woman scantily dressed in a tribal green and blue costume dances in a parade while onlookers watch .|Эмэгтэй хүн үзэгчдийг үзэж байхдаа омгийн ногоон, цэнхэр өнгийн хувцас өмссөн эмэгтэй.
1698995792.jpg|0|Several people are walking down a street , ignoring a mime in a turban , who appears to be sitting on something while on a cigarette break .|Хэд хэдэн хүн гудамжаар алхаж, тамхины зам дээр миман руу алхаж байна.
169959689.jpg|0|In the desert on a cloudy day , a long camel caravan makes several curves away from the camera , the last camel passing a sign along side the trail .|Үүлэрхэг өдөр цөлд, урт хугацааны караван Карван нь камераас хэд хэдэн муруйг камерын хажуугаар өнгөрдөг.
170007535.jpg|0|A man and a woman in wedding clothes in back of a limo with others of a wedding party|Хуримын үдэшлэгийн арын хэсэг, хуримын хувцасны арын хувцас, эмэгтэй хүн
1700282068.jpg|0|Two Harley-Davison police motorcycles park in a single parking space .|Харли-Дэвидсоны цагдаагийн мотоцикль нь нэг зогсоолын орон зайд цэцэрлэгт хүрээлэн.
170100272.jpg|0|A small girl slides down a spiral slide at the playground .|Жижигхэн охин тоглоомын талбай дээр спираль слайдыг слайдаар гулсдаг.
170258785.jpg|0|Two men working outside cleaning the street in their orange uniforms .|Гудамжны гадна талын жүржийн дүрэмт хувцастайгаа хамт гудамжинд ажилладаг хоёр хүн.
170273913.jpg|0|A smiling man in uniform stands on a cobblestone street , surrounded by grinning people in brightly-colored clothes .|Дүрэмт хувцастай инээмсэглэл нь хүмүүсийг тод өнгөөр тод өнгөөр хүрээлэх замаар хүрээлэгдсэн байдаг.
170292350.jpg|0|A baseball player in a red jersey throwing a ball at the pitchers mound .|Улаан өмсгөлтэй бейсболын тоглогч тогоочдод бөмбөг шидэж бөмбөг шидэж байна.
1703971772.jpg|0|Two girls on tricycles are riding around a concrete area that resembles part of a maze .|Трактикууд дээрх хоёр охин нь Maze-ийн нэг хэсэгтэй төстэй бетонон талбайг тойрон явж байна.
170405864.jpg|0|The South American dancer is with a small boy during Carnival ' .|Өмнөд Америкийн бүжигчин багт наадам хийх үеэр жижиг хүүтэй байдаг. '
170473787.jpg|0|A man in military camouflage is working a shepherd type dog in a grassy area while being observed by others in a parking lot in uniform .|Цэргийн өнгөлөн далангүй эр хүн квадратаар, загатнах газартай,
170525064.jpg|0|Two men dressed in blue uniforms wearing headphones are standing with their arms behind their back while a man dressed in a brown camouflage uniform with a leashed dog looks over his right shoulder at several parked vehicles .|Цэнхэр өнгийн дүрэмт хувцас өмссөн цэнхэр өнгийн хувцас өмссөн хоёр эрэгтэй нь хөх өнгөлөн далангүй нохойтойгоо хамт хувцас өмссөн хүн хэд хэдэн парктед машин дээр гарч ирэв.
170525554.jpg|0|Active photographers are watching and snapping photos at a noisy outdoor event .|Идэвхтэй гэрэл зурагчид чимээ шуугиантай гадаа үйл явдлын зургийг харж, тайрч байна.
170540666.jpg|0|Two people in dark jogging suits walk with a group of participants in the Race For The Cure .|Харанхуй гүйлтээр хоёр хүн эмчлэх уралдаанд оролцогчтой хамт оролцогчтой хамт алхдаг.
170541259.jpg|0|A large crowd of people are walking for the cure on a gray , overcast day with a blue car heading in the opposite direction .|Олон хүн олон хүн саарал, улаан машинтай хамт цэнхэр машинтай хамт цэнхэр машинаар явж байна.
170541548.jpg|0|A group of people participate in the walk to support breast cancer .|Хөхний хорт хавдрыг дэмжихийн тулд хүмүүс алхаж буй хүмүүс оролцдог.
170547828.jpg|0|an elderly man checking a fishing net in a small boat on the beach .|Ахмад настнууд далайн эрэг дээрх жижиг усан онгоцонд загас барих торыг шалгаж байна.
170550385.jpg|0|Four men in fatigues ride across a dry field on the back of a John Deere Gator while a woman sits at the wheel .|Фатибузын дөрвөн эр хүн дугуй дээр сууж байхдаа john deere gator-ийн арын хэсэгт хуурай талбайд явдаг.
170614554.jpg|0|A group of young children wearing backpacks are gathered together and watching a woman in brown shorts and a white t-shirt .|Үдэшлэг өмссөн залуу хүүхдүүд цугларч, нэг эмэгтэй цугларч, бор шорт, цагаан өнгийн футболк өмсдөг.
