image_name|comment_number|comment|Translated Comment
4887777705.jpg|0|A young man wearing short pants and a backpack is standing in a parking lot with his hand on his head .|Богино өмд өмссөн залуу, үүргэвчиндээ гараа толгой дээрээ гараараа зогсож байна.
4887777901.jpg|0|A man in a white shirt taking a photograph , while lots of people sit on the steps .|Цагаан цамцтай хүн гэрэл зураг аваад олон хүмүүс алхам алхмаар сууж байв.
4887879873.jpg|0|A man stands near a metal railing that runs along side a river , with a city in the background .|Эрэгтэй хүн голын хажуугаар явдаг металлын хашлага, арын дэвсгэртэй хоттой хамт зогсож байна.
488797425.jpg|0|Many people are outside in a town wearing safety vests walking around .|Олон хүмүүс гадаа алхаж буй аюулгүйн хантааз өмссөн хотод байдаг.
4888017896.jpg|0|Two men are sitting at a table , one of them smoking , with two drinks on their table staring out into the area in front of them .|Хоёр хүн ширээн дээр сууж байна, тэдний нэг нь тамхи татдаг, тэдний урд хоёр ундаа нь тэдний өмнө хоёр ундаа ширтэж байв.
4888123485.jpg|0|A woman carrying several bags in one hand and a shoulder bag over her other arm , walks with her head down , along a street , as several other passersby walk along the same street in the opposite direction .|Нэг гараараа хэд хэдэн цүнх авч, нөгөө гараараа мөрөн дээрээ байрлуулж, нөгөө гараараа нөгөө гудамжаар алхаж, гудамжинд алхаж явдаг.
4888149239.jpg|0|A woman wearing a blue shirt , jeans and red converse sneakers takes a photograph .|Цэнхэр цамц өмссөн эмэгтэй, жинсэн өмд, улаан, улаан хөрвүүлэгч пүүз нь гэрэл зураг авдаг.
4888243690.jpg|0|A nearly monochromatic picture of a gorgeous old city street at sunset .|Нар жаргах үед хотын гайхалтай хуучин хотын гудамжны бараг л монохромат зураг.
4888278371.jpg|0|A woman talking on her cellphone and a man shopping at a small outside shop .|Гар утсаараа ярьж буй эмэгтэй хүн жижиг дэлгүүрээр дэлгүүр хэсдэг.
4888307519.jpg|0|Many people are standing on the street and one young woman is wearing headphones and looking toward the camera .|Олон хүмүүс гудамжинд зогсож байгаа бөгөөд нэг залуу эмэгтэй чихэвч өмсөж, камер руу чиглэж байна.
4888308769.jpg|0|A asian male rides a bike in the streets of a large brightly lit city .|Азийн эрэгтэй том гэрэлтдэг хотын гудамжинд дугуй унадаг дугуй унадаг.
4888309413.jpg|0|While standing in a crowd of people , a man with dark hair is holding a blond-haired little boy on top of his shoulders who looks very tired .|Олон хүн олон хүн зогсож байхдаа харанхуй үстэй хүн шаргал үстэй бяцхан хүүг түүний мөрөн дээр нь харагддаг.
4888366529.jpg|0|A woman in a short red dress and black boots stands while playing an electrified red cello .|Богино улаан даашинз, хар гутал, хар гутал нь цахилгаан селло тоглож байхдаа зогсож байна.
4888378070.jpg|0|Several people sitting , standing or descending high , wide set of white , outside stairs .|Хэд хэдэн хүн сууж, зогсож, дээшээ доошоо буух, эсвэл өргөн цар хүрээтэй байдаг.
4888378326.jpg|0|Three men sit next to each other and a woman walks toward their direction .|Гурван эр бие биенийхээ хажууд сууж, эмэгтэй хүн чиглэл рүүгээ явдаг.
4888431749.jpg|0|A man with a black hat and blue and white shirt standing near a stand full of hats , scarves , nesting dolls outside .|Хар малгай, цэнхэр, цагаан цамцтай, гадаа малгай, ороолт, ороолтоор дүүрэн байдаг.
4888497463.jpg|0|Two monks in bright orange togas standing under a tree in front of a home with Tibetan statues on both sides of entrance .|Хурц улбар шар өнгийн тоон дээр хоёр лам нарыг гэрийн хоёр талд байрлах байшингийн өмнө
488866979.jpg|0|A young woman is holding a baby as she lays on a blue checkered sofa .|Залуу эмэгтэй нь цэнхэр шалгагчтай буйдан дээр хэвтэж байхдаа нялх хүүхэд барьж байна.
4888840424.jpg|0|A man wearing a white shirt and khaki pants passes in front of a snack stand .|Цагаан цамц өмссөн эр хөнгөн зуушны урд талд дамждаг.
4888936808.jpg|0|An older man in a purple shirt sitting on a bench with his foot on a pole .|Нил ягаан өнгийн цамц өмссөн том цамц өмссөн том цамц.
4888969156.jpg|0|A female dressed in red plays an odd looking stringed instrument .|Улаан өнгөөр хувцасласан эмэгтэй сондгой харагддаг туузыг тоглодог.
4889084974.jpg|0|An onlooker peers from above to watch a construction worker below carefully cements stone squares in place for an outdoor walkway .|Дээрх хүмүүсийн үе тэнгийнхэн нь барилгын ажил хийж, гадаа явган аялал хийхээр байрлах чулуун квадратыг анхааралтай ажиглаарай.
4889128774.jpg|0|A man with a colorful array of pinwheels is standing in front of some people on motorbikes .|Өнгөлөг цуваа бүхий хүн мотоцикль дээр зарим хүмүүсийн урд зогсож байна.
4889181219.jpg|0|A man in a blue shirt lifts a long pole-handled tool towards a ceiling in a restaurant decorated in an Oriental style with small orange paper lanterns .|Цэнхэр цамц өмссөн эр хүн жижиг улбар шар өнгийн цаасан дэнлүүтэй зоогийн газарт таазанд тааз руу чиглэсэн таазанд өргөжүүлдэг.
4889242095.jpg|0|A small group of people are standing in front of a store under an umbrella that is covered in a red tablecloth .|Жижиг бүлгийн хүмүүс улаан ширээний бүтээлчээр бүрхэгдсэн шүхэр дор зогсож байна.
4889307357.jpg|0|An elderly Asian woman wearing a straw-like hat sits outside near a bicycle while a gray car is about to pass by .|Настай азийн эмэгтэй хувцас өмссөн сүрэлтэй эмэгтэй унадаг дугуй өмсдөг, саарал машин өнгөрөх гэж байна.
4889385580.jpg|0|2 kids and one men on a Motorcycle its black one kid has a yellow shirt on the other one has a blue shirt on the men his a white shirt on and a white hat on .|2 хүүхэд, нэг эрчүүд мотоцикль дээр нэг эр хүн, нөгөө нь шар өнгийн цамцтай, цагаан цамц өмссөн цэнхэр цамцтай, цагаан цамц өмсдөг.
4889393782.jpg|0|A man is holding up the white shirt he is wearing exposing is abdomen while sitting on a red motorbike .|Эрэгтэй хүн цагаан цамц өмсөж байгаа цагаан цамц өмсөж байгаа нь улаан мотоцикль дээр сууж байхдаа хэвлий юм.
4889441439.jpg|0|An elderly oriental looking woman , in a black jacket with flower print , is holding up a smiling baby in a brown hooded outfit with flower print .|ХӨДӨЛГӨӨНД ОРОЛЦОГЧ, ХУГАЦААНЫ ХУГАЦААНЫ ХУГАЦАА, ХУДАЛДАН АВЧ БАЙНА.
4889455765.jpg|0|A marching band dressed in red tunics and black trousers with tall black furry headpieces are walking in pairs in cadence down a sidewalk bordering a stone wall .|Өндөр хар үстэй, хар өмдтэй улаан өмд, хар өмдтэй хамт хувцас өмсдөг.
4889458424.jpg|0|A man wearing a dark green shirt and a camera strapped around his neck stands on a city street and frowns .|Харанхуй ногоон цамц өмссөн эр, хүзүүгээ хаасан камер нь хотын гудамжинд зогсож, хөмсгөө зангидаж байв.
4889481566.jpg|0|Young woman playing the violin , staring into the camera .|Хийл тоглож, камер руу ширтэж буй залуу эмэгтэй.
4889482908.jpg|0|A bald man in a black shirt and sunglasses plays a large stringed instrument outside .|Хар цамц, нарны шилэнд халзан хүн гадаа том мөртэй багаж тоглодог.
4889806295.jpg|0|A man wearing a shite short-sleeved shirt kisses a woman wearing a light pink jacket while standing on a public street .|Шилдэг богино ханцуйтай цамц өмссөн хүн олон нийтийн гудамжинд зогсож байхдаа хөнгөн ягаан хүрэм өмсдөг эмэгтэйг үнсэж байв.
4889818024.jpg|0|A man wearing a blue shirt and dark pants is riding a bicycle and is approaching an intersection .|Цэнхэр цамц өмссөн эр, бараан өмд өмссөн хүн унадаг дугуй унаж, уулзварт ойртож байна.
4889835088.jpg|0|A chef wearing white and black ( and a white chef hat ) lifting a spoon full of his newly concocted soup from a large stainless steel pot .|Цагаан, хар, хар (цагаан тогоо малгай малгай өмссөн) том зэвэрдэггүй ган савнаасаа л халбагаар дүүрсэн тогооч.
4889849608.jpg|0|There is a lady riding a bicycle on the sidewalk and people walking by a Chinese restaurant .|Явган хүний зам дээр унадаг дугуй унаж буй эмэгтэй байдаг, Хятад ресторанаар алхаж буй хүмүүс байдаг.
4889930205.jpg|0|Bikers riding their motorcycles in a motorcycle lane amid a bustling city .|Дугуйчид мотоцикльчууд мотоциклийн зам дээр мотоциклийн зам дээр унаж байна.
4889930609.jpg|0|A woman is looking at her camera and her husband is standing facing her waiting to have his picture taken .|Эмэгтэй хүн түүний камер руу харж байгаа бөгөөд нөхөр нь түүний зургийг хүлээж буй түүний хүлээж байна.
4890064956.jpg|0|A woman dressed in a swimsuit is leaning against a pier while a man takes her picture .|Нэгэн эмэгтэй хувцас өмссөн эмэгтэй хүн түүний зургийг авч байхдаа хөлнийхөө эсрэг бөхийж байна.
4890093788.jpg|0|A blond women in a dress carrying a white purse walks past a window front .|Цагаан түрийвчтэй даашинз өмссөн шаргал үстэй эмэгтэйчүүд цонхны урд алхаж байв.
4890158457.jpg|0|A small group of adults and children stand on a cobblestone street outside of an Irish pub .|Насанд хүрэгчдийн жижиг бүлэг, хүүхдэд ирланд пабаас гадна байрлах цомгийн гудамжинд зогсож байна.
489017052.jpg|0|A woman in a blue dress and a little girl walking in an outside marketplace .|Цэнхэр даашинзтай эмэгтэй, гадаа жижигхэн охин гаднах зах зээл дээр алхаж байна.
4890344819.jpg|0|A crowd of standing and sitting people taking their own pictures with multiple cameras .|Олон хүн зогсож, сууж, олон тооны зурагнуудаа олон камераар авч явдаг.
4890379428.jpg|0|A woman is walking in the road wearing Ugg boots in front of Hutchesons ' grammar school .|Эмэгтэй хүн Hutchesons-ийн сургуулийн өмнө UGG гутал өмссөн зам дээр алхаж байна.
4890458723.jpg|0|People walking under a covered arch way , that passes a plaza filled with vendors tents .|Хулгайлагдсан нуман нуман хазаар дамжин алхаж байгаа хүмүүс Плаза нь худалдаачдын майхангаар дүүргэсэн плаза дамжуулдаг.
4890590648.jpg|0|People riding on a vehicle that is being pulled by another person down a street by the beach .|Далайн эрэг дээрээс нөгөө хүнээс доошоо явж буй тээврийн хэрэгслээр явж буй машин дээр унаж байна.
4890592090.jpg|0|Three boys are looking through a fence lined with rocks on the opposite side .|Гурван хөвгүүн нь эсрэг талд чулуулаг доторлогоотой хашаа туулж байна.
4890594204.jpg|0|A man with a bandanna plays some homemade instruments in a crowded city .|Банданна хүнтэй нэг хүн хөл хөдөлгөөн ихтэй хотод гар хийцийн хэрэгслээр тоглодог.
489065557.jpg|0|A person in swimming trunks who has used a rope swing to jump into a lake .|Нуур руу үсрэхийн тулд олс сэлүүрт сэлж байсан усан сэлэлтэнд байгаа хүн.
4890659779.jpg|0|A man vendor with a bright yellow umbrella and backpack offers his wares to an elderly couple .|Шар Шар Шар Шар шүхэртэй, үүргэвчин, үүргэвчиндээ ахмад настнуудад нь ахмад настнуудад санал болгодог.
4890769146.jpg|0|Four adults and a little blond girl walk up a set of outside stairs lead by a lady in a pink shirt .|Дөрвөн насанд хүрэгчид, бяцхан шаргал охин ягаан цамцтай эмэгтэйн гаднах шатаар явдаг.
48908313.jpg|0|A woman in a red dress is singing on a stage next to three men playing instruments .|Улаан даашинзтай эмэгтэй гурван хүний хажууд тоглодог гурван хүний хажууд тайзан дээр дуулж байна.
48908641.jpg|0|A band performs beneath colorful stage lights , the bass player singing into the microphone while the guitarist and drummer play in the background .|Багц нь өнгөлөг тайзны гэрлийн доор тоглодог, басс цоорхойг микрофон дээр тоглодог.
48909006.jpg|0|Two women , one in blue , the other in white , sing in a brown walled room while a man in a scarlet shirt plays lead guitar , a man in a white shirt drums , a man in a white shirt plays keyboard and a man wearing black plays bass .|Хоёр эмэгтэй, нөгөө нь цэнхэр өнгийн цамц, цагаан цамц өмссөн, цагаан цамц, цагаан цамцтай хүн хар тугалгатай өрөөнд хар тугалга, цагаан цамц өмсдөг хүн бол цагаан цамц өмсдөг, цагаан цамц өмсдөг эрэгтэй, цагаан цамц өмсдөг хүн бол цагаан цамц өмсдөг хүн, цагаан цамц өмсдөг хүн гар, цагаан цамц өмсдөг хүн гар, цагаан цамц өмсдөг хүн гар, цагаан цамц өмсдөг хүн юмбасс тоглодог.
48909051.jpg|0|A band performs a song with a saxophone , guitars , base , drums and a keyboard .|Хамтлаг нь Саксофон, гитар, гитар, басс, бөмбөр, гар, гар, гар.
4890932738.jpg|0|Some graffiti appears on a column of a stone structure .|Зарим граффити чулуун бүтцийн баган дээр гарч ирдэг.
48909501.jpg|0|A bride with a tattoo , large earrings , and a red sash mingles with guests .|Шивээс, том ээмэг, том ээмэгтэй сүйт бүсгүй, зочидтой хамт улаан сашууд.
4891059394.jpg|0|A woman with long brown hair , sunglasses , white shirt , scarf and jeans with a bag on her right shoulder walking down a sidewalk .|Урт бор үстэй үс, нарны шил, цагаан цамц, цагаан цамц, ороолт, жинсэн өмд нь явган хүний зам дээр алхаж байв.
4891151258.jpg|0|A woman sitting with a man of about the same age reaches towards a bird who had just landed on the table where the two share a drink .|Нэгэн настай эмэгтэй хүнтэй хамт сууж байв
4891182729.jpg|0|A young man with glasses wearing a white t-shirt and dark pants wipes his nose with his left hand .|Цагаан футболк, бараан өмд өмссөн залуу, хар өмд нь түүний зүүн гараараа хамараа арчина.
489134459.jpg|0|A little girl leans on a concrete wall next to a blue door where a shirtless child sits .|Цамцгүй хүүхэдтэй цэнхэр хаалганы хажууд бяцхан охин бетонон ханан дээр бөхийлгө.
4891356534.jpg|0|A group of eight dancer both male and female dressed in casual shirts and pants are seen jumping in midair .|Найман бүжигчин, эрэгтэй, эмэгтэй аль алиныг нь энгийн цамц, өмд өмсөж, өмд өмсөж, өмд өмсдөг.
4891364108.jpg|0|three people walking front of large glass building with motorcycles and bikes out front .|Гурван хүн мотоцикль, урд нь урд талын том шилэн барилгын урд алхаж байв.
4891383938.jpg|0|Two women are sitting next to each other while eating .|Хоёр эмэгтэй хоол идэж байхдаа бие биенийхээ хажууд сууж байна.
4891462499.jpg|0|Two men standing , both in shorts , in a crowd of others outside on the grass , some sitting and some standing .|Хоёр хүн зогсож, богино, өвсөн дээр бусад олон хүн хоёулаа өвсөн дээр, зарим нь сууж, зарим нь сууж байдаг.
4891622164.jpg|0|Three women security officers showing off their awesome sunglasses .|Гурван эмэгтэй аюулгүй байдлын алба хаагчид гайхалтай нарны шилээ харуулж байна.
4891714957.jpg|0|One man in a guitar t-shirt sits next to another man in a gray shirt with a nike bag in his lap .|Гитартай футболк өмссөн нэг хүн саарал цамцтай саарал цамцтай саарал цамцтай саарал цамц өмсдөг.
4891825066.jpg|0|A man in black and a man in green walk down through central park in new york .|Нью Йорк дахь Нью-Йорк дахь НОГООН НЭГДҮГЭЭР НЭГДҮГЭЭР ХҮРГЭЕ.
4891975016.jpg|0|A large group of men in Scottish outfits are playing bagpipes .|Шотландын гаднах хувцасны олон тооны эрчүүд уут тоглож байна.
489226417.jpg|0|People man the lines in a factory as each one of them has a different and specific job to do .|Хүмүүс үйлдвэрт байгаа мөрөнд байгаа мөрөнд байгаа мөрөнд нэг хүн бүр өөр өөр, тодорхой ажил хийдэг.
4892334228.jpg|0|This woman in touching her hair while standing in front of some red and white background .|Энэ эмэгтэй нь улаан, цагаан дэвсгэрийн урд зогсож байхдаа үсээ чангалдаг.
4892420004.jpg|0|A man and a woman are standing on the balcony of a building kissing .|Эрэгтэй, эмэгтэй хүн барилгын үнсэлтийн тагтан дээр зогсож байна.
4892689267.jpg|0|An older man in a red vest and blue cap is walking with a cane carrying a white bag .|Улаан биелэгдэнэ, цэнхэр өнгийн малгай, цэнхэр өнгийн малгай нь цагаан цүнхийг авч явдаг нишингэтэй хамт алхаж байна.
4892691213.jpg|0|A blond-haired woman and her friend are buying some items from the man in the white t-shirt while the other blond woman stands near the baby stroller .|Шаргал үстэй эмэгтэй, найз нь эмэгтэй хүний цамцнаас зарим шар өнгийн футболк өмсөж байсан бөгөөд бусад шаргал эмэгтэйн хажууд зогсож байсан.
4892698507.jpg|0|A very busy market street with lots of people looking at different things .|Маш их завгүй зах зээлийн гудамжууд өөр өөр зүйлийг хардаг.
4892890793.jpg|0|Four older gentlemen sitting on patio chairs , one in stripes , one in black and one in blue all having the same stomach shape .|ДӨРӨВДҮГЭЭР СУРГУУЛЬД ЗОРИУЛСАН ДЭЛГЭРЭН, НЭГ НЭГ НЭГ НЭГ НЭГ НЭГ НЭГ НЭГ НЭГ НЭГ НЭГ, ХУГАЦААНЫ ХУГАЦАА.
4893288272.jpg|0|A group of people walk down a walkway surrounded by stores like McDonalds and Vagabond .|Бүлэг хүмүүс МакДональс, Вагабондон шиг дэлгүүрүүдээр хүрээлэгдсэн явган замаар явдаг.
4893324386.jpg|0|Two women stand under a striped umbrella while a man in a striped shirt and jeans and a woman in blue walk in the rain .|Судалгатай цамц, жинсэн өмд, цэнхэр өнгийн алхаж байхдаа хоёр эмэгтэй баригдсан шүхэр дор зогсож байв.
4893339483.jpg|0|An asian man with glasses standing with his arms crossed in front of an Infineon Technologies advertisement .|Нүүрэн дээр гараараа гараа түүнтэй хамт өнгөрөв
4893369019.jpg|0|A large group of men , women , and children gather on a lawn for a concert .|Эрэгтэй, эмэгтэй хүмүүс, хүүхдүүд, хүүхдүүд нь концертын төлөө зүлэг дээр цуглардаг.
4893487530.jpg|0|Four pink and white tulips gaze up in stair-step fashion to the light , as women sit in the shade at the side of the building .|Дөрвөн ягаан, цагаан алтанзул цэцэг нь байшингийн хажуугийн сүүдэрт сууж, гэрэлтсэн байдлаар гэрэлтдэг.
4893487832.jpg|0|A woman wearing a blue and white striped shirt is standing at a bar .|Цэнхэр, цагаан судалтай цамц өмссөн эмэгтэй бааранд зогсож байна.
4893505289.jpg|0|A man mows the lawn at an orchard , careful to avoid the hedges and flowers on either side of him .|Нэг хүн зүлгэн дээр зүлгэн дээр зүлгэн дээр зүлгэн дээр зүлгэж, түүний хоёр талд нь болгоомжтой байгаарай.
4893518190.jpg|0|A man in a gray suit walks down a stone corridor , carrying a briefcase .|Саарал, саарал костюмтай хүн чулуун коридороор алхаж, цүнх авч явдаг.
4893545292.jpg|0|A woman standing outside on a sunny day looking at something wearing blue jeans and sandals and a tank top .|Нартай өдөр гадаа нартай, цэнхэр жинсэн өмд, шаахайнууд, танкийн дээд өмссөн зүйлийг харж буй нартай хамт зогсож байв.
4893568355.jpg|0|A guy without a shirt sleeping in front of a window .|Цонхны өмнө унтлагын цамцгүй залуу.
4893597664.jpg|0|a fat man is listening to headphones sitting on his motorcycle|Тарган хүн мотоцикл дээрээ сууж буй чихэвчийг сонсож байна
4893673956.jpg|0|A woman with a light blue t-shirt and a backpack holding some vegetables in her right hand .|Гэрэл цэнхэр футболктай эмэгтэй, баруун гартаа зарим ногоо барьдаг үүргэвчинтэй эмэгтэй.
4893674164.jpg|0|A young woman wearing a black and white striped shirt looks at a necklace that another woman is holding up .|Хар ба цагаан судалтай цамц өмссөн залуу эмэгтэй өөр эмэгтэй барьж байгаа зүүлт рүү хардаг.
4893674870.jpg|0|On wooden steps leading to a porch , a blond woman in denim shorts sits next to another person whose face is obscured by a baseball cap .|Шүдээ дээгүүр чиглүүлж буй модон алхам дээр DELIM BOLDS дээр шаргал үстэй эмэгтэй.
4893675344.jpg|0|People moving furniture into a U-haul and man disposing of garbage into garbage cans .|Хүмүүс тавилга онгоцыг U-Haul-д наалдаж, хогийг хогийн саванд хаядаг.
