image_name|comment_number|comment|Translated Comment
1799188614.jpg|0|A young boy is walking towards a seagull on the shoreline of a beach .|Залуу хүү далайн эрэг дээр далайн эрэг дээр далайн эрэг рүү явж байна.
1799256185.jpg|0|An apparent political event is shown with a crowd closeup , focusing on a middle-aged man in a purple shirt , with a person hoisting a platter of canapes to his right and a ' Hillary ' campaign sign to his rear left .|Тодорхой улс төрийн үйл явдлыг олон түмэнтэй, дунд цамцтай, нил ягаан өнгийн цамцтай, дунд насны хөвчтэй эрин дээр анхаарлаа төвлөрүүл.
1799271536.jpg|0|An animal running through the sand at the beach .|Далайн эрэг дээр элсээр дамждаг амьтан.
1799847835.jpg|0|A boy in red prepares to throw a blue ball into the hoop , while others watch .|Улаан өнгийн хөвгүүн нь Цэнхэр бөмбөгийг цагираг руу шидэж, бусад цаг үед
180027584.jpg|0|People are walking around and a woman leans on a baby carriage while a large crowd is seen in the background .|Хүмүүс эргэн тойронд алхаж байгаа бөгөөд эмэгтэй хүний тэлмийг арын дэвсгэр дээр хардаг.
1800601130.jpg|0|A dog that looks much like a coyote jumps into the air over a grassy field to catch a tennis ball .|Теннисний бөмбөгийг барьж авахын тулд зүлэгтэй газар үсэрч буй нохойтой харагддаг нохой.
1800739200.jpg|0|People are listening to their headphones as they hold on for a ride on public transit .|Хүмүүс нийтийн тээврээр дамжин өнгөрөх гэж байгаа шигээ чихэвчээ сонсож байна.
1800778962.jpg|0|A group of people walking around , a man holding up a baby up over his head and other people walking down some stairs .|Бүлэг тойрон алхаж буй бүлэг хүмүүс толгойгоо дээшлүүлж, толгойгоо дээшлүүлж, бусад шатаар алхаж буй бусад хүмүүс.
180094434.jpg|0|Three boys play around a fountain in an office building courtyard .|Гурван хүү оффисын барилгын хашаанд усан оргилуурын эргэн тойронд тоглодог.
1801063894.jpg|0|A woman in a yellow bathing suit gets ready to jump in the water to join someone .|Шар усанд ороход эмэгтэй хүн усанд орохын тулд усанд үсрэхэд бэлэн болжээ.
1801188148.jpg|0|Four dogs play together on a grassy and leafy ground .|Дөрвөн нохой нь өвс, навчит газар дээр хамт тоглодог.
1801283994.jpg|0|A Father is observing his son , Kurt to see if his teaching prevents Kurt from cutting himself as he shave with a razor for the first time .|Аав нь анх удаа сахлаа хусаж байхад нь Куртыг тонгойноос сэргийлж чаддаг бол Курт, Куртыг Куртыг ажиглаж байна.
180146696.jpg|0|The man in the red , hooded sweatshirt looks back and construction is taking place on a shop with Hebrew lettering .|Улаан, улаан, бүрээстэй цамц нь арын хэсэгт харагддаг бөгөөд барилгын ажил нь Еврей захидалтай дэлгүүрт явагдаж байна.
180150786.jpg|0|Men stand by the road , where construction is being done on the corner in a small suburban area .|Замдаа зогсож байгаа эрэгтэй, барилгын ажил нь барилгын жижиг хотын жижиг талбайд барилгын ажил хийдэг.
1801663973.jpg|0|A large woman with long pink hair dressed in black is laying on a tree trunk talking to a man who is crouched down next to her .|Хар ягаан өнгийн үстэй том эмэгтэйтэй том эмэгтэй.
1801697440.jpg|0|A man in a white tank shirt holds a laptop while sitting next to a white column with a statue on top of it .|Цагаан савны цамц өмссөн эр зөөврийн баганын дэргэд сууж байхдаа зөөврийн компьютерийг зөөвөрлөж байна.
1801874841.jpg|0|The little dog grabs a hold of the bedroom slipper with its mouth .|Бяцхан нохой нь унтлагын өрөөний шаахайг амаараа барьж авав.
1802092493.jpg|0|Four young children dressed formally pose for a potrait with the two boys standing in front and the two girls smiling in the back .|Дөрвөн залуу хүүхдүүд урд, хоёр хөвгүүн хувцас өмссөн хоёр хүүтэй, хоёр охин нуруундаа инээмсэглэв.
180209719.jpg|0|A sushi restaurant with a man cooking while in the background is a man and young boy sitting at a table .|Арын дэвсгэр дээр хоол хийж байхдаа хоол хийж буй эрэгтэй, залуу хүү, залуу хүү нь ширээн дээр сууж байв.
180217379.jpg|0|An adult and a child , both wearing hats , are outside , looking at a black and white rooster in a cage .|Насанд хүрэгчдэд, хүүхэд, хүүхэд, хоёулаа малгай өмсдөг, гадна талд нь хар, цагаан азарган тахиа хардаг.
1802509657.jpg|0|"A man wearing a black shirt and blue jeans up in the air holding a plywood in each hand in front of a building that has a word "" stomp "" ."|"""Stomp"" гэсэн үгтэй гар, цэнхэр цамц өмссөн хар цамц, цэнхэр жинсэн өмд өмссөн хүн."
180312736.jpg|0|Two very young boys and an adult are playing with big preschool Legos and a red dish-shaped play cushion that 's filled with balls on a white carpet in front of a gray couch .|Хоёр залуу хөвгүүд, насанд хүрэгчдийн Big Predchool Levos болон улаан аяга хэлбэртэй тоглодог тоглолтыг саарал өнгөөр дүүргэж байна.
1803299842.jpg|0|Two men sit outside of an apartment playing a board game , while a third man watches .|Хоёр хүн самбарын гадна талд байрлах орон сууцны гадна талд сууж, гуравдагч хүн цаг алддаг.
180361087.jpg|0|A woman in white cuts the hair of a woman wearing a red smock .|Цагаан өнгөтэй эмэгтэй нь улаан ороомог өмссөн эмэгтэйн үсийг тайрдаг.
180362495.jpg|0|A young woman in a black blouse , blue jeans , and sandals is standing behind another young woman who is seated with a red poncho draped around her as the first young lady cuts her hair .|Хар цамц, цэнхэр жинсэн өмд, шаахайнууд, шаахайнууд, шаахай нь анхны залуу эмэгтэй үсээ тайрч байсан өөр залуу эмэгтэйн ард зогсож байна.
180362693.jpg|0|The female with the dark shirt cutting the hair of the female in the red shirt .|Харанхуй цамцтай эмэгтэй улаан цамц өмссөн эмэгтэйн үсийг улаан цамц өмссөн байв.
1803631090.jpg|0|The woman wearing a fire department uniform is talking to people .|Гал түймрийн тасгийн дүрэмт хувцас өмссөн эмэгтэй хүмүүстэй ярилцаж байна.
1804144683.jpg|0|An artist is working on his very contemporary looking piece of art , and is focusing very intensely on the work at hand .|Уран бүтээлч түүний орчин үеийн урлагийн бүтээл дээр ажиллаж байгаа бөгөөд ажлын талаар маш их анхаарал төвлөрүүлж байна.
180476372.jpg|0|"A street with a store that has a sign outside of it reading "" Bleecker Street Records "" ."|"""Блекер гудамжны бүртгэл"" -ээс гадна гарын үсэг бүхий гудамжтай гудамж."
180506881.jpg|0|two people wearing white shirts and jeans each carrying a skateboard|Тэшүүр авч явдаг цагаан цамц, жинсэн өмд өмссөн хоёр хүн
180524168.jpg|0|A child in a light and dark green ensemble sits in a chair in front of a typewriter looking off-camera .|Гэрэл, бараан ногоон, харанхуй чуулга нь бичгийн машиныг харж буй бичгийнхээ урд сандал дээр сууж байв.
1805628702.jpg|0|A bearded man in a purple cape getting his haircut makes a twisted face at the hair dryer .|Нил ягаан өнгийн малгай өмссөн сахалтай хүн үсээ засдаг.
18056405.jpg|0|A man dressed in black is sitting on a seat in the subway station that has an opened black umbrella laying on the ground .|Хар хувцас өмссөн эр хүн газар дээр хэвтэж байгаа нээлтэй хар шүхрүү суудал дээр сууж байна.
1805677013.jpg|0|A woman with brown hair wearing a black and white striped tank top holding a pole in a pool .|Бөөрөнхий усан санд туйлыг хар, цагаан үстэй савтай эмэгтэй.
1805990081.jpg|0|A boy signals with his hands while he walks a white dog with a pink leash .|Хөвгүүн гараараа цагаан нохойтойгоо ягаан нохойтой алхаж байхдаа
1806088665.jpg|0|A little boy runs along side a merry-go-round while holding on to a handle .|Бяцхан хүү бариултай явж байхдаа зугаатай замаар явдаг.
1806580620.jpg|0|The gal wearing the black sunglasses and blue jean jacket is smiling .|Хар нарны шил, цэнхэр өнгийн хүрэм, цэнхэр өнгийн хүрэм өмссөн гал.
1807169176.jpg|0|A large campfire at night with several people sitting around it .|Шөнийн цагаар шөнийн цагаар хэдэн хүн сууж байв.
1807463181.jpg|0|Two workers in orange vests are cleaning the windows outside while other look on .|Улбар шар өнгийн хантааз дахь хоёр ажилчин нь цонхыг гаднаас нь цэвэрлэж байна.
180753784.jpg|0|A group of people all dressed up marching along the road playing instruments and holding flags and other props .|Бүлгийн бүлэг хүмүүс зам мөрөөр тоглож, багаж хэрэгсэл, бусад тулгуур тоглож, барьсан туг, бусад тулгуур тоглож байв.
1808007704.jpg|0|A man in a red shirt is jumping from one rock to another larger rocker with two male spotters below him .|Улаан цамцтай эр хүн түүний доор хоёр эрэгтэй, өөр том рокер дээр үсэрч байна.
1808370027.jpg|0|The dog swims through the water toward the waterfall .|Нохой нь усан замаар усан замаар усанд сэлдэг.
1808504612.jpg|0|Two children look down from a green tree they have climbed .|Хоёр хүүхэд авирсан ногоон модноос доошоо харав.
1809476783.jpg|0|A man in a suit stands next to a white carriage pulled by two white horses while a bride sits inside .|Сүйт бүсгүй дотор сууж байхдаа костюмны хажууд байгаа цагаан тэрэгний хажууд зогсож байсан цагаан тэрэгний хажууд зогсож байв.
1809758121.jpg|0|A girl leaps through the air while running on the riverbank .|Гол мөрөн дээр гүйж байхдаа охин агаарт үсрэв.
1809796012.jpg|0|A black and white dog standing on its hind legs on carpeting in front of a chair .|Сандал дээр хивсэн дээр зогсож байгаа хар, цагаан нохой.
1809926566.jpg|0|A group of young girls on sitting on the wooden floor in a large room .|Том өрөөнд модон шалан дээр сууж буй залуу охидын бүлэг.
18105594.jpg|0|A girl wearing a blue short and yellow shirt uniform throws a yellow softball while a girl in a black and red short uniform and red helmet runs .|Цэнхэр богино, шар цамц өмссөн охин нь хар, улаан богино, улаан өнгийн дуулга явдаг.
1810651611.jpg|0|A little girl in a pink and white flowered dress and blue sweater swinging .|Ягаан, цагаан өнгийн цэцэглэсэн даашинз, цэнхэр цамц дүүжлэв.
181103691.jpg|0|Children play in the street under a spray of water from a large machine .|Хүүхдүүд том машинаас ус шүрших дор гудамжинд тоглодог.
18111123.jpg|0|Young Asian girl who looks upset at a children 's outdoor playground .|Хүүхдийн гадаа тоглоомын талбайд сэтгэл дундуур байгаа залуу ази охин.
181157221.jpg|0|Two dogs try to reach each other as their human companions pull them in opposite directions by their leashes .|Хүний хамтрагч нар өөрсдийгөө эсрэг чиглэлд чиглүүлж бие биетэйгээ хүрэхийг хичээдэг.
181172072.jpg|0|Closeup of a young caucasian boy with brown eyes , and in a red fleece zip-up jacket , holding up a monarch butterfly on his index finger .|Браун нүдтэй залуу Кавказ хөвгүүнийг бор нүдтэй, улаан ноосны Zip-Zip Zippe хүрэмтэй.
18119750.jpg|0|A lady wearing a green sweatshirt and jeans sits on the ground and hits a tennis ball with a tennis racket .|Ногоон цамц өмссөн хатагтай, жинсэн өмд өмсөж, жинсэн өмд газар дээр сууж, теннисний бөмбөгийг теннисний цохиураар цохиж, теннисний бөмбөгийг теннисний цохиуртай хамт цохиж, теннисний бөмбөгийг теннисний цохиураар цохиж, теннисний бөмбөгийг теннисний цохиуртай хамт цохиж, теннисний бөмбөгтэй теннисний бөмбөгийг цохиж байв.
1812525037.jpg|0|The two young children are in black and white face paint and costumes while riding in a stroller , they are being pushed by a man also in face paint and a costume|Хоёр залуу хүүхэд хар, цагаан нүүрний будаг, крофол дээр явж байхдаа хувцас, хувцас өмсөж байгаа бөгөөд тэд бас нүүрний будаг, хувцасны будаг, хувцас өмсөж байна
1813069437.jpg|0|A shirtless man wearing a white turban is climbing a tree trunk .|Цамц хоосон цамцгүй эрчүүд модны их бие дээр авирч байна.
1813266419.jpg|0|A child in rolled up jeans , a striped shirt , and a helmet frolics in sprinklers .|Жимс, судалтай цамц, судалтай цамц, шүршигч дэх дуулга
181343499.jpg|0|A group of people sit or walk near a yellow building with white trimming and columns with two bikes parked nearby .|Бүлэг бүлэг хүмүүс ойролцоо байрлуулсан цагаан өнгийн барилга, баганатай хамт шар өнгийн барилга, баганатай хамт алхаж, эсвэл багана.
1813597483.jpg|0|A large , black dog is climbing over a wooden fence surrounded by bushes .|Том, хар нохой бутнаас хүрээлэгдсэн модон хашаан дээр авирч байна.
1813777902.jpg|0|A young boy dressed as a pirate and running .|Хулгайлж, гүйж, гүйж байсан залуу хүү.
1814086703.jpg|0|Two dogs are running next to each other on the grass .|Хоёр нохой нь өвсөн дээр бие биенийхээ хажууд гүйж байна.
181415975.jpg|0|Man airborne on wakeboard with elevation in the background and blue water .|Эрэгтэй хүний хүрээлэн, цэлмэг, цэнхэр усанд сэрүүн байна.
1814372530.jpg|0|Four young men , one fully dressed and seated , and three in black swim trunks - two standing , one seated - are on a pier with brightly painted railings .|Дөрвөн залуу эрэгтэй, нэг нь бүрэн хувцасласан, суудалтай, суусан, гурван хар сэлэлтийн хонгил, гурван хүн, нэг нь зогсож, нэг суудалтай, нэг суудалтай, нэг суудалтай, нэг суудалтай, нэг суудалтай, нэг суудалтай, нэг суудалтай, нэг суудалтай, нэг суудалтай, нэг суудалтай, нэг суудалтай, нэг суудалтай, нэг суудалтай, нэг суудалтай, нэг суудалтай, нэг суудалтай, нэг суудалтай, нэг суудалтай, нэг суудалтай, нэг суудалтай, нэг суудалтай, нэг суудалтай, нэг суудалтай, нэг суудалтай, нэг суудалтай, нэг суудалтай, нэг суудалтай, нэг суудалтай, нэг суудалтай, нэг суудалтай, нэг суудалтай, нэг суудалтай, нэг суудалтай, нэг суудалтай, нэг суудалтай, тод будсан хашлага юм.
1814391289.jpg|0|A young child in a costume rings the door bell of a gray house .|Нэгэн залуу хүүхэд нь саарал байшингийн хаалганы хонх дуугардаг.
181465013.jpg|0|A shirtless boy and a boy in green and white are playing on a concrete surface by a small stage .|Цамцгүй хөвгүүн, ногоон, цагаан хөвгүүн, цагаан, цагаан нь бетонон дээр жижиг гадаргуу дээр жижиг шатаар тоглож байна.
1815242986.jpg|0|A woman in a denim jumper and another woman in a navy blue jacket are overlooking a mountain range .|Тэнгисийн цэргийн цэнхэр хүрэмтэй, жинсэн өмд өмссөн эмэгтэй, өөр эмэгтэй.
181600316.jpg|0|An older man with a beard uses a hay broom to sweep the ground in front of cubed cardboard trash in a parking lot .|Баавгайтай ахимаг хөгшин хүн хадлангийн урд талын картон хогийн савны урд газар шүүрч авахын тулд өвсийг шүүрдэхэд хүргэдэг.
181616579.jpg|0|Three men wearing hats are holding up flags , one man is walking with a rifle on his shoulder .|Гурван эр өмссөн малгай өмссөн гурван эрэгтэй баригдаж байна, нэг хүн мөрөн дээрээ винтовоор алхаж байна.
181618457.jpg|0|A truck is decorated in American flags and the colors of the flag , three people are in the truck bed with one driving .|Ачааны машин нь Америкийн тугуудад чимэглэгдсэн бөгөөд тугны өнгөөр чимэглэгддэг, тугны өнгө нь ачааны машинд нэг жолоо барьж байгаа.
1816224182.jpg|0|A young woman with long dark hair is followed by a costumed person with a mask and cape .|Урт харанхуй үстэй залуу эмэгтэй нь маск, малгайтай капитай хүн дагаж мөрддөг.
181702621.jpg|0|Two woman , both sitting near a pile of poker chips , are playing cards .|Хоёр эмэгтэй, хоёулаа овоолсон покер чипс дээр сууж, хоёулаа хөзөр тоглож байна.
18171073.jpg|0|A woman in a blue shirt is laughing with a woman in a black shirt outside , as people are sitting and standing all around them .|Цэнхэр цамц өмссөн эмэгтэй хүмүүс гадаа хар цамцтай, хүмүүс гадаа сууж, эргэн тойронд зогсож байгаа мэт эмэгтэйтэй хамт инээж байна.
1817746886.jpg|0|A woman sits on a bed with a stuffed camel in her lap while putting her hands over her face .|Нэг эмэгтэй хүн нүүрэндээ гараа тавиад гараараа чихмэл тэмээтэй хамт орооцолддог.
181777261.jpg|0|A partly cloudy day at the beach with people standing around and a building on the right .|Баруун тийшээ зогсож байгаа хүмүүстэй хамт үүлэрхэг өдөр үүлэрхэг өдөр.
1818403842.jpg|0|Two dogs are leaping into a swimming pool trying to fetch the yellow toy that is floating in the water .|Хоёр нохой усанд хөвж байгаа шар тоглоомоо усанд авч, усан дээр хөвж буй шар тоглоомоо авчрахыг хичээдэг.
181876171.jpg|0|A man in glasses wearing a military style cap and a jacket with medals is waving his right hand and sits in front of another waving man in military dress .|Цэргийн хэв маягийн хэв маягийн малгай өмссөн эр, медаль бүхий хүрэм, медал нь баруун гараа даллаж, цэргийн хувцас өмссөн өөр хүний урд байрладаг.
1819261140.jpg|0|A costumed diner sits in a restaurant wearing a black outfit that covers their face .|Костюмед Кинер нь нүүрээ хамардаг хар хувцас өмссөн ресторанд сууж байна.
181967064.jpg|0|A middle-aged man , wearing shorts and a t-shirt , cooks hamburgers and hotdogs on a stainless steel outdoor barbecue grill .|Дунд насны эрэгтэй, шорт, футболк өмсөж, подволь өмсдөг, зэвэрдэггүй ган гадаа шарсан гангаар шарсан мах, гамбургерууд, халуунд хоол хийдэг.
181970350.jpg|0|A man wearing a shirt with an animal pattern on it and a purple tie is singing in a microphone .|Малын хэв маягаар цамц өмссөн цамц өмсөж, ягаан зангиа микрофон дээр дуулж байна.
181989658.jpg|0|A woman carrying a mannequin is walking down the sidewalk and talking on a mobile phone .|Маннекин авч явдаг эмэгтэй явган хүний зам дээр алхаж, гар утсаар ярьж байна.
181989740.jpg|0|A girl , perhaps around five , wearing white shorts , red and white top and carrying a red balloon , is standing outside of a wooden building , looking inside .|Охид, магадгүй цагаан, цагаан шорт, улаан, цагаан өнгийн дээд, улаан, цагаан бөмбөлгийг өмсөж, улаан бөмбөлгийг авч, улаан бөмбөлгийг авч, дотор нь модон барилга байгууламжийн гадна зогсож байна.
182013889.jpg|0|An older man in a red t-shirt and khaki shorts is waving to the crowd at a parade while driving an antique Ford vehicle .|Улаан футболк өмссөн хөгшин хүн, Хаки шорт нь эртний Ford тээврийн хэрэгслийг жолоодож байхдаа олон хүний дундуур жагсаалдаж байна.
182030893.jpg|0|A smiling elderly man wearing suspenders holds a shotgun while sitting in front of a fireplace in a home .|Инээмсэглэл өмссөн хөгшин хүн зогсож байсан.
182074740.jpg|0|A woman in yellow shorts and a red bandanna wrapped around her head is walking in the street in front of a blue house .|Шар шорт, улаан өнгийн Банданна түүний толгойд ороосон эмэгтэй, цэнхэр байшингийн урд гудамжинд алхаж байна.
1820795682.jpg|0|"A dark-haired woman in a black , sparkly outfit is cheering in front of a yellow banner that says "" Cheer "" ."|"Хар үстэй хар үстэй эмэгтэй, гялалзсан хувцас нь ""хацар"" гэж хэлдэг шар баннерын өмнө баярладаг."
1821238649.jpg|0|A girl dressed as a devil stands in front of a lighted object on a city street .|Хотын гудамжинд гэрэлтсэн объектын урд хувцас өмссөн охин.
1821672488.jpg|0|A group of employees dressed in blue are gathered in front of a building .|Цэнхэр өнгөөр хувцасласан ажилчдын бүлэг нь барилгын урд цуглардаг.
182169366.jpg|0|Three Caucasian hikers in summer clothes walk a dirt path through a wooded meadow during the day .|Зуны улиралд гурван кавказын аялал жуулчдын гурван кавказын явган аялал.
