image_name|comment_number|comment|Translated Comment
3642088668.jpg|0|A stewardess on an airplane pushes a cart down the center isle , looking carefully so as not to bump any of the passengers .|Нисэх онгоцонд суусан ажилтан нь төвийн арлын боомтыг боомтоор түлхэж, зорчигчдын аль нэгийг нь цохихгүй байхын тулд анхааралтай ажиглаарай.
364213568.jpg|0|One white and tan dog is chasing another white and brown dog who has a toy in its mouth .|Нэг цагаан, тан нохой амандаа тоглоомонтой, нэг цагаан, бор нохойг хөөж байна.
3642220260.jpg|0|Black dog walking on the beach after swimming in the ocean .|Далайд усанд сэлсний дараа далайн эрэг дээр явж буй хар нохой.
36422830.jpg|0|A red jeep hangs from the edge of a rocky cliff as a girl looks on .|Охидын харцаар чулуурхаг хавцлын ирмэгээс өлгөөтэй байв.
3642570796.jpg|0|A woman in a multicolored top is walking down the street and holding a black purse while talking on her phone .|Олон өнгийн дээд хэсэгт байгаа эмэгтэй гудамжаар явж, утсаар ярьж байхдаа хар түрийвч барьж байна.
3642604708.jpg|0|A boy toddler play outside on a clothes rack full of tied dye shirts .|Хөвгүүн хөвгүүн нь уялдаатай будгийн цамцаар дүүрэн хувцасны тавиур дээр тоглодог.
364282261.jpg|0|A man in jeans and a tea shirt is scrubbing an area of the floor with a blue bucket and yellow ladder nearby .|Жинсэн жийнс, цайны цамц, цайны газар шалан дээрх талбайг цэнхэр хувин, шар шатаар хусаж байна.
3643021980.jpg|0|A young girl in a baby pink outfit poses for the camera while holding onto a jungle gym in a playground .|Хүүхдийн ягаан өнгийн хувцас өмссөн залуу охин нь тоглоомын талбайд ширэнгэн ойд барьж байхдаа камерт байрладаг.
3643022155.jpg|0|A woman who is holding a bright pink purse and has sunglasses clipped to her shirt is leaning against a wall .|Хурц ягаан түрийвч барьж байгаа эмэгтэй, нарны шил нь цамцныхаа тууралттай байв.
3643074723.jpg|0|A boy laying on a sitting swing , face down , wearing a hat backwards .|Хөвгүүн дүүжин дээр хэвтэж, нүүрээ доош нь тавиад малгай өмсдөг.
3643087589.jpg|0|A small light tan dog is running past a large brown dog standing in the grass .|Жижигхэн гэрлийн тан нохой өвс дээр зогсож байгаа том хүрэн нохой өнгөрсөн байна.
3643175169.jpg|0|A man wearing a white shirt and black pants balances at the top of a red ladder as it leans against a brick building .|Цагаан цамц, хар өмдний дээд хэсэгт улаан өмд өмссөн хүн улаан өнгийн дээд хэсэгт байрладаг.
3643503169.jpg|0|A mother naps on the beach next to her also-sleeping infant .|Ням гарагийн хажууд байхдаа далайн эрэг дээрх эх нь нойрмоглодог.
3643666111.jpg|0|A Texas baseball player catches the ball as the ,  12 player from the opposite team slides into base with an umpire standing by , ready to make the call .|Техасын бейсболын тоглогч бөмбөгийг бөмбөгөнд 12 тоглогч, дуудлагыг дээш нь зогсож, дуудлага хийхэд бэлэн байна.
3643666619.jpg|0|A guy in a red cap is standing on wooden beams and using a net to pulling something .|Улаан малгайтай залуу модон цацраг дээр зогсож, торыг нь татахын тулд тор хэрэглэж байна.
3643684044.jpg|0|Four people are sitting at a table , with microphones and bottles of water in front of them .|Дөрвөн хүн ширээн дээр сууж, микрофон, урд талын усаар угаана.
3643684616.jpg|0|Women wearing a black top and glasses speaking into a blue tipped microphone with another woman beside her writing .|Эмэгтэйчүүд хар, нүдний шил зүүж буй цэнхэр өнгийн микрофон, түүний бичсэн өөр эмэгтэйтэй цэнхэр үзүүртэй микрофон өмсдөг эмэгтэй.
3643684688.jpg|0|A group of four men sits at a table on a platform before an audience in a darkened room .|Дөрвөн эрчүүд харанхуй өрөөнд үзэгчиддээ платформ дээр тавиур дээр сууж байна.
364369665.jpg|0|A man wearing an orange jacket , a ski cap , goggles and a backpack stands on what appears to be solid blue ice .|Улбар шар өнгийн хүрэм өмссөн эр, цанын малгай, цанын малгай, нүдний шил, үүргэвчин нь хатуу цэнхэр мөс шиг харагдаж байна.
3643807095.jpg|0|Two rodeo guys in flame shirts and jeans try to subdue a dark brown bull in the rodeo ring .|Галын цамц, жинсэн өмд, жинсэн өмд, жинсэн өмд, жинсэн өмд нь Rodeo цагирган дахь бараан хүрэн бухыг судлахыг хичээдэг.
3643971203.jpg|0|Two men in blue suits carrying black briefcases walk into the entrance of Saint Peter 's Church .|Black Bestcass-д хоёр эрчүүд хар өнгийн товчлуурууд нь Гэгээн Петрийн сүмийн үүдэнд алхаж байв.
3643974707.jpg|0|A child stands in silhouette under an old stone arch on a red tile floor .|Хүүхэд хөгшин чулуун нуман дор хуучин чулуун нуман хаалган дээр зогсож байв.
3643981804.jpg|0|A Dallas man in a hat reaches up to realtor signs on a brick wall , advertising Trees and the Gypsy Tea Room .|Далласын Даллас Хүн бүр тоосгон хана, сурталчилгааны мод, цаамийн мод, цаамийн өрөөнд хүрч байна.
3644136054.jpg|0|A man wearing blue is biking on a long , empty , road with grass on either side .|Цэнхэр хувцас өмссөн эр урт, хоосон, хоосон, хоёр талд нь өвсөөр дугуй унаж байна.
3644142276.jpg|0|Two children kick each other while being suspended from the ceiling .|Таазнаас түр зогсоод байхдаа хоёр хүүхэд бие биенээ өшиглөдөг.
3644469632.jpg|0|A man standing in water at the beach , is wearing a pale blue , long-sleeved shirt and a woven hat , and pulling netted fabric from the water .|Далайн эрэг дээр зогсож байгаа хүн цайвар цэнхэр, урт ханцуйтай цамц, нэхмэл малгай өмсөж, цэвэрлэсэн даавууг уснаас гаргаж авдаг.
3644668446.jpg|0|One woman in a black dress and another one in a gray tank top and green shorts are walking on the street somewhat crowded with people .|Хар даашинзтай нэг эмэгтэй, нөгөө нь саарал савны дээд, ногоон шорт, ногоон шорт нь гудамжаар алхаж байна.
3644690490.jpg|0|a middle-aged man wearing a cowboy hat and blue jeans is chasing after a sheep with a kid attached on the side|Ковбой малгай, цэнхэр жинсэн өмд өмссөн дунд насны хүн, цэнхэр жинсэн өмд нь хажуу тийшээ хавсаргасан хүүхэдтэй хамт хонины дараа хөөгддөг
3644941648.jpg|0|A man is bouncing on a trampoline next to tall buildings and a church .|Эрэгтэй хүн өндөр барилга, сүм, сүмийн хажууд трамплин дээр үсэрч ирдэг.
3644945293.jpg|0|Five women inside a room while two are holding something in their hands while sitting and the other three are talking .|Хоёр эмэгтэй дотор таван эмэгтэй сууж байхад сууж байхад хоёр хүн гар дээрээ сууж, нөгөө гурав нь
3645080830.jpg|0|This rooftop skateboarder flies high doing a trick to impress his friend .|Энэхүү саравч нь найзыгаа сэтгэгдэл төрүүлэхийн тулд тэшүүрээр төгс төгөлдөр юм.
3645134768.jpg|0|A band with four members , one female , plays for a small audience .|Дөрвөн гишүүнтэй хамтлаг, нэг эмэгтэй, нэг эмэгтэй, жижиг үзэгчид тоглодог.
3645162492.jpg|0|a blond child on a horse riding uniform carrying a teddy bear riding a donkey or pony .|Морин дээр шаргал үстэй, эсвэл илжиг, одой морьтой,
36451757.jpg|0|Two men with brown shirts on and a woman are outside with two black dogs .|Браун цамцтай хоёр эрэгтэй, эмэгтэй хүн хоёр хар нохойтой байдаг.
3645350123.jpg|0|A woman with a large pink hula hoop grins at the camera while wearing a black and gold skirt and black and white top in front of a crowd of onlookers .|Том ягаан Hula Hop-ийг хар, алтан банзал өмсөөд хар, алтан банзал өмсөж, хар, цагаан өнгийг хар, хар, цагаан өнгөөр сонгоорой.
364542005.jpg|0|Cars covered in snow with a man walking with a snow plow on the sidewalk in front of the snow covered vehicles .|Цасаар хучигдсан тээврийн хэрэгслийн урд талын явган хүний зам дээр цасан зам дээр цас орж буй машинууд цасаар бүрхэгдсэн машинууд.
3645730082.jpg|0|A young boy is holding onto railing of a staircase while his mother looks onwards to him .|Залуу хүү, ээж нь түүн рүү харж байх үед шатны хашлага дээр хашгирч байна.
3645809088.jpg|0|A band of five men singing and playing instruments on stage before an audience .|Таван эрчүүд үзэгчдийн өмнө тайзны үе шатанд тоглож, тоглодог хэрэгсэл тоглож, тоглодог.
3646120271.jpg|0|A blond woman lays in the grass on her pink cellphone lying next to a man in black on his cellphone .|Цэцгийн эмэгтэй гар гар утсан дээрээ хар гар утсаараа хар арьст гар утсан дээр хэвтэж буй ягаан гар утсан дээр өвс тавьдаг.
3646190566.jpg|0|An aging rocker performs on stage in a sleeveless shirt and striped pants .|Хөгшрөлт хөгшч рокерийг ханцуйгүй цамц, судалтай өмд дээр тоглодог.
3646453252.jpg|0|A person wearing a red helmet and yellow and white clothing is riding a bike outside in a wooded area .|Улаан малгай, шар, цагаан хувцас өмссөн хүн.
3646814919.jpg|0|A stocky gentleman wearing a long-sleeve , blue shirt , black slacks , aged , black boots and a blue billed cap is scaling a roof , using the structure 's struts to approach stacks of tiles stored at the roof 's apex .|Урт ханцуйтай, цэнхэр цамц, цэнхэр цамц, хар гутал, хар гутал, хар гутал, цэнхэр гутал, цэнхэр өнгийн торны тагийг дээвэр дээр байрлуулсан плита руу бэхэлсэн.
3646820231.jpg|0|A black and brown dog pokes his head above the white farm animals .|Хар ба хүрэн нохой нь түүний толгойг цагаан фермийн амьтнаас дээгүүр харав.
3646927481.jpg|0|A motorcyclist dressed in green with a green motorcycle is jumping over a row of green motorcycles|Ногоон мотоцикльт хувцасласан мотоцикльчин ногоон мотоцикльтой ногоон мотоцикль нь ногоон мотоциклийн эгнээнд үсэрч байна
3646970605.jpg|0|a group of adults are standing under a tree in front of a red brick house .|Насанд хүрэгчдийн бүлэг нь улаан тоосгон байшингийн урд модны дор зогсож байна.
3647170476.jpg|0|A group of children and their guardian walk on the boardwalk and eat ice cream .|Бүлэг, тэдний асран хамгаалагч, асран хамгаалагч онгоцон дээр алхаж, зайрмаг иддэг.
3647283075.jpg|0|A young man in a red shirt and jeans skateboards over a graffiti-strewn background .|Улаан цамц, жинсэн өмд, граффити-граффити дээр
3647446816.jpg|0|Two girls play softball , one slides into plate as other fails to catch ball .|Хоёр охин софтбол тоглодог, нөгөө нь бөмбөгийг барьж чаддаггүй тул нэг слайд руу гулсдаг.
364747261.jpg|0|Some people have the most unusual centerpieces at their parties .|Зарим хүмүүс үдэшлэгт хамгийн их ер бусын төв хэсгүүд байдаг.
3647617584.jpg|0|A man in black and a man in blue with a tattooed arm balance atop a plank several stories high .|Хар ба эр хүн цагаан, эр хүн хөхний тэнцвэртэй гараараа цэнхэр өнгийн үлдэгдэлтэй байдаг.
3647693147.jpg|0|A small , young boy wearing a white shirt is playing with fallen leaves outside .|Цагаан цамц өмссөн жижиг, залуу хүү нь гадаа унасан навчтай тоглож байна.
3647750811.jpg|0|a black and white dog is wearing a red collar whilst walking on the grass .|Хар ба цагаан нохой нь зүлгэн дээр алхаж байхдаа улаан хүзүүвч өмсдөг.
3647826834.jpg|0|A woman is playing with two children on a seesaw in a playground .|Эмэгтэй хүн тоглоомын талбайд хараатай хоёр хүүхэд тоглож байна.
3648081498.jpg|0|A skateboarder in flannel rides his skateboard to the top of a ramp .|Фаннер дахь тэшүүрчин тэшүүрээ налуу замын дээд хэсэгт унадаг.
3648097366.jpg|0|A boy doing a skateboard trick off of a flight of stairs while people watch .|Хүмүүсийг харж байхад хүн шатахуун шатаар шатаж буй хүүгийн заль мэхийг хийж байна.
3648160673.jpg|0|A golden retriever jumps off of a blue surfboard in the water .|Алтан таталт нь усан дотор цэнхэр гадаргуу дээр үсэрч унав.
364880092.jpg|0|A boy is standing in the middle of a street about to kick a ball .|Хөвгүүн бөмбөгийг боовын голд зогсож байна.
3648988742.jpg|0|A little girl in a pink , floppy hat takes a photograph with a big camera .|Ягаан, уян харин малгай өмссөн бяцхан охин том камертай гэрэл зураг авдаг.
3649224118.jpg|0|They are playing with a soccer ball on the beach .|Тэд далайн эрэг дээр хөл бөмбөгийн бөмбөг тоглож байна.
3649307685.jpg|0|Two males are playing field hockey , one with a blue stick , one with a gold stick .|Хоёр эрэгтэй нь хээрийн хоккей тоглож, цэнхэр саваа, цэнхэр саваагаар нэг нь алтан саваагаараа.
3649382413.jpg|0|A woman with a tall , red , white , and blue hat sits on the ground .|Өндөр, улаан, цагаан, цагаан, цэнхэр малгай нь газар дээр сууж байна.
3649384501.jpg|0|a military guard is wearing a ceremonial gold helmet and is holding a sword .|Цэргийн харуул ёслол ёслолын алтан дуулга өмсөж, сэлэм барьж байна.
3649387275.jpg|0|The white and brown-spotted dog is walking through shallow water .|Цагаан, хүрэн толботой нохой нь гүехэн усаар дамждаг.
3649802021.jpg|0|A white dog on a green leash is standing on its hind legs to look over a stone wall .|Ногоон ургацтай цагаан нохой нь чулуун ханан дээр харахын тулд арын хөл дээрээ зогсож байна.
3649916507.jpg|0|Closeup perspective of a bicycle wheel being ridden by someone|Дугуй дугуйны дугуйг хэн нэгэнд чиглүүлж буйг харах
3650111717.jpg|0|A dog is jumping in the air with flowers in his mouth on a very windy day .|Нохой нь аманд нь их салхитай өдөр цэцэглэж байна.
3650188378.jpg|0|Three people in uniform are outdoors and are observing a scene which is out of the picture .|Дүрэмт дүрэмт хувцастай гурван хүн гадаа байдаг бөгөөд энэ нь зурагнаас гарсан дүр зургийг ажиглаж байна.
3650485497.jpg|0|Females are painting a large grid painting of Africa and other parts of the world .|Эмэгтэйчүүд Африк ба дэлхийн бусад томоохон зураг зурдаг.
3650986674.jpg|0|The black dog and the brown dog are on the ground .|Хар нохой, хүрэн нохой газар дээр байна.
365099444.jpg|0|Three Vietnamese women paddle their boats along the river market in the morning .|Гурван Вьетнам эмэгтэй, өглөө нь голын захын дагуух завинуудаа завиар сэлэв.
3651107058.jpg|0|A person with torn orange leggings and black boots is sitting nearby a large crowd of people .|Торн улбар шар өнгийн леггинс, хар гутал, хар гутал нь ойролцоо олон хүн олон хүн сууж байна.
365128300.jpg|0|A group of people white water raft on very choppy water .|Маш тасалсан устай цагаан усны саваа.
3651476768.jpg|0|Two women standing in front of a fence looking at mountains .|Уулыг хардаг хашааны урд хоёр эмэгтэй.
365150037.jpg|0|Guys drinking in a crowded pub , just chatting and having a beer .|Залуус хөл хөдөлгөөн ихтэй, зүгээр л чатлаж, шаргуу чатлаж, шар айраг уух.
3651690772.jpg|0|A woman attempts to mini-golf while water pouring down from above interferes .|Дээрх саад болж усыг асгах үед мини-гольф тоглохыг оролддог.
3651971126.jpg|0|A black dog and a yellow dog are walking on asphalt next to a field of grass .|Хар нохой, шар нохой нь зүлгэн дээр талбайн хажууд асфальт дээр алхаж байна.
3652094744.jpg|0|images are missing images are missing images are missing images are missing images are missing images are missing|Зураг байхгүй байна Зураг байхгүй байна Зураг байхгүй байна Зураг байхгүй байна Зураг байхгүй байна Зураг байхгүй байна
3652150541.jpg|0|Child with Mohawk haircut holding mirror for woman putting on face paint .|Mohawk Foodcut-тай хүүхэд нүүрний будаг дээр тавьдаг.
3652207174.jpg|0|The sky is very blue and the grass is very green at a golf course while a girl looks into a golf hole for a ball .|Тэнгэр нь маш цэнхэр, өвс нь гольфын талбайд нил ягаан өнгөтэй байдаг.
3652572138.jpg|0|The boy in the purple shirt and green jacket stands in the crowd whilst raising his hands in the air .|Нил ягаан цамц, ногоон хүрэм, ногоон хүрэм нь агаарт гараа дээшлүүлж байхад олон түмэн дээр зогсож байв.
3652584682.jpg|0|A man is jumping over the rocks , and towards the water .|Эрэгтэй хүн хадны дээгүүр үсэрч, ус руугаа явж байна.
365274901.jpg|0|The dog is chasing the other dog carrying a stick in its mouth .|Нохой нь бусад нохойг амандаа хийж өгдөг.
3652764505.jpg|0|A red truck is parked next to a burning blue building while a man in a green vest runs toward it .|Улаан өнгийн ачааны машиныг шатаж буй цэнхэр барилгын хажууд ногоон байшингийн хажууд байрлуулсан.
3652859271.jpg|0|The woman wearing a red jacket is holding a glass and she is in front of the man in a white t-shirt .|Улаан хүрэм өмссөн эмэгтэй шилийг барьж байгаа бөгөөд тэр эмэгтэй цагаан цамцтай хүний урд байна.
365291944.jpg|0|A woman in a sweater and a scarf stands in the middle of a snow filled forrest .|Цамц өмссөн эмэгтэй, ороолт нь цасаар дүүрсэн цасны дундуур зогсож байв.
3653062245.jpg|0|A biker in blue gear bikes through the trees on a bike path .|Бялууг дугуйгаар дугуйгаар дугуйгаар дугуй унадаг дугуйчин.
3653230362.jpg|0|A man wearing a suit with a red tie is talking to a woman wearing a dress while another woman is leaning against a red car .|Улаан өнгийн зангиа өмссөн хүн хувцас өмссөн эмэгтэй нь хувцас өмссөн эмэгтэйтэй ярилцаж байгаа нь өөр эмэгтэй улаан машины эсрэг бөхийж байна.
3653385929.jpg|0|Two members of a military brass band play their horns while others look on .|Цэргийн гуулин хамтлагийн хоёр гишүүн эвэрээ эвэрээ тоглодог.
3653386313.jpg|0|A group of officers in navy blue uniforms play brass instruments for a group of children .|Тэнгисийн цэргийн цэнхэр дүрэмт хувцастай офицеруудын бүлэг.
3653462288.jpg|0|A boy in a green shirt is riding his skateboard in a park while three boys watch .|Ногоон цамцтай хүү нь гурван хөвгүүд үзэж байхад Паркт тэшүүрээ унаж байна.
3653484549.jpg|0|A family watches as a little girl blows out the candles on her third birthday|Жаахан охин гурав дахь төрсөн өдөр лаа гарч ирэв
3653497668.jpg|0|A group of adults and children around a large sheet cake , including a man in army fatigues .|Том хэмжээтэй бялуу, хүүхдүүдийн бүлгүүд, хүүхдүүдийг армийн ядаргаа,
3653764864.jpg|0|A number of people ascending a zig-zag ramp with bright blue railings .|Цэнхэр өнгийн хашлага бүхий Zig-ZAG налуу замыг дээшлүүлж буй олон хүн.
3653837067.jpg|0|A woman riding a horse in a show jumping competition .|Үзэсгэлэнгийн үсрэлт тэмцээнд морь унаж буй эмэгтэй.
3654103642.jpg|0|A white dog and a brown dog run along side each other at the beach .|Цагаан нохой, хүрэн нохой далайн эрэг дээр бие биенийхээ хажууд гүйдэг.
3654276875.jpg|0|A woman with glasses raised is staring with her mouth open and there is a man with a child behind her .|Нүдний шил бүхий эмэгтэй хүн амаараа ширтэж, түүний ард байгаа хүүхэдтэй хүн байдаг.
365432689.jpg|0|Two elderly men sit on a park bench , with flowers in the background .|Хоёр настай эрчүүд Паркын вандан сандал дээр цэврүү, цаана цэцэглэнэ.
3654338683.jpg|0|A golden retriever runs through a field of yellow flowers .|Алтан Retriever нь шар цэцгийн талбайгаар гүйдэг.
3654366861.jpg|0|A man in a dress shirt and tie is smiling and holding in his hands a pair of sunglasses and some sort of paper .|Хувцаслалт цамц өмсөж, зангиа, зангиа нь нүүрэн дээр нь инээмсэглэж, хэдэн төрлийн нарны шил, зарим нэг цаас барьж байна.
3654377237.jpg|0|A group of nicely dressed people sit at tables with white tablecloths as they enjoy drinks and foods .|Сайхан хувцасласан хүмүүс архи, хоол хүнс, хоол идэж байхдаа цагаан ширээний бүтээлэг дээр сууж байсан.
3654397917.jpg|0|A woman in white gets her makeup done by a woman with short blond-hair while a woman in a purple dress watches .|Цагаан өнгөтэй эмэгтэй, ягаан даашинзтай эмэгтэй хүний будалтыг богино шаргал үстэй эмэгтэй хүн болгосон.
