image_name|comment_number|comment|Translated Comment
2199250692.jpg|0|A man is pulling a cart on wheels loaded with nets and is in front of the Ocean Blue Company .|Эр хүн торонд ачих сүлжээгээр тэрэг татаж, далайн цэнхэр компанийн урд байрладаг.
2199710546.jpg|0|A DJ standing under some bright lights with an advertisement .|Сурталчилгаа бүхий зарим тод гэрлийн дор зогсож байна.
2199721922.jpg|0|A lady in green shorts on a beach clapping her hands above her head while observing a band .|Наран шарлагын газар, хамтлаг дээр гараа атгаж байхдаа толгойгоо ажиглаж байхдаа гараа толгойгоо ажиглав.
2199793371.jpg|0|A brown and white dog plays with a soccer ball on snowy ground .|Браун, цагаан нохой цастай газар дээр хөл бөмбөгийн бөмбөг тоглодог.
2199932695.jpg|0|A small child wearing the colors of the American flag is shoveling snow from the front steps .|Америкийн тугны өнгийг өмссөн жижиг хүүхэд нүүрнийхээ цасыг урд алхамаас цас оруулдаг.
2200070339.jpg|0|A child in red and white striped pajamas is standing and holding her arms up .|Улаан, цагаан судалтай унтлагын өмд цамц өмсөж, гараа барьж зогсож байна.
220028982.jpg|0|A lady in a red shirt is with a child in a blue shirt at a playground .|Улаан цамцтай хатагтай нь тоглоомын талбайд цэнхэр цамцтай хүүхэдтэй.
2200337743.jpg|0|A white man playing an acoustic guitar with another person .|Өөр хүнтэй акустик гитар тоглож байгаа цагаан арьст хүн.
2200338547.jpg|0|A bearded man in with a ukulele vocalizes against the background of a clear blue sky .|BACKULELE-тэй сахалтай хүн, хөх цэнхэр тэнгэрийн арын дэвсгэр дээр дуу авалцдаг.
2200688503.jpg|0|Eight people are sitting at a table posing for a group picture .|Найман хүн бүлгийн зураг авах ширээний ард сууж байна.
2200875336.jpg|0|Three ladies are performing a concert on a stage decorated with two big , artistic face drawings that look like suns behind them while three fans gather at center stage .|Гурван бүсгүйн хоёр том, уран сайхны нүүрэн дээр нар мандаж буй тэнгэрийн зураг дээр Centers-тэй хамт гэрэлтэж байсан бөгөөд гурван фэнүүд.
2200901777.jpg|0|A young woman with light brown hair wearing a red beaded neclace , a Gonzaga sweatshirt and earrings stands smiling .|Улаан өнгийн хар хүрэн үстэй залуу эмэгтэй улаан үстэй зүүлт зүүсэн залуу эмэгтэй. Гонзага цамц, ээмэг инээмсэглэв.
2201050079.jpg|0|A man dressed in orange looking down one of those holes in the street .|Гудамжны нүхнээс улбар шар өнгөөр хувцаслав.
2201122447.jpg|0|Three photographers with their cameras and tripods set up indoors in a high-traffic area .|Камера, Tripods-тай гурван гэрэл зураг, триподууд өндөр хурдны талбайд байрладаг.
2201136364.jpg|0|A bearded , glasses-wearing man in a turquoise shirt is playing the acoustic guitar .|Туркоун цамц өмссөн сахалтай, нүдний шил зүүсэн хүн акустик гитар тоглож байна.
2201192417.jpg|0|Boy wearing a green and white soccer uniform running through the grass .|Өвсний дундуур ногоон, цагаан хөл бөмбөгийн жигд хувцас өмссөн хүү.
2201202388.jpg|0|A young guy is brushing his teeth with no shirt standing in front of a mirror wearing his goggles .|Залуу залуу шүдээ хавиргатай толин тусгалын өмнө шүдээ хавиргаагүй шүү дээ.
2201222219.jpg|0|Young barefoot boy playing a guitar setting in a large muti colored chair with a picture of three pigs beside him .|Залуу хөл нүцгэн хөл нүцгэн хөвгүүн түүний хажууд гурван гахайтай гурван өнгийн зураг дээр гитарын тохиргоог тоглож байна.
2201480583.jpg|0|There are some men and women sitting outside on a lawn having a barbecue , there is food cooking an the grill and food on a table .|Шарсан махтай зүлэг дээр сууж, эмэгтэй хүмүүс шарсан махтай, ширхэгтэй хоол, хоолонд хоол хийх хоол хүнс байдаг.
2201734906.jpg|0|A blond-haired woman talks to a man wearing a tank top and shorts .|Шаргал үстэй эмэгтэй танкийн дээд, шорт өмссөн хүнийг ярьдаг.
2201858857.jpg|0|A young brown-haired child sitting in his room , holding onto a green Elmo book with lots of other books scattered around .|Залуу хүрэн үстэй хүүхэд түүний өрөөнд сууж, Ногоон элмо номыг нөмөрсөн, бусад олон ном тархсан.
2201877660.jpg|0|A young man shaving his beard outside in front of a garage while someone else holds a mirror for him to see .|Нэг хүн сахлынхаа урд байраа гаражийн өмнө хусаж байхад хэн нэгэн түүнийг харахаар толин тусгалыг барьж байх үед
2201951953.jpg|0|Four people are in the process of creating colorful lanterns in their lantern shop .|Дөрвөн хүн Ланктигийн дэлгүүрт өнгөлөг дэнлүү үүсгэх үйл явцад байна.
2201951969.jpg|0|The surfer is wearing a black bodysuit while picking up her board .|Сурагч самбарыг аваад ирж байхдаа хар биет хувцас өмсөж байна.
2201978994.jpg|0|Two children standing near a wheelbarrow are looking at the lake in front of them .|Тэргэнцэрийн ойролцоо зогсож байгаа хоёр хүүхэд тэдний өмнө нуурыг харж байна.
2202059975.jpg|0|People on a street corner with very odd shaped objects bolted to the ground that look like old car parts .|Маш хачин хэлбэртэй, хуучин машины эд анги шиг харагддаг газартай гудамжны булан дээр хүмүүс.
2202443907.jpg|0|A woman on a shoreline wearing pale jeans and multicolored jacket , is squinting through a telescope .|Цэнэг жинсэн өмд, олон өнгийн хүрэм өмссөн эрэг дээрх эмэгтэй, олон өнгийн хүрэм өмсдөг, телескопоор эргэлдэж байна.
2202625355.jpg|0|The boy with the red trunks kicks and grins as he falls back down after being thrown in the air by the man standing in the waist deep water .|Улаан хонгил бүхий хүү нь бүсэлхийн гүн гүнзгий зогсож байсан,
2203168780.jpg|0|A man in a black sweater sits at a desk typing on a computer keyboard .|Хар цамцтай хүн компьютерийн гар дээр бичиж байгаа ширээн дээр сууж байна.
2203224077.jpg|0|With a cellphone off to the side , a young white girl is eating cereal from a white bowl on a white table in the kitchen .|Хажуу талд нь гар утсаа унтраа, залуу цагаан охин гал тогооны өрөөний цагаан ширээн дээр үр тариа идэж байна.
2203234266.jpg|0|A man wearing a blue t-shirt is grilling food while a woman wearing a pink tank top watches .|Цэнхэр футболк өмссөн эр хүн ягаан танкны дээд цаг өмсөж байхдаа шарсан мах идэж байна.
2203286182.jpg|0|A black dog is attempting to catch a thrown object that is red .|Хар нохой улаан өнгөтэй хаясан объектыг барьж авах гэж оролдож байна.
2203398833.jpg|0|An apparently elderly person is sweeping a slate patio while wearing a straw wide-bimmed hat and light-blue baggy clothing .|Ахмад настан хүн бол сүрэл өргөнтэй малгай өмсөж байхдаа шиферийг шүүрч авав.
2203449950.jpg|0|The young girl standing on the grass is wearing a pink dress .|Өвс дээр зогсож байгаа залуу охин ягаан даашинз өмсөж байна.
2203585314.jpg|0|A woman in a mauve jacket who is selling apples is talking to a young customer in a floral jacket .|Алим зарж буй эмэгтэй хүн алим зарж байгаа эмэгтэй цэцэгсийн хүрэмтэй ярилцаж байна.
2203586218.jpg|0|A man in a white apron holding a blue plastic bin in one hand , uses his other hand to tend to a large steaming cooker of shrimp .|Нэг гарт цэнхэр хуванцар хогийн савтай нэг хүн, нөгөө гараараа сам хорхойн том уурын зууханд хандах хандлагатай байдаг.
2203615439.jpg|0|A man dressed in denim is walking along a snow covered street next to red brick buildings .|Жинсэн хувцас өмссөн эр улаан тоосгон барилгуудын хажууд цасан бүрхүүлтэй гудамжаар алхаж байна.
2204277704.jpg|0|A little boy in a yellow shirt and green shorts jumping on the couch .|Шар цамцтай шар цамц, ногоон шорт, буйдан дээр үсэрч буй ногоон шорт.
2204545235.jpg|0|A child wearing a snorkeling mask and a red and blue striped towel crying next to a pool .|Усан бассейны дэргэдэх хүүхэд, улаан, цэнхэр судалтай алчуур өмссөн хүүхэд.
2204550058.jpg|0|A woman tilts her face upward and lifts her white gloved hand|Эмэгтэй хүн нүүрээ дээшлүүлж, цагаан өнгийн бээлий өргөөв
2204677106.jpg|0|"Overly dramatic couple pose for a picture where an "" angry "" man "" chokes "" a woman who sticks out her tongue ."|"Хэт их драматик хосууд ""ууртай"" хүн хэлэхдээ ""ууртай"" хүн ""амьтан"" гэж хэлдэг."
2204695848.jpg|0|Blond girl with pink top smiling while wearing funny glasses with large nose .|Том хамартай инээдтэй нүдний шил зүүсэн шар өнгийн дээд инээмсэглэл.
2204777844.jpg|0|A child in red , wearing rollerskates is being pushed along by an adult in black .|Улаан хүүхэдтэй хүүхэд, өндгөвчний хавтанг харцаар харцаар түлхэж байна.
2204991372.jpg|0|Two teenage boys in Hawaiian shirts , one in a jester 's hat , laugh and gesture in a locker room .|Хавайн цамц өмссөн хоёр өсвөр насны хөвгүүд, нэг нь Жестерийн малгай, шүүгээний өрөөнд орж, шүлгэнэ.
2204993532.jpg|0|A young lady in a black shirt sits on a the lap of a boy in a white and orange shirt .|Хар цамцтай залуу эмэгтэй цагаан цамц өмссөн хөвгүүн цагаан, улбар шар өнгийн цамц өмсдөг.
2205088706.jpg|0|Boy in red jumping forward on sand , hill in background .|БИДНИЙ ХУГАЦААНЫ ХУГАЦААНЫ ХУГАЦААНЫ ХУГАЦААНЫ ХУГАЦАА, ХУГАЦАА.
220513228.jpg|0|A man in with a red and blue suit performs a trick while surfing in the ocean .|Улаан, цэнхэр өнгийн костюмтай эр хүн далайд гарахдаа трик хийдэг.
2205328215.jpg|0|a long bicyclist wearing a white helmet riding down a mountain path|Уулын малгай өмссөн урт унадаг дугуйчин
2205336881.jpg|0|The girl in the pink sweater is playing with a camera whilst being watched by the woman on the couch|Ягаан цамцтай охин нь буйдан дээр байгаа эмэгтэйг үзэж байхдаа камераар тоглож байна
2205915732.jpg|0|A young man wearing a gray shirt putting on a white apron .|Цагаан хормогч өмссөн саарал цамц өмссөн залуу.
2205958052.jpg|0|A boy is hanging out of the window of a yellow taxi .|Хөвгүүн шар таксины цонхнаас өлгөөтэй байна.
2206060803.jpg|0|A painting of a marketplace with a man pushing a cart full of buckets , some customers at a shop , and a black woman with two children .|Нэгэн дэлгүүртэй, дэлгүүр, дэлгүүр, хоёр хүүхэдтэй, хоёр хүүхэдтэй хар арьстнуудтай хамт байгаа зах зээл, нэг үйлчлүүлэгчид, хар эмэгтэй.
2206282062.jpg|0|Female beach volleyball players on either side of a net , with one looking to spike the ball as her teammate watches with the blue sky in the background .|Эмэгтэй далайн эргийн далайн эрэг дээрх эмэгтэй далайн эргийн ба
2206284983.jpg|0|An individual is poling a boat in a lake on a sunny day clear enough to see the mountains in the distance .|Хувь хүн нартай өдөр нартай хамт завин дээр завин дээр нууранд шилжиж байна.
220631119.jpg|0|Two women , one spiking the ball and another trying to block the ball , playing beach volleyball .|Хоёр эмэгтэй, бөмбөгийг нэг нулимж, нөгөө нь бөмбөгийг хаах гэж оролдож, далайн эрэг дээр тоглож, далайн эргийн волейбол тоглохыг хичээдэг.
2206403470.jpg|0|The young boy listens to the elderly gentleman playing violin at the park .|Залуу хүү нь цэцэрлэгт хүрээлэнг л хийл тоглож байгаа ахмад настнуудыг сонсдог.
2206501278.jpg|0|A groomsman at a wedding is showing off hula-hooping skills in front of the cameras and the bridesmaids .|Хуримын хүргэний хүргэний хүргэнүүд нь камер, сүйт бүсгүйн урд талбайн цагираг ур чадварыг харуулж байна.
220655860.jpg|0|A man with brown hair is wearing gray pants and a black belt and is sitting at a table with four other people .|Хүрэн үстэй хүн саарал өмд өмсөж, хар бүс өмсөж, хар бүс өмсөж, бусад дөрвөн хүнтэй ширээн дээр сууж байна.
2206594874.jpg|0|The man wearing black makes a face as the woman across from him speaks .|Хар өмссөн хүн хар өнгөтэй эмэгтэйг түүнтэй ярьдаг эмэгтэйн адил нүүр царай гаргадаг.
2206600240.jpg|0|A man and woman sit across from each other at a restaurant table .|Эрэгтэй, эмэгтэй хүмүүс нэг бие биенээсээ рестораны ширээн дээр сууж байв.
220689305.jpg|0|A woman , viewed through a window , sits at a restaurant table and puts down a red shopping bag .|Эмэгтэй, цонхоор үзсэн эмэгтэй, рестораны ширээн дээр суугаад улаан дэлгүүрийн уутанд байрлуулна.
2206960564.jpg|0|A white puppy is running on a tiled floor .|Цагаан гөлөг нь хавтанцарсан шалан дээр гүйж байна.
2207244634.jpg|0|A young man wearing a red jacket performs a jump on a red skateboard .|Улаан хүрэм өмссөн залуу улаан тэшүүр дээр үсэрч тоглодог.
2207346072.jpg|0|Two men are in a small boat and spraying water at something .|Хоёр хүн жижиг завин дээр байдаг, ямар нэгэн зүйл цацаж байна.
220747961.jpg|0|Two young men similarly attired walk leisurely through a farmer 's market shortly before 2 o'clock in the afternoon , drinking a beverage , possibly tea .|Үдээс хойш 2-р сарын 2-ны өмнө фермерийн зах зээлд гардаг хоёр залуу.
2208055895.jpg|0|a man in a stripy hat is standing in a house built from ice that has a pair of boots in the doorway .|Турдаа малгай өмссөн эр хаалган дээр хос гутал өмсдөг мөсөөр баригдсан байшинд зогсож байна.
2208067635.jpg|0|The long black shadow casts a image on the rock while the young girl climbs the rock .|Урт хар сүүдэр нь залуу охин рок авирч байхад хадны зургийг хадаж байна.
2208250764.jpg|0|An black female on team blue chases a basketball between one other female teammate and two female members of team white .|Багийн цэнхэр эмэгтэйн хар эмэгтэй нь бусад эмэгтэй багийн хамтрагч, багийн хоёр эмэгтэйн хоёрын хооронд сагсан бөмбөгийг хөөж байна.
2208310655.jpg|0|a boy is kissing a woman on the cheek next to a girl who is wide eyed and sticking out her tongue .|Хөвгүүн нь өргөн нүдтэй охины хажууд байгаа эмэгтэйг үнсэж, хэлээ наалддаг.
2208631481.jpg|0|A black dog is running in a field of grass and another black dog can be seen behind him .|Хар нохой өвсний талбайд гүйж, өөр нэг хар нохойг түүний ард харж болно.
2208652989.jpg|0|A person in reflective gear is riding a white horse on a cobblestone city street .|Тухайн цацруулагч араатай хүн Кобблестоны хотын гудамжинд цагаан морь унаж байна.
2208662604.jpg|0|A man wearing jeans and boots is jumping into the air with a white sandy hill below him , and a blue cloudless sky behind him .|Жинсэн жийнс, гутал өмссөн хүн түүний доор цагаан элсэрхэг толгодтой, түүний ард цагаан элсэрхэг толбон руу орж, түүний ард цэнхэр үүлгүй тэнгэрт орж байна.
2209036528.jpg|0|2 women wearing scarves , waiting for the light to change so they can cross the street|2 эмэгтэй ороолт өмсөж, гэрлийг өөрчлөхийг хүлээж байгаа тул тэд гудамжаар гаталж болно
2209317.jpg|0|A group of people wearing black shirts and one in a white shirt watching another person sitting on the ground in front of them .|Хар цамц өмссөн хүмүүс, нэг нь цагаан цамц өмссөн, цагаан цамц өмссөн, нөгөө нь газар дээр нь газар дээр нь сууж байсан
2209496328.jpg|0|A Golden Labrador is swimming through water with a red toy in its mouth .|Алтан Лабрадор нь амандаа улаан тоглоомоор усан замаар усанд сэлж байна.
2209610692.jpg|0|A mother and daughter smiling at the camera taking in the middle of playing the Simpsons version of Monopoly in their living room .|Ээж, охин нь камерынхаа симпозонуудын симполоны хувилбарыг зочны өрөөнд тоглодог.
2209751.jpg|0|Men standing around a car with a lamp behind them .|Арын арын гэрэлтэй машин тойрон зогсож байв.
2209766109.jpg|0|A lady with long hair and a hat walks down a sloping sidewalk paved with stone .|Урт үстэй хатагтай, малгай нь чулуугаар хучилтаж буй налуу явган хүний зам дээр алхдаг.
2209888959.jpg|0|The little girl in the black and red top is holding a long wooden stick .|Хар ба Улаан дээр байгаа бяцхан охин урт модон саваа барьж байна.
2210054257.jpg|0|A group of five children and three adults look on while a fourth adult speaks on a beach .|Таван хүүхэд, гурван насанд хүрэгчдийн нэг хэсэг, гурван насанд хүрсэн хүн Дөрөв дэх насанд хүрсэн хүн далайн эрэг дээр ярьдаг.
2210059361.jpg|0|A small group of adults and children are wearing hats and shorts on the sandy beach near the blue water .|Насанд хүрэгчдийн жижиг бүлэг, хүүхдүүд цэнхэр усны ойролцоох элсэрхэг далайн эрэг дээр малгай, шорт өмсөж байна.
2210065293.jpg|0|A group of people , mostly in straw hats , follow a man onto a beach covered with many large rocks .|Ихэнх нь сүрэл малгай, ихэнхдээ сүрэл малгайтай, олон том чулуугаар хучигдсан эргийг дагаж яв.
2210068481.jpg|0|People of all ages in hats are paying attention to a person in a blue shirt .|Малгай дахь бүх насны хүмүүс цэнхэр цамцтай хүнэд анхаарал хандуулдаг.
2210070009.jpg|0|A group of people , several in straw hats , stand outside among greenery .|Нэг бүлэг хүмүүс, хэд хэдэн сүрэл малгай, ногоон байгууламжийн дунд зогсож байдаг.
2210173140.jpg|0|A small boy in a green shirt and dark pants is attempting to brush the hair of a little girl in a flowered top .|Ногоон цамц, харанхуй өмд, бараан өмд нь бяцхан охины үсийг цэцэглэсэн дээд хэсэгт үсрэх гэж оролдож байна.
221024576.jpg|0|A man in a short-sleeved button up shirt stands in front of a crown all sitting in chairs in front of a wooden building .|Богино ханцуйтай товчлуурын цамц нь Модон байшингийн өмнө сандал дээр сууж буй бүх титэмийн урд байрладаг.
221024947.jpg|0|A group of men , some with musical instruments , sit in chairs around the perimeter of a room .|Эрэгтэйчүүдийн бүлэг, зарим нэг хөгжмийн зэмсэг, өрөөний периметрийн эргэн тойронд суу.
2210339046.jpg|0|There is a boy wearing a cap , long shorts and slide on slippers sitting in a fold up chair on the dock of a lake or river , fishing .|Нуур эсвэл голын док дээр сууж, шаахай дээр сууж, шаахай дээр сууж, шаахай өмсдөг хөвч, шаахай дээр сууж, загас барих, загас барих.
2210368267.jpg|0|A girl in a pink shirt jumping from one couch to another in a well apportioned living room .|Нэгэн охин нь нэг бөөлжсөн охиныг нөгөөд шилжсэн нэг уутыг нөгөөд шилжүүлсэн зочны өрөөнд.
221062338.jpg|0|Happy people enjoy each other 's company at a table full of empty dishes , while they wait for a meal to be served .|Аз жаргалтай хүмүүс бие биенийхээ компанид хоосон аяга, хоосон аяга тавагаар дүүрэн ширээн дээр өнгөрөөдөг.
2210633831.jpg|0|A nervous looking woman with red-hair is working with possibly dangerous materials in a lab .|Улаан үстэй мэдрэлийн харагддаг эмэгтэй лабораторид аюултай материалаар ажиллаж байна.
221063801.jpg|0|Dancers , in front of the Costa Rican flag , are finishing their performance .|Бүжигчид, Коста Риканы урд талд байрлах Коста Рикан тугны өмнө дуусч байна.
2211495714.jpg|0|A female child in a white , long-sleeved shirt is kneeling on a couch , laughing as her hair is sticking up .|Цагаан, урт ханцуйтай цамц нь үстэй, үсээ өвдөг дээрээ өвдөг сөгдөж, түүний үс нь наалдана.
2211593099.jpg|0|A group of young Middle Eastern kids posing for the picture|Зураг дээр зураг авсан залуу Дунд Дорнодын залуучуудын бүлэг
2211946621.jpg|0|A young man wearing glasses and a red plaid shirt sits at a table with a cup of coffee , writing on a stack of papers .|Нүдний шил зүүж, улаан Плайед цамц өмссөн, улаан өнгийн цамцтай нэг аяга кофе, цаасан дээр бичээрэй.
2212472643.jpg|0|A baby in campflauge crawls on a clean hardwood floor .|Нялх хүүхэдтэй нялх хүүхэд цэвэрхэн хатуу модны шалан дээр мөлхөж байв.
