image_name|comment_number|comment|Translated Comment
3949924354.jpg|0|A food vendor in Korea is siting behind a tricycle cart on the street selling some kind of food .|Солонгос дахь хүнсний борлуулагч нь гудамжинд ямар нэгэн төрлийн хоол хүнс зарж буй дугуйны тэрэгний ард сууж байна.
3951142610.jpg|0|A woman wearing a lab coat and gloves looks at some chemicals and stands next to some lab equipment .|Лабораторийн дээл өмссөн эмэгтэй зарим химийн бодисыг зарим химийн бодисоор харуулж, зарим лабораторийн тоног төхөөрөмжийн хажууд зогсож байна.
395125320.jpg|0|A number of people are doing a synchronized martial arts performance in the street .|Олон тооны хүмүүс гудамжинд синхрончлогдсон тулааны урлагийг хийж байна.
3951498887.jpg|0|A man in a blue shirt and who has scratches below his right elbow is working on a blue bicycle .|Цэнхэр цамц өмссөн хүн, баруун тохойноосоо зураасны доор зурж, цэнхэр унадаг дугуй дээр ажиллаж байна.
3951953306.jpg|0|The man is standing upside down on the bottle , with hands on the ground .|Эр хүн газар дээр нь доошоо, гараараа гараараа доошоо зогсож байна.
3952305716.jpg|0|A man making balloon animals for two children on a street corner .|Гудамжны булан дээр хоёр хүүхдийн бөмбөлөг амьтад хийдэг.
395248604.jpg|0|A group of people wearing backpacks are walking toward hills in the distance on a trail outside .|Банкны үүргэвч өмссөн хүмүүсийн бүлэг хүмүүс гадаа зам дээр явж байгаа зайд алхаж байна.
3952790386.jpg|0|A man in a brown jacket , white shirt , and dark slacks is holding a book with his finger on the page while sitting on a wooden floor , and leaning against a yellow wall with a door on one side and cloths on hangers on the other side .|Хүрэн хүрэм, цагаан цамц, харанхуй чуулган нь модон шалан дээр сууж, нөгөө талд нь өлгүүртэй, даавуугаараа шар хананд наалдаж, нөгөө талд нь хаалган дээр хөлийг нь хаалган дээр нь наалдаж, нэг талд нь өлгүүртэй байдагБайна уу.
3952819160.jpg|0|A worker is pointing at something while suspended above ground , standing on a platform .|Ажилчин газар дээр зогсож байхдаа ямар нэгэн зүйлийг зааж, платформ дээр зогсож байв.
3952821132.jpg|0|a group of people , some with white helmets and diving gear , and some in life preservers , carrying a gurney with a person on it .|Бүлгийн хүмүүс, зарим нь цагаан дуулга, шумбах араа, амьдралын бэлдмэл, зарим нь
3952964772.jpg|0|A man and a woman in with a headscarf and a black apron are leading two horned cattle pulling a trailer down a paved road with trees in the background .|Толгой, эмэгтэй хүний толгойтой, хар хормогч, хар хормогч нь арын дэвсгэртэй хучилттай зам дээр чиргүүл рүү чиглүүлж буй хоёр эвэртэй үхэрт хүргэдэг.
3953055731.jpg|0|A female member of the military in fatigues is playing with an inflated blue glove with three brown-haired children .|Хортой цэргийн эмэгтэйн эмэгтэй гишүүн гурван хүрэн үстэй хүүхэдтэй хийсэн цэнхэр бээлийтэй тоглож байна.
3953235262.jpg|0|A woman , wearing a blue dress that reveals her abdomen , is holding a sledgehammer in the forest .|Хэврэлд нь цэнхэр даашинз өмссөн цэнхэр даашинз өмссөн цэнхэр даашинз өмсөж, ойд чармайлт барьж байна.
3953382308.jpg|0|Here is a picture of the side of an airplane where the linen and garbage is being thrown out .|Маалинган, хог хаягдлыг хаядаг онгоцны хажуугийн зураг энд байна.
3954079669.jpg|0|"Musician sitting on the ground plays his guitar as crowds of people walk around him disregarding the sign in his case which states "" tell me why my music sucks "" ."|"Хөгжимчин газар дээр сууж буй гитараа олон хүн ""яагаад миний хөгжим сорж байгааг"" гэж хэлдэг."
3954384143.jpg|0|Four kids , two of whom are jumping in the air , are posing for a picture in a classroom .|Дөрвөн хүүхэд, агаарт үсэрч байгаа хоёр хүн ангид зураг авахаар зураг авч байна.
3954483544.jpg|0|Two people are on the street , and one has a cello while another is holding an accordion .|Хоёр хүн гудамжинд байдаг, нөгөө нь нэг нь rail-ыг барьж байх үед мельтэй байдаг.
395461421.jpg|0|Four kids jumping on the street with a blue car in the back .|Дөрвөн хүүхэд арын хэсэгт цэнхэр машинтай үсэрч дөрвөн хүүхэд үсэрч байв.
3954705002.jpg|0|A group of people wearing hats and using walking sticks are walking through a wooded area on a trail .|Малгай өмсөж, алхах саваа өмсөж, алхах саваа ашиглан модоор дамжин ой модоор явж байна.
3955157194.jpg|0|A little girl with brown hair wearing white t-shirt is playing with the giant machine .|Цагаан футболк өмссөн бор үстэй бяцхан охин аварга том машинтай тоглож байна.
3955648022.jpg|0|A woman and a boy are in a parking lot , he is riding a bike and carrying a shovel while she is pulling a laundry basket on a furniture dolly .|Эмэгтэй, хүү, хүү нь машины зогсоол дээр байдаг, тэр дугуй унаж, чибээр угаалгын сагс руу залгаж,
3955794229.jpg|0|A female DJ dressed in all black is looking intently at her Apple MacBook .|Бүх хар хувцастай эмэгтэй хувцас өмссөн эмэгтэй нь түүний Apple MacBook-т анхааралтай харагдаж байна.
3955811518.jpg|0|Two men in the process of competing wrestling each other while a small crowd in the background looks on .|Арын хэсэгт бага зэрэг цугларч байхдаа бие биенээ өрсөлдөх чадвартай хоёр эрэгтэй.
395633951.jpg|0|A woman is hugging a child , while sitting on a blue couch .|Нэг эмэгтэй хүүхэд, цэнхэр буйдан дээр сууж байхдаа хүүхэд тэврэв.
3956420030.jpg|0|A woman jumps over a park bench while throwing leaves in the air .|Агаарт навчис шидэх үедээ эмэгтэй паркийн вандан дээгүүр үсэрч байв.
3956780803.jpg|0|Pan handler stands on his head to get attention in front of orange and white traffic barriers|PAN Bandler нь улбар шар, цагаан замын хөдөлгөөний өмнө анхаарлаа хандуулахын тулд толгой дээрээ анхаарлаа хандуулдаг
3957074517.jpg|0|People are waiting for the subway on the outdoor platform .|Хүмүүс гаднах платформ дээр метроныг хүлээж байна.
3957644036.jpg|0|A bride and groom followed by their bridal party leaving the ceremony on a beautiful sunny day outside .|Сүйт бүсгүй, хүргэн дагалдаж, дагалдах ёслолын үдэшлэгийг гадаа нартай нартай өдөр
3957716846.jpg|0|A young man is kicking a board while dressed in a Karate Gi .|Залуу эр Карате Ги-д хувцаслаж байхдаа самбарыг өшиглөж байна.
3957762825.jpg|0|Students are sitting in a classroom listening to six people who are teaching .|Оюутнууд хичээлдээ сурч байгаа зургаан хүнийг сурч сууж байна.
3957765471.jpg|0|Two men , one with a blue bag & one with glasses , chatting with a young woman with a backpack at a gathering with other men & women .|Хоёр эрэгтэй, нэг нь цэнхэр ууттай, нөгөө нь нүдний шилтэй, бусад эрэгтэй, эмэгтэй хүмүүстэй хамт үүргэвчинтэй чатлах.
395798320.jpg|0|A group of people playing ice hockey , wearing jackets and hats and holding sticks .|Мөсөн хоккей тоглож, хүрэм, малгай өмсөж, малгай өмсөж, саваа өмсдөг хэсэг.
395805433.jpg|0|A young boy dressed in white shorts swims underwater with his eyes closed .|Цагаан шортоор хувцасласан залуу хүү нүдээ аниад нүдээ аниад нүдээ анив.
3958204411.jpg|0|A woman with brown hair , a yellow scarf , and a green top is sitting with her hands on her face and is around other people .|Хүрэн үстэй эмэгтэй, шар ороолт, ногоон өнгөтэй, ногоон дээд нь нүүрэн дээр нь гараараа сууж, бусад хүмүүсийн эргэн тойронд сууж байна.
3958553026.jpg|0|Two white canopies with men standing under them while one man is walking away .|Нэг хүн алхаж байхад хоёр цагаан өнгийн халхавчнууд.
3958589423.jpg|0|A man is taking a scenic photo of mountains while framing the foreground with low-growth , colorful brush .|Эрэгтэй хүн бага өсөлт, өнгө, өнгөлөг сойз бүхий урд талбайн үзэсгэлэнт зургийг авч байна.
3958612961.jpg|0|A woman who appears to be a student , laughs at something that her male companion does n't seem to find amusing .|Оюутан болж байгаа эмэгтэй, эрэгтэй хамтрагч нь хөгжилтэй биш юм шиг санагддаг эмэгтэй.
3958778014.jpg|0|A woman in a white shirt inspects a black garment while sitting in a chair at a festival .|Цагаан цамц өмссөн эмэгтэй нь наадамд сандал дээр сууж байхдаа хар хувцасыг шалгадаг.
3958929614.jpg|0|A crowd of people appear to listen to a speaker while a man and a woman talk behind them .|Хүмүүсийн олон хүн чанга яригчийг сонсож байхад эрэгтэй, эмэгтэй хүмүүс тэдний ард ярьдаг.
3958968118.jpg|0|Two women and a man sitting down in chairs next to a table with a candle burning .|Хоёр эмэгтэй, нэг хүн лааны шатаж буй ширээний хажууд сууж буй сандал дээр сууж байв.
3959035241.jpg|0|Standing in a kitchen a young woman wearing a black peasant blouse and holding a plastic fork between her teeth shows the camera a ladle in her right hand and a bowl in her left hand .|Гал тогооны өрөөнд зогсож байсан залуу эмэгтэйд зогсож, шүдээ хавирга өмсөж, түүний хооронд хуванцар салаа барьж байгаа гал тогооны өрөөнд зогсож, түүний хоорондох камер нь түүний зүүн гартаа, зүүн гартаа аяга тавьдаг.
39593539.jpg|0|A quiet woman with red-hair in a ponytail is about to open a freezer door in a dairy aisle .|Улаан өнгийн үстэй чимээгүй эмэгтэй нь сүүн эгнээнд хөлдөөгч хаалгыг нээх гэж байна.
3959371388.jpg|0|A middle-aged man is standing outside of a building while looking at his phone .|Дунд насны эр хүн түүний утсыг харж байхдаа барилгын гадна зогсож байна.
3959884639.jpg|0|A man in a blue t-shirt is cutting the food , a woman is sitting and looking at something .|Цэнхэр футболк өмссөн хүн хоолоо зүсэж, эмэгтэй хүн сууж, ямар нэгэн зүйл хайж байна.
3960632488.jpg|0|A man and a woman sit on a deck under a blue sky that is about to be overtaken by tumultuous clouds .|Эрэгтэй, эмэгтэй хүн бүдгэрсэн цэнхэр тэнгэрийн дор тавцан дээр сууна.
3960660630.jpg|0|A skateboarder wearing a blue shirt and black slacks rests on the ground and looks toward the camera while is skateboard sits in front of him and a steep incline looms behind him .|Цэнхэр цамц өмсдөг тэшүүр, хар чавга өмсдөг тэшүүр газар газар дээр нь тавьж, камер нь түүний урд байрладаг бөгөөд камер нь түүний өмнө харагдаж байна.
396084707.jpg|0|A young girl who is barefoot and with a scarf over her head dips her pen in ink and writes in a notebook .|Хөл нүцгэн, түүний толгой, түүний толгой дээр гар ороолтой залуу охин нь үзүүрийг бэхлээд бэхлээд дэвтэрт бичээд бичдэг.
396129701.jpg|0|An outdoor setting shows people in various period costumes , including cowboys , a nun , a robed figure , and American Revolution minutemen .|Гадаа тохиргоо нь янз бүрийн үе мөчний хувцас, үүнд ковбойчууд, үүнд ковбойч, гэлэнмаа, гэлэнмаа, Америкийн хувьсгал.
396140659.jpg|0|A group of people walk by some stores , where one men in the front smokes a cigar and a woman toward the back has pink hair .|Бүлэг бүлэг хүмүүс зарим дэлгүүрүүдээр алхаж, урд нь тамхи татдаг хүмүүс тамхи татдаг, ар тал руу чиглэсэн эмэгтэй.
396154083.jpg|0|ladies are wearing white bonnets and are standing behind fruits and vegetables .|Хатагтай нар цагаан бонн өмсөж, жимс, хүнсний ногооны ард зогсож байна.
3961790757.jpg|0|A man with white hair and a full beard is eating food wrapped in aluminum foil .|Цагаан үстэй, бүрэн сахал, бүрэн сахал нь хөнгөн цагаан тугалган цаасаар ороосон хоол иддэг.
396179143.jpg|0|Tan dog on lead standing on surface covered with white snow .|Цагаан цасаар бүрхэгдсэн гадаргуу дээр зогсож буй хар тугалга.
3962553148.jpg|0|A single male wearing a long-sleeve white shirt riding a dirt bike .|Шороон дугуй унаж урт ханцуйтай цамц өмссөн ганц бие эрэгтэй.
3963038375.jpg|0|A hiker in a blue shirt and shorts tampering with his grapple hook in a forest .|Цэнхэр цамц, шорнолоо ой модоор гашуун дэгээтэйгээр цохилж байна.
3963079057.jpg|0|A man in a plaid shirt and a blue helmet holds onto a blue rope while hanging against some large boulders .|Плаш цамцтай эрэгтэй, цэнхэр дуулга нь зарим том булцууг өлгөхдөө цэнхэр олсоор барьдаг.
3963089141.jpg|0|This is a very dark picture , perhaps taken at night , of three people with their backs to the camera buying goods from two men at a booth .|Энэ бол маш харанхуй зураг, магадгүй шөнийн цагаар, магадгүй шөнийн цагаар, гурван хүний арын хэсэгт байранд бараагаа лангуу худалдаж авдаг.
3963243135.jpg|0|A man with a gray jacket and white hat bending over watering a garden with a water container .|Саарал хүрэм, цагаан малгайтай эр хүн усыг устай саванд усалж, усаар усалж байна.
3963364562.jpg|0|A dark-haired man is looking closely at something in an art museum .|Харанхуй үстэй хүн урлагийн музейд ямар нэгэн зүйлийг сайтар ажиглаж байна.
396360611.jpg|0|A person with a backpack stands on a rocky bank beside a body of water .|Үүргэвчинтэй хүн усны биений дэргэд уулын эрэг дээр зогсож байна.
3963616424.jpg|0|A older model blue van being driven with a bunch of items strapped on the top of the roof of the van .|Хуучин загвар өмсөгч цэнхэр өнгийн ван нь ванны дээвэр дээр бэхэлсэн олон тооны хог хаягдлаар дамждаг.
3963654975.jpg|0|A woman wearing a dark skirt and a t-shirt is facing a bathroom sink .|Харанхуй банзал өмссөн эмэгтэй, футболк угаалгын өрөөний угаалтууртай тулгарч байна.
3963683506.jpg|0|Six males , four with shirts and two without , have taken a break from their construction work on a building .|Зургаан эрэгтэй, дөрвөлжин, хоёр нь, хоёр, хоёр нь барилга дээр байрлах ажлын байрнаас завсарлага авлаа.
3963684908.jpg|0|Five men stand on construction scaffolding with paints splattered on them as they appear fascinated by something to the left , one even records the unseen event on a phone .|Таван эр барьсан нь барьсан нь барьсан нь барьсан нь барьсан нь зүүн тийш харагддаг, зүүн талд нь гайхсан мэт харагддаг.
3963770900.jpg|0|A little girl with black hair and a red shirt standing at a water fountain with her hand under it .|Хар үстэй бяцхан охин, улаан цамц нь гараа доор нь усан оргилуур дээр зогсож байв.
3963996930.jpg|0|A man in a red shirt sits while leaning on a walker and holding a water bottle .|Улаан цамц өмссөн эр хүн алхаж, усны савыг барьж байхдаа сууж байхдаа сууж байна.
396458005.jpg|0|A chinese man is reading a newspaper inside a restaurant .|Хятад хүн ресторанд сонин уншиж байна.
3964632200.jpg|0|Two divers are looking at wreckage of some sort underwater .|Хоёр шумбагч нь усан доорх эрэмбийн эвдрэлийг харж байна.
3964718336.jpg|0|A trick rider wearing a bright green outfit carrying an American flag riding a paint horse with green riding gear .|Ногоон морьтой хамт будгаар будгаар будгаар будгаар хийсэн тод ногоон хувцас өмссөн трикер морьтон.
3965161439.jpg|0|Two Asian girls wearing boots , the girl on the right is wearing a blue shirt .|Бут өмссөн хоёр Азийн охид, баруун талд байгаа охин цэнхэр цамц өмссөн байна.
3965289801.jpg|0|A man in an aqua colored shirt , a sailor , a young boy wearing a red shirt and some other people tug on ropes while standing on a ship 's deck .|Аква өнгөт цамц, далайчин, далайчин, улаан цамц өмссөн залуу цамц өмссөн залуу цамц, бусад хүмүүс усан онгоцны тавцан дээр зогсож байхдаа олсоор явж байхдаа олсоор явж байна.
3965588075.jpg|0|A man with a white construction hat , yellow vest , orange undershirt , and jeans , standing near a large white truck and orange safety cones .|Цагаан барилгын малгай, шар биелэгдэнэ, шар айраг, улбар шар өнгийн оёдол, жинсэн өмд, жинсэн өмд, жинсэн өмд, том цагаан ачааны машин, жүржийн аюулгүй байдал.
3965632762.jpg|0|A young man in a purple American football uniform is attempting to allude the tackle of another young man in a white uniform .|Нил ягаан өнгийн хөлбөмбөгийн жигд, цагаан өнгийн дүрэмт хувцастай өөр залуу хүний барьцаалахыг оролдож байна.
3965760848.jpg|0|A black man wearing a black shirt with yellow leaves on it , is sitting and drinking a cup of coffee .|Хар цамц өмссөн хар цамц өмссөн хар цамц өмсдөг, аяга таваг угааж, аяга кофе ууж байна.
3965762928.jpg|0|An African American Male with a black top with the sleeves rolled up holding a white cup with his right hand .|Ханцуйвчтай гаралтай нь хар өнгөтэй эрэгтэй хүн баруун гараараа баруун гараараа цагаан аяганд оров.
3965771582.jpg|0|Four men , two in work cloths , are relaxing and taking a rest break .|Дөрвөн эр, хоёр ажлын хувцас, амрах, амрах завсарлага авах боломжтой.
3966071063.jpg|0|A policeman is leaning in picked up front to all of the bus as he looks at an old lady passenger getting off he makes a fish face pout|Хуучин эмэгтэй зорчигчдыг харахад тэр цагдаагийн автобусанд сууж байна
3966311887.jpg|0|A boy dressed in blue jeans and a red shirt sits on the road holding a water bottle while a little girl dressed in a red shirt looks on .|Цэнхэр жинсэн өмд өмссөн хөвгүүн, улаан цамц нь улаан цамц өмссөн бяцхан охин дээр байрладаг.
396698013.jpg|0|Two old men are on a balcony and one is looking at a small square of paper , and the other is holding a few sheets of paper .|Хоёр хөгшин тагтаа байгаа бөгөөд нэг нь жижиг дөрвөлжин цаасыг харж, нөгөө нь цөөн хэдэн хуудсыг барьж байна.
396728479.jpg|0|A young child wearing a red wig peaks out at the photographer as clowns walk by in a parade .|Улаан хиймэл үсийг улаан хиймэл үсийг өмссөн залуу хүүхэд нь парадаар алхаж, жагсаалаар алхаж явдаг.
396763804.jpg|0|A black and white dog is running through the sand on a beach .|Хар ба Цагаан нохой далайн эрэг дээр элсээр гүйж байна.
396768260.jpg|0|dressed-up participants throw confetti and candy from a float during a parade .|Хувцасласан оролцогчид Контетти, чихэр, шифрийг парадны үеэр хөвөхөд шиддэг.
3968045166.jpg|0|A man in a blue wetsuit standing on a blue surfboard in front of a small wave in the ocean .|Цэнхэр ветсуитын эр хүн далай дахь жижиг долгионы урд байрлах цэнхэр өнгийн гадаргуу дээр зогсож байв.
3969219773.jpg|0|A man with a dark shirt and light shorts is standing next to a person wearing a light shirt on a sidewalk .|Харанхуй цамцтай эр, хөнгөн шорт нь явган хүний зам дээр гэрэлтэй цамц өмсдөг хүний хажууд зогсож байна.
3969232921.jpg|0|Two law enforcement officers standing near one another with an open air market in the background .|Агаарын нээлттэй агаарын зах зээл дээр наасан хоёр хууль сахиулах ажилтнууд.
3969245655.jpg|0|A crowd at a concert with person in foreground , all unidentifiable because of lighting , with hands in the air .|Нүүрэн дээр байгаа хүмүүстэй хамт олон хүнтэй хамт хүнтэй хамт байдаг. Гэрэлтүүлэг, агаарт гараараа
3969506142.jpg|0|Men , women and children are enjoying a meal outside on the patio .|Эрэгтэй, эмэгтэйчүүд, хүүхдүүд, хүүхдүүд гадаа хоолонд дуртай байдаг.
3969759188.jpg|0|A man in a blue shirt and safety glasses grinds a piece of metal which throws sparks .|Цэнхэр цамц, аюулгүй шилний шил, аюулгүй шил нь оч шиддэг металлыг нунтаглана.
3969772063.jpg|0|A man playing an acoustic guitar on a stone ledge in public with his belongings by his side .|Хажуугаараа түүний хажууд байгаа чулуугаараа нүүрэн дээр нь чулуун дээл дээр акустик гитар тоглож байна.
3970078088.jpg|0|Man in striped pants and mustard yellow shirt sits at a outside table at a restaurant .|Судалтай өмд, гич шар цамц нь рестораны гадна талд байрладаг.
3970114165.jpg|0|Two people with their hands expressively out towards a sporting event 's field .|Спортын үйл явдлын чиглэлээр гараа илэрхийлсэн хоёр хүн.
